data/autotune_measurements.csv
family_group,family,task_id,m,n,config_id,block_size,num_warps,num_stages,shape_json,config_json,median_ms,effective_gbps,score,validation_error
A,softmax,softmax_m4096_n256,4096,256,0,256,1,1,"{""family"": ""softmax"", ""group_count"": null, ""k"": null, ""m"": 4096, ""n"": 256}","{""block_size"": 256, ""num_stages"": 1, ""num_warps"": 1}",0.007104000076651573,590.4144080438917,4.947097262502351,3.0517578125e-05
A,softmax,softmax_m4096_n256,4096,256,1,256,1,2,"{""family"": ""softmax"", ""group_count"": null, ""k"": null, ""m"": 4096, ""n"": 256}","{""block_size"": 256, ""num_stages"": 2, ""num_warps"": 1}",0.007135999854654074,587.7668281151225,4.9426029040724115,3.0517578125e-05
A,softmax,softmax_m4096_n256,4096,256,2,256,1,3,"{""family"": ""softmax"", ""group_count"": null, ""k"": null, ""m"": 4096, ""n"": 256}","{""block_size"": 256, ""num_stages"": 3, ""num_warps"": 1}",0.007135999854654074,587.7668281151225,4.9426029040724115,3.0517578125e-05
A,softmax,softmax_m4096_n256,4096,256,3,256,1,4,"{""family"": ""softmax"", ""group_count"": null, ""k"": null, ""m"": 4096, ""n"": 256}","{""block_size"": 256, ""num_stages"": 4, ""num_warps"": 1}",0.007135999854654074,587.7668281151225,4.9426029040724115,3.0517578125e-05
A,softmax,softmax_m4096_n256,4096,256,4,256,2,1,"{""family"": ""softmax"", ""group_count"": null, ""k"": null, ""m"": 4096, ""n"": 256}","{""block_size"": 256, ""num_stages"": 1, ""num_warps"": 2}",0.0072639998979866505,577.4096997389177,4.924824651726833,3.0517578125e-05
A,softmax,softmax_m4096_n256,4096,256,5,256,2,2,"{""family"": ""softmax"", ""group_count"": null, ""k"": null, ""m"": 4096, ""n"": 256}","{""block_size"": 256, ""num_stages"": 2, ""num_warps"": 2}",0.007296000141650438,574.8771818213262,4.920429006795299,3.0517578125e-05
A,softmax,softmax_m4096_n256,4096,256,6,256,2,3,"{""family"": ""softmax"", ""group_count"": null, ""k"": null, ""m"": 4096, ""n"": 256}","{""block_size"": 256, ""num_stages"": 3, ""num_warps"": 2}",0.0072639998979866505,577.4096997389177,4.924824651726833,3.0517578125e-05
A,softmax,softmax_m4096_n256,4096,256,7,256,2,4,"{""family"": ""softmax"", ""group_count"": null, ""k"": null, ""m"": 4096, ""n"": 256}","{""block_size"": 256, ""num_stages"": 4, ""num_warps"": 2}",0.007296000141650438,574.8771818213262,4.920429006795299,3.0517578125e-05
A,softmax,softmax_m4096_n256,4096,256,8,256,4,1,"{""family"": ""softmax"", ""group_count"": null, ""k"": null, ""m"": 4096, ""n"": 256}","{""block_size"": 256, ""num_stages"": 1, ""num_warps"": 4}",0.007391999941319227,567.4112599156022,4.90735695258117,3.0517578125e-05
A,softmax,softmax_m4096_n256,4096,256,9,256,4,2,"{""family"": ""softmax"", ""group_count"": null, ""k"": null, ""m"": 4096, ""n"": 256}","{""block_size"": 256, ""num_stages"": 2, ""num_warps"": 4}",0.007391999941319227,567.4112599156022,4.90735695258117,3.0517578125e-05
A,softmax,softmax_m4096_n256,4096,256,10,256,4,3,"{""family"": ""softmax"", ""group_count"": null, ""k"": null, ""m"": 4096, ""n"": 256}","{""block_size"": 256, ""num_stages"": 3, ""num_warps"": 4}",0.007391999941319227,567.4112599156022,4.90735695258117,3.0517578125e-05
A,softmax,softmax_m4096_n256,4096,256,11,256,4,4,"{""family"": ""softmax"", ""group_count"": null, ""k"": null, ""m"": 4096, ""n"": 256}","{""block_size"": 256, ""num_stages"": 4, ""num_warps"": 4}",0.007391999941319227,567.4112599156022,4.90735695258117,3.0517578125e-05
A,softmax,softmax_m4096_n256,4096,256,12,256,8,1,"{""family"": ""softmax"", ""group_count"": null, ""k"": null, ""m"": 4096, ""n"": 256}","{""block_size"": 256, ""num_stages"": 1, ""num_warps"": 8}",0.009727999567985535,431.15791388429847,4.6327469981677085,3.0517578125e-05
A,softmax,softmax_m4096_n256,4096,256,13,256,8,2,"{""family"": ""softmax"", ""group_count"": null, ""k"": null, ""m"": 4096, ""n"": 256}","{""block_size"": 256, ""num_stages"": 2, ""num_warps"": 8}",0.009727999567985535,431.15791388429847,4.6327469981677085,3.0517578125e-05
A,softmax,softmax_m4096_n256,4096,256,14,256,8,3,"{""family"": ""softmax"", ""group_count"": null, ""k"": null, ""m"": 4096, ""n"": 256}","{""block_size"": 256, ""num_stages"": 3, ""num_warps"": 8}",0.009727999567985535,431.15791388429847,4.6327469981677085,3.0517578125e-05
A,softmax,softmax_m4096_n256,4096,256,15,256,8,4,"{""family"": ""softmax"", ""group_count"": null, ""k"": null, ""m"": 4096, ""n"": 256}","{""block_size"": 256, ""num_stages"": 4, ""num_warps"": 8}",0.009727999567985535,431.15791388429847,4.6327469981677085,3.0517578125e-05
A,softmax,softmax_m4096_n256,4096,256,16,512,1,1,"{""family"": ""softmax"", ""group_count"": null, ""k"": null, ""m"": 4096, ""n"": 256}","{""block_size"": 512, ""num_stages"": 1, ""num_warps"": 1}",0.00723200011998415,579.9645921478763,4.929239639301533,3.0517578125e-05
A,softmax,softmax_m4096_n256,4096,256,17,512,1,2,"{""family"": ""softmax"", ""group_count"": null, ""k"": null, ""m"": 4096, ""n"": 256}","{""block_size"": 512, ""num_stages"": 2, ""num_warps"": 1}",0.00723200011998415,579.9645921478763,4.929239639301533,3.0517578125e-05
A,softmax,softmax_m4096_n256,4096,256,18,512,1,3,"{""family"": ""softmax"", ""group_count"": null, ""k"": null, ""m"": 4096, ""n"": 256}","{""block_size"": 512, ""num_stages"": 3, ""num_warps"": 1}",0.00723200011998415,579.9645921478763,4.929239639301533,3.0517578125e-05
A,softmax,softmax_m4096_n256,4096,256,19,512,1,4,"{""family"": ""softmax"", ""group_count"": null, ""k"": null, ""m"": 4096, ""n"": 256}","{""block_size"": 512, ""num_stages"": 4, ""num_warps"": 1}",0.00723200011998415,579.9645921478763,4.929239639301533,3.0517578125e-05
A,softmax,softmax_m4096_n256,4096,256,20,512,2,1,"{""family"": ""softmax"", ""group_count"": null, ""k"": null, ""m"": 4096, ""n"": 256}","{""block_size"": 512, ""num_stages"": 1, ""num_warps"": 2}",0.007391999941319227,567.4112599156022,4.90735695258117,3.0517578125e-05
A,softmax,softmax_m4096_n256,4096,256,21,512,2,2,"{""family"": ""softmax"", ""group_count"": null, ""k"": null, ""m"": 4096, ""n"": 256}","{""block_size"": 512, ""num_stages"": 2, ""num_warps"": 2}",0.007391999941319227,567.4112599156022,4.90735695258117,3.0517578125e-05
A,softmax,softmax_m4096_n256,4096,256,22,512,2,3,"{""family"": ""softmax"", ""group_count"": null, ""k"": null, ""m"": 4096, ""n"": 256}","{""block_size"": 512, ""num_stages"": 3, ""num_warps"": 2}",0.007391999941319227,567.4112599156022,4.90735695258117,3.0517578125e-05
A,softmax,softmax_m4096_n256,4096,256,23,512,2,4,"{""family"": ""softmax"", ""group_count"": null, ""k"": null, ""m"": 4096, ""n"": 256}","{""block_size"": 512, ""num_stages"": 4, ""num_warps"": 2}",0.007391999941319227,567.4112599156022,4.90735695258117,3.0517578125e-05
A,softmax,softmax_m4096_n256,4096,256,24,512,4,1,"{""family"": ""softmax"", ""group_count"": null, ""k"": null, ""m"": 4096, ""n"": 256}","{""block_size"": 512, ""num_stages"": 1, ""num_warps"": 4}",0.007424000184983015,564.9655031641942,4.903037258581345,3.0517578125e-05
A,softmax,softmax_m4096_n256,4096,256,25,512,4,2,"{""family"": ""softmax"", ""group_count"": null, ""k"": null, ""m"": 4096, ""n"": 256}","{""block_size"": 512, ""num_stages"": 2, ""num_warps"": 4}",0.007455999962985516,562.5407753248601,4.898736206563236,3.0517578125e-05
A,softmax,softmax_m4096_n256,4096,256,26,512,4,3,"{""family"": ""softmax"", ""group_count"": null, ""k"": null, ""m"": 4096, ""n"": 256}","{""block_size"": 512, ""num_stages"": 3, ""num_warps"": 4}",0.007455999962985516,562.5407753248601,4.898736206563236,3.0517578125e-05
A,softmax,softmax_m4096_n256,4096,256,27,512,4,4,"{""family"": ""softmax"", ""group_count"": null, ""k"": null, ""m"": 4096, ""n"": 256}","{""block_size"": 512, ""num_stages"": 4, ""num_warps"": 4}",0.007455999962985516,562.5407753248601,4.898736206563236,3.0517578125e-05
A,softmax,softmax_m4096_n256,4096,256,28,512,8,1,"{""family"": ""softmax"", ""group_count"": null, ""k"": null, ""m"": 4096, ""n"": 256}","{""block_size"": 512, ""num_stages"": 1, ""num_warps"": 8}",0.009631999768316746,435.45515997587916,4.6426644144691664,3.0517578125e-05
A,softmax,softmax_m4096_n256,4096,256,29,512,8,2,"{""family"": ""softmax"", ""group_count"": null, ""k"": null, ""m"": 4096, ""n"": 256}","{""block_size"": 512, ""num_stages"": 2, ""num_warps"": 8}",0.009664000011980534,434.01324449506313,4.63934763654997,3.0517578125e-05
A,softmax,softmax_m4096_n256,4096,256,30,512,8,3,"{""family"": ""softmax"", ""group_count"": null, ""k"": null, ""m"": 4096, ""n"": 256}","{""block_size"": 512, ""num_stages"": 3, ""num_warps"": 8}",0.009664000011980534,434.01324449506313,4.63934763654997,3.0517578125e-05
A,softmax,softmax_m4096_n256,4096,256,31,512,8,4,"{""family"": ""softmax"", ""group_count"": null, ""k"": null, ""m"": 4096, ""n"": 256}","{""block_size"": 512, ""num_stages"": 4, ""num_warps"": 8}",0.009696000255644321,432.58084668040044,4.636041823289221,3.0517578125e-05
A,softmax,softmax_m4096_n256,4096,256,32,1024,1,1,"{""family"": ""softmax"", ""group_count"": null, ""k"": null, ""m"": 4096, ""n"": 256}","{""block_size"": 1024, ""num_stages"": 1, ""num_warps"": 1}",0.007712000049650669,543.867216415538,4.864977715235788,3.0517578125e-05
A,softmax,softmax_m4096_n256,4096,256,33,1024,1,2,"{""family"": ""softmax"", ""group_count"": null, ""k"": null, ""m"": 4096, ""n"": 256}","{""block_size"": 1024, ""num_stages"": 2, ""num_warps"": 1}",0.007712000049650669,543.867216415538,4.864977715235788,3.0517578125e-05
A,softmax,softmax_m4096_n256,4096,256,34,1024,1,3,"{""family"": ""softmax"", ""group_count"": null, ""k"": null, ""m"": 4096, ""n"": 256}","{""block_size"": 1024, ""num_stages"": 3, ""num_warps"": 1}",0.007712000049650669,543.867216415538,4.864977715235788,3.0517578125e-05
A,softmax,softmax_m4096_n256,4096,256,35,1024,1,4,"{""family"": ""softmax"", ""group_count"": null, ""k"": null, ""m"": 4096, ""n"": 256}","{""block_size"": 1024, ""num_stages"": 4, ""num_warps"": 1}",0.007712000049650669,543.867216415538,4.864977715235788,3.0517578125e-05
A,softmax,softmax_m4096_n256,4096,256,36,1024,2,1,"{""family"": ""softmax"", ""group_count"": null, ""k"": null, ""m"": 4096, ""n"": 256}","{""block_size"": 1024, ""num_stages"": 1, ""num_warps"": 2}",0.007679999805986881,546.1333471298221,4.869135757084681,3.0517578125e-05
A,softmax,softmax_m4096_n256,4096,256,37,1024,2,2,"{""family"": ""softmax"", ""group_count"": null, ""k"": null, ""m"": 4096, ""n"": 256}","{""block_size"": 1024, ""num_stages"": 2, ""num_warps"": 2}",0.007679999805986881,546.1333471298221,4.869135757084681,3.0517578125e-05
A,softmax,softmax_m4096_n256,4096,256,38,1024,2,3,"{""family"": ""softmax"", ""group_count"": null, ""k"": null, ""m"": 4096, ""n"": 256}","{""block_size"": 1024, ""num_stages"": 3, ""num_warps"": 2}",0.007679999805986881,546.1333471298221,4.869135757084681,3.0517578125e-05
A,softmax,softmax_m4096_n256,4096,256,39,1024,2,4,"{""family"": ""softmax"", ""group_count"": null, ""k"": null, ""m"": 4096, ""n"": 256}","{""block_size"": 1024, ""num_stages"": 4, ""num_warps"": 2}",0.007679999805986881,546.1333471298221,4.869135757084681,3.0517578125e-05
A,softmax,softmax_m4096_n256,4096,256,40,1024,4,1,"{""family"": ""softmax"", ""group_count"": null, ""k"": null, ""m"": 4096, ""n"": 256}","{""block_size"": 1024, ""num_stages"": 1, ""num_warps"": 4}",0.007807999849319458,537.1803382354797,4.852606449169571,3.0517578125e-05
A,softmax,softmax_m4096_n256,4096,256,41,1024,4,2,"{""family"": ""softmax"", ""group_count"": null, ""k"": null, ""m"": 4096, ""n"": 256}","{""block_size"": 1024, ""num_stages"": 2, ""num_warps"": 4}",0.007807999849319458,537.1803382354797,4.852606449169571,3.0517578125e-05
A,softmax,softmax_m4096_n256,4096,256,42,1024,4,3,"{""family"": ""softmax"", ""group_count"": null, ""k"": null, ""m"": 4096, ""n"": 256}","{""block_size"": 1024, ""num_stages"": 3, ""num_warps"": 4}",0.007807999849319458,537.1803382354797,4.852606449169571,3.0517578125e-05
A,softmax,softmax_m4096_n256,4096,256,43,1024,4,4,"{""family"": ""softmax"", ""group_count"": null, ""k"": null, ""m"": 4096, ""n"": 256}","{""block_size"": 1024, ""num_stages"": 4, ""num_warps"": 4}",0.007807999849319458,537.1803382354797,4.852606449169571,3.0517578125e-05
A,softmax,softmax_m4096_n256,4096,256,44,1024,8,1,"{""family"": ""softmax"", ""group_count"": null, ""k"": null, ""m"": 4096, ""n"": 256}","{""block_size"": 1024, ""num_stages"": 1, ""num_warps"": 8}",0.010015999898314476,418.7603876379662,4.603571474776703,3.0517578125e-05
A,softmax,softmax_m4096_n256,4096,256,45,1024,8,2,"{""family"": ""softmax"", ""group_count"": null, ""k"": null, ""m"": 4096, ""n"": 256}","{""block_size"": 1024, ""num_stages"": 2, ""num_warps"": 8}",0.010015999898314476,418.7603876379662,4.603571474776703,3.0517578125e-05
A,softmax,softmax_m4096_n256,4096,256,46,1024,8,3,"{""family"": ""softmax"", ""group_count"": null, ""k"": null, ""m"": 4096, ""n"": 256}","{""block_size"": 1024, ""num_stages"": 3, ""num_warps"": 8}",0.009983999654650688,420.10257863402813,4.6067715019453415,3.0517578125e-05
A,softmax,softmax_m4096_n256,4096,256,47,1024,8,4,"{""family"": ""softmax"", ""group_count"": null, ""k"": null, ""m"": 4096, ""n"": 256}","{""block_size"": 1024, ""num_stages"": 4, ""num_warps"": 8}",0.010015999898314476,418.7603876379662,4.603571474776703,3.0517578125e-05
A,softmax,softmax_m4096_n256,4096,256,48,2048,1,1,"{""family"": ""softmax"", ""group_count"": null, ""k"": null, ""m"": 4096, ""n"": 256}","{""block_size"": 2048, ""num_stages"": 1, ""num_warps"": 1}",0.010463999584317207,400.83182020440466,4.5598145239923324,3.0517578125e-05
A,softmax,softmax_m4096_n256,4096,256,49,2048,1,2,"{""family"": ""softmax"", ""group_count"": null, ""k"": null, ""m"": 4096, ""n"": 256}","{""block_size"": 2048, ""num_stages"": 2, ""num_warps"": 1}",0.010432000271975994,402.06133921098234,4.562877247726521,3.0517578125e-05
A,softmax,softmax_m4096_n256,4096,256,50,2048,1,3,"{""family"": ""softmax"", ""group_count"": null, ""k"": null, ""m"": 4096, ""n"": 256}","{""block_size"": 2048, ""num_stages"": 3, ""num_warps"": 1}",0.010432000271975994,402.06133921098234,4.562877247726521,3.0517578125e-05
A,softmax,softmax_m4096_n256,4096,256,51,2048,1,4,"{""family"": ""softmax"", ""group_count"": null, ""k"": null, ""m"": 4096, ""n"": 256}","{""block_size"": 2048, ""num_stages"": 4, ""num_warps"": 1}",0.010432000271975994,402.06133921098234,4.562877247726521,3.0517578125e-05
A,softmax,softmax_m4096_n256,4096,256,52,2048,2,1,"{""family"": ""softmax"", ""group_count"": null, ""k"": null, ""m"": 4096, ""n"": 256}","{""block_size"": 2048, ""num_stages"": 1, ""num_warps"": 2}",0.009440000168979168,444.31185645344834,4.662799280924392,3.0517578125e-05
A,softmax,softmax_m4096_n256,4096,256,53,2048,2,2,"{""family"": ""softmax"", ""group_count"": null, ""k"": null, ""m"": 4096, ""n"": 256}","{""block_size"": 2048, ""num_stages"": 2, ""num_warps"": 2}",0.009440000168979168,444.31185645344834,4.662799280924392,3.0517578125e-05
A,softmax,softmax_m4096_n256,4096,256,54,2048,2,3,"{""family"": ""softmax"", ""group_count"": null, ""k"": null, ""m"": 4096, ""n"": 256}","{""block_size"": 2048, ""num_stages"": 3, ""num_warps"": 2}",0.009440000168979168,444.31185645344834,4.662799280924392,3.0517578125e-05
A,softmax,softmax_m4096_n256,4096,256,55,2048,2,4,"{""family"": ""softmax"", ""group_count"": null, ""k"": null, ""m"": 4096, ""n"": 256}","{""block_size"": 2048, ""num_stages"": 4, ""num_warps"": 2}",0.009472000412642956,442.81079151997955,4.659415157275987,3.0517578125e-05
A,softmax,softmax_m4096_n256,4096,256,56,2048,4,1,"{""family"": ""softmax"", ""group_count"": null, ""k"": null, ""m"": 4096, ""n"": 256}","{""block_size"": 2048, ""num_stages"": 1, ""num_warps"": 4}",0.009312000125646591,450.4192379087584,4.676451374500079,3.0517578125e-05
A,softmax,softmax_m4096_n256,4096,256,57,2048,4,2,"{""family"": ""softmax"", ""group_count"": null, ""k"": null, ""m"": 4096, ""n"": 256}","{""block_size"": 2048, ""num_stages"": 2, ""num_warps"": 4}",0.009312000125646591,450.4192379087584,4.676451374500079,3.0517578125e-05
A,softmax,softmax_m4096_n256,4096,256,58,2048,4,3,"{""family"": ""softmax"", ""group_count"": null, ""k"": null, ""m"": 4096, ""n"": 256}","{""block_size"": 2048, ""num_stages"": 3, ""num_warps"": 4}",0.009312000125646591,450.4192379087584,4.676451374500079,3.0517578125e-05
A,softmax,softmax_m4096_n256,4096,256,59,2048,4,4,"{""family"": ""softmax"", ""group_count"": null, ""k"": null, ""m"": 4096, ""n"": 256}","{""block_size"": 2048, ""num_stages"": 4, ""num_warps"": 4}",0.009312000125646591,450.4192379087584,4.676451374500079,3.0517578125e-05
A,softmax,softmax_m4096_n256,4096,256,60,2048,8,1,"{""family"": ""softmax"", ""group_count"": null, ""k"": null, ""m"": 4096, ""n"": 256}","{""block_size"": 2048, ""num_stages"": 1, ""num_warps"": 8}",0.011168000288307667,375.56446021865025,4.494702707146606,3.0517578125e-05
A,softmax,softmax_m4096_n256,4096,256,61,2048,8,2,"{""family"": ""softmax"", ""group_count"": null, ""k"": null, ""m"": 4096, ""n"": 256}","{""block_size"": 2048, ""num_stages"": 2, ""num_warps"": 8}",0.01119999960064888,374.4914419244265,4.491841536337438,3.0517578125e-05
A,softmax,softmax_m4096_n256,4096,256,62,2048,8,3,"{""family"": ""softmax"", ""group_count"": null, ""k"": null, ""m"": 4096, ""n"": 256}","{""block_size"": 2048, ""num_stages"": 3, ""num_warps"": 8}",0.01119999960064888,374.4914419244265,4.491841536337438,3.0517578125e-05
A,softmax,softmax_m4096_n256,4096,256,63,2048,8,4,"{""family"": ""softmax"", ""group_count"": null, ""k"": null, ""m"": 4096, ""n"": 256}","{""block_size"": 2048, ""num_stages"": 4, ""num_warps"": 8}",0.01119999960064888,374.4914419244265,4.491841536337438,3.0517578125e-05
A,softmax,softmax_m4096_n256,4096,256,64,4096,1,1,"{""family"": ""softmax"", ""group_count"": null, ""k"": null, ""m"": 4096, ""n"": 256}","{""block_size"": 4096, ""num_stages"": 1, ""num_warps"": 1}",0.017920000478625298,234.05713660571055,4.021837844726352,3.0517578125e-05
A,softmax,softmax_m4096_n256,4096,256,65,4096,1,2,"{""family"": ""softmax"", ""group_count"": null, ""k"": null, ""m"": 4096, ""n"": 256}","{""block_size"": 4096, ""num_stages"": 2, ""num_warps"": 1}",0.017952000722289085,233.63991929837547,4.020053709407389,3.0517578125e-05
A,softmax,softmax_m4096_n256,4096,256,66,4096,1,3,"{""family"": ""softmax"", ""group_count"": null, ""k"": null, ""m"": 4096, ""n"": 256}","{""block_size"": 4096, ""num_stages"": 3, ""num_warps"": 1}",0.017920000478625298,234.05713660571055,4.021837844726352,3.0517578125e-05
A,softmax,softmax_m4096_n256,4096,256,67,4096,1,4,"{""family"": ""softmax"", ""group_count"": null, ""k"": null, ""m"": 4096, ""n"": 256}","{""block_size"": 4096, ""num_stages"": 4, ""num_warps"": 1}",0.017920000478625298,234.05713660571055,4.021837844726352,3.0517578125e-05
A,softmax,softmax_m4096_n256,4096,256,68,4096,2,1,"{""family"": ""softmax"", ""group_count"": null, ""k"": null, ""m"": 4096, ""n"": 256}","{""block_size"": 4096, ""num_stages"": 1, ""num_warps"": 2}",0.014271999709308147,293.88341405756125,4.249455723512467,3.0517578125e-05
A,softmax,softmax_m4096_n256,4096,256,69,4096,2,2,"{""family"": ""softmax"", ""group_count"": null, ""k"": null, ""m"": 4096, ""n"": 256}","{""block_size"": 4096, ""num_stages"": 2, ""num_warps"": 2}",0.014240000396966934,294.5438120137532,4.251700345121416,3.0517578125e-05
A,softmax,softmax_m4096_n256,4096,256,70,4096,2,3,"{""family"": ""softmax"", ""group_count"": null, ""k"": null, ""m"": 4096, ""n"": 256}","{""block_size"": 4096, ""num_stages"": 3, ""num_warps"": 2}",0.014271999709308147,293.88341405756125,4.249455723512467,3.0517578125e-05
A,softmax,softmax_m4096_n256,4096,256,71,4096,2,4,"{""family"": ""softmax"", ""group_count"": null, ""k"": null, ""m"": 4096, ""n"": 256}","{""block_size"": 4096, ""num_stages"": 4, ""num_warps"": 2}",0.014240000396966934,294.5438120137532,4.251700345121416,3.0517578125e-05
A,softmax,softmax_m4096_n256,4096,256,72,4096,4,1,"{""family"": ""softmax"", ""group_count"": null, ""k"": null, ""m"": 4096, ""n"": 256}","{""block_size"": 4096, ""num_stages"": 1, ""num_warps"": 4}",0.013535999692976475,309.862891189066,4.302402498800268,3.0517578125e-05
A,softmax,softmax_m4096_n256,4096,256,73,4096,4,2,"{""family"": ""softmax"", ""group_count"": null, ""k"": null, ""m"": 4096, ""n"": 256}","{""block_size"": 4096, ""num_stages"": 2, ""num_warps"": 4}",0.01360000018030405,308.4047017936311,4.29768547298248,3.0517578125e-05
A,softmax,softmax_m4096_n256,4096,256,74,4096,4,3,"{""family"": ""softmax"", ""group_count"": null, ""k"": null, ""m"": 4096, ""n"": 256}","{""block_size"": 4096, ""num_stages"": 3, ""num_warps"": 4}",0.013504000380635262,310.59714764334814,4.3047693129416835,3.0517578125e-05
A,softmax,softmax_m4096_n256,4096,256,75,4096,4,4,"{""family"": ""softmax"", ""group_count"": null, ""k"": null, ""m"": 4096, ""n"": 256}","{""block_size"": 4096, ""num_stages"": 4, ""num_warps"": 4}",0.013535999692976475,309.862891189066,4.302402498800268,3.0517578125e-05
A,softmax,softmax_m4096_n256,4096,256,76,4096,8,1,"{""family"": ""softmax"", ""group_count"": null, ""k"": null, ""m"": 4096, ""n"": 256}","{""block_size"": 4096, ""num_stages"": 1, ""num_warps"": 8}",0.014368000440299511,291.91981288055746,4.24275173677784,3.0517578125e-05
A,softmax,softmax_m4096_n256,4096,256,77,4096,8,2,"{""family"": ""softmax"", ""group_count"": null, ""k"": null, ""m"": 4096, ""n"": 256}","{""block_size"": 4096, ""num_stages"": 2, ""num_warps"": 8}",0.014368000440299511,291.91981288055746,4.24275173677784,3.0517578125e-05
A,softmax,softmax_m4096_n256,4096,256,78,4096,8,3,"{""family"": ""softmax"", ""group_count"": null, ""k"": null, ""m"": 4096, ""n"": 256}","{""block_size"": 4096, ""num_stages"": 3, ""num_warps"": 8}",0.014368000440299511,291.91981288055746,4.24275173677784,3.0517578125e-05
A,softmax,softmax_m4096_n256,4096,256,79,4096,8,4,"{""family"": ""softmax"", ""group_count"": null, ""k"": null, ""m"": 4096, ""n"": 256}","{""block_size"": 4096, ""num_stages"": 4, ""num_warps"": 8}",0.014368000440299511,291.91981288055746,4.24275173677784,3.0517578125e-05
A,softmax,softmax_m4096_n256,4096,256,80,8192,1,1,"{""family"": ""softmax"", ""group_count"": null, ""k"": null, ""m"": 4096, ""n"": 256}","{""block_size"": 8192, ""num_stages"": 1, ""num_warps"": 1}",0.040192000567913055,104.35668642352894,3.214087294006401,3.0517578125e-05
A,softmax,softmax_m4096_n256,4096,256,81,8192,1,2,"{""family"": ""softmax"", ""group_count"": null, ""k"": null, ""m"": 4096, ""n"": 256}","{""block_size"": 8192, ""num_stages"": 2, ""num_warps"": 1}",0.04012800008058548,104.52312578690575,3.2156809319634707,3.0517578125e-05
A,softmax,softmax_m4096_n256,4096,256,82,8192,1,3,"{""family"": ""softmax"", ""group_count"": null, ""k"": null, ""m"": 4096, ""n"": 256}","{""block_size"": 8192, ""num_stages"": 3, ""num_warps"": 1}",0.04012800008058548,104.52312578690575,3.2156809319634707,3.0517578125e-05
A,softmax,softmax_m4096_n256,4096,256,83,8192,1,4,"{""family"": ""softmax"", ""group_count"": null, ""k"": null, ""m"": 4096, ""n"": 256}","{""block_size"": 8192, ""num_stages"": 4, ""num_warps"": 1}",0.04012800008058548,104.52312578690575,3.2156809319634707,3.0517578125e-05
A,softmax,softmax_m4096_n256,4096,256,84,8192,2,1,"{""family"": ""softmax"", ""group_count"": null, ""k"": null, ""m"": 4096, ""n"": 256}","{""block_size"": 8192, ""num_stages"": 1, ""num_warps"": 2}",0.03129599988460541,134.02045039191063,3.4642649888169297,3.0517578125e-05
A,softmax,softmax_m4096_n256,4096,256,85,8192,2,2,"{""family"": ""softmax"", ""group_count"": null, ""k"": null, ""m"": 4096, ""n"": 256}","{""block_size"": 8192, ""num_stages"": 2, ""num_warps"": 2}",0.03129599988460541,134.02045039191063,3.4642649888169297,3.0517578125e-05
A,softmax,softmax_m4096_n256,4096,256,86,8192,2,3,"{""family"": ""softmax"", ""group_count"": null, ""k"": null, ""m"": 4096, ""n"": 256}","{""block_size"": 8192, ""num_stages"": 3, ""num_warps"": 2}",0.03129599988460541,134.02045039191063,3.4642649888169297,3.0517578125e-05
A,softmax,softmax_m4096_n256,4096,256,87,8192,2,4,"{""family"": ""softmax"", ""group_count"": null, ""k"": null, ""m"": 4096, ""n"": 256}","{""block_size"": 8192, ""num_stages"": 4, ""num_warps"": 2}",0.03129599988460541,134.02045039191063,3.4642649888169297,3.0517578125e-05
A,softmax,softmax_m4096_n256,4096,256,88,8192,4,1,"{""family"": ""softmax"", ""group_count"": null, ""k"": null, ""m"": 4096, ""n"": 256}","{""block_size"": 8192, ""num_stages"": 1, ""num_warps"": 4}",0.02518399991095066,166.54637924201256,3.6815464102830933,3.0517578125e-05
A,softmax,softmax_m4096_n256,4096,256,89,8192,4,2,"{""family"": ""softmax"", ""group_count"": null, ""k"": null, ""m"": 4096, ""n"": 256}","{""block_size"": 8192, ""num_stages"": 2, ""num_warps"": 4}",0.02518399991095066,166.54637924201256,3.6815464102830933,3.0517578125e-05
A,softmax,softmax_m4096_n256,4096,256,90,8192,4,3,"{""family"": ""softmax"", ""group_count"": null, ""k"": null, ""m"": 4096, ""n"": 256}","{""block_size"": 8192, ""num_stages"": 3, ""num_warps"": 4}",0.02518399991095066,166.54637924201256,3.6815464102830933,3.0517578125e-05
A,softmax,softmax_m4096_n256,4096,256,91,8192,4,4,"{""family"": ""softmax"", ""group_count"": null, ""k"": null, ""m"": 4096, ""n"": 256}","{""block_size"": 8192, ""num_stages"": 4, ""num_warps"": 4}",0.02518399991095066,166.54637924201256,3.6815464102830933,3.0517578125e-05
A,softmax,softmax_m4096_n256,4096,256,92,8192,8,1,"{""family"": ""softmax"", ""group_count"": null, ""k"": null, ""m"": 4096, ""n"": 256}","{""block_size"": 8192, ""num_stages"": 1, ""num_warps"": 8}",0.022624000906944275,185.39178889055773,3.788743949180269,3.0517578125e-05
A,softmax,softmax_m4096_n256,4096,256,93,8192,8,2,"{""family"": ""softmax"", ""group_count"": null, ""k"": null, ""m"": 4096, ""n"": 256}","{""block_size"": 8192, ""num_stages"": 2, ""num_warps"": 8}",0.022655999287962914,185.1299493211242,3.787330592899019,3.0517578125e-05
A,softmax,softmax_m4096_n256,4096,256,94,8192,8,3,"{""family"": ""softmax"", ""group_count"": null, ""k"": null, ""m"": 4096, ""n"": 256}","{""block_size"": 8192, ""num_stages"": 3, ""num_warps"": 8}",0.022655999287962914,185.1299493211242,3.787330592899019,3.0517578125e-05
A,softmax,softmax_m4096_n256,4096,256,95,8192,8,4,"{""family"": ""softmax"", ""group_count"": null, ""k"": null, ""m"": 4096, ""n"": 256}","{""block_size"": 8192, ""num_stages"": 4, ""num_warps"": 8}",0.022655999287962914,185.1299493211242,3.787330592899019,3.0517578125e-05
A,softmax,softmax_m4096_n512,4096,512,0,512,1,1,"{""family"": ""softmax"", ""group_count"": null, ""k"": null, ""m"": 4096, ""n"": 512}","{""block_size"": 512, ""num_stages"": 1, ""num_warps"": 1}",0.007615999784320593,1101.445409343368,4.8775040098123235,1.52587890625e-05
A,softmax,softmax_m4096_n512,4096,512,1,512,1,2,"{""family"": ""softmax"", ""group_count"": null, ""k"": null, ""m"": 4096, ""n"": 512}","{""block_size"": 512, ""num_stages"": 2, ""num_warps"": 1}",0.007615999784320593,1101.445409343368,4.8775040098123235,1.52587890625e-05
A,softmax,softmax_m4096_n512,4096,512,2,512,1,3,"{""family"": ""softmax"", ""group_count"": null, ""k"": null, ""m"": 4096, ""n"": 512}","{""block_size"": 512, ""num_stages"": 3, ""num_warps"": 1}",0.007615999784320593,1101.445409343368,4.8775040098123235,1.52587890625e-05
A,softmax,softmax_m4096_n512,4096,512,3,512,1,4,"{""family"": ""softmax"", ""group_count"": null, ""k"": null, ""m"": 4096, ""n"": 512}","{""block_size"": 512, ""num_stages"": 4, ""num_warps"": 1}",0.007615999784320593,1101.445409343368,4.8775040098123235,1.52587890625e-05
A,softmax,softmax_m4096_n512,4096,512,4,512,2,1,"{""family"": ""softmax"", ""group_count"": null, ""k"": null, ""m"": 4096, ""n"": 512}","{""block_size"": 512, ""num_stages"": 1, ""num_warps"": 2}",0.007712000049650669,1087.734432831076,4.864977715235788,1.52587890625e-05
A,softmax,softmax_m4096_n512,4096,512,5,512,2,2,"{""family"": ""softmax"", ""group_count"": null, ""k"": null, ""m"": 4096, ""n"": 512}","{""block_size"": 512, ""num_stages"": 2, ""num_warps"": 2}",0.007712000049650669,1087.734432831076,4.864977715235788,1.52587890625e-05
A,softmax,softmax_m4096_n512,4096,512,6,512,2,3,"{""family"": ""softmax"", ""group_count"": null, ""k"": null, ""m"": 4096, ""n"": 512}","{""block_size"": 512, ""num_stages"": 3, ""num_warps"": 2}",0.007712000049650669,1087.734432831076,4.864977715235788,1.52587890625e-05
A,softmax,softmax_m4096_n512,4096,512,7,512,2,4,"{""family"": ""softmax"", ""group_count"": null, ""k"": null, ""m"": 4096, ""n"": 512}","{""block_size"": 512, ""num_stages"": 4, ""num_warps"": 2}",0.007712000049650669,1087.734432831076,4.864977715235788,1.52587890625e-05
A,softmax,softmax_m4096_n512,4096,512,8,512,4,1,"{""family"": ""softmax"", ""group_count"": null, ""k"": null, ""m"": 4096, ""n"": 512}","{""block_size"": 512, ""num_stages"": 1, ""num_warps"": 4}",0.007840000092983246,1069.9754975140568,4.848516432759713,1.52587890625e-05
A,softmax,softmax_m4096_n512,4096,512,9,512,4,2,"{""family"": ""softmax"", ""group_count"": null, ""k"": null, ""m"": 4096, ""n"": 512}","{""block_size"": 512, ""num_stages"": 2, ""num_warps"": 4}",0.007872000336647034,1065.625970688539,4.844443076467065,1.52587890625e-05
A,softmax,softmax_m4096_n512,4096,512,10,512,4,3,"{""family"": ""softmax"", ""group_count"": null, ""k"": null, ""m"": 4096, ""n"": 512}","{""block_size"": 512, ""num_stages"": 3, ""num_warps"": 4}",0.007872000336647034,1065.625970688539,4.844443076467065,1.52587890625e-05
A,softmax,softmax_m4096_n512,4096,512,11,512,4,4,"{""family"": ""softmax"", ""group_count"": null, ""k"": null, ""m"": 4096, ""n"": 512}","{""block_size"": 512, ""num_stages"": 4, ""num_warps"": 4}",0.007872000336647034,1065.625970688539,4.844443076467065,1.52587890625e-05
A,softmax,softmax_m4096_n512,4096,512,12,512,8,1,"{""family"": ""softmax"", ""group_count"": null, ""k"": null, ""m"": 4096, ""n"": 512}","{""block_size"": 512, ""num_stages"": 1, ""num_warps"": 8}",0.010143999941647053,826.9526861450242,4.590872887039726,1.52587890625e-05
A,softmax,softmax_m4096_n512,4096,512,13,512,8,2,"{""family"": ""softmax"", ""group_count"": null, ""k"": null, ""m"": 4096, ""n"": 512}","{""block_size"": 512, ""num_stages"": 2, ""num_warps"": 8}",0.010143999941647053,826.9526861450242,4.590872887039726,1.52587890625e-05
A,softmax,softmax_m4096_n512,4096,512,14,512,8,3,"{""family"": ""softmax"", ""group_count"": null, ""k"": null, ""m"": 4096, ""n"": 512}","{""block_size"": 512, ""num_stages"": 3, ""num_warps"": 8}",0.010111999697983265,829.569645030055,4.594032471444797,1.52587890625e-05
A,softmax,softmax_m4096_n512,4096,512,15,512,8,4,"{""family"": ""softmax"", ""group_count"": null, ""k"": null, ""m"": 4096, ""n"": 512}","{""block_size"": 512, ""num_stages"": 4, ""num_warps"": 8}",0.010143999941647053,826.9526861450242,4.590872887039726,1.52587890625e-05
A,softmax,softmax_m4096_n512,4096,512,16,1024,1,1,"{""family"": ""softmax"", ""group_count"": null, ""k"": null, ""m"": 4096, ""n"": 512}","{""block_size"": 1024, ""num_stages"": 1, ""num_warps"": 1}",0.007968000136315823,1052.7871305833905,4.83232174159193,1.52587890625e-05
A,softmax,softmax_m4096_n512,4096,512,17,1024,1,2,"{""family"": ""softmax"", ""group_count"": null, ""k"": null, ""m"": 4096, ""n"": 512}","{""block_size"": 1024, ""num_stages"": 2, ""num_warps"": 1}",0.007968000136315823,1052.7871305833905,4.83232174159193,1.52587890625e-05
A,softmax,softmax_m4096_n512,4096,512,18,1024,1,3,"{""family"": ""softmax"", ""group_count"": null, ""k"": null, ""m"": 4096, ""n"": 512}","{""block_size"": 1024, ""num_stages"": 3, ""num_warps"": 1}",0.007968000136315823,1052.7871305833905,4.83232174159193,1.52587890625e-05
A,softmax,softmax_m4096_n512,4096,512,19,1024,1,4,"{""family"": ""softmax"", ""group_count"": null, ""k"": null, ""m"": 4096, ""n"": 512}","{""block_size"": 1024, ""num_stages"": 4, ""num_warps"": 1}",0.007968000136315823,1052.7871305833905,4.83232174159193,1.52587890625e-05
A,softmax,softmax_m4096_n512,4096,512,20,1024,2,1,"{""family"": ""softmax"", ""group_count"": null, ""k"": null, ""m"": 4096, ""n"": 512}","{""block_size"": 1024, ""num_stages"": 1, ""num_warps"": 2}",0.007968000136315823,1052.7871305833905,4.83232174159193,1.52587890625e-05
A,softmax,softmax_m4096_n512,4096,512,21,1024,2,2,"{""family"": ""softmax"", ""group_count"": null, ""k"": null, ""m"": 4096, ""n"": 512}","{""block_size"": 1024, ""num_stages"": 2, ""num_warps"": 2}",0.007968000136315823,1052.7871305833905,4.83232174159193,1.52587890625e-05
A,softmax,softmax_m4096_n512,4096,512,22,1024,2,3,"{""family"": ""softmax"", ""group_count"": null, ""k"": null, ""m"": 4096, ""n"": 512}","{""block_size"": 1024, ""num_stages"": 3, ""num_warps"": 2}",0.007968000136315823,1052.7871305833905,4.83232174159193,1.52587890625e-05
A,softmax,softmax_m4096_n512,4096,512,23,1024,2,4,"{""family"": ""softmax"", ""group_count"": null, ""k"": null, ""m"": 4096, ""n"": 512}","{""block_size"": 1024, ""num_stages"": 4, ""num_warps"": 2}",0.007968000136315823,1052.7871305833905,4.83232174159193,1.52587890625e-05
A,softmax,softmax_m4096_n512,4096,512,24,1024,4,1,"{""family"": ""softmax"", ""group_count"": null, ""k"": null, ""m"": 4096, ""n"": 512}","{""block_size"": 1024, ""num_stages"": 1, ""num_warps"": 4}",0.00825599953532219,1016.0620726915577,4.796815126526582,1.52587890625e-05
A,softmax,softmax_m4096_n512,4096,512,25,1024,4,2,"{""family"": ""softmax"", ""group_count"": null, ""k"": null, ""m"": 4096, ""n"": 512}","{""block_size"": 1024, ""num_stages"": 2, ""num_warps"": 4}",0.00825599953532219,1016.0620726915577,4.796815126526582,1.52587890625e-05
A,softmax,softmax_m4096_n512,4096,512,26,1024,4,3,"{""family"": ""softmax"", ""group_count"": null, ""k"": null, ""m"": 4096, ""n"": 512}","{""block_size"": 1024, ""num_stages"": 3, ""num_warps"": 4}",0.00825599953532219,1016.0620726915577,4.796815126526582,1.52587890625e-05
A,softmax,softmax_m4096_n512,4096,512,27,1024,4,4,"{""family"": ""softmax"", ""group_count"": null, ""k"": null, ""m"": 4096, ""n"": 512}","{""block_size"": 1024, ""num_stages"": 4, ""num_warps"": 4}",0.00825599953532219,1016.0620726915577,4.796815126526582,1.52587890625e-05
A,softmax,softmax_m4096_n512,4096,512,28,1024,8,1,"{""family"": ""softmax"", ""group_count"": null, ""k"": null, ""m"": 4096, ""n"": 512}","{""block_size"": 1024, ""num_stages"": 1, ""num_warps"": 8}",0.010432000271975994,804.1226784219647,4.562877247726521,1.52587890625e-05
A,softmax,softmax_m4096_n512,4096,512,29,1024,8,2,"{""family"": ""softmax"", ""group_count"": null, ""k"": null, ""m"": 4096, ""n"": 512}","{""block_size"": 1024, ""num_stages"": 2, ""num_warps"": 8}",0.010432000271975994,804.1226784219647,4.562877247726521,1.52587890625e-05
A,softmax,softmax_m4096_n512,4096,512,30,1024,8,3,"{""family"": ""softmax"", ""group_count"": null, ""k"": null, ""m"": 4096, ""n"": 512}","{""block_size"": 1024, ""num_stages"": 3, ""num_warps"": 8}",0.010432000271975994,804.1226784219647,4.562877247726521,1.52587890625e-05
A,softmax,softmax_m4096_n512,4096,512,31,1024,8,4,"{""family"": ""softmax"", ""group_count"": null, ""k"": null, ""m"": 4096, ""n"": 512}","{""block_size"": 1024, ""num_stages"": 4, ""num_warps"": 8}",0.010432000271975994,804.1226784219647,4.562877247726521,1.52587890625e-05
A,softmax,softmax_m4096_n512,4096,512,32,2048,1,1,"{""family"": ""softmax"", ""group_count"": null, ""k"": null, ""m"": 4096, ""n"": 512}","{""block_size"": 2048, ""num_stages"": 1, ""num_warps"": 1}",0.011008000001311302,762.04651153713,4.509132997672027,1.52587890625e-05
A,softmax,softmax_m4096_n512,4096,512,33,2048,1,2,"{""family"": ""softmax"", ""group_count"": null, ""k"": null, ""m"": 4096, ""n"": 512}","{""block_size"": 2048, ""num_stages"": 2, ""num_warps"": 1}",0.011008000001311302,762.04651153713,4.509132997672027,1.52587890625e-05
A,softmax,softmax_m4096_n512,4096,512,34,2048,1,3,"{""family"": ""softmax"", ""group_count"": null, ""k"": null, ""m"": 4096, ""n"": 512}","{""block_size"": 2048, ""num_stages"": 3, ""num_warps"": 1}",0.011008000001311302,762.04651153713,4.509132997672027,1.52587890625e-05
A,softmax,softmax_m4096_n512,4096,512,35,2048,1,4,"{""family"": ""softmax"", ""group_count"": null, ""k"": null, ""m"": 4096, ""n"": 512}","{""block_size"": 2048, ""num_stages"": 4, ""num_warps"": 1}",0.011008000001311302,762.04651153713,4.509132997672027,1.52587890625e-05
A,softmax,softmax_m4096_n512,4096,512,36,2048,2,1,"{""family"": ""softmax"", ""group_count"": null, ""k"": null, ""m"": 4096, ""n"": 512}","{""block_size"": 2048, ""num_stages"": 1, ""num_warps"": 2}",0.009855999611318111,851.1169166815879,4.619674911627042,1.52587890625e-05
A,softmax,softmax_m4096_n512,4096,512,37,2048,2,2,"{""family"": ""softmax"", ""group_count"": null, ""k"": null, ""m"": 4096, ""n"": 512}","{""block_size"": 2048, ""num_stages"": 2, ""num_warps"": 2}",0.009855999611318111,851.1169166815879,4.619674911627042,1.52587890625e-05
A,softmax,softmax_m4096_n512,4096,512,38,2048,2,3,"{""family"": ""softmax"", ""group_count"": null, ""k"": null, ""m"": 4096, ""n"": 512}","{""block_size"": 2048, ""num_stages"": 3, ""num_warps"": 2}",0.009855999611318111,851.1169166815879,4.619674911627042,1.52587890625e-05
A,softmax,softmax_m4096_n512,4096,512,39,2048,2,4,"{""family"": ""softmax"", ""group_count"": null, ""k"": null, ""m"": 4096, ""n"": 512}","{""block_size"": 2048, ""num_stages"": 4, ""num_warps"": 2}",0.009855999611318111,851.1169166815879,4.619674911627042,1.52587890625e-05
A,softmax,softmax_m4096_n512,4096,512,40,2048,4,1,"{""family"": ""softmax"", ""group_count"": null, ""k"": null, ""m"": 4096, ""n"": 512}","{""block_size"": 2048, ""num_stages"": 1, ""num_warps"": 4}",0.009568000212311745,876.73576649861,4.649331059584089,1.52587890625e-05
A,softmax,softmax_m4096_n512,4096,512,41,2048,4,2,"{""family"": ""softmax"", ""group_count"": null, ""k"": null, ""m"": 4096, ""n"": 512}","{""block_size"": 2048, ""num_stages"": 2, ""num_warps"": 4}",0.009568000212311745,876.73576649861,4.649331059584089,1.52587890625e-05
A,softmax,softmax_m4096_n512,4096,512,42,2048,4,3,"{""family"": ""softmax"", ""group_count"": null, ""k"": null, ""m"": 4096, ""n"": 512}","{""block_size"": 2048, ""num_stages"": 3, ""num_warps"": 4}",0.009600000455975533,873.813291829429,4.645992133010896,1.52587890625e-05
A,softmax,softmax_m4096_n512,4096,512,43,2048,4,4,"{""family"": ""softmax"", ""group_count"": null, ""k"": null, ""m"": 4096, ""n"": 512}","{""block_size"": 2048, ""num_stages"": 4, ""num_warps"": 4}",0.009568000212311745,876.73576649861,4.649331059584089,1.52587890625e-05
A,softmax,softmax_m4096_n512,4096,512,44,2048,8,1,"{""family"": ""softmax"", ""group_count"": null, ""k"": null, ""m"": 4096, ""n"": 512}","{""block_size"": 2048, ""num_stages"": 1, ""num_warps"": 8}",0.01152000017464161,728.1777667387033,4.46367060855453,1.52587890625e-05
A,softmax,softmax_m4096_n512,4096,512,45,2048,8,2,"{""family"": ""softmax"", ""group_count"": null, ""k"": null, ""m"": 4096, ""n"": 512}","{""block_size"": 2048, ""num_stages"": 2, ""num_warps"": 8}",0.011487999930977821,730.2061325209278,4.466452272684466,1.52587890625e-05
A,softmax,softmax_m4096_n512,4096,512,46,2048,8,3,"{""family"": ""softmax"", ""group_count"": null, ""k"": null, ""m"": 4096, ""n"": 512}","{""block_size"": 2048, ""num_stages"": 3, ""num_warps"": 8}",0.01152000017464161,728.1777667387033,4.46367060855453,1.52587890625e-05
A,softmax,softmax_m4096_n512,4096,512,47,2048,8,4,"{""family"": ""softmax"", ""group_count"": null, ""k"": null, ""m"": 4096, ""n"": 512}","{""block_size"": 2048, ""num_stages"": 4, ""num_warps"": 8}",0.01152000017464161,728.1777667387033,4.46367060855453,1.52587890625e-05
A,softmax,softmax_m4096_n512,4096,512,48,4096,1,1,"{""family"": ""softmax"", ""group_count"": null, ""k"": null, ""m"": 4096, ""n"": 512}","{""block_size"": 4096, ""num_stages"": 1, ""num_warps"": 1}",0.018432000651955605,455.1110950134424,3.993666959097802,1.52587890625e-05
A,softmax,softmax_m4096_n512,4096,512,49,4096,1,2,"{""family"": ""softmax"", ""group_count"": null, ""k"": null, ""m"": 4096, ""n"": 512}","{""block_size"": 4096, ""num_stages"": 2, ""num_warps"": 1}",0.018432000651955605,455.1110950134424,3.993666959097802,1.52587890625e-05
A,softmax,softmax_m4096_n512,4096,512,50,4096,1,3,"{""family"": ""softmax"", ""group_count"": null, ""k"": null, ""m"": 4096, ""n"": 512}","{""block_size"": 4096, ""num_stages"": 3, ""num_warps"": 1}",0.018464000895619392,454.32233498159155,3.9919323401501994,1.52587890625e-05
A,softmax,softmax_m4096_n512,4096,512,51,4096,1,4,"{""family"": ""softmax"", ""group_count"": null, ""k"": null, ""m"": 4096, ""n"": 512}","{""block_size"": 4096, ""num_stages"": 4, ""num_warps"": 1}",0.018432000651955605,455.1110950134424,3.993666959097802,1.52587890625e-05
A,softmax,softmax_m4096_n512,4096,512,52,4096,2,1,"{""family"": ""softmax"", ""group_count"": null, ""k"": null, ""m"": 4096, ""n"": 512}","{""block_size"": 4096, ""num_stages"": 1, ""num_warps"": 2}",0.014592000283300877,574.8771818213262,4.2272818262353535,1.52587890625e-05
A,softmax,softmax_m4096_n512,4096,512,53,4096,2,2,"{""family"": ""softmax"", ""group_count"": null, ""k"": null, ""m"": 4096, ""n"": 512}","{""block_size"": 4096, ""num_stages"": 2, ""num_warps"": 2}",0.014560000039637089,576.1406577722157,4.22947723349127,1.52587890625e-05
A,softmax,softmax_m4096_n512,4096,512,54,4096,2,3,"{""family"": ""softmax"", ""group_count"": null, ""k"": null, ""m"": 4096, ""n"": 512}","{""block_size"": 4096, ""num_stages"": 3, ""num_warps"": 2}",0.014592000283300877,574.8771818213262,4.2272818262353535,1.52587890625e-05
A,softmax,softmax_m4096_n512,4096,512,55,4096,2,4,"{""family"": ""softmax"", ""group_count"": null, ""k"": null, ""m"": 4096, ""n"": 512}","{""block_size"": 4096, ""num_stages"": 4, ""num_warps"": 2}",0.014560000039637089,576.1406577722157,4.22947723349127,1.52587890625e-05
A,softmax,softmax_m4096_n512,4096,512,56,4096,4,1,"{""family"": ""softmax"", ""group_count"": null, ""k"": null, ""m"": 4096, ""n"": 512}","{""block_size"": 4096, ""num_stages"": 1, ""num_warps"": 4}",0.013728000223636627,611.0582651038018,4.288317719945984,1.52587890625e-05
A,softmax,softmax_m4096_n512,4096,512,57,4096,4,2,"{""family"": ""softmax"", ""group_count"": null, ""k"": null, ""m"": 4096, ""n"": 512}","{""block_size"": 4096, ""num_stages"": 2, ""num_warps"": 4}",0.013728000223636627,611.0582651038018,4.288317719945984,1.52587890625e-05
A,softmax,softmax_m4096_n512,4096,512,58,4096,4,3,"{""family"": ""softmax"", ""group_count"": null, ""k"": null, ""m"": 4096, ""n"": 512}","{""block_size"": 4096, ""num_stages"": 3, ""num_warps"": 4}",0.013728000223636627,611.0582651038018,4.288317719945984,1.52587890625e-05
A,softmax,softmax_m4096_n512,4096,512,59,4096,4,4,"{""family"": ""softmax"", ""group_count"": null, ""k"": null, ""m"": 4096, ""n"": 512}","{""block_size"": 4096, ""num_stages"": 4, ""num_warps"": 4}",0.013728000223636627,611.0582651038018,4.288317719945984,1.52587890625e-05
A,softmax,softmax_m4096_n512,4096,512,60,4096,8,1,"{""family"": ""softmax"", ""group_count"": null, ""k"": null, ""m"": 4096, ""n"": 512}","{""block_size"": 4096, ""num_stages"": 1, ""num_warps"": 8}",0.014495999552309513,578.6843445827453,4.23388256056524,1.52587890625e-05
A,softmax,softmax_m4096_n512,4096,512,61,4096,8,2,"{""family"": ""softmax"", ""group_count"": null, ""k"": null, ""m"": 4096, ""n"": 512}","{""block_size"": 4096, ""num_stages"": 2, ""num_warps"": 8}",0.014495999552309513,578.6843445827453,4.23388256056524,1.52587890625e-05
A,softmax,softmax_m4096_n512,4096,512,62,4096,8,3,"{""family"": ""softmax"", ""group_count"": null, ""k"": null, ""m"": 4096, ""n"": 512}","{""block_size"": 4096, ""num_stages"": 3, ""num_warps"": 8}",0.0144640002399683,579.9645921478763,4.236092458741588,1.52587890625e-05
A,softmax,softmax_m4096_n512,4096,512,63,4096,8,4,"{""family"": ""softmax"", ""group_count"": null, ""k"": null, ""m"": 4096, ""n"": 512}","{""block_size"": 4096, ""num_stages"": 4, ""num_warps"": 8}",0.014495999552309513,578.6843445827453,4.23388256056524,1.52587890625e-05
A,softmax,softmax_m4096_n512,4096,512,64,8192,1,1,"{""family"": ""softmax"", ""group_count"": null, ""k"": null, ""m"": 4096, ""n"": 512}","{""block_size"": 8192, ""num_stages"": 1, ""num_warps"": 1}",0.04032000154256821,208.05078569115756,3.2109076169608843,1.52587890625e-05
A,softmax,softmax_m4096_n512,4096,512,65,8192,1,2,"{""family"": ""softmax"", ""group_count"": null, ""k"": null, ""m"": 4096, ""n"": 512}","{""block_size"": 8192, ""num_stages"": 2, ""num_warps"": 1}",0.040352001786231995,207.88579571440673,3.210114274933372,1.52587890625e-05
A,softmax,softmax_m4096_n512,4096,512,66,8192,1,3,"{""family"": ""softmax"", ""group_count"": null, ""k"": null, ""m"": 4096, ""n"": 512}","{""block_size"": 8192, ""num_stages"": 3, ""num_warps"": 1}",0.040383998304605484,207.7210863750295,3.2093216540452274,1.52587890625e-05
A,softmax,softmax_m4096_n512,4096,512,67,8192,1,4,"{""family"": ""softmax"", ""group_count"": null, ""k"": null, ""m"": 4096, ""n"": 512}","{""block_size"": 8192, ""num_stages"": 4, ""num_warps"": 1}",0.04032000154256821,208.05078569115756,3.2109076169608843,1.52587890625e-05
A,softmax,softmax_m4096_n512,4096,512,68,8192,2,1,"{""family"": ""softmax"", ""group_count"": null, ""k"": null, ""m"": 4096, ""n"": 512}","{""block_size"": 8192, ""num_stages"": 1, ""num_warps"": 2}",0.0315839983522892,265.5967717080379,3.455104667900229,1.52587890625e-05
A,softmax,softmax_m4096_n512,4096,512,69,8192,2,2,"{""family"": ""softmax"", ""group_count"": null, ""k"": null, ""m"": 4096, ""n"": 512}","{""block_size"": 8192, ""num_stages"": 2, ""num_warps"": 2}",0.03161599859595299,265.3279470057222,3.4540920018260626,1.52587890625e-05
A,softmax,softmax_m4096_n512,4096,512,70,8192,2,3,"{""family"": ""softmax"", ""group_count"": null, ""k"": null, ""m"": 4096, ""n"": 512}","{""block_size"": 8192, ""num_stages"": 3, ""num_warps"": 2}",0.0315839983522892,265.5967717080379,3.455104667900229,1.52587890625e-05
A,softmax,softmax_m4096_n512,4096,512,71,8192,2,4,"{""family"": ""softmax"", ""group_count"": null, ""k"": null, ""m"": 4096, ""n"": 512}","{""block_size"": 8192, ""num_stages"": 4, ""num_warps"": 2}",0.03161599859595299,265.3279470057222,3.4540920018260626,1.52587890625e-05
A,softmax,softmax_m4096_n512,4096,512,72,8192,4,1,"{""family"": ""softmax"", ""group_count"": null, ""k"": null, ""m"": 4096, ""n"": 512}","{""block_size"": 8192, ""num_stages"": 1, ""num_warps"": 4}",0.025439999997615814,329.7408805340473,3.671432540603934,1.52587890625e-05
A,softmax,softmax_m4096_n512,4096,512,73,8192,4,2,"{""family"": ""softmax"", ""group_count"": null, ""k"": null, ""m"": 4096, ""n"": 512}","{""block_size"": 8192, ""num_stages"": 2, ""num_warps"": 4}",0.025472000241279602,329.3266300463333,3.6701754598478185,1.52587890625e-05
A,softmax,softmax_m4096_n512,4096,512,74,8192,4,3,"{""family"": ""softmax"", ""group_count"": null, ""k"": null, ""m"": 4096, ""n"": 512}","{""block_size"": 8192, ""num_stages"": 3, ""num_warps"": 4}",0.025472000241279602,329.3266300463333,3.6701754598478185,1.52587890625e-05
A,softmax,softmax_m4096_n512,4096,512,75,8192,4,4,"{""family"": ""softmax"", ""group_count"": null, ""k"": null, ""m"": 4096, ""n"": 512}","{""block_size"": 8192, ""num_stages"": 4, ""num_warps"": 4}",0.025472000241279602,329.3266300463333,3.6701754598478185,1.52587890625e-05
A,softmax,softmax_m4096_n512,4096,512,76,8192,8,1,"{""family"": ""softmax"", ""group_count"": null, ""k"": null, ""m"": 4096, ""n"": 512}","{""block_size"": 8192, ""num_stages"": 1, ""num_warps"": 8}",0.022784000262618065,368.1797710371024,3.781696732226147,1.52587890625e-05
A,softmax,softmax_m4096_n512,4096,512,77,8192,8,2,"{""family"": ""softmax"", ""group_count"": null, ""k"": null, ""m"": 4096, ""n"": 512}","{""block_size"": 8192, ""num_stages"": 2, ""num_warps"": 8}",0.022816000506281853,367.66338595102997,3.7802932125604793,1.52587890625e-05
A,softmax,softmax_m4096_n512,4096,512,78,8192,8,3,"{""family"": ""softmax"", ""group_count"": null, ""k"": null, ""m"": 4096, ""n"": 512}","{""block_size"": 8192, ""num_stages"": 3, ""num_warps"": 8}",0.022784000262618065,368.1797710371024,3.781696732226147,1.52587890625e-05
A,softmax,softmax_m4096_n512,4096,512,79,8192,8,4,"{""family"": ""softmax"", ""group_count"": null, ""k"": null, ""m"": 4096, ""n"": 512}","{""block_size"": 8192, ""num_stages"": 4, ""num_warps"": 8}",0.022784000262618065,368.1797710371024,3.781696732226147,1.52587890625e-05
A,softmax,softmax_m4096_n1024,4096,1024,0,1024,1,1,"{""family"": ""softmax"", ""group_count"": null, ""k"": null, ""m"": 4096, ""n"": 1024}","{""block_size"": 1024, ""num_stages"": 1, ""num_warps"": 1}",0.008960000239312649,1872.4570928456844,4.714985025286297,7.62939453125e-06
A,softmax,softmax_m4096_n1024,4096,1024,1,1024,1,2,"{""family"": ""softmax"", ""group_count"": null, ""k"": null, ""m"": 4096, ""n"": 1024}","{""block_size"": 1024, ""num_stages"": 2, ""num_warps"": 1}",0.008960000239312649,1872.4570928456844,4.714985025286297,7.62939453125e-06
A,softmax,softmax_m4096_n1024,4096,1024,2,1024,1,3,"{""family"": ""softmax"", ""group_count"": null, ""k"": null, ""m"": 4096, ""n"": 1024}","{""block_size"": 1024, ""num_stages"": 3, ""num_warps"": 1}",0.008960000239312649,1872.4570928456844,4.714985025286297,7.62939453125e-06
A,softmax,softmax_m4096_n1024,4096,1024,3,1024,1,4,"{""family"": ""softmax"", ""group_count"": null, ""k"": null, ""m"": 4096, ""n"": 1024}","{""block_size"": 1024, ""num_stages"": 4, ""num_warps"": 1}",0.008960000239312649,1872.4570928456844,4.714985025286297,7.62939453125e-06
A,softmax,softmax_m4096_n1024,4096,1024,4,1024,2,1,"{""family"": ""softmax"", ""group_count"": null, ""k"": null, ""m"": 4096, ""n"": 1024}","{""block_size"": 1024, ""num_stages"": 1, ""num_warps"": 2}",0.008927999995648861,1879.168459697191,4.718562873830541,7.62939453125e-06
A,softmax,softmax_m4096_n1024,4096,1024,5,1024,2,2,"{""family"": ""softmax"", ""group_count"": null, ""k"": null, ""m"": 4096, ""n"": 1024}","{""block_size"": 1024, ""num_stages"": 2, ""num_warps"": 2}",0.008927999995648861,1879.168459697191,4.718562873830541,7.62939453125e-06
A,softmax,softmax_m4096_n1024,4096,1024,6,1024,2,3,"{""family"": ""softmax"", ""group_count"": null, ""k"": null, ""m"": 4096, ""n"": 1024}","{""block_size"": 1024, ""num_stages"": 3, ""num_warps"": 2}",0.008927999995648861,1879.168459697191,4.718562873830541,7.62939453125e-06
A,softmax,softmax_m4096_n1024,4096,1024,7,1024,2,4,"{""family"": ""softmax"", ""group_count"": null, ""k"": null, ""m"": 4096, ""n"": 1024}","{""block_size"": 1024, ""num_stages"": 4, ""num_warps"": 2}",0.008927999995648861,1879.168459697191,4.718562873830541,7.62939453125e-06
A,softmax,softmax_m4096_n1024,4096,1024,8,1024,4,1,"{""family"": ""softmax"", ""group_count"": null, ""k"": null, ""m"": 4096, ""n"": 1024}","{""block_size"": 1024, ""num_stages"": 1, ""num_warps"": 4}",0.00940799992531538,1783.292531163321,4.666194895764282,7.62939453125e-06
A,softmax,softmax_m4096_n1024,4096,1024,9,1024,4,2,"{""family"": ""softmax"", ""group_count"": null, ""k"": null, ""m"": 4096, ""n"": 1024}","{""block_size"": 1024, ""num_stages"": 2, ""num_warps"": 4}",0.00940799992531538,1783.292531163321,4.666194895764282,7.62939453125e-06
A,softmax,softmax_m4096_n1024,4096,1024,10,1024,4,3,"{""family"": ""softmax"", ""group_count"": null, ""k"": null, ""m"": 4096, ""n"": 1024}","{""block_size"": 1024, ""num_stages"": 3, ""num_warps"": 4}",0.00940799992531538,1783.292531163321,4.666194895764282,7.62939453125e-06
A,softmax,softmax_m4096_n1024,4096,1024,11,1024,4,4,"{""family"": ""softmax"", ""group_count"": null, ""k"": null, ""m"": 4096, ""n"": 1024}","{""block_size"": 1024, ""num_stages"": 4, ""num_warps"": 4}",0.009375999681651592,1789.3789003461948,4.669602080101023,7.62939453125e-06
A,softmax,softmax_m4096_n1024,4096,1024,12,1024,8,1,"{""family"": ""softmax"", ""group_count"": null, ""k"": null, ""m"": 4096, ""n"": 1024}","{""block_size"": 1024, ""num_stages"": 1, ""num_warps"": 8}",0.01158399973064661,1448.3094259415618,4.458130466590968,7.62939453125e-06
A,softmax,softmax_m4096_n1024,4096,1024,13,1024,8,2,"{""family"": ""softmax"", ""group_count"": null, ""k"": null, ""m"": 4096, ""n"": 1024}","{""block_size"": 1024, ""num_stages"": 2, ""num_warps"": 8}",0.01158399973064661,1448.3094259415618,4.458130466590968,7.62939453125e-06
A,softmax,softmax_m4096_n1024,4096,1024,14,1024,8,3,"{""family"": ""softmax"", ""group_count"": null, ""k"": null, ""m"": 4096, ""n"": 1024}","{""block_size"": 1024, ""num_stages"": 3, ""num_warps"": 8}",0.01158399973064661,1448.3094259415618,4.458130466590968,7.62939453125e-06
A,softmax,softmax_m4096_n1024,4096,1024,15,1024,8,4,"{""family"": ""softmax"", ""group_count"": null, ""k"": null, ""m"": 4096, ""n"": 1024}","{""block_size"": 1024, ""num_stages"": 4, ""num_warps"": 8}",0.01158399973064661,1448.3094259415618,4.458130466590968,7.62939453125e-06
A,softmax,softmax_m4096_n1024,4096,1024,16,2048,1,1,"{""family"": ""softmax"", ""group_count"": null, ""k"": null, ""m"": 4096, ""n"": 1024}","{""block_size"": 2048, ""num_stages"": 1, ""num_warps"": 1}",0.01196799986064434,1401.8395885155649,4.425518869394038,7.62939453125e-06
A,softmax,softmax_m4096_n1024,4096,1024,17,2048,1,2,"{""family"": ""softmax"", ""group_count"": null, ""k"": null, ""m"": 4096, ""n"": 1024}","{""block_size"": 2048, ""num_stages"": 2, ""num_warps"": 1}",0.011935999616980553,1405.5979003327188,4.428196267610163,7.62939453125e-06
A,softmax,softmax_m4096_n1024,4096,1024,18,2048,1,3,"{""family"": ""softmax"", ""group_count"": null, ""k"": null, ""m"": 4096, ""n"": 1024}","{""block_size"": 2048, ""num_stages"": 3, ""num_warps"": 1}",0.011935999616980553,1405.5979003327188,4.428196267610163,7.62939453125e-06
A,softmax,softmax_m4096_n1024,4096,1024,19,2048,1,4,"{""family"": ""softmax"", ""group_count"": null, ""k"": null, ""m"": 4096, ""n"": 1024}","{""block_size"": 2048, ""num_stages"": 4, ""num_warps"": 1}",0.01196799986064434,1401.8395885155649,4.425518869394038,7.62939453125e-06
A,softmax,softmax_m4096_n1024,4096,1024,20,2048,2,1,"{""family"": ""softmax"", ""group_count"": null, ""k"": null, ""m"": 4096, ""n"": 1024}","{""block_size"": 2048, ""num_stages"": 1, ""num_warps"": 2}",0.010528000071644783,1593.5805362678827,4.55371689759401,7.62939453125e-06
A,softmax,softmax_m4096_n1024,4096,1024,21,2048,2,2,"{""family"": ""softmax"", ""group_count"": null, ""k"": null, ""m"": 4096, ""n"": 1024}","{""block_size"": 2048, ""num_stages"": 2, ""num_warps"": 2}",0.010528000071644783,1593.5805362678827,4.55371689759401,7.62939453125e-06
A,softmax,softmax_m4096_n1024,4096,1024,22,2048,2,3,"{""family"": ""softmax"", ""group_count"": null, ""k"": null, ""m"": 4096, ""n"": 1024}","{""block_size"": 2048, ""num_stages"": 3, ""num_warps"": 2}",0.010528000071644783,1593.5805362678827,4.55371689759401,7.62939453125e-06
A,softmax,softmax_m4096_n1024,4096,1024,23,2048,2,4,"{""family"": ""softmax"", ""group_count"": null, ""k"": null, ""m"": 4096, ""n"": 1024}","{""block_size"": 2048, ""num_stages"": 4, ""num_warps"": 2}",0.010528000071644783,1593.5805362678827,4.55371689759401,7.62939453125e-06
A,softmax,softmax_m4096_n1024,4096,1024,24,2048,4,1,"{""family"": ""softmax"", ""group_count"": null, ""k"": null, ""m"": 4096, ""n"": 1024}","{""block_size"": 2048, ""num_stages"": 1, ""num_warps"": 4}",0.010304000228643417,1628.2235663545612,4.575223087430367,7.62939453125e-06
A,softmax,softmax_m4096_n1024,4096,1024,25,2048,4,2,"{""family"": ""softmax"", ""group_count"": null, ""k"": null, ""m"": 4096, ""n"": 1024}","{""block_size"": 2048, ""num_stages"": 2, ""num_warps"": 4}",0.01027199998497963,1633.2959525440722,4.578333533496795,7.62939453125e-06
A,softmax,softmax_m4096_n1024,4096,1024,26,2048,4,3,"{""family"": ""softmax"", ""group_count"": null, ""k"": null, ""m"": 4096, ""n"": 1024}","{""block_size"": 2048, ""num_stages"": 3, ""num_warps"": 4}",0.01027199998497963,1633.2959525440722,4.578333533496795,7.62939453125e-06
A,softmax,softmax_m4096_n1024,4096,1024,27,2048,4,4,"{""family"": ""softmax"", ""group_count"": null, ""k"": null, ""m"": 4096, ""n"": 1024}","{""block_size"": 2048, ""num_stages"": 4, ""num_warps"": 4}",0.01027199998497963,1633.2959525440722,4.578333533496795,7.62939453125e-06
A,softmax,softmax_m4096_n1024,4096,1024,28,2048,8,1,"{""family"": ""softmax"", ""group_count"": null, ""k"": null, ""m"": 4096, ""n"": 1024}","{""block_size"": 2048, ""num_stages"": 1, ""num_warps"": 8}",0.01244799979031086,1347.7840844003604,4.386195328391309,7.62939453125e-06
A,softmax,softmax_m4096_n1024,4096,1024,29,2048,8,2,"{""family"": ""softmax"", ""group_count"": null, ""k"": null, ""m"": 4096, ""n"": 1024}","{""block_size"": 2048, ""num_stages"": 2, ""num_warps"": 8}",0.01244799979031086,1347.7840844003604,4.386195328391309,7.62939453125e-06
A,softmax,softmax_m4096_n1024,4096,1024,30,2048,8,3,"{""family"": ""softmax"", ""group_count"": null, ""k"": null, ""m"": 4096, ""n"": 1024}","{""block_size"": 2048, ""num_stages"": 3, ""num_warps"": 8}",0.012480000033974648,1344.3282014685035,4.383627913318528,7.62939453125e-06
A,softmax,softmax_m4096_n1024,4096,1024,31,2048,8,4,"{""family"": ""softmax"", ""group_count"": null, ""k"": null, ""m"": 4096, ""n"": 1024}","{""block_size"": 2048, ""num_stages"": 4, ""num_warps"": 8}",0.01244799979031086,1347.7840844003604,4.386195328391309,7.62939453125e-06
A,softmax,softmax_m4096_n1024,4096,1024,32,4096,1,1,"{""family"": ""softmax"", ""group_count"": null, ""k"": null, ""m"": 4096, ""n"": 1024}","{""block_size"": 4096, ""num_stages"": 1, ""num_warps"": 1}",0.019648000597953796,853.8892248276514,3.9297796965840894,7.62939453125e-06
A,softmax,softmax_m4096_n1024,4096,1024,33,4096,1,2,"{""family"": ""softmax"", ""group_count"": null, ""k"": null, ""m"": 4096, ""n"": 1024}","{""block_size"": 4096, ""num_stages"": 2, ""num_warps"": 1}",0.019648000597953796,853.8892248276514,3.9297796965840894,7.62939453125e-06
A,softmax,softmax_m4096_n1024,4096,1024,34,4096,1,3,"{""family"": ""softmax"", ""group_count"": null, ""k"": null, ""m"": 4096, ""n"": 1024}","{""block_size"": 4096, ""num_stages"": 3, ""num_warps"": 1}",0.019680000841617584,852.500776550831,3.9281523445929096,7.62939453125e-06
A,softmax,softmax_m4096_n1024,4096,1024,35,4096,1,4,"{""family"": ""softmax"", ""group_count"": null, ""k"": null, ""m"": 4096, ""n"": 1024}","{""block_size"": 4096, ""num_stages"": 4, ""num_warps"": 1}",0.01961600035429001,855.2822031495748,3.9314097011670595,7.62939453125e-06
A,softmax,softmax_m4096_n1024,4096,1024,36,4096,2,1,"{""family"": ""softmax"", ""group_count"": null, ""k"": null, ""m"": 4096, ""n"": 1024}","{""block_size"": 4096, ""num_stages"": 1, ""num_warps"": 2}",0.015552000142633915,1078.7818831101542,4.163566022092635,7.62939453125e-06
A,softmax,softmax_m4096_n1024,4096,1024,37,4096,2,2,"{""family"": ""softmax"", ""group_count"": null, ""k"": null, ""m"": 4096, ""n"": 1024}","{""block_size"": 4096, ""num_stages"": 2, ""num_warps"": 2}",0.015584000386297703,1076.5667084268964,4.161510507293861,7.62939453125e-06
A,softmax,softmax_m4096_n1024,4096,1024,38,4096,2,3,"{""family"": ""softmax"", ""group_count"": null, ""k"": null, ""m"": 4096, ""n"": 1024}","{""block_size"": 4096, ""num_stages"": 3, ""num_warps"": 2}",0.015519999898970127,1081.0061926039896,4.165625770736721,7.62939453125e-06
A,softmax,softmax_m4096_n1024,4096,1024,39,4096,2,4,"{""family"": ""softmax"", ""group_count"": null, ""k"": null, ""m"": 4096, ""n"": 1024}","{""block_size"": 4096, ""num_stages"": 4, ""num_warps"": 2}",0.015552000142633915,1078.7818831101542,4.163566022092635,7.62939453125e-06
A,softmax,softmax_m4096_n1024,4096,1024,40,4096,4,1,"{""family"": ""softmax"", ""group_count"": null, ""k"": null, ""m"": 4096, ""n"": 1024}","{""block_size"": 4096, ""num_stages"": 1, ""num_warps"": 4}",0.014431999996304512,1162.5011089451225,4.238307315917932,7.62939453125e-06
A,softmax,softmax_m4096_n1024,4096,1024,41,4096,4,2,"{""family"": ""softmax"", ""group_count"": null, ""k"": null, ""m"": 4096, ""n"": 1024}","{""block_size"": 4096, ""num_stages"": 2, ""num_warps"": 4}",0.014431999996304512,1162.5011089451225,4.238307315917932,7.62939453125e-06
A,softmax,softmax_m4096_n1024,4096,1024,42,4096,4,3,"{""family"": ""softmax"", ""group_count"": null, ""k"": null, ""m"": 4096, ""n"": 1024}","{""block_size"": 4096, ""num_stages"": 3, ""num_warps"": 4}",0.0144640002399683,1159.9291842957525,4.236092458741588,7.62939453125e-06
A,softmax,softmax_m4096_n1024,4096,1024,43,4096,4,4,"{""family"": ""softmax"", ""group_count"": null, ""k"": null, ""m"": 4096, ""n"": 1024}","{""block_size"": 4096, ""num_stages"": 4, ""num_warps"": 4}",0.014431999996304512,1162.5011089451225,4.238307315917932,7.62939453125e-06
A,softmax,softmax_m4096_n1024,4096,1024,44,4096,8,1,"{""family"": ""softmax"", ""group_count"": null, ""k"": null, ""m"": 4096, ""n"": 1024}","{""block_size"": 4096, ""num_stages"": 1, ""num_warps"": 8}",0.01500799972563982,1117.8848818432234,4.199171904999197,7.62939453125e-06
A,softmax,softmax_m4096_n1024,4096,1024,45,4096,8,2,"{""family"": ""softmax"", ""group_count"": null, ""k"": null, ""m"": 4096, ""n"": 1024}","{""block_size"": 4096, ""num_stages"": 2, ""num_warps"": 8}",0.01500799972563982,1117.8848818432234,4.199171904999197,7.62939453125e-06
A,softmax,softmax_m4096_n1024,4096,1024,46,4096,8,3,"{""family"": ""softmax"", ""group_count"": null, ""k"": null, ""m"": 4096, ""n"": 1024}","{""block_size"": 4096, ""num_stages"": 3, ""num_warps"": 8}",0.014944000169634819,1122.6723641297963,4.203445386144284,7.62939453125e-06
A,softmax,softmax_m4096_n1024,4096,1024,47,4096,8,4,"{""family"": ""softmax"", ""group_count"": null, ""k"": null, ""m"": 4096, ""n"": 1024}","{""block_size"": 4096, ""num_stages"": 4, ""num_warps"": 8}",0.01500799972563982,1117.8848818432234,4.199171904999197,7.62939453125e-06
A,softmax,softmax_m4096_n1024,4096,1024,48,8192,1,1,"{""family"": ""softmax"", ""group_count"": null, ""k"": null, ""m"": 4096, ""n"": 1024}","{""block_size"": 8192, ""num_stages"": 1, ""num_warps"": 1}",0.04102399945259094,408.96100389696176,3.193598031027562,7.62939453125e-06
A,softmax,softmax_m4096_n1024,4096,1024,49,8192,1,2,"{""family"": ""softmax"", ""group_count"": null, ""k"": null, ""m"": 4096, ""n"": 1024}","{""block_size"": 8192, ""num_stages"": 2, ""num_warps"": 1}",0.04102399945259094,408.96100389696176,3.193598031027562,7.62939453125e-06
A,softmax,softmax_m4096_n1024,4096,1024,50,8192,1,3,"{""family"": ""softmax"", ""group_count"": null, ""k"": null, ""m"": 4096, ""n"": 1024}","{""block_size"": 8192, ""num_stages"": 3, ""num_warps"": 1}",0.04102399945259094,408.96100389696176,3.193598031027562,7.62939453125e-06
A,softmax,softmax_m4096_n1024,4096,1024,51,8192,1,4,"{""family"": ""softmax"", ""group_count"": null, ""k"": null, ""m"": 4096, ""n"": 1024}","{""block_size"": 8192, ""num_stages"": 4, ""num_warps"": 1}",0.04105599969625473,408.64224776215775,3.1928182979472273,7.62939453125e-06
A,softmax,softmax_m4096_n1024,4096,1024,52,8192,2,1,"{""family"": ""softmax"", ""group_count"": null, ""k"": null, ""m"": 4096, ""n"": 1024}","{""block_size"": 8192, ""num_stages"": 1, ""num_warps"": 2}",0.032416000962257385,517.5597082297122,3.4291031212312215,7.62939453125e-06
A,softmax,softmax_m4096_n1024,4096,1024,53,8192,2,2,"{""family"": ""softmax"", ""group_count"": null, ""k"": null, ""m"": 4096, ""n"": 1024}","{""block_size"": 8192, ""num_stages"": 2, ""num_warps"": 2}",0.032416000962257385,517.5597082297122,3.4291031212312215,7.62939453125e-06
A,softmax,softmax_m4096_n1024,4096,1024,54,8192,2,3,"{""family"": ""softmax"", ""group_count"": null, ""k"": null, ""m"": 4096, ""n"": 1024}","{""block_size"": 8192, ""num_stages"": 3, ""num_warps"": 2}",0.032416000962257385,517.5597082297122,3.4291031212312215,7.62939453125e-06
A,softmax,softmax_m4096_n1024,4096,1024,55,8192,2,4,"{""family"": ""softmax"", ""group_count"": null, ""k"": null, ""m"": 4096, ""n"": 1024}","{""block_size"": 8192, ""num_stages"": 4, ""num_warps"": 2}",0.03248000144958496,516.539878424617,3.427130719058582,7.62939453125e-06
A,softmax,softmax_m4096_n1024,4096,1024,56,8192,4,1,"{""family"": ""softmax"", ""group_count"": null, ""k"": null, ""m"": 4096, ""n"": 1024}","{""block_size"": 8192, ""num_stages"": 1, ""num_warps"": 4}",0.02611199952661991,642.5098155695218,3.6453603183292738,7.62939453125e-06
A,softmax,softmax_m4096_n1024,4096,1024,57,8192,4,2,"{""family"": ""softmax"", ""group_count"": null, ""k"": null, ""m"": 4096, ""n"": 1024}","{""block_size"": 8192, ""num_stages"": 2, ""num_warps"": 4}",0.02611199952661991,642.5098155695218,3.6453603183292738,7.62939453125e-06
A,softmax,softmax_m4096_n1024,4096,1024,58,8192,4,3,"{""family"": ""softmax"", ""group_count"": null, ""k"": null, ""m"": 4096, ""n"": 1024}","{""block_size"": 8192, ""num_stages"": 3, ""num_warps"": 4}",0.02611199952661991,642.5098155695218,3.6453603183292738,7.62939453125e-06
A,softmax,softmax_m4096_n1024,4096,1024,59,8192,4,4,"{""family"": ""softmax"", ""group_count"": null, ""k"": null, ""m"": 4096, ""n"": 1024}","{""block_size"": 8192, ""num_stages"": 4, ""num_warps"": 4}",0.0261439997702837,641.7233838515269,3.644135569091123,7.62939453125e-06
A,softmax,softmax_m4096_n1024,4096,1024,60,8192,8,1,"{""family"": ""softmax"", ""group_count"": null, ""k"": null, ""m"": 4096, ""n"": 1024}","{""block_size"": 8192, ""num_stages"": 1, ""num_warps"": 8}",0.023264000192284584,721.1664314533534,3.7608481693657003,7.62939453125e-06
A,softmax,softmax_m4096_n1024,4096,1024,61,8192,8,2,"{""family"": ""softmax"", ""group_count"": null, ""k"": null, ""m"": 4096, ""n"": 1024}","{""block_size"": 8192, ""num_stages"": 2, ""num_warps"": 8}",0.023231999948620796,722.1597812114323,3.7622246425513217,7.62939453125e-06
A,softmax,softmax_m4096_n1024,4096,1024,62,8192,8,3,"{""family"": ""softmax"", ""group_count"": null, ""k"": null, ""m"": 4096, ""n"": 1024}","{""block_size"": 8192, ""num_stages"": 3, ""num_warps"": 8}",0.023231999948620796,722.1597812114323,3.7622246425513217,7.62939453125e-06
A,softmax,softmax_m4096_n1024,4096,1024,63,8192,8,4,"{""family"": ""softmax"", ""group_count"": null, ""k"": null, ""m"": 4096, ""n"": 1024}","{""block_size"": 8192, ""num_stages"": 4, ""num_warps"": 8}",0.023231999948620796,722.1597812114323,3.7622246425513217,7.62939453125e-06
A,softmax,softmax_m4096_n1536,4096,1536,0,2048,1,1,"{""family"": ""softmax"", ""group_count"": null, ""k"": null, ""m"": 4096, ""n"": 1536}","{""block_size"": 2048, ""num_stages"": 1, ""num_warps"": 1}",0.013791999779641628,1824.6682426102757,4.28366658103806,3.814697265625e-06
A,softmax,softmax_m4096_n1536,4096,1536,1,2048,1,2,"{""family"": ""softmax"", ""group_count"": null, ""k"": null, ""m"": 4096, ""n"": 1536}","{""block_size"": 2048, ""num_stages"": 2, ""num_warps"": 1}",0.013791999779641628,1824.6682426102757,4.28366658103806,3.814697265625e-06
A,softmax,softmax_m4096_n1536,4096,1536,2,2048,1,3,"{""family"": ""softmax"", ""group_count"": null, ""k"": null, ""m"": 4096, ""n"": 1536}","{""block_size"": 2048, ""num_stages"": 3, ""num_warps"": 1}",0.013824000023305416,1820.4444413754184,4.281349065234571,3.814697265625e-06
A,softmax,softmax_m4096_n1536,4096,1536,3,2048,1,4,"{""family"": ""softmax"", ""group_count"": null, ""k"": null, ""m"": 4096, ""n"": 1536}","{""block_size"": 2048, ""num_stages"": 4, ""num_warps"": 1}",0.013791999779641628,1824.6682426102757,4.28366658103806,3.814697265625e-06
A,softmax,softmax_m4096_n1536,4096,1536,4,2048,2,1,"{""family"": ""softmax"", ""group_count"": null, ""k"": null, ""m"": 4096, ""n"": 1536}","{""block_size"": 2048, ""num_stages"": 1, ""num_warps"": 2}",0.011455999687314034,2196.7374901264825,4.469241696058363,3.814697265625e-06
A,softmax,softmax_m4096_n1536,4096,1536,5,2048,2,2,"{""family"": ""softmax"", ""group_count"": null, ""k"": null, ""m"": 4096, ""n"": 1536}","{""block_size"": 2048, ""num_stages"": 2, ""num_warps"": 2}",0.011455999687314034,2196.7374901264825,4.469241696058363,3.814697265625e-06
A,softmax,softmax_m4096_n1536,4096,1536,6,2048,2,3,"{""family"": ""softmax"", ""group_count"": null, ""k"": null, ""m"": 4096, ""n"": 1536}","{""block_size"": 2048, ""num_stages"": 3, ""num_warps"": 2}",0.011455999687314034,2196.7374901264825,4.469241696058363,3.814697265625e-06
A,softmax,softmax_m4096_n1536,4096,1536,7,2048,2,4,"{""family"": ""softmax"", ""group_count"": null, ""k"": null, ""m"": 4096, ""n"": 1536}","{""block_size"": 2048, ""num_stages"": 4, ""num_warps"": 2}",0.011455999687314034,2196.7374901264825,4.469241696058363,3.814697265625e-06
A,softmax,softmax_m4096_n1536,4096,1536,8,2048,4,1,"{""family"": ""softmax"", ""group_count"": null, ""k"": null, ""m"": 4096, ""n"": 1536}","{""block_size"": 2048, ""num_stages"": 1, ""num_warps"": 4}",0.011296000331640244,2227.852625810412,4.483306568872164,7.62939453125e-06
A,softmax,softmax_m4096_n1536,4096,1536,9,2048,4,2,"{""family"": ""softmax"", ""group_count"": null, ""k"": null, ""m"": 4096, ""n"": 1536}","{""block_size"": 2048, ""num_stages"": 2, ""num_warps"": 4}",0.011264000087976456,2234.181800731943,4.486143471756041,7.62939453125e-06
A,softmax,softmax_m4096_n1536,4096,1536,10,2048,4,3,"{""family"": ""softmax"", ""group_count"": null, ""k"": null, ""m"": 4096, ""n"": 1536}","{""block_size"": 2048, ""num_stages"": 3, ""num_warps"": 4}",0.011264000087976456,2234.181800731943,4.486143471756041,7.62939453125e-06
A,softmax,softmax_m4096_n1536,4096,1536,11,2048,4,4,"{""family"": ""softmax"", ""group_count"": null, ""k"": null, ""m"": 4096, ""n"": 1536}","{""block_size"": 2048, ""num_stages"": 4, ""num_warps"": 4}",0.011264000087976456,2234.181800731943,4.486143471756041,7.62939453125e-06
A,softmax,softmax_m4096_n1536,4096,1536,12,2048,8,1,"{""family"": ""softmax"", ""group_count"": null, ""k"": null, ""m"": 4096, ""n"": 1536}","{""block_size"": 2048, ""num_stages"": 1, ""num_warps"": 8}",0.013376000337302685,1881.416220498898,4.314293197422785,7.62939453125e-06
A,softmax,softmax_m4096_n1536,4096,1536,13,2048,8,2,"{""family"": ""softmax"", ""group_count"": null, ""k"": null, ""m"": 4096, ""n"": 1536}","{""block_size"": 2048, ""num_stages"": 2, ""num_warps"": 8}",0.013344000093638897,1885.9280443198274,4.316688426348443,7.62939453125e-06
A,softmax,softmax_m4096_n1536,4096,1536,14,2048,8,3,"{""family"": ""softmax"", ""group_count"": null, ""k"": null, ""m"": 4096, ""n"": 1536}","{""block_size"": 2048, ""num_stages"": 3, ""num_warps"": 8}",0.013344000093638897,1885.9280443198274,4.316688426348443,7.62939453125e-06
A,softmax,softmax_m4096_n1536,4096,1536,15,2048,8,4,"{""family"": ""softmax"", ""group_count"": null, ""k"": null, ""m"": 4096, ""n"": 1536}","{""block_size"": 2048, ""num_stages"": 4, ""num_warps"": 8}",0.013344000093638897,1885.9280443198274,4.316688426348443,7.62939453125e-06
A,softmax,softmax_m4096_n1536,4096,1536,16,4096,1,1,"{""family"": ""softmax"", ""group_count"": null, ""k"": null, ""m"": 4096, ""n"": 1536}","{""block_size"": 4096, ""num_stages"": 1, ""num_warps"": 1}",0.020864000543951988,1206.184017632947,3.8697300671665764,3.814697265625e-06
A,softmax,softmax_m4096_n1536,4096,1536,17,4096,1,2,"{""family"": ""softmax"", ""group_count"": null, ""k"": null, ""m"": 4096, ""n"": 1536}","{""block_size"": 4096, ""num_stages"": 2, ""num_warps"": 1}",0.020864000543951988,1206.184017632947,3.8697300671665764,3.814697265625e-06
A,softmax,softmax_m4096_n1536,4096,1536,18,4096,1,3,"{""family"": ""softmax"", ""group_count"": null, ""k"": null, ""m"": 4096, ""n"": 1536}","{""block_size"": 4096, ""num_stages"": 3, ""num_warps"": 1}",0.020927999168634415,1202.4954606132142,3.866667343432387,3.814697265625e-06
A,softmax,softmax_m4096_n1536,4096,1536,19,4096,1,4,"{""family"": ""softmax"", ""group_count"": null, ""k"": null, ""m"": 4096, ""n"": 1536}","{""block_size"": 4096, ""num_stages"": 4, ""num_warps"": 1}",0.020896000787615776,1204.3368611909116,3.8681974881959382,3.814697265625e-06
A,softmax,softmax_m4096_n1536,4096,1536,20,4096,2,1,"{""family"": ""softmax"", ""group_count"": null, ""k"": null, ""m"": 4096, ""n"": 1536}","{""block_size"": 4096, ""num_stages"": 1, ""num_warps"": 2}",0.016448000445961952,1530.0233048192986,4.107551362595937,3.814697265625e-06
A,softmax,softmax_m4096_n1536,4096,1536,21,4096,2,2,"{""family"": ""softmax"", ""group_count"": null, ""k"": null, ""m"": 4096, ""n"": 1536}","{""block_size"": 4096, ""num_stages"": 2, ""num_warps"": 2}",0.016448000445961952,1530.0233048192986,4.107551362595937,3.814697265625e-06
A,softmax,softmax_m4096_n1536,4096,1536,22,4096,2,3,"{""family"": ""softmax"", ""group_count"": null, ""k"": null, ""m"": 4096, ""n"": 1536}","{""block_size"": 4096, ""num_stages"": 3, ""num_warps"": 2}",0.016448000445961952,1530.0233048192986,4.107551362595937,3.814697265625e-06
A,softmax,softmax_m4096_n1536,4096,1536,23,4096,2,4,"{""family"": ""softmax"", ""group_count"": null, ""k"": null, ""m"": 4096, ""n"": 1536}","{""block_size"": 4096, ""num_stages"": 4, ""num_warps"": 2}",0.016448000445961952,1530.0233048192986,4.107551362595937,3.814697265625e-06
A,softmax,softmax_m4096_n1536,4096,1536,24,4096,4,1,"{""family"": ""softmax"", ""group_count"": null, ""k"": null, ""m"": 4096, ""n"": 1536}","{""block_size"": 4096, ""num_stages"": 1, ""num_warps"": 4}",0.014879999682307243,1691.251649011989,4.207737270927511,7.62939453125e-06
A,softmax,softmax_m4096_n1536,4096,1536,25,4096,4,2,"{""family"": ""softmax"", ""group_count"": null, ""k"": null, ""m"": 4096, ""n"": 1536}","{""block_size"": 4096, ""num_stages"": 2, ""num_warps"": 4}",0.014879999682307243,1691.251649011989,4.207737270927511,7.62939453125e-06
A,softmax,softmax_m4096_n1536,4096,1536,26,4096,4,3,"{""family"": ""softmax"", ""group_count"": null, ""k"": null, ""m"": 4096, ""n"": 1536}","{""block_size"": 4096, ""num_stages"": 3, ""num_warps"": 4}",0.014879999682307243,1691.251649011989,4.207737270927511,7.62939453125e-06
A,softmax,softmax_m4096_n1536,4096,1536,27,4096,4,4,"{""family"": ""softmax"", ""group_count"": null, ""k"": null, ""m"": 4096, ""n"": 1536}","{""block_size"": 4096, ""num_stages"": 4, ""num_warps"": 4}",0.014879999682307243,1691.251649011989,4.207737270927511,7.62939453125e-06
A,softmax,softmax_m4096_n1536,4096,1536,28,4096,8,1,"{""family"": ""softmax"", ""group_count"": null, ""k"": null, ""m"": 4096, ""n"": 1536}","{""block_size"": 4096, ""num_stages"": 1, ""num_warps"": 8}",0.015519999898970127,1621.509288905984,4.165625770736721,7.62939453125e-06
A,softmax,softmax_m4096_n1536,4096,1536,29,4096,8,2,"{""family"": ""softmax"", ""group_count"": null, ""k"": null, ""m"": 4096, ""n"": 1536}","{""block_size"": 4096, ""num_stages"": 2, ""num_warps"": 8}",0.015519999898970127,1621.509288905984,4.165625770736721,7.62939453125e-06
A,softmax,softmax_m4096_n1536,4096,1536,30,4096,8,3,"{""family"": ""softmax"", ""group_count"": null, ""k"": null, ""m"": 4096, ""n"": 1536}","{""block_size"": 4096, ""num_stages"": 3, ""num_warps"": 8}",0.015519999898970127,1621.509288905984,4.165625770736721,7.62939453125e-06
A,softmax,softmax_m4096_n1536,4096,1536,31,4096,8,4,"{""family"": ""softmax"", ""group_count"": null, ""k"": null, ""m"": 4096, ""n"": 1536}","{""block_size"": 4096, ""num_stages"": 4, ""num_warps"": 8}",0.015552000142633915,1618.1728246652312,4.163566022092635,7.62939453125e-06
A,softmax,softmax_m4096_n1536,4096,1536,32,8192,1,1,"{""family"": ""softmax"", ""group_count"": null, ""k"": null, ""m"": 4096, ""n"": 1536}","{""block_size"": 8192, ""num_stages"": 1, ""num_warps"": 1}",0.04188799858093262,600.7884084358105,3.1727559231323075,3.814697265625e-06
A,softmax,softmax_m4096_n1536,4096,1536,33,8192,1,2,"{""family"": ""softmax"", ""group_count"": null, ""k"": null, ""m"": 4096, ""n"": 1536}","{""block_size"": 8192, ""num_stages"": 2, ""num_warps"": 1}",0.04188799858093262,600.7884084358105,3.1727559231323075,3.814697265625e-06
A,softmax,softmax_m4096_n1536,4096,1536,34,8192,1,3,"{""family"": ""softmax"", ""group_count"": null, ""k"": null, ""m"": 4096, ""n"": 1536}","{""block_size"": 8192, ""num_stages"": 3, ""num_warps"": 1}",0.04188799858093262,600.7884084358105,3.1727559231323075,3.814697265625e-06
A,softmax,softmax_m4096_n1536,4096,1536,35,8192,1,4,"{""family"": ""softmax"", ""group_count"": null, ""k"": null, ""m"": 4096, ""n"": 1536}","{""block_size"": 8192, ""num_stages"": 4, ""num_warps"": 1}",0.04188799858093262,600.7884084358105,3.1727559231323075,3.814697265625e-06
A,softmax,softmax_m4096_n1536,4096,1536,36,8192,2,1,"{""family"": ""softmax"", ""group_count"": null, ""k"": null, ""m"": 4096, ""n"": 1536}","{""block_size"": 8192, ""num_stages"": 1, ""num_warps"": 2}",0.03331200033426285,755.4582056759843,3.4018375765152715,3.814697265625e-06
A,softmax,softmax_m4096_n1536,4096,1536,37,8192,2,2,"{""family"": ""softmax"", ""group_count"": null, ""k"": null, ""m"": 4096, ""n"": 1536}","{""block_size"": 8192, ""num_stages"": 2, ""num_warps"": 2}",0.03331200033426285,755.4582056759843,3.4018375765152715,3.814697265625e-06
A,softmax,softmax_m4096_n1536,4096,1536,38,8192,2,3,"{""family"": ""softmax"", ""group_count"": null, ""k"": null, ""m"": 4096, ""n"": 1536}","{""block_size"": 8192, ""num_stages"": 3, ""num_warps"": 2}",0.03331200033426285,755.4582056759843,3.4018375765152715,3.814697265625e-06
A,softmax,softmax_m4096_n1536,4096,1536,39,8192,2,4,"{""family"": ""softmax"", ""group_count"": null, ""k"": null, ""m"": 4096, ""n"": 1536}","{""block_size"": 8192, ""num_stages"": 4, ""num_warps"": 2}",0.033376000821590424,754.0095691668553,3.3999181755475716,3.814697265625e-06
A,softmax,softmax_m4096_n1536,4096,1536,40,8192,4,1,"{""family"": ""softmax"", ""group_count"": null, ""k"": null, ""m"": 4096, ""n"": 1536}","{""block_size"": 8192, ""num_stages"": 1, ""num_warps"": 4}",0.02687999978661537,936.2285788607435,3.6163727712656044,7.62939453125e-06
A,softmax,softmax_m4096_n1536,4096,1536,41,8192,4,2,"{""family"": ""softmax"", ""group_count"": null, ""k"": null, ""m"": 4096, ""n"": 1536}","{""block_size"": 8192, ""num_stages"": 2, ""num_warps"": 4}",0.02691200003027916,935.1153378301684,3.615182994066482,7.62939453125e-06
A,softmax,softmax_m4096_n1536,4096,1536,42,8192,4,3,"{""family"": ""softmax"", ""group_count"": null, ""k"": null, ""m"": 4096, ""n"": 1536}","{""block_size"": 8192, ""num_stages"": 3, ""num_warps"": 4}",0.02687999978661537,936.2285788607435,3.6163727712656044,7.62939453125e-06
A,softmax,softmax_m4096_n1536,4096,1536,43,8192,4,4,"{""family"": ""softmax"", ""group_count"": null, ""k"": null, ""m"": 4096, ""n"": 1536}","{""block_size"": 8192, ""num_stages"": 4, ""num_warps"": 4}",0.02691200003027916,935.1153378301684,3.615182994066482,7.62939453125e-06
A,softmax,softmax_m4096_n1536,4096,1536,44,8192,8,1,"{""family"": ""softmax"", ""group_count"": null, ""k"": null, ""m"": 4096, ""n"": 1536}","{""block_size"": 8192, ""num_stages"": 1, ""num_warps"": 8}",0.023903999477624893,1052.7871716009795,3.733709491884772,7.62939453125e-06
A,softmax,softmax_m4096_n1536,4096,1536,45,8192,8,2,"{""family"": ""softmax"", ""group_count"": null, ""k"": null, ""m"": 4096, ""n"": 1536}","{""block_size"": 8192, ""num_stages"": 2, ""num_warps"": 8}",0.023903999477624893,1052.7871716009795,3.733709491884772,7.62939453125e-06
A,softmax,softmax_m4096_n1536,4096,1536,46,8192,8,3,"{""family"": ""softmax"", ""group_count"": null, ""k"": null, ""m"": 4096, ""n"": 1536}","{""block_size"": 8192, ""num_stages"": 3, ""num_warps"": 8}",0.02393599972128868,1051.3796913866738,3.7323716888340925,7.62939453125e-06
A,softmax,softmax_m4096_n1536,4096,1536,47,8192,8,4,"{""family"": ""softmax"", ""group_count"": null, ""k"": null, ""m"": 4096, ""n"": 1536}","{""block_size"": 8192, ""num_stages"": 4, ""num_warps"": 8}",0.023903999477624893,1052.7871716009795,3.733709491884772,7.62939453125e-06
A,softmax,softmax_m4096_n2048,4096,2048,0,2048,1,1,"{""family"": ""softmax"", ""group_count"": null, ""k"": null, ""m"": 4096, ""n"": 2048}","{""block_size"": 2048, ""num_stages"": 1, ""num_warps"": 1}",0.015519999898970127,2162.012385207979,4.165625770736721,3.814697265625e-06
A,softmax,softmax_m4096_n2048,4096,2048,1,2048,1,2,"{""family"": ""softmax"", ""group_count"": null, ""k"": null, ""m"": 4096, ""n"": 2048}","{""block_size"": 2048, ""num_stages"": 2, ""num_warps"": 1}",0.015552000142633915,2157.5637662203085,4.163566022092635,3.814697265625e-06
A,softmax,softmax_m4096_n2048,4096,2048,2,2048,1,3,"{""family"": ""softmax"", ""group_count"": null, ""k"": null, ""m"": 4096, ""n"": 2048}","{""block_size"": 2048, ""num_stages"": 3, ""num_warps"": 1}",0.015519999898970127,2162.012385207979,4.165625770736721,3.814697265625e-06
A,softmax,softmax_m4096_n2048,4096,2048,3,2048,1,4,"{""family"": ""softmax"", ""group_count"": null, ""k"": null, ""m"": 4096, ""n"": 2048}","{""block_size"": 2048, ""num_stages"": 4, ""num_warps"": 1}",0.015552000142633915,2157.5637662203085,4.163566022092635,3.814697265625e-06
A,softmax,softmax_m4096_n2048,4096,2048,4,2048,2,1,"{""family"": ""softmax"", ""group_count"": null, ""k"": null, ""m"": 4096, ""n"": 2048}","{""block_size"": 2048, ""num_stages"": 1, ""num_warps"": 2}",0.013376000337302685,2508.554960665197,4.314293197422785,3.814697265625e-06
A,softmax,softmax_m4096_n2048,4096,2048,5,2048,2,2,"{""family"": ""softmax"", ""group_count"": null, ""k"": null, ""m"": 4096, ""n"": 2048}","{""block_size"": 2048, ""num_stages"": 2, ""num_warps"": 2}",0.013376000337302685,2508.554960665197,4.314293197422785,3.814697265625e-06
A,softmax,softmax_m4096_n2048,4096,2048,6,2048,2,3,"{""family"": ""softmax"", ""group_count"": null, ""k"": null, ""m"": 4096, ""n"": 2048}","{""block_size"": 2048, ""num_stages"": 3, ""num_warps"": 2}",0.013376000337302685,2508.554960665197,4.314293197422785,3.814697265625e-06
A,softmax,softmax_m4096_n2048,4096,2048,7,2048,2,4,"{""family"": ""softmax"", ""group_count"": null, ""k"": null, ""m"": 4096, ""n"": 2048}","{""block_size"": 2048, ""num_stages"": 4, ""num_warps"": 2}",0.013376000337302685,2508.554960665197,4.314293197422785,3.814697265625e-06
A,softmax,softmax_m4096_n2048,4096,2048,8,2048,4,1,"{""family"": ""softmax"", ""group_count"": null, ""k"": null, ""m"": 4096, ""n"": 2048}","{""block_size"": 2048, ""num_stages"": 1, ""num_warps"": 4}",0.013151999562978745,2551.279890128006,4.331181473896815,3.814697265625e-06
A,softmax,softmax_m4096_n2048,4096,2048,9,2048,4,2,"{""family"": ""softmax"", ""group_count"": null, ""k"": null, ""m"": 4096, ""n"": 2048}","{""block_size"": 2048, ""num_stages"": 2, ""num_warps"": 4}",0.013151999562978745,2551.279890128006,4.331181473896815,3.814697265625e-06
A,softmax,softmax_m4096_n2048,4096,2048,10,2048,4,3,"{""family"": ""softmax"", ""group_count"": null, ""k"": null, ""m"": 4096, ""n"": 2048}","{""block_size"": 2048, ""num_stages"": 3, ""num_warps"": 4}",0.013151999562978745,2551.279890128006,4.331181473896815,3.814697265625e-06
A,softmax,softmax_m4096_n2048,4096,2048,11,2048,4,4,"{""family"": ""softmax"", ""group_count"": null, ""k"": null, ""m"": 4096, ""n"": 2048}","{""block_size"": 2048, ""num_stages"": 4, ""num_warps"": 4}",0.013151999562978745,2551.279890128006,4.331181473896815,3.814697265625e-06
A,softmax,softmax_m4096_n2048,4096,2048,12,2048,8,1,"{""family"": ""softmax"", ""group_count"": null, ""k"": null, ""m"": 4096, ""n"": 2048}","{""block_size"": 2048, ""num_stages"": 1, ""num_warps"": 8}",0.014271999709308147,2351.06731246049,4.249455723512467,3.814697265625e-06
A,softmax,softmax_m4096_n2048,4096,2048,13,2048,8,2,"{""family"": ""softmax"", ""group_count"": null, ""k"": null, ""m"": 4096, ""n"": 2048}","{""block_size"": 2048, ""num_stages"": 2, ""num_warps"": 8}",0.014271999709308147,2351.06731246049,4.249455723512467,3.814697265625e-06
A,softmax,softmax_m4096_n2048,4096,2048,14,2048,8,3,"{""family"": ""softmax"", ""group_count"": null, ""k"": null, ""m"": 4096, ""n"": 2048}","{""block_size"": 2048, ""num_stages"": 3, ""num_warps"": 8}",0.014271999709308147,2351.06731246049,4.249455723512467,3.814697265625e-06
A,softmax,softmax_m4096_n2048,4096,2048,15,2048,8,4,"{""family"": ""softmax"", ""group_count"": null, ""k"": null, ""m"": 4096, ""n"": 2048}","{""block_size"": 2048, ""num_stages"": 4, ""num_warps"": 8}",0.014271999709308147,2351.06731246049,4.249455723512467,3.814697265625e-06
A,softmax,softmax_m4096_n2048,4096,2048,16,4096,1,1,"{""family"": ""softmax"", ""group_count"": null, ""k"": null, ""m"": 4096, ""n"": 2048}","{""block_size"": 4096, ""num_stages"": 1, ""num_warps"": 1}",0.021727999672293663,1544.2945741013955,3.829153542688065,3.814697265625e-06
A,softmax,softmax_m4096_n2048,4096,2048,17,4096,1,2,"{""family"": ""softmax"", ""group_count"": null, ""k"": null, ""m"": 4096, ""n"": 2048}","{""block_size"": 4096, ""num_stages"": 2, ""num_warps"": 1}",0.02175999991595745,1542.0235353674443,3.8276818608566447,3.814697265625e-06
A,softmax,softmax_m4096_n2048,4096,2048,18,4096,1,3,"{""family"": ""softmax"", ""group_count"": null, ""k"": null, ""m"": 4096, ""n"": 2048}","{""block_size"": 4096, ""num_stages"": 3, ""num_warps"": 1}",0.02175999991595745,1542.0235353674443,3.8276818608566447,3.814697265625e-06
A,softmax,softmax_m4096_n2048,4096,2048,19,4096,1,4,"{""family"": ""softmax"", ""group_count"": null, ""k"": null, ""m"": 4096, ""n"": 2048}","{""block_size"": 4096, ""num_stages"": 4, ""num_warps"": 1}",0.021743999794125557,1543.15821917296,3.8284174310414527,3.814697265625e-06
A,softmax,softmax_m4096_n2048,4096,2048,20,4096,2,1,"{""family"": ""softmax"", ""group_count"": null, ""k"": null, ""m"": 4096, ""n"": 2048}","{""block_size"": 4096, ""num_stages"": 1, ""num_warps"": 2}",0.01740800030529499,1927.5293779604167,4.050825390770979,3.814697265625e-06
A,softmax,softmax_m4096_n2048,4096,2048,21,4096,2,2,"{""family"": ""softmax"", ""group_count"": null, ""k"": null, ""m"": 4096, ""n"": 2048}","{""block_size"": 4096, ""num_stages"": 2, ""num_warps"": 2}",0.017376000061631203,1931.07918283755,4.052665331683697,3.814697265625e-06
A,softmax,softmax_m4096_n2048,4096,2048,22,4096,2,3,"{""family"": ""softmax"", ""group_count"": null, ""k"": null, ""m"": 4096, ""n"": 2048}","{""block_size"": 4096, ""num_stages"": 3, ""num_warps"": 2}",0.01740800030529499,1927.5293779604167,4.050825390770979,3.814697265625e-06
A,softmax,softmax_m4096_n2048,4096,2048,23,4096,2,4,"{""family"": ""softmax"", ""group_count"": null, ""k"": null, ""m"": 4096, ""n"": 2048}","{""block_size"": 4096, ""num_stages"": 4, ""num_warps"": 2}",0.01740800030529499,1927.5293779604167,4.050825390770979,3.814697265625e-06
A,softmax,softmax_m4096_n2048,4096,2048,24,4096,4,1,"{""family"": ""softmax"", ""group_count"": null, ""k"": null, ""m"": 4096, ""n"": 2048}","{""block_size"": 4096, ""num_stages"": 1, ""num_warps"": 4}",0.015552000142633915,2157.5637662203085,4.163566022092635,3.814697265625e-06
A,softmax,softmax_m4096_n2048,4096,2048,25,4096,4,2,"{""family"": ""softmax"", ""group_count"": null, ""k"": null, ""m"": 4096, ""n"": 2048}","{""block_size"": 4096, ""num_stages"": 2, ""num_warps"": 4}",0.015552000142633915,2157.5637662203085,4.163566022092635,3.814697265625e-06
A,softmax,softmax_m4096_n2048,4096,2048,26,4096,4,3,"{""family"": ""softmax"", ""group_count"": null, ""k"": null, ""m"": 4096, ""n"": 2048}","{""block_size"": 4096, ""num_stages"": 3, ""num_warps"": 4}",0.015552000142633915,2157.5637662203085,4.163566022092635,3.814697265625e-06
A,softmax,softmax_m4096_n2048,4096,2048,27,4096,4,4,"{""family"": ""softmax"", ""group_count"": null, ""k"": null, ""m"": 4096, ""n"": 2048}","{""block_size"": 4096, ""num_stages"": 4, ""num_warps"": 4}",0.015552000142633915,2157.5637662203085,4.163566022092635,3.814697265625e-06
A,softmax,softmax_m4096_n2048,4096,2048,28,4096,8,1,"{""family"": ""softmax"", ""group_count"": null, ""k"": null, ""m"": 4096, ""n"": 2048}","{""block_size"": 4096, ""num_stages"": 1, ""num_warps"": 8}",0.015776000916957855,2126.928882460437,4.149265422998263,3.814697265625e-06
A,softmax,softmax_m4096_n2048,4096,2048,29,4096,8,2,"{""family"": ""softmax"", ""group_count"": null, ""k"": null, ""m"": 4096, ""n"": 2048}","{""block_size"": 4096, ""num_stages"": 2, ""num_warps"": 8}",0.015807999297976494,2122.6235760457776,4.1472391823860075,3.814697265625e-06
A,softmax,softmax_m4096_n2048,4096,2048,30,4096,8,3,"{""family"": ""softmax"", ""group_count"": null, ""k"": null, ""m"": 4096, ""n"": 2048}","{""block_size"": 4096, ""num_stages"": 3, ""num_warps"": 8}",0.015776000916957855,2126.928882460437,4.149265422998263,3.814697265625e-06
A,softmax,softmax_m4096_n2048,4096,2048,31,4096,8,4,"{""family"": ""softmax"", ""group_count"": null, ""k"": null, ""m"": 4096, ""n"": 2048}","{""block_size"": 4096, ""num_stages"": 4, ""num_warps"": 8}",0.015776000916957855,2126.928882460437,4.149265422998263,3.814697265625e-06
A,softmax,softmax_m4096_n2048,4096,2048,32,8192,1,1,"{""family"": ""softmax"", ""group_count"": null, ""k"": null, ""m"": 4096, ""n"": 2048}","{""block_size"": 8192, ""num_stages"": 1, ""num_warps"": 1}",0.042847998440265656,783.1038373187534,3.150096345874943,3.814697265625e-06
A,softmax,softmax_m4096_n2048,4096,2048,33,8192,1,2,"{""family"": ""softmax"", ""group_count"": null, ""k"": null, ""m"": 4096, ""n"": 2048}","{""block_size"": 8192, ""num_stages"": 2, ""num_warps"": 1}",0.042847998440265656,783.1038373187534,3.150096345874943,3.814697265625e-06
A,softmax,softmax_m4096_n2048,4096,2048,34,8192,1,3,"{""family"": ""softmax"", ""group_count"": null, ""k"": null, ""m"": 4096, ""n"": 2048}","{""block_size"": 8192, ""num_stages"": 3, ""num_warps"": 1}",0.042847998440265656,783.1038373187534,3.150096345874943,3.814697265625e-06
A,softmax,softmax_m4096_n2048,4096,2048,35,8192,1,4,"{""family"": ""softmax"", ""group_count"": null, ""k"": null, ""m"": 4096, ""n"": 2048}","{""block_size"": 8192, ""num_stages"": 4, ""num_warps"": 1}",0.04287999868392944,782.5194270021169,3.149349792911535,3.814697265625e-06
A,softmax,softmax_m4096_n2048,4096,2048,36,8192,2,1,"{""family"": ""softmax"", ""group_count"": null, ""k"": null, ""m"": 4096, ""n"": 2048}","{""block_size"": 8192, ""num_stages"": 1, ""num_warps"": 2}",0.033663999289274216,996.7452681919129,3.391326282979232,3.814697265625e-06
A,softmax,softmax_m4096_n2048,4096,2048,37,8192,2,2,"{""family"": ""softmax"", ""group_count"": null, ""k"": null, ""m"": 4096, ""n"": 2048}","{""block_size"": 8192, ""num_stages"": 2, ""num_warps"": 2}",0.033695999532938004,995.7986842681541,3.390376156891624,3.814697265625e-06
A,softmax,softmax_m4096_n2048,4096,2048,38,8192,2,3,"{""family"": ""softmax"", ""group_count"": null, ""k"": null, ""m"": 4096, ""n"": 2048}","{""block_size"": 8192, ""num_stages"": 3, ""num_warps"": 2}",0.033663999289274216,996.7452681919129,3.391326282979232,3.814697265625e-06
A,softmax,softmax_m4096_n2048,4096,2048,39,8192,2,4,"{""family"": ""softmax"", ""group_count"": null, ""k"": null, ""m"": 4096, ""n"": 2048}","{""block_size"": 8192, ""num_stages"": 4, ""num_warps"": 2}",0.033695999532938004,995.7986842681541,3.390376156891624,3.814697265625e-06
A,softmax,softmax_m4096_n2048,4096,2048,40,8192,4,1,"{""family"": ""softmax"", ""group_count"": null, ""k"": null, ""m"": 4096, ""n"": 2048}","{""block_size"": 8192, ""num_stages"": 1, ""num_warps"": 4}",0.027648000046610832,1213.6296275836123,3.5882018846746258,3.814697265625e-06
A,softmax,softmax_m4096_n2048,4096,2048,41,8192,4,2,"{""family"": ""softmax"", ""group_count"": null, ""k"": null, ""m"": 4096, ""n"": 2048}","{""block_size"": 8192, ""num_stages"": 2, ""num_warps"": 4}",0.027648000046610832,1213.6296275836123,3.5882018846746258,3.814697265625e-06
A,softmax,softmax_m4096_n2048,4096,2048,42,8192,4,3,"{""family"": ""softmax"", ""group_count"": null, ""k"": null, ""m"": 4096, ""n"": 2048}","{""block_size"": 8192, ""num_stages"": 3, ""num_warps"": 4}",0.02768000029027462,1212.2265768829982,3.5870451377458683,3.814697265625e-06
A,softmax,softmax_m4096_n2048,4096,2048,43,8192,4,4,"{""family"": ""softmax"", ""group_count"": null, ""k"": null, ""m"": 4096, ""n"": 2048}","{""block_size"": 8192, ""num_stages"": 4, ""num_warps"": 4}",0.027648000046610832,1213.6296275836123,3.5882018846746258,3.814697265625e-06
A,softmax,softmax_m4096_n2048,4096,2048,44,8192,8,1,"{""family"": ""softmax"", ""group_count"": null, ""k"": null, ""m"": 4096, ""n"": 2048}","{""block_size"": 8192, ""num_stages"": 1, ""num_warps"": 8}",0.024383999407291412,1376.0840229501648,3.7138281237851762,3.814697265625e-06
A,softmax,softmax_m4096_n2048,4096,2048,45,8192,8,2,"{""family"": ""softmax"", ""group_count"": null, ""k"": null, ""m"": 4096, ""n"": 2048}","{""block_size"": 8192, ""num_stages"": 2, ""num_warps"": 8}",0.024351999163627625,1377.892294367241,3.715141331647983,3.814697265625e-06
A,softmax,softmax_m4096_n2048,4096,2048,46,8192,8,3,"{""family"": ""softmax"", ""group_count"": null, ""k"": null, ""m"": 4096, ""n"": 2048}","{""block_size"": 8192, ""num_stages"": 3, ""num_warps"": 8}",0.0244159996509552,1374.2804914681135,3.712516638175831,3.814697265625e-06
A,softmax,softmax_m4096_n2048,4096,2048,47,8192,8,4,"{""family"": ""softmax"", ""group_count"": null, ""k"": null, ""m"": 4096, ""n"": 2048}","{""block_size"": 8192, ""num_stages"": 4, ""num_warps"": 8}",0.024383999407291412,1376.0840229501648,3.7138281237851762,3.814697265625e-06
A,softmax,softmax_m4096_n3072,4096,3072,0,4096,1,1,"{""family"": ""softmax"", ""group_count"": null, ""k"": null, ""m"": 4096, ""n"": 3072}","{""block_size"": 4096, ""num_stages"": 1, ""num_warps"": 1}",0.02627200074493885,1915.7904450690191,3.639251517357261,3.814697265625e-06
A,softmax,softmax_m4096_n3072,4096,3072,1,4096,1,2,"{""family"": ""softmax"", ""group_count"": null, ""k"": null, ""m"": 4096, ""n"": 3072}","{""block_size"": 4096, ""num_stages"": 2, ""num_warps"": 1}",0.026240000501275063,1918.1267926254143,3.6404702958027784,3.814697265625e-06
A,softmax,softmax_m4096_n3072,4096,3072,2,4096,1,3,"{""family"": ""softmax"", ""group_count"": null, ""k"": null, ""m"": 4096, ""n"": 3072}","{""block_size"": 4096, ""num_stages"": 3, ""num_warps"": 1}",0.02630399912595749,1913.4599175960047,3.63803429333687,3.814697265625e-06
A,softmax,softmax_m4096_n3072,4096,3072,3,4096,1,4,"{""family"": ""softmax"", ""group_count"": null, ""k"": null, ""m"": 4096, ""n"": 3072}","{""block_size"": 4096, ""num_stages"": 4, ""num_warps"": 1}",0.02627200074493885,1915.7904450690191,3.639251517357261,3.814697265625e-06
A,softmax,softmax_m4096_n3072,4096,3072,4,4096,2,1,"{""family"": ""softmax"", ""group_count"": null, ""k"": null, ""m"": 4096, ""n"": 3072}","{""block_size"": 4096, ""num_stages"": 1, ""num_warps"": 2}",0.0197759997099638,2545.087415967207,3.923286212372927,3.814697265625e-06
A,softmax,softmax_m4096_n3072,4096,3072,5,4096,2,2,"{""family"": ""softmax"", ""group_count"": null, ""k"": null, ""m"": 4096, ""n"": 3072}","{""block_size"": 4096, ""num_stages"": 2, ""num_warps"": 2}",0.0197759997099638,2545.087415967207,3.923286212372927,3.814697265625e-06
A,softmax,softmax_m4096_n3072,4096,3072,6,4096,2,3,"{""family"": ""softmax"", ""group_count"": null, ""k"": null, ""m"": 4096, ""n"": 3072}","{""block_size"": 4096, ""num_stages"": 3, ""num_warps"": 2}",0.0197759997099638,2545.087415967207,3.923286212372927,3.814697265625e-06
A,softmax,softmax_m4096_n3072,4096,3072,7,4096,2,4,"{""family"": ""softmax"", ""group_count"": null, ""k"": null, ""m"": 4096, ""n"": 3072}","{""block_size"": 4096, ""num_stages"": 4, ""num_warps"": 2}",0.0197759997099638,2545.087415967207,3.923286212372927,3.814697265625e-06
A,softmax,softmax_m4096_n3072,4096,3072,8,4096,4,1,"{""family"": ""softmax"", ""group_count"": null, ""k"": null, ""m"": 4096, ""n"": 3072}","{""block_size"": 4096, ""num_stages"": 1, ""num_warps"": 4}",0.01772800087928772,2839.1045523245843,4.032609918818454,3.814697265625e-06
A,softmax,softmax_m4096_n3072,4096,3072,9,4096,4,2,"{""family"": ""softmax"", ""group_count"": null, ""k"": null, ""m"": 4096, ""n"": 3072}","{""block_size"": 4096, ""num_stages"": 2, ""num_warps"": 4}",0.01772800087928772,2839.1045523245843,4.032609918818454,3.814697265625e-06
A,softmax,softmax_m4096_n3072,4096,3072,10,4096,4,3,"{""family"": ""softmax"", ""group_count"": null, ""k"": null, ""m"": 4096, ""n"": 3072}","{""block_size"": 4096, ""num_stages"": 3, ""num_warps"": 4}",0.01772800087928772,2839.1045523245843,4.032609918818454,3.814697265625e-06
A,softmax,softmax_m4096_n3072,4096,3072,11,4096,4,4,"{""family"": ""softmax"", ""group_count"": null, ""k"": null, ""m"": 4096, ""n"": 3072}","{""block_size"": 4096, ""num_stages"": 4, ""num_warps"": 4}",0.01772800087928772,2839.1045523245843,4.032609918818454,3.814697265625e-06
A,softmax,softmax_m4096_n3072,4096,3072,12,4096,8,1,"{""family"": ""softmax"", ""group_count"": null, ""k"": null, ""m"": 4096, ""n"": 3072}","{""block_size"": 4096, ""num_stages"": 1, ""num_warps"": 8}",0.017823999747633934,2823.8133254395566,4.027209429396042,3.814697265625e-06
A,softmax,softmax_m4096_n3072,4096,3072,13,4096,8,2,"{""family"": ""softmax"", ""group_count"": null, ""k"": null, ""m"": 4096, ""n"": 3072}","{""block_size"": 4096, ""num_stages"": 2, ""num_warps"": 8}",0.017823999747633934,2823.8133254395566,4.027209429396042,3.814697265625e-06
A,softmax,softmax_m4096_n3072,4096,3072,14,4096,8,3,"{""family"": ""softmax"", ""group_count"": null, ""k"": null, ""m"": 4096, ""n"": 3072}","{""block_size"": 4096, ""num_stages"": 3, ""num_warps"": 8}",0.017823999747633934,2823.8133254395566,4.027209429396042,3.814697265625e-06
A,softmax,softmax_m4096_n3072,4096,3072,15,4096,8,4,"{""family"": ""softmax"", ""group_count"": null, ""k"": null, ""m"": 4096, ""n"": 3072}","{""block_size"": 4096, ""num_stages"": 4, ""num_warps"": 8}",0.017823999747633934,2823.8133254395566,4.027209429396042,3.814697265625e-06
A,softmax,softmax_m4096_n3072,4096,3072,16,8192,1,1,"{""family"": ""softmax"", ""group_count"": null, ""k"": null, ""m"": 4096, ""n"": 3072}","{""block_size"": 8192, ""num_stages"": 1, ""num_warps"": 1}",0.04678399860858917,1075.8304013534985,3.0622140445959927,3.814697265625e-06
A,softmax,softmax_m4096_n3072,4096,3072,17,8192,1,2,"{""family"": ""softmax"", ""group_count"": null, ""k"": null, ""m"": 4096, ""n"": 3072}","{""block_size"": 8192, ""num_stages"": 2, ""num_warps"": 1}",0.04684799909591675,1074.360676470959,3.060846979941516,3.814697265625e-06
A,softmax,softmax_m4096_n3072,4096,3072,18,8192,1,3,"{""family"": ""softmax"", ""group_count"": null, ""k"": null, ""m"": 4096, ""n"": 3072}","{""block_size"": 8192, ""num_stages"": 3, ""num_warps"": 1}",0.04684799909591675,1074.360676470959,3.060846979941516,3.814697265625e-06
A,softmax,softmax_m4096_n3072,4096,3072,19,8192,1,4,"{""family"": ""softmax"", ""group_count"": null, ""k"": null, ""m"": 4096, ""n"": 3072}","{""block_size"": 8192, ""num_stages"": 4, ""num_warps"": 1}",0.04681599885225296,1075.0950366100722,3.0615302786605514,3.814697265625e-06
A,softmax,softmax_m4096_n3072,4096,3072,20,8192,2,1,"{""family"": ""softmax"", ""group_count"": null, ""k"": null, ""m"": 4096, ""n"": 3072}","{""block_size"": 8192, ""num_stages"": 1, ""num_warps"": 2}",0.03481600061058998,1445.6470334703126,3.357678210211034,3.814697265625e-06
A,softmax,softmax_m4096_n3072,4096,3072,21,8192,2,2,"{""family"": ""softmax"", ""group_count"": null, ""k"": null, ""m"": 4096, ""n"": 3072}","{""block_size"": 8192, ""num_stages"": 2, ""num_warps"": 2}",0.034752000123262405,1448.3093871281624,3.3595181511237513,3.814697265625e-06
A,softmax,softmax_m4096_n3072,4096,3072,22,8192,2,3,"{""family"": ""softmax"", ""group_count"": null, ""k"": null, ""m"": 4096, ""n"": 3072}","{""block_size"": 8192, ""num_stages"": 3, ""num_warps"": 2}",0.03481600061058998,1445.6470334703126,3.357678210211034,3.814697265625e-06
A,softmax,softmax_m4096_n3072,4096,3072,23,8192,2,4,"{""family"": ""softmax"", ""group_count"": null, ""k"": null, ""m"": 4096, ""n"": 3072}","{""block_size"": 8192, ""num_stages"": 4, ""num_warps"": 2}",0.03478400036692619,1446.9769856562282,3.358597757494632,3.814697265625e-06
A,softmax,softmax_m4096_n3072,4096,3072,24,8192,4,1,"{""family"": ""softmax"", ""group_count"": null, ""k"": null, ""m"": 4096, ""n"": 3072}","{""block_size"": 8192, ""num_stages"": 1, ""num_warps"": 4}",0.02908799983561039,1730.3234421220845,3.5374295666385267,3.814697265625e-06
A,softmax,softmax_m4096_n3072,4096,3072,25,8192,4,2,"{""family"": ""softmax"", ""group_count"": null, ""k"": null, ""m"": 4096, ""n"": 3072}","{""block_size"": 8192, ""num_stages"": 2, ""num_warps"": 4}",0.029023999348282814,1734.138958453975,3.5396322275038345,3.814697265625e-06
A,softmax,softmax_m4096_n3072,4096,3072,26,8192,4,3,"{""family"": ""softmax"", ""group_count"": null, ""k"": null, ""m"": 4096, ""n"": 3072}","{""block_size"": 8192, ""num_stages"": 3, ""num_warps"": 4}",0.02908799983561039,1730.3234421220845,3.5374295666385267,3.814697265625e-06
A,softmax,softmax_m4096_n3072,4096,3072,27,8192,4,4,"{""family"": ""softmax"", ""group_count"": null, ""k"": null, ""m"": 4096, ""n"": 3072}","{""block_size"": 8192, ""num_stages"": 4, ""num_warps"": 4}",0.029055999591946602,1732.229099216753,3.5385302906069422,3.814697265625e-06
A,softmax,softmax_m4096_n3072,4096,3072,28,8192,8,1,"{""family"": ""softmax"", ""group_count"": null, ""k"": null, ""m"": 4096, ""n"": 3072}","{""block_size"": 8192, ""num_stages"": 1, ""num_warps"": 8}",0.025151999667286873,2001.099263111959,3.6828178759634396,3.814697265625e-06
A,softmax,softmax_m4096_n3072,4096,3072,29,8192,8,2,"{""family"": ""softmax"", ""group_count"": null, ""k"": null, ""m"": 4096, ""n"": 3072}","{""block_size"": 8192, ""num_stages"": 2, ""num_warps"": 8}",0.025119999423623085,2003.6484536169075,3.6840909603270804,3.814697265625e-06
A,softmax,softmax_m4096_n3072,4096,3072,30,8192,8,3,"{""family"": ""softmax"", ""group_count"": null, ""k"": null, ""m"": 4096, ""n"": 3072}","{""block_size"": 8192, ""num_stages"": 3, ""num_warps"": 8}",0.025151999667286873,2001.099263111959,3.6828178759634396,3.814697265625e-06
A,softmax,softmax_m4096_n3072,4096,3072,31,8192,8,4,"{""family"": ""softmax"", ""group_count"": null, ""k"": null, ""m"": 4096, ""n"": 3072}","{""block_size"": 8192, ""num_stages"": 4, ""num_warps"": 8}",0.025119999423623085,2003.6484536169075,3.6840909603270804,3.814697265625e-06
A,softmax,softmax_m4096_n4096,4096,4096,0,4096,1,1,"{""family"": ""softmax"", ""group_count"": null, ""k"": null, ""m"": 4096, ""n"": 4096}","{""block_size"": 4096, ""num_stages"": 1, ""num_warps"": 1}",0.028543999418616295,2351.06731246049,3.556308542952521,1.9073486328125e-06
A,softmax,softmax_m4096_n4096,4096,4096,1,4096,1,2,"{""family"": ""softmax"", ""group_count"": null, ""k"": null, ""m"": 4096, ""n"": 4096}","{""block_size"": 4096, ""num_stages"": 2, ""num_warps"": 1}",0.028543999418616295,2351.06731246049,3.556308542952521,1.9073486328125e-06
A,softmax,softmax_m4096_n4096,4096,4096,2,4096,1,3,"{""family"": ""softmax"", ""group_count"": null, ""k"": null, ""m"": 4096, ""n"": 4096}","{""block_size"": 4096, ""num_stages"": 3, ""num_warps"": 1}",0.02860799990594387,2345.8076139764257,3.5540688832787897,1.9073486328125e-06
A,softmax,softmax_m4096_n4096,4096,4096,3,4096,1,4,"{""family"": ""softmax"", ""group_count"": null, ""k"": null, ""m"": 4096, ""n"": 4096}","{""block_size"": 4096, ""num_stages"": 4, ""num_warps"": 1}",0.028543999418616295,2351.06731246049,3.556308542952521,1.9073486328125e-06
A,softmax,softmax_m4096_n4096,4096,4096,4,4096,2,1,"{""family"": ""softmax"", ""group_count"": null, ""k"": null, ""m"": 4096, ""n"": 4096}","{""block_size"": 4096, ""num_stages"": 1, ""num_warps"": 2}",0.023423999547958374,2864.9618039225575,3.7539941605014615,1.9073486328125e-06
A,softmax,softmax_m4096_n4096,4096,4096,5,4096,2,2,"{""family"": ""softmax"", ""group_count"": null, ""k"": null, ""m"": 4096, ""n"": 4096}","{""block_size"": 4096, ""num_stages"": 2, ""num_warps"": 2}",0.023423999547958374,2864.9618039225575,3.7539941605014615,1.9073486328125e-06
A,softmax,softmax_m4096_n4096,4096,4096,6,4096,2,3,"{""family"": ""softmax"", ""group_count"": null, ""k"": null, ""m"": 4096, ""n"": 4096}","{""block_size"": 4096, ""num_stages"": 3, ""num_warps"": 2}",0.023423999547958374,2864.9618039225575,3.7539941605014615,1.9073486328125e-06
A,softmax,softmax_m4096_n4096,4096,4096,7,4096,2,4,"{""family"": ""softmax"", ""group_count"": null, ""k"": null, ""m"": 4096, ""n"": 4096}","{""block_size"": 4096, ""num_stages"": 4, ""num_warps"": 2}",0.023423999547958374,2864.9618039225575,3.7539941605014615,1.9073486328125e-06
A,softmax,softmax_m4096_n4096,4096,4096,8,4096,4,1,"{""family"": ""softmax"", ""group_count"": null, ""k"": null, ""m"": 4096, ""n"": 4096}","{""block_size"": 4096, ""num_stages"": 1, ""num_warps"": 4}",0.02131200022995472,3148.876842900756,3.8484849738342413,1.9073486328125e-06
A,softmax,softmax_m4096_n4096,4096,4096,9,4096,4,2,"{""family"": ""softmax"", ""group_count"": null, ""k"": null, ""m"": 4096, ""n"": 4096}","{""block_size"": 4096, ""num_stages"": 2, ""num_warps"": 4}",0.02131200022995472,3148.876842900756,3.8484849738342413,1.9073486328125e-06
A,softmax,softmax_m4096_n4096,4096,4096,10,4096,4,3,"{""family"": ""softmax"", ""group_count"": null, ""k"": null, ""m"": 4096, ""n"": 4096}","{""block_size"": 4096, ""num_stages"": 3, ""num_warps"": 4}",0.02127999998629093,3153.612032106818,3.8499876151529167,1.9073486328125e-06
A,softmax,softmax_m4096_n4096,4096,4096,11,4096,4,4,"{""family"": ""softmax"", ""group_count"": null, ""k"": null, ""m"": 4096, ""n"": 4096}","{""block_size"": 4096, ""num_stages"": 4, ""num_warps"": 4}",0.02127999998629093,3153.612032106818,3.8499876151529167,1.9073486328125e-06
A,softmax,softmax_m4096_n4096,4096,4096,12,4096,8,1,"{""family"": ""softmax"", ""group_count"": null, ""k"": null, ""m"": 4096, ""n"": 4096}","{""block_size"": 4096, ""num_stages"": 1, ""num_warps"": 8}",0.02131200022995472,3148.876842900756,3.8484849738342413,1.9073486328125e-06
A,softmax,softmax_m4096_n4096,4096,4096,13,4096,8,2,"{""family"": ""softmax"", ""group_count"": null, ""k"": null, ""m"": 4096, ""n"": 4096}","{""block_size"": 4096, ""num_stages"": 2, ""num_warps"": 8}",0.02131200022995472,3148.876842900756,3.8484849738342413,1.9073486328125e-06
A,softmax,softmax_m4096_n4096,4096,4096,14,4096,8,3,"{""family"": ""softmax"", ""group_count"": null, ""k"": null, ""m"": 4096, ""n"": 4096}","{""block_size"": 4096, ""num_stages"": 3, ""num_warps"": 8}",0.02131200022995472,3148.876842900756,3.8484849738342413,1.9073486328125e-06
A,softmax,softmax_m4096_n4096,4096,4096,15,4096,8,4,"{""family"": ""softmax"", ""group_count"": null, ""k"": null, ""m"": 4096, ""n"": 4096}","{""block_size"": 4096, ""num_stages"": 4, ""num_warps"": 8}",0.02131200022995472,3148.876842900756,3.8484849738342413,1.9073486328125e-06
A,softmax,softmax_m4096_n4096,4096,4096,16,8192,1,1,"{""family"": ""softmax"", ""group_count"": null, ""k"": null, ""m"": 4096, ""n"": 4096}","{""block_size"": 8192, ""num_stages"": 1, ""num_warps"": 1}",0.049215998500585556,1363.5579089023574,3.0115365355649546,1.9073486328125e-06
A,softmax,softmax_m4096_n4096,4096,4096,17,8192,1,2,"{""family"": ""softmax"", ""group_count"": null, ""k"": null, ""m"": 4096, ""n"": 4096}","{""block_size"": 8192, ""num_stages"": 2, ""num_warps"": 1}",0.04915200173854828,1365.3332850403274,3.0128377060860756,1.9073486328125e-06
A,softmax,softmax_m4096_n4096,4096,4096,18,8192,1,3,"{""family"": ""softmax"", ""group_count"": null, ""k"": null, ""m"": 4096, ""n"": 4096}","{""block_size"": 8192, ""num_stages"": 3, ""num_warps"": 1}",0.049215998500585556,1363.5579089023574,3.0115365355649546,1.9073486328125e-06
A,softmax,softmax_m4096_n4096,4096,4096,19,8192,1,4,"{""family"": ""softmax"", ""group_count"": null, ""k"": null, ""m"": 4096, ""n"": 4096}","{""block_size"": 8192, ""num_stages"": 4, ""num_warps"": 1}",0.04915200173854828,1365.3332850403274,3.0128377060860756,1.9073486328125e-06
A,softmax,softmax_m4096_n4096,4096,4096,20,8192,2,1,"{""family"": ""softmax"", ""group_count"": null, ""k"": null, ""m"": 4096, ""n"": 4096}","{""block_size"": 8192, ""num_stages"": 1, ""num_warps"": 2}",0.035551998764276505,1887.6256281667231,3.3367589002831175,1.9073486328125e-06
A,softmax,softmax_m4096_n4096,4096,4096,21,8192,2,2,"{""family"": ""softmax"", ""group_count"": null, ""k"": null, ""m"": 4096, ""n"": 4096}","{""block_size"": 8192, ""num_stages"": 2, ""num_warps"": 2}",0.035551998764276505,1887.6256281667231,3.3367589002831175,1.9073486328125e-06
A,softmax,softmax_m4096_n4096,4096,4096,22,8192,2,3,"{""family"": ""softmax"", ""group_count"": null, ""k"": null, ""m"": 4096, ""n"": 4096}","{""block_size"": 8192, ""num_stages"": 3, ""num_warps"": 2}",0.03558399900794029,1885.9281101324552,3.335859208233396,1.9073486328125e-06
A,softmax,softmax_m4096_n4096,4096,4096,23,8192,2,4,"{""family"": ""softmax"", ""group_count"": null, ""k"": null, ""m"": 4096, ""n"": 4096}","{""block_size"": 8192, ""num_stages"": 4, ""num_warps"": 2}",0.035551998764276505,1887.6256281667231,3.3367589002831175,1.9073486328125e-06
A,softmax,softmax_m4096_n4096,4096,4096,24,8192,4,1,"{""family"": ""softmax"", ""group_count"": null, ""k"": null, ""m"": 4096, ""n"": 4096}","{""block_size"": 8192, ""num_stages"": 1, ""num_warps"": 4}",0.031231999397277832,2148.7213529419187,3.4663120880496803,1.9073486328125e-06
A,softmax,softmax_m4096_n4096,4096,4096,25,8192,4,2,"{""family"": ""softmax"", ""group_count"": null, ""k"": null, ""m"": 4096, ""n"": 4096}","{""block_size"": 8192, ""num_stages"": 2, ""num_warps"": 4}",0.031231999397277832,2148.7213529419187,3.4663120880496803,1.9073486328125e-06
A,softmax,softmax_m4096_n4096,4096,4096,26,8192,4,3,"{""family"": ""softmax"", ""group_count"": null, ""k"": null, ""m"": 4096, ""n"": 4096}","{""block_size"": 8192, ""num_stages"": 3, ""num_warps"": 4}",0.03126399964094162,2146.5220307934596,3.4652880146064877,1.9073486328125e-06
A,softmax,softmax_m4096_n4096,4096,4096,27,8192,4,4,"{""family"": ""softmax"", ""group_count"": null, ""k"": null, ""m"": 4096, ""n"": 4096}","{""block_size"": 8192, ""num_stages"": 4, ""num_warps"": 4}",0.031231999397277832,2148.7213529419187,3.4663120880496803,1.9073486328125e-06
A,softmax,softmax_m4096_n4096,4096,4096,28,8192,8,1,"{""family"": ""softmax"", ""group_count"": null, ""k"": null, ""m"": 4096, ""n"": 4096}","{""block_size"": 8192, ""num_stages"": 1, ""num_warps"": 8}",0.026464000344276428,2535.854864229328,3.63196994713162,1.9073486328125e-06
A,softmax,softmax_m4096_n4096,4096,4096,29,8192,8,2,"{""family"": ""softmax"", ""group_count"": null, ""k"": null, ""m"": 4096, ""n"": 4096}","{""block_size"": 8192, ""num_stages"": 2, ""num_warps"": 8}",0.02643200010061264,2538.924929802968,3.6331798778370987,1.9073486328125e-06
A,softmax,softmax_m4096_n4096,4096,4096,30,8192,8,3,"{""family"": ""softmax"", ""group_count"": null, ""k"": null, ""m"": 4096, ""n"": 4096}","{""block_size"": 8192, ""num_stages"": 3, ""num_warps"": 8}",0.026464000344276428,2535.854864229328,3.63196994713162,1.9073486328125e-06
A,softmax,softmax_m4096_n4096,4096,4096,31,8192,8,4,"{""family"": ""softmax"", ""group_count"": null, ""k"": null, ""m"": 4096, ""n"": 4096}","{""block_size"": 8192, ""num_stages"": 4, ""num_warps"": 8}",0.02643200010061264,2538.924929802968,3.6331798778370987,1.9073486328125e-06
A,softmax,softmax_m4096_n6144,4096,6144,0,8192,1,1,"{""family"": ""softmax"", ""group_count"": null, ""k"": null, ""m"": 4096, ""n"": 6144}","{""block_size"": 8192, ""num_stages"": 1, ""num_warps"": 1}",0.05584000051021576,1802.709439115853,2.8852648113909183,1.9073486328125e-06
A,softmax,softmax_m4096_n6144,4096,6144,1,8192,1,2,"{""family"": ""softmax"", ""group_count"": null, ""k"": null, ""m"": 4096, ""n"": 6144}","{""block_size"": 8192, ""num_stages"": 2, ""num_warps"": 1}",0.05580800026655197,1803.743110650959,2.88583804591939,1.9073486328125e-06
A,softmax,softmax_m4096_n6144,4096,6144,2,8192,1,3,"{""family"": ""softmax"", ""group_count"": null, ""k"": null, ""m"": 4096, ""n"": 6144}","{""block_size"": 8192, ""num_stages"": 3, ""num_warps"": 1}",0.05587200075387955,1801.6769516350337,2.884691905272024,1.9073486328125e-06
A,softmax,softmax_m4096_n6144,4096,6144,3,8192,1,4,"{""family"": ""softmax"", ""group_count"": null, ""k"": null, ""m"": 4096, ""n"": 6144}","{""block_size"": 8192, ""num_stages"": 4, ""num_warps"": 1}",0.05580800026655197,1803.743110650959,2.88583804591939,1.9073486328125e-06
A,softmax,softmax_m4096_n6144,4096,6144,4,8192,2,1,"{""family"": ""softmax"", ""group_count"": null, ""k"": null, ""m"": 4096, ""n"": 6144}","{""block_size"": 8192, ""num_stages"": 1, ""num_warps"": 2}",0.044863998889923096,2243.7432794830506,3.1041196123131676,1.9073486328125e-06
A,softmax,softmax_m4096_n6144,4096,6144,5,8192,2,2,"{""family"": ""softmax"", ""group_count"": null, ""k"": null, ""m"": 4096, ""n"": 6144}","{""block_size"": 8192, ""num_stages"": 2, ""num_warps"": 2}",0.044863998889923096,2243.7432794830506,3.1041196123131676,1.9073486328125e-06
A,softmax,softmax_m4096_n6144,4096,6144,6,8192,2,3,"{""family"": ""softmax"", ""group_count"": null, ""k"": null, ""m"": 4096, ""n"": 6144}","{""block_size"": 8192, ""num_stages"": 3, ""num_warps"": 2}",0.044863998889923096,2243.7432794830506,3.1041196123131676,1.9073486328125e-06
A,softmax,softmax_m4096_n6144,4096,6144,7,8192,2,4,"{""family"": ""softmax"", ""group_count"": null, ""k"": null, ""m"": 4096, ""n"": 6144}","{""block_size"": 8192, ""num_stages"": 4, ""num_warps"": 2}",0.044863998889923096,2243.7432794830506,3.1041196123131676,1.9073486328125e-06
A,softmax,softmax_m4096_n6144,4096,6144,8,8192,4,1,"{""family"": ""softmax"", ""group_count"": null, ""k"": null, ""m"": 4096, ""n"": 6144}","{""block_size"": 8192, ""num_stages"": 1, ""num_warps"": 4}",0.03500799834728241,2875.437064450566,3.352178719392334,1.9073486328125e-06
A,softmax,softmax_m4096_n6144,4096,6144,9,8192,4,2,"{""family"": ""softmax"", ""group_count"": null, ""k"": null, ""m"": 4096, ""n"": 6144}","{""block_size"": 8192, ""num_stages"": 2, ""num_warps"": 4}",0.03500799834728241,2875.437064450566,3.352178719392334,1.9073486328125e-06
A,softmax,softmax_m4096_n6144,4096,6144,10,8192,4,3,"{""family"": ""softmax"", ""group_count"": null, ""k"": null, ""m"": 4096, ""n"": 6144}","{""block_size"": 8192, ""num_stages"": 3, ""num_warps"": 4}",0.0350399985909462,2872.811074427665,3.35126505312667,1.9073486328125e-06
A,softmax,softmax_m4096_n6144,4096,6144,11,8192,4,4,"{""family"": ""softmax"", ""group_count"": null, ""k"": null, ""m"": 4096, ""n"": 6144}","{""block_size"": 8192, ""num_stages"": 4, ""num_warps"": 4}",0.03500799834728241,2875.437064450566,3.352178719392334,1.9073486328125e-06
A,softmax,softmax_m4096_n6144,4096,6144,12,8192,8,1,"{""family"": ""softmax"", ""group_count"": null, ""k"": null, ""m"": 4096, ""n"": 6144}","{""block_size"": 8192, ""num_stages"": 1, ""num_warps"": 8}",0.030751999467611313,3273.3902751923765,3.4818002635065826,1.9073486328125e-06
A,softmax,softmax_m4096_n6144,4096,6144,13,8192,8,2,"{""family"": ""softmax"", ""group_count"": null, ""k"": null, ""m"": 4096, ""n"": 6144}","{""block_size"": 8192, ""num_stages"": 2, ""num_warps"": 8}",0.030719999223947525,3276.8000827789333,3.482841395964791,1.9073486328125e-06
A,softmax,softmax_m4096_n6144,4096,6144,14,8192,8,3,"{""family"": ""softmax"", ""group_count"": null, ""k"": null, ""m"": 4096, ""n"": 6144}","{""block_size"": 8192, ""num_stages"": 3, ""num_warps"": 8}",0.030719999223947525,3276.8000827789333,3.482841395964791,1.9073486328125e-06
A,softmax,softmax_m4096_n6144,4096,6144,15,8192,8,4,"{""family"": ""softmax"", ""group_count"": null, ""k"": null, ""m"": 4096, ""n"": 6144}","{""block_size"": 8192, ""num_stages"": 4, ""num_warps"": 8}",0.030719999223947525,3276.8000827789333,3.482841395964791,1.9073486328125e-06
A,softmax,softmax_m4096_n8192,4096,8192,0,8192,1,1,"{""family"": ""softmax"", ""group_count"": null, ""k"": null, ""m"": 4096, ""n"": 8192}","{""block_size"": 8192, ""num_stages"": 1, ""num_warps"": 1}",0.06441599875688553,2083.608584670951,2.7423932488229816,1.9073486328125e-06
A,softmax,softmax_m4096_n8192,4096,8192,1,8192,1,2,"{""family"": ""softmax"", ""group_count"": null, ""k"": null, ""m"": 4096, ""n"": 8192}","{""block_size"": 8192, ""num_stages"": 2, ""num_warps"": 1}",0.06441599875688553,2083.608584670951,2.7423932488229816,1.9073486328125e-06
A,softmax,softmax_m4096_n8192,4096,8192,2,8192,1,3,"{""family"": ""softmax"", ""group_count"": null, ""k"": null, ""m"": 4096, ""n"": 8192}","{""block_size"": 8192, ""num_stages"": 3, ""num_warps"": 1}",0.06438399851322174,2084.6441833282124,2.742890147037274,1.9073486328125e-06
A,softmax,softmax_m4096_n8192,4096,8192,3,8192,1,4,"{""family"": ""softmax"", ""group_count"": null, ""k"": null, ""m"": 4096, ""n"": 8192}","{""block_size"": 8192, ""num_stages"": 4, ""num_warps"": 1}",0.06441599875688553,2083.608584670951,2.7423932488229816,1.9073486328125e-06
A,softmax,softmax_m4096_n8192,4096,8192,4,8192,2,1,"{""family"": ""softmax"", ""group_count"": null, ""k"": null, ""m"": 4096, ""n"": 8192}","{""block_size"": 8192, ""num_stages"": 1, ""num_warps"": 2}",0.048287998884916306,2779.525577770951,3.030572219489055,3.814697265625e-06
A,softmax,softmax_m4096_n8192,4096,8192,5,8192,2,2,"{""family"": ""softmax"", ""group_count"": null, ""k"": null, ""m"": 4096, ""n"": 8192}","{""block_size"": 8192, ""num_stages"": 2, ""num_warps"": 2}",0.04831999912858009,2777.6848183056677,3.02990974338993,3.814697265625e-06
A,softmax,softmax_m4096_n8192,4096,8192,6,8192,2,3,"{""family"": ""softmax"", ""group_count"": null, ""k"": null, ""m"": 4096, ""n"": 8192}","{""block_size"": 8192, ""num_stages"": 3, ""num_warps"": 2}",0.04831999912858009,2777.6848183056677,3.02990974338993,3.814697265625e-06
A,softmax,softmax_m4096_n8192,4096,8192,7,8192,2,4,"{""family"": ""softmax"", ""group_count"": null, ""k"": null, ""m"": 4096, ""n"": 8192}","{""block_size"": 8192, ""num_stages"": 4, ""num_warps"": 2}",0.04831999912858009,2777.6848183056677,3.02990974338993,3.814697265625e-06
A,softmax,softmax_m4096_n8192,4096,8192,8,8192,4,1,"{""family"": ""softmax"", ""group_count"": null, ""k"": null, ""m"": 4096, ""n"": 8192}","{""block_size"": 8192, ""num_stages"": 1, ""num_warps"": 4}",0.03984000161290169,3368.9187391130845,3.2228838057812603,1.9073486328125e-06
A,softmax,softmax_m4096_n8192,4096,8192,9,8192,4,2,"{""family"": ""softmax"", ""group_count"": null, ""k"": null, ""m"": 4096, ""n"": 8192}","{""block_size"": 8192, ""num_stages"": 2, ""num_warps"": 4}",0.03984000161290169,3368.9187391130845,3.2228838057812603,1.9073486328125e-06
A,softmax,softmax_m4096_n8192,4096,8192,10,8192,4,3,"{""family"": ""softmax"", ""group_count"": null, ""k"": null, ""m"": 4096, ""n"": 8192}","{""block_size"": 8192, ""num_stages"": 3, ""num_warps"": 4}",0.03984000161290169,3368.9187391130845,3.2228838057812603,1.9073486328125e-06
A,softmax,softmax_m4096_n8192,4096,8192,11,8192,4,4,"{""family"": ""softmax"", ""group_count"": null, ""k"": null, ""m"": 4096, ""n"": 8192}","{""block_size"": 8192, ""num_stages"": 4, ""num_warps"": 4}",0.03984000161290169,3368.9187391130845,3.2228838057812603,1.9073486328125e-06
A,softmax,softmax_m4096_n8192,4096,8192,12,8192,8,1,"{""family"": ""softmax"", ""group_count"": null, ""k"": null, ""m"": 4096, ""n"": 8192}","{""block_size"": 8192, ""num_stages"": 1, ""num_warps"": 8}",0.03747199848294258,3581.813979339706,3.2841613320519243,3.814697265625e-06
A,softmax,softmax_m4096_n8192,4096,8192,13,8192,8,2,"{""family"": ""softmax"", ""group_count"": null, ""k"": null, ""m"": 4096, ""n"": 8192}","{""block_size"": 8192, ""num_stages"": 2, ""num_warps"": 8}",0.03747199848294258,3581.813979339706,3.2841613320519243,3.814697265625e-06
A,softmax,softmax_m4096_n8192,4096,8192,14,8192,8,3,"{""family"": ""softmax"", ""group_count"": null, ""k"": null, ""m"": 4096, ""n"": 8192}","{""block_size"": 8192, ""num_stages"": 3, ""num_warps"": 8}",0.03747199848294258,3581.813979339706,3.2841613320519243,3.814697265625e-06
A,softmax,softmax_m4096_n8192,4096,8192,15,8192,8,4,"{""family"": ""softmax"", ""group_count"": null, ""k"": null, ""m"": 4096, ""n"": 8192}","{""block_size"": 8192, ""num_stages"": 4, ""num_warps"": 8}",0.03747199848294258,3581.813979339706,3.2841613320519243,3.814697265625e-06
A,layernorm,layernorm_m4096_n256,4096,256,0,256,1,1,"{""family"": ""layernorm"", ""group_count"": null, ""k"": null, ""m"": 4096, ""n"": 256}","{""block_size"": 256, ""num_stages"": 1, ""num_warps"": 1}",0.007040000054985285,595.7818135285181,4.956147101001776,0.001953125
A,layernorm,layernorm_m4096_n256,4096,256,1,256,1,2,"{""family"": ""layernorm"", ""group_count"": null, ""k"": null, ""m"": 4096, ""n"": 256}","{""block_size"": 256, ""num_stages"": 2, ""num_warps"": 1}",0.007071999832987785,593.0859868569859,4.951611977262775,0.001953125
A,layernorm,layernorm_m4096_n256,4096,256,2,256,1,3,"{""family"": ""layernorm"", ""group_count"": null, ""k"": null, ""m"": 4096, ""n"": 256}","{""block_size"": 256, ""num_stages"": 3, ""num_warps"": 1}",0.007071999832987785,593.0859868569859,4.951611977262775,0.001953125
A,layernorm,layernorm_m4096_n256,4096,256,3,256,1,4,"{""family"": ""layernorm"", ""group_count"": null, ""k"": null, ""m"": 4096, ""n"": 256}","{""block_size"": 256, ""num_stages"": 4, ""num_warps"": 1}",0.007071999832987785,593.0859868569859,4.951611977262775,0.001953125
A,layernorm,layernorm_m4096_n256,4096,256,4,256,2,1,"{""family"": ""layernorm"", ""group_count"": null, ""k"": null, ""m"": 4096, ""n"": 256}","{""block_size"": 256, ""num_stages"": 1, ""num_warps"": 2}",0.00723200011998415,579.9645921478763,4.929239639301533,0.001953125
A,layernorm,layernorm_m4096_n256,4096,256,5,256,2,2,"{""family"": ""layernorm"", ""group_count"": null, ""k"": null, ""m"": 4096, ""n"": 256}","{""block_size"": 256, ""num_stages"": 2, ""num_warps"": 2}",0.00723200011998415,579.9645921478763,4.929239639301533,0.001953125
A,layernorm,layernorm_m4096_n256,4096,256,6,256,2,3,"{""family"": ""layernorm"", ""group_count"": null, ""k"": null, ""m"": 4096, ""n"": 256}","{""block_size"": 256, ""num_stages"": 3, ""num_warps"": 2}",0.00723200011998415,579.9645921478763,4.929239639301533,0.001953125
A,layernorm,layernorm_m4096_n256,4096,256,7,256,2,4,"{""family"": ""layernorm"", ""group_count"": null, ""k"": null, ""m"": 4096, ""n"": 256}","{""block_size"": 256, ""num_stages"": 4, ""num_warps"": 2}",0.00723200011998415,579.9645921478763,4.929239639301533,0.001953125
A,layernorm,layernorm_m4096_n256,4096,256,8,256,4,1,"{""family"": ""layernorm"", ""group_count"": null, ""k"": null, ""m"": 4096, ""n"": 256}","{""block_size"": 256, ""num_stages"": 1, ""num_warps"": 4}",0.007360000163316727,569.8782482240964,4.91169532405158,0.001953125
A,layernorm,layernorm_m4096_n256,4096,256,9,256,4,2,"{""family"": ""layernorm"", ""group_count"": null, ""k"": null, ""m"": 4096, ""n"": 256}","{""block_size"": 256, ""num_stages"": 2, ""num_warps"": 4}",0.007360000163316727,569.8782482240964,4.91169532405158,0.001953125
A,layernorm,layernorm_m4096_n256,4096,256,10,256,4,3,"{""family"": ""layernorm"", ""group_count"": null, ""k"": null, ""m"": 4096, ""n"": 256}","{""block_size"": 256, ""num_stages"": 3, ""num_warps"": 4}",0.007360000163316727,569.8782482240964,4.91169532405158,0.001953125
A,layernorm,layernorm_m4096_n256,4096,256,11,256,4,4,"{""family"": ""layernorm"", ""group_count"": null, ""k"": null, ""m"": 4096, ""n"": 256}","{""block_size"": 256, ""num_stages"": 4, ""num_warps"": 4}",0.007360000163316727,569.8782482240964,4.91169532405158,0.001953125
A,layernorm,layernorm_m4096_n256,4096,256,12,256,8,1,"{""family"": ""layernorm"", ""group_count"": null, ""k"": null, ""m"": 4096, ""n"": 256}","{""block_size"": 256, ""num_stages"": 1, ""num_warps"": 8}",0.009727999567985535,431.15791388429847,4.6327469981677085,0.001953125
A,layernorm,layernorm_m4096_n256,4096,256,13,256,8,2,"{""family"": ""layernorm"", ""group_count"": null, ""k"": null, ""m"": 4096, ""n"": 256}","{""block_size"": 256, ""num_stages"": 2, ""num_warps"": 8}",0.009727999567985535,431.15791388429847,4.6327469981677085,0.001953125
A,layernorm,layernorm_m4096_n256,4096,256,14,256,8,3,"{""family"": ""layernorm"", ""group_count"": null, ""k"": null, ""m"": 4096, ""n"": 256}","{""block_size"": 256, ""num_stages"": 3, ""num_warps"": 8}",0.009727999567985535,431.15791388429847,4.6327469981677085,0.001953125
A,layernorm,layernorm_m4096_n256,4096,256,15,256,8,4,"{""family"": ""layernorm"", ""group_count"": null, ""k"": null, ""m"": 4096, ""n"": 256}","{""block_size"": 256, ""num_stages"": 4, ""num_warps"": 8}",0.009727999567985535,431.15791388429847,4.6327469981677085,0.001953125
A,layernorm,layernorm_m4096_n256,4096,256,16,512,1,1,"{""family"": ""layernorm"", ""group_count"": null, ""k"": null, ""m"": 4096, ""n"": 256}","{""block_size"": 512, ""num_stages"": 1, ""num_warps"": 1}",0.007135999854654074,587.7668281151225,4.9426029040724115,0.076171875
A,layernorm,layernorm_m4096_n256,4096,256,17,512,1,2,"{""family"": ""layernorm"", ""group_count"": null, ""k"": null, ""m"": 4096, ""n"": 256}","{""block_size"": 512, ""num_stages"": 2, ""num_warps"": 1}",0.007135999854654074,587.7668281151225,4.9426029040724115,0.076171875
A,layernorm,layernorm_m4096_n256,4096,256,18,512,1,3,"{""family"": ""layernorm"", ""group_count"": null, ""k"": null, ""m"": 4096, ""n"": 256}","{""block_size"": 512, ""num_stages"": 3, ""num_warps"": 1}",0.007135999854654074,587.7668281151225,4.9426029040724115,0.076171875
A,layernorm,layernorm_m4096_n256,4096,256,19,512,1,4,"{""family"": ""layernorm"", ""group_count"": null, ""k"": null, ""m"": 4096, ""n"": 256}","{""block_size"": 512, ""num_stages"": 4, ""num_warps"": 1}",0.007104000076651573,590.4144080438917,4.947097262502351,0.076171875
A,layernorm,layernorm_m4096_n256,4096,256,20,512,2,1,"{""family"": ""layernorm"", ""group_count"": null, ""k"": null, ""m"": 4096, ""n"": 256}","{""block_size"": 512, ""num_stages"": 1, ""num_warps"": 2}",0.00723200011998415,579.9645921478763,4.929239639301533,0.076171875
A,layernorm,layernorm_m4096_n256,4096,256,21,512,2,2,"{""family"": ""layernorm"", ""group_count"": null, ""k"": null, ""m"": 4096, ""n"": 256}","{""block_size"": 512, ""num_stages"": 2, ""num_warps"": 2}",0.00723200011998415,579.9645921478763,4.929239639301533,0.076171875
A,layernorm,layernorm_m4096_n256,4096,256,22,512,2,3,"{""family"": ""layernorm"", ""group_count"": null, ""k"": null, ""m"": 4096, ""n"": 256}","{""block_size"": 512, ""num_stages"": 3, ""num_warps"": 2}",0.00723200011998415,579.9645921478763,4.929239639301533,0.076171875
A,layernorm,layernorm_m4096_n256,4096,256,23,512,2,4,"{""family"": ""layernorm"", ""group_count"": null, ""k"": null, ""m"": 4096, ""n"": 256}","{""block_size"": 512, ""num_stages"": 4, ""num_warps"": 2}",0.00723200011998415,579.9645921478763,4.929239639301533,0.076171875
A,layernorm,layernorm_m4096_n256,4096,256,24,512,4,1,"{""family"": ""layernorm"", ""group_count"": null, ""k"": null, ""m"": 4096, ""n"": 256}","{""block_size"": 512, ""num_stages"": 1, ""num_warps"": 4}",0.007296000141650438,574.8771818213262,4.920429006795299,0.076171875
A,layernorm,layernorm_m4096_n256,4096,256,25,512,4,2,"{""family"": ""layernorm"", ""group_count"": null, ""k"": null, ""m"": 4096, ""n"": 256}","{""block_size"": 512, ""num_stages"": 2, ""num_warps"": 4}",0.007296000141650438,574.8771818213262,4.920429006795299,0.076171875
A,layernorm,layernorm_m4096_n256,4096,256,26,512,4,3,"{""family"": ""layernorm"", ""group_count"": null, ""k"": null, ""m"": 4096, ""n"": 256}","{""block_size"": 512, ""num_stages"": 3, ""num_warps"": 4}",0.007296000141650438,574.8771818213262,4.920429006795299,0.076171875
A,layernorm,layernorm_m4096_n256,4096,256,27,512,4,4,"{""family"": ""layernorm"", ""group_count"": null, ""k"": null, ""m"": 4096, ""n"": 256}","{""block_size"": 512, ""num_stages"": 4, ""num_warps"": 4}",0.007296000141650438,574.8771818213262,4.920429006795299,0.076171875
A,layernorm,layernorm_m4096_n256,4096,256,28,512,8,1,"{""family"": ""layernorm"", ""group_count"": null, ""k"": null, ""m"": 4096, ""n"": 256}","{""block_size"": 512, ""num_stages"": 1, ""num_warps"": 8}",0.009568000212311745,438.367883249305,4.649331059584089,0.076171875
A,layernorm,layernorm_m4096_n256,4096,256,29,512,8,2,"{""family"": ""layernorm"", ""group_count"": null, ""k"": null, ""m"": 4096, ""n"": 256}","{""block_size"": 512, ""num_stages"": 2, ""num_warps"": 8}",0.009568000212311745,438.367883249305,4.649331059584089,0.076171875
A,layernorm,layernorm_m4096_n256,4096,256,30,512,8,3,"{""family"": ""layernorm"", ""group_count"": null, ""k"": null, ""m"": 4096, ""n"": 256}","{""block_size"": 512, ""num_stages"": 3, ""num_warps"": 8}",0.009568000212311745,438.367883249305,4.649331059584089,0.076171875
A,layernorm,layernorm_m4096_n256,4096,256,31,512,8,4,"{""family"": ""layernorm"", ""group_count"": null, ""k"": null, ""m"": 4096, ""n"": 256}","{""block_size"": 512, ""num_stages"": 4, ""num_warps"": 8}",0.009568000212311745,438.367883249305,4.649331059584089,0.076171875
A,layernorm,layernorm_m4096_n256,4096,256,32,1024,1,1,"{""family"": ""layernorm"", ""group_count"": null, ""k"": null, ""m"": 4096, ""n"": 256}","{""block_size"": 1024, ""num_stages"": 1, ""num_warps"": 1}",0.00723200011998415,579.9645921478763,4.929239639301533,0.21484375
A,layernorm,layernorm_m4096_n256,4096,256,33,1024,1,2,"{""family"": ""layernorm"", ""group_count"": null, ""k"": null, ""m"": 4096, ""n"": 256}","{""block_size"": 1024, ""num_stages"": 2, ""num_warps"": 1}",0.00723200011998415,579.9645921478763,4.929239639301533,0.21484375
A,layernorm,layernorm_m4096_n256,4096,256,34,1024,1,3,"{""family"": ""layernorm"", ""group_count"": null, ""k"": null, ""m"": 4096, ""n"": 256}","{""block_size"": 1024, ""num_stages"": 3, ""num_warps"": 1}",0.00723200011998415,579.9645921478763,4.929239639301533,0.21484375
A,layernorm,layernorm_m4096_n256,4096,256,35,1024,1,4,"{""family"": ""layernorm"", ""group_count"": null, ""k"": null, ""m"": 4096, ""n"": 256}","{""block_size"": 1024, ""num_stages"": 4, ""num_warps"": 1}",0.00723200011998415,579.9645921478763,4.929239639301533,0.21484375
A,layernorm,layernorm_m4096_n256,4096,256,36,1024,2,1,"{""family"": ""layernorm"", ""group_count"": null, ""k"": null, ""m"": 4096, ""n"": 256}","{""block_size"": 1024, ""num_stages"": 1, ""num_warps"": 2}",0.007296000141650438,574.8771818213262,4.920429006795299,0.21484375
A,layernorm,layernorm_m4096_n256,4096,256,37,1024,2,2,"{""family"": ""layernorm"", ""group_count"": null, ""k"": null, ""m"": 4096, ""n"": 256}","{""block_size"": 1024, ""num_stages"": 2, ""num_warps"": 2}",0.007296000141650438,574.8771818213262,4.920429006795299,0.21484375
A,layernorm,layernorm_m4096_n256,4096,256,38,1024,2,3,"{""family"": ""layernorm"", ""group_count"": null, ""k"": null, ""m"": 4096, ""n"": 256}","{""block_size"": 1024, ""num_stages"": 3, ""num_warps"": 2}",0.007296000141650438,574.8771818213262,4.920429006795299,0.21484375
A,layernorm,layernorm_m4096_n256,4096,256,39,1024,2,4,"{""family"": ""layernorm"", ""group_count"": null, ""k"": null, ""m"": 4096, ""n"": 256}","{""block_size"": 1024, ""num_stages"": 4, ""num_warps"": 2}",0.007280000019818544,576.1406577722157,4.9226244140512145,0.21484375
A,layernorm,layernorm_m4096_n256,4096,256,40,1024,4,1,"{""family"": ""layernorm"", ""group_count"": null, ""k"": null, ""m"": 4096, ""n"": 256}","{""block_size"": 1024, ""num_stages"": 1, ""num_warps"": 4}",0.007360000163316727,569.8782482240964,4.91169532405158,0.21484375
A,layernorm,layernorm_m4096_n256,4096,256,41,1024,4,2,"{""family"": ""layernorm"", ""group_count"": null, ""k"": null, ""m"": 4096, ""n"": 256}","{""block_size"": 1024, ""num_stages"": 2, ""num_warps"": 4}",0.007360000163316727,569.8782482240964,4.91169532405158,0.21484375
A,layernorm,layernorm_m4096_n256,4096,256,42,1024,4,3,"{""family"": ""layernorm"", ""group_count"": null, ""k"": null, ""m"": 4096, ""n"": 256}","{""block_size"": 1024, ""num_stages"": 3, ""num_warps"": 4}",0.007360000163316727,569.8782482240964,4.91169532405158,0.21484375
A,layernorm,layernorm_m4096_n256,4096,256,43,1024,4,4,"{""family"": ""layernorm"", ""group_count"": null, ""k"": null, ""m"": 4096, ""n"": 256}","{""block_size"": 1024, ""num_stages"": 4, ""num_warps"": 4}",0.007360000163316727,569.8782482240964,4.91169532405158,0.21484375
A,layernorm,layernorm_m4096_n256,4096,256,44,1024,8,1,"{""family"": ""layernorm"", ""group_count"": null, ""k"": null, ""m"": 4096, ""n"": 256}","{""block_size"": 1024, ""num_stages"": 1, ""num_warps"": 8}",0.009631999768316746,435.45515997587916,4.6426644144691664,0.21484375
A,layernorm,layernorm_m4096_n256,4096,256,45,1024,8,2,"{""family"": ""layernorm"", ""group_count"": null, ""k"": null, ""m"": 4096, ""n"": 256}","{""block_size"": 1024, ""num_stages"": 2, ""num_warps"": 8}",0.009631999768316746,435.45515997587916,4.6426644144691664,0.21484375
A,layernorm,layernorm_m4096_n256,4096,256,46,1024,8,3,"{""family"": ""layernorm"", ""group_count"": null, ""k"": null, ""m"": 4096, ""n"": 256}","{""block_size"": 1024, ""num_stages"": 3, ""num_warps"": 8}",0.009631999768316746,435.45515997587916,4.6426644144691664,0.21484375
A,layernorm,layernorm_m4096_n256,4096,256,47,1024,8,4,"{""family"": ""layernorm"", ""group_count"": null, ""k"": null, ""m"": 4096, ""n"": 256}","{""block_size"": 1024, ""num_stages"": 4, ""num_warps"": 8}",0.009631999768316746,435.45515997587916,4.6426644144691664,0.21484375
A,layernorm,layernorm_m4096_n256,4096,256,48,2048,1,1,"{""family"": ""layernorm"", ""group_count"": null, ""k"": null, ""m"": 4096, ""n"": 256}","{""block_size"": 2048, ""num_stages"": 1, ""num_warps"": 1}",0.007455999962985516,562.5407753248601,4.898736206563236,0.455078125
A,layernorm,layernorm_m4096_n256,4096,256,49,2048,1,2,"{""family"": ""layernorm"", ""group_count"": null, ""k"": null, ""m"": 4096, ""n"": 256}","{""block_size"": 2048, ""num_stages"": 2, ""num_warps"": 1}",0.007455999962985516,562.5407753248601,4.898736206563236,0.455078125
A,layernorm,layernorm_m4096_n256,4096,256,50,2048,1,3,"{""family"": ""layernorm"", ""group_count"": null, ""k"": null, ""m"": 4096, ""n"": 256}","{""block_size"": 2048, ""num_stages"": 3, ""num_warps"": 1}",0.007455999962985516,562.5407753248601,4.898736206563236,0.455078125
A,layernorm,layernorm_m4096_n256,4096,256,51,2048,1,4,"{""family"": ""layernorm"", ""group_count"": null, ""k"": null, ""m"": 4096, ""n"": 256}","{""block_size"": 2048, ""num_stages"": 4, ""num_warps"": 1}",0.007455999962985516,562.5407753248601,4.898736206563236,0.455078125
A,layernorm,layernorm_m4096_n256,4096,256,52,2048,2,1,"{""family"": ""layernorm"", ""group_count"": null, ""k"": null, ""m"": 4096, ""n"": 256}","{""block_size"": 2048, ""num_stages"": 1, ""num_warps"": 2}",0.0074880002066493034,560.1367366784366,4.89445351220945,0.455078125
A,layernorm,layernorm_m4096_n256,4096,256,53,2048,2,2,"{""family"": ""layernorm"", ""group_count"": null, ""k"": null, ""m"": 4096, ""n"": 256}","{""block_size"": 2048, ""num_stages"": 2, ""num_warps"": 2}",0.0074880002066493034,560.1367366784366,4.89445351220945,0.455078125
A,layernorm,layernorm_m4096_n256,4096,256,54,2048,2,3,"{""family"": ""layernorm"", ""group_count"": null, ""k"": null, ""m"": 4096, ""n"": 256}","{""block_size"": 2048, ""num_stages"": 3, ""num_warps"": 2}",0.0074880002066493034,560.1367366784366,4.89445351220945,0.455078125
A,layernorm,layernorm_m4096_n256,4096,256,55,2048,2,4,"{""family"": ""layernorm"", ""group_count"": null, ""k"": null, ""m"": 4096, ""n"": 256}","{""block_size"": 2048, ""num_stages"": 4, ""num_warps"": 2}",0.0074880002066493034,560.1367366784366,4.89445351220945,0.455078125
A,layernorm,layernorm_m4096_n256,4096,256,56,2048,4,1,"{""family"": ""layernorm"", ""group_count"": null, ""k"": null, ""m"": 4096, ""n"": 256}","{""block_size"": 2048, ""num_stages"": 1, ""num_warps"": 4}",0.00774399982765317,541.619846764781,4.860836951263392,0.455078125
A,layernorm,layernorm_m4096_n256,4096,256,57,2048,4,2,"{""family"": ""layernorm"", ""group_count"": null, ""k"": null, ""m"": 4096, ""n"": 256}","{""block_size"": 2048, ""num_stages"": 2, ""num_warps"": 4}",0.00774399982765317,541.619846764781,4.860836951263392,0.455078125
A,layernorm,layernorm_m4096_n256,4096,256,58,2048,4,3,"{""family"": ""layernorm"", ""group_count"": null, ""k"": null, ""m"": 4096, ""n"": 256}","{""block_size"": 2048, ""num_stages"": 3, ""num_warps"": 4}",0.00774399982765317,541.619846764781,4.860836951263392,0.455078125
A,layernorm,layernorm_m4096_n256,4096,256,59,2048,4,4,"{""family"": ""layernorm"", ""group_count"": null, ""k"": null, ""m"": 4096, ""n"": 256}","{""block_size"": 2048, ""num_stages"": 4, ""num_warps"": 4}",0.007712000049650669,543.867216415538,4.864977715235788,0.455078125
A,layernorm,layernorm_m4096_n256,4096,256,60,2048,8,1,"{""family"": ""layernorm"", ""group_count"": null, ""k"": null, ""m"": 4096, ""n"": 256}","{""block_size"": 2048, ""num_stages"": 1, ""num_warps"": 8}",0.009983999654650688,420.10257863402813,4.6067715019453415,0.455078125
A,layernorm,layernorm_m4096_n256,4096,256,61,2048,8,2,"{""family"": ""layernorm"", ""group_count"": null, ""k"": null, ""m"": 4096, ""n"": 256}","{""block_size"": 2048, ""num_stages"": 2, ""num_warps"": 8}",0.009983999654650688,420.10257863402813,4.6067715019453415,0.455078125
A,layernorm,layernorm_m4096_n256,4096,256,62,2048,8,3,"{""family"": ""layernorm"", ""group_count"": null, ""k"": null, ""m"": 4096, ""n"": 256}","{""block_size"": 2048, ""num_stages"": 3, ""num_warps"": 8}",0.009983999654650688,420.10257863402813,4.6067715019453415,0.455078125
A,layernorm,layernorm_m4096_n256,4096,256,63,2048,8,4,"{""family"": ""layernorm"", ""group_count"": null, ""k"": null, ""m"": 4096, ""n"": 256}","{""block_size"": 2048, ""num_stages"": 4, ""num_warps"": 8}",0.009983999654650688,420.10257863402813,4.6067715019453415,0.455078125
A,layernorm,layernorm_m4096_n256,4096,256,64,4096,1,1,"{""family"": ""layernorm"", ""group_count"": null, ""k"": null, ""m"": 4096, ""n"": 256}","{""block_size"": 4096, ""num_stages"": 1, ""num_warps"": 1}",0.009855999611318111,425.55845834079395,4.619674911627042,0.826171875
A,layernorm,layernorm_m4096_n256,4096,256,65,4096,1,2,"{""family"": ""layernorm"", ""group_count"": null, ""k"": null, ""m"": 4096, ""n"": 256}","{""block_size"": 4096, ""num_stages"": 2, ""num_warps"": 1}",0.009855999611318111,425.55845834079395,4.619674911627042,0.826171875
A,layernorm,layernorm_m4096_n256,4096,256,66,4096,1,3,"{""family"": ""layernorm"", ""group_count"": null, ""k"": null, ""m"": 4096, ""n"": 256}","{""block_size"": 4096, ""num_stages"": 3, ""num_warps"": 1}",0.009824000298976898,426.9446124138257,4.622926877144034,0.826171875
A,layernorm,layernorm_m4096_n256,4096,256,67,4096,1,4,"{""family"": ""layernorm"", ""group_count"": null, ""k"": null, ""m"": 4096, ""n"": 256}","{""block_size"": 4096, ""num_stages"": 4, ""num_warps"": 1}",0.009824000298976898,426.9446124138257,4.622926877144034,0.826171875
A,layernorm,layernorm_m4096_n256,4096,256,68,4096,2,1,"{""family"": ""layernorm"", ""group_count"": null, ""k"": null, ""m"": 4096, ""n"": 256}","{""block_size"": 4096, ""num_stages"": 1, ""num_warps"": 2}",0.009472000412642956,442.81079151997955,4.659415157275987,0.826171875
A,layernorm,layernorm_m4096_n256,4096,256,69,4096,2,2,"{""family"": ""layernorm"", ""group_count"": null, ""k"": null, ""m"": 4096, ""n"": 256}","{""block_size"": 4096, ""num_stages"": 2, ""num_warps"": 2}",0.009472000412642956,442.81079151997955,4.659415157275987,0.826171875
A,layernorm,layernorm_m4096_n256,4096,256,70,4096,2,3,"{""family"": ""layernorm"", ""group_count"": null, ""k"": null, ""m"": 4096, ""n"": 256}","{""block_size"": 4096, ""num_stages"": 3, ""num_warps"": 2}",0.009472000412642956,442.81079151997955,4.659415157275987,0.826171875
A,layernorm,layernorm_m4096_n256,4096,256,71,4096,2,4,"{""family"": ""layernorm"", ""group_count"": null, ""k"": null, ""m"": 4096, ""n"": 256}","{""block_size"": 4096, ""num_stages"": 4, ""num_warps"": 2}",0.009503999724984169,441.3198780902728,4.656042545298699,0.826171875
A,layernorm,layernorm_m4096_n256,4096,256,72,4096,4,1,"{""family"": ""layernorm"", ""group_count"": null, ""k"": null, ""m"": 4096, ""n"": 256}","{""block_size"": 4096, ""num_stages"": 1, ""num_warps"": 4}",0.009600000455975533,436.9066459147145,4.645992133010896,0.826171875
A,layernorm,layernorm_m4096_n256,4096,256,73,4096,4,2,"{""family"": ""layernorm"", ""group_count"": null, ""k"": null, ""m"": 4096, ""n"": 256}","{""block_size"": 4096, ""num_stages"": 2, ""num_warps"": 4}",0.009600000455975533,436.9066459147145,4.645992133010896,0.826171875
A,layernorm,layernorm_m4096_n256,4096,256,74,4096,4,3,"{""family"": ""layernorm"", ""group_count"": null, ""k"": null, ""m"": 4096, ""n"": 256}","{""block_size"": 4096, ""num_stages"": 3, ""num_warps"": 4}",0.009600000455975533,436.9066459147145,4.645992133010896,0.826171875
A,layernorm,layernorm_m4096_n256,4096,256,75,4096,4,4,"{""family"": ""layernorm"", ""group_count"": null, ""k"": null, ""m"": 4096, ""n"": 256}","{""block_size"": 4096, ""num_stages"": 4, ""num_warps"": 4}",0.009600000455975533,436.9066459147145,4.645992133010896,0.826171875
A,layernorm,layernorm_m4096_n256,4096,256,76,4096,8,1,"{""family"": ""layernorm"", ""group_count"": null, ""k"": null, ""m"": 4096, ""n"": 256}","{""block_size"": 4096, ""num_stages"": 1, ""num_warps"": 8}",0.01119999960064888,374.4914419244265,4.491841536337438,0.826171875
A,layernorm,layernorm_m4096_n256,4096,256,77,4096,8,2,"{""family"": ""layernorm"", ""group_count"": null, ""k"": null, ""m"": 4096, ""n"": 256}","{""block_size"": 4096, ""num_stages"": 2, ""num_warps"": 8}",0.011168000288307667,375.56446021865025,4.494702707146606,0.826171875
A,layernorm,layernorm_m4096_n256,4096,256,78,4096,8,3,"{""family"": ""layernorm"", ""group_count"": null, ""k"": null, ""m"": 4096, ""n"": 256}","{""block_size"": 4096, ""num_stages"": 3, ""num_warps"": 8}",0.01119999960064888,374.4914419244265,4.491841536337438,0.826171875
A,layernorm,layernorm_m4096_n256,4096,256,79,4096,8,4,"{""family"": ""layernorm"", ""group_count"": null, ""k"": null, ""m"": 4096, ""n"": 256}","{""block_size"": 4096, ""num_stages"": 4, ""num_warps"": 8}",0.011168000288307667,375.56446021865025,4.494702707146606,0.826171875
A,layernorm,layernorm_m4096_n256,4096,256,80,8192,1,1,"{""family"": ""layernorm"", ""group_count"": null, ""k"": null, ""m"": 4096, ""n"": 256}","{""block_size"": 8192, ""num_stages"": 1, ""num_warps"": 1}",0.021023999899625778,199.5007619874778,3.8620906414542056,1.3203125
A,layernorm,layernorm_m4096_n256,4096,256,81,8192,1,2,"{""family"": ""layernorm"", ""group_count"": null, ""k"": null, ""m"": 4096, ""n"": 256}","{""block_size"": 8192, ""num_stages"": 2, ""num_warps"": 1}",0.021023999899625778,199.5007619874778,3.8620906414542056,1.3203125
A,layernorm,layernorm_m4096_n256,4096,256,82,8192,1,3,"{""family"": ""layernorm"", ""group_count"": null, ""k"": null, ""m"": 4096, ""n"": 256}","{""block_size"": 8192, ""num_stages"": 3, ""num_warps"": 1}",0.021056000143289566,199.19756703348534,3.860569717034065,1.3203125
A,layernorm,layernorm_m4096_n256,4096,256,83,8192,1,4,"{""family"": ""layernorm"", ""group_count"": null, ""k"": null, ""m"": 4096, ""n"": 256}","{""block_size"": 8192, ""num_stages"": 4, ""num_warps"": 1}",0.021056000143289566,199.19756703348534,3.860569717034065,1.3203125
A,layernorm,layernorm_m4096_n256,4096,256,84,8192,2,1,"{""family"": ""layernorm"", ""group_count"": null, ""k"": null, ""m"": 4096, ""n"": 256}","{""block_size"": 8192, ""num_stages"": 1, ""num_warps"": 2}",0.015039999969303608,278.8765963138634,4.197041962501427,1.3203125
A,layernorm,layernorm_m4096_n256,4096,256,85,8192,2,2,"{""family"": ""layernorm"", ""group_count"": null, ""k"": null, ""m"": 4096, ""n"": 256}","{""block_size"": 8192, ""num_stages"": 2, ""num_warps"": 2}",0.015072000212967396,278.2844971294105,4.194916547018128,1.3203125
A,layernorm,layernorm_m4096_n256,4096,256,86,8192,2,3,"{""family"": ""layernorm"", ""group_count"": null, ""k"": null, ""m"": 4096, ""n"": 256}","{""block_size"": 8192, ""num_stages"": 3, ""num_warps"": 2}",0.015039999969303608,278.8765963138634,4.197041962501427,1.3203125
A,layernorm,layernorm_m4096_n256,4096,256,87,8192,2,4,"{""family"": ""layernorm"", ""group_count"": null, ""k"": null, ""m"": 4096, ""n"": 256}","{""block_size"": 8192, ""num_stages"": 4, ""num_warps"": 2}",0.015072000212967396,278.2844971294105,4.194916547018128,1.3203125
A,layernorm,layernorm_m4096_n256,4096,256,88,8192,4,1,"{""family"": ""layernorm"", ""group_count"": null, ""k"": null, ""m"": 4096, ""n"": 256}","{""block_size"": 8192, ""num_stages"": 1, ""num_warps"": 4}",0.014783999882638454,283.7056299578011,4.214209772021225,1.3203125
A,layernorm,layernorm_m4096_n256,4096,256,89,8192,4,2,"{""family"": ""layernorm"", ""group_count"": null, ""k"": null, ""m"": 4096, ""n"": 256}","{""block_size"": 8192, ""num_stages"": 2, ""num_warps"": 4}",0.014783999882638454,283.7056299578011,4.214209772021225,1.3203125
A,layernorm,layernorm_m4096_n256,4096,256,90,8192,4,3,"{""family"": ""layernorm"", ""group_count"": null, ""k"": null, ""m"": 4096, ""n"": 256}","{""block_size"": 8192, ""num_stages"": 3, ""num_warps"": 4}",0.014751999638974667,284.32104817293254,4.216376636640875,1.3203125
A,layernorm,layernorm_m4096_n256,4096,256,91,8192,4,4,"{""family"": ""layernorm"", ""group_count"": null, ""k"": null, ""m"": 4096, ""n"": 256}","{""block_size"": 8192, ""num_stages"": 4, ""num_warps"": 4}",0.014783999882638454,283.7056299578011,4.214209772021225,1.3203125
A,layernorm,layernorm_m4096_n256,4096,256,92,8192,8,1,"{""family"": ""layernorm"", ""group_count"": null, ""k"": null, ""m"": 4096, ""n"": 256}","{""block_size"": 8192, ""num_stages"": 1, ""num_warps"": 8}",0.015104000456631184,277.69490685883517,4.192795639346525,1.3203125
A,layernorm,layernorm_m4096_n256,4096,256,93,8192,8,2,"{""family"": ""layernorm"", ""group_count"": null, ""k"": null, ""m"": 4096, ""n"": 256}","{""block_size"": 8192, ""num_stages"": 2, ""num_warps"": 8}",0.015104000456631184,277.69490685883517,4.192795639346525,1.3203125
A,layernorm,layernorm_m4096_n256,4096,256,94,8192,8,3,"{""family"": ""layernorm"", ""group_count"": null, ""k"": null, ""m"": 4096, ""n"": 256}","{""block_size"": 8192, ""num_stages"": 3, ""num_warps"": 8}",0.015104000456631184,277.69490685883517,4.192795639346525,1.3203125
A,layernorm,layernorm_m4096_n256,4096,256,95,8192,8,4,"{""family"": ""layernorm"", ""group_count"": null, ""k"": null, ""m"": 4096, ""n"": 256}","{""block_size"": 8192, ""num_stages"": 4, ""num_warps"": 8}",0.015104000456631184,277.69490685883517,4.192795639346525,1.3203125
A,layernorm,layernorm_m4096_n512,4096,512,0,512,1,1,"{""family"": ""layernorm"", ""group_count"": null, ""k"": null, ""m"": 4096, ""n"": 512}","{""block_size"": 512, ""num_stages"": 1, ""num_warps"": 1}",0.007584000006318092,1106.0928260827536,4.881714513196335,0.001953125
A,layernorm,layernorm_m4096_n512,4096,512,1,512,1,2,"{""family"": ""layernorm"", ""group_count"": null, ""k"": null, ""m"": 4096, ""n"": 512}","{""block_size"": 512, ""num_stages"": 2, ""num_warps"": 1}",0.007584000006318092,1106.0928260827536,4.881714513196335,0.001953125
A,layernorm,layernorm_m4096_n512,4096,512,2,512,1,3,"{""family"": ""layernorm"", ""group_count"": null, ""k"": null, ""m"": 4096, ""n"": 512}","{""block_size"": 512, ""num_stages"": 3, ""num_warps"": 1}",0.007584000006318092,1106.0928260827536,4.881714513196335,0.001953125
A,layernorm,layernorm_m4096_n512,4096,512,3,512,1,4,"{""family"": ""layernorm"", ""group_count"": null, ""k"": null, ""m"": 4096, ""n"": 512}","{""block_size"": 512, ""num_stages"": 4, ""num_warps"": 1}",0.007584000006318092,1106.0928260827536,4.881714513196335,0.001953125
A,layernorm,layernorm_m4096_n512,4096,512,4,512,2,1,"{""family"": ""layernorm"", ""group_count"": null, ""k"": null, ""m"": 4096, ""n"": 512}","{""block_size"": 512, ""num_stages"": 1, ""num_warps"": 2}",0.007584000006318092,1106.0928260827536,4.881714513196335,0.001953125
A,layernorm,layernorm_m4096_n512,4096,512,5,512,2,2,"{""family"": ""layernorm"", ""group_count"": null, ""k"": null, ""m"": 4096, ""n"": 512}","{""block_size"": 512, ""num_stages"": 2, ""num_warps"": 2}",0.007584000006318092,1106.0928260827536,4.881714513196335,0.001953125
A,layernorm,layernorm_m4096_n512,4096,512,6,512,2,3,"{""family"": ""layernorm"", ""group_count"": null, ""k"": null, ""m"": 4096, ""n"": 512}","{""block_size"": 512, ""num_stages"": 3, ""num_warps"": 2}",0.007584000006318092,1106.0928260827536,4.881714513196335,0.001953125
A,layernorm,layernorm_m4096_n512,4096,512,7,512,2,4,"{""family"": ""layernorm"", ""group_count"": null, ""k"": null, ""m"": 4096, ""n"": 512}","{""block_size"": 512, ""num_stages"": 4, ""num_warps"": 2}",0.007584000006318092,1106.0928260827536,4.881714513196335,0.001953125
A,layernorm,layernorm_m4096_n512,4096,512,8,512,4,1,"{""family"": ""layernorm"", ""group_count"": null, ""k"": null, ""m"": 4096, ""n"": 512}","{""block_size"": 512, ""num_stages"": 1, ""num_warps"": 4}",0.007712000049650669,1087.734432831076,4.864977715235788,0.001953125
A,layernorm,layernorm_m4096_n512,4096,512,9,512,4,2,"{""family"": ""layernorm"", ""group_count"": null, ""k"": null, ""m"": 4096, ""n"": 512}","{""block_size"": 512, ""num_stages"": 2, ""num_warps"": 4}",0.007712000049650669,1087.734432831076,4.864977715235788,0.001953125
A,layernorm,layernorm_m4096_n512,4096,512,10,512,4,3,"{""family"": ""layernorm"", ""group_count"": null, ""k"": null, ""m"": 4096, ""n"": 512}","{""block_size"": 512, ""num_stages"": 3, ""num_warps"": 4}",0.007712000049650669,1087.734432831076,4.864977715235788,0.001953125
A,layernorm,layernorm_m4096_n512,4096,512,11,512,4,4,"{""family"": ""layernorm"", ""group_count"": null, ""k"": null, ""m"": 4096, ""n"": 512}","{""block_size"": 512, ""num_stages"": 4, ""num_warps"": 4}",0.007712000049650669,1087.734432831076,4.864977715235788,0.001953125
A,layernorm,layernorm_m4096_n512,4096,512,12,512,8,1,"{""family"": ""layernorm"", ""group_count"": null, ""k"": null, ""m"": 4096, ""n"": 512}","{""block_size"": 512, ""num_stages"": 1, ""num_warps"": 8}",0.010048000141978264,834.8534913882315,4.6003816551262915,0.001953125
A,layernorm,layernorm_m4096_n512,4096,512,13,512,8,2,"{""family"": ""layernorm"", ""group_count"": null, ""k"": null, ""m"": 4096, ""n"": 512}","{""block_size"": 512, ""num_stages"": 2, ""num_warps"": 8}",0.010048000141978264,834.8534913882315,4.6003816551262915,0.001953125
A,layernorm,layernorm_m4096_n512,4096,512,14,512,8,3,"{""family"": ""layernorm"", ""group_count"": null, ""k"": null, ""m"": 4096, ""n"": 512}","{""block_size"": 512, ""num_stages"": 3, ""num_warps"": 8}",0.010048000141978264,834.8534913882315,4.6003816551262915,0.001953125
A,layernorm,layernorm_m4096_n512,4096,512,15,512,8,4,"{""family"": ""layernorm"", ""group_count"": null, ""k"": null, ""m"": 4096, ""n"": 512}","{""block_size"": 512, ""num_stages"": 4, ""num_warps"": 8}",0.010048000141978264,834.8534913882315,4.6003816551262915,0.001953125
A,layernorm,layernorm_m4096_n512,4096,512,16,1024,1,1,"{""family"": ""layernorm"", ""group_count"": null, ""k"": null, ""m"": 4096, ""n"": 512}","{""block_size"": 1024, ""num_stages"": 1, ""num_warps"": 1}",0.007615999784320593,1101.445409343368,4.8775040098123235,0.0390625
A,layernorm,layernorm_m4096_n512,4096,512,17,1024,1,2,"{""family"": ""layernorm"", ""group_count"": null, ""k"": null, ""m"": 4096, ""n"": 512}","{""block_size"": 1024, ""num_stages"": 2, ""num_warps"": 1}",0.007615999784320593,1101.445409343368,4.8775040098123235,0.0390625
A,layernorm,layernorm_m4096_n512,4096,512,18,1024,1,3,"{""family"": ""layernorm"", ""group_count"": null, ""k"": null, ""m"": 4096, ""n"": 512}","{""block_size"": 1024, ""num_stages"": 3, ""num_warps"": 1}",0.007615999784320593,1101.445409343368,4.8775040098123235,0.0390625
A,layernorm,layernorm_m4096_n512,4096,512,19,1024,1,4,"{""family"": ""layernorm"", ""group_count"": null, ""k"": null, ""m"": 4096, ""n"": 512}","{""block_size"": 1024, ""num_stages"": 4, ""num_warps"": 1}",0.007615999784320593,1101.445409343368,4.8775040098123235,0.0390625
A,layernorm,layernorm_m4096_n512,4096,512,20,1024,2,1,"{""family"": ""layernorm"", ""group_count"": null, ""k"": null, ""m"": 4096, ""n"": 512}","{""block_size"": 1024, ""num_stages"": 1, ""num_warps"": 2}",0.007648000027984381,1096.836816070306,4.873311099573991,0.0390625
A,layernorm,layernorm_m4096_n512,4096,512,21,1024,2,2,"{""family"": ""layernorm"", ""group_count"": null, ""k"": null, ""m"": 4096, ""n"": 512}","{""block_size"": 1024, ""num_stages"": 2, ""num_warps"": 2}",0.007648000027984381,1096.836816070306,4.873311099573991,0.0390625
A,layernorm,layernorm_m4096_n512,4096,512,22,1024,2,3,"{""family"": ""layernorm"", ""group_count"": null, ""k"": null, ""m"": 4096, ""n"": 512}","{""block_size"": 1024, ""num_stages"": 3, ""num_warps"": 2}",0.007648000027984381,1096.836816070306,4.873311099573991,0.0390625
A,layernorm,layernorm_m4096_n512,4096,512,23,1024,2,4,"{""family"": ""layernorm"", ""group_count"": null, ""k"": null, ""m"": 4096, ""n"": 512}","{""block_size"": 1024, ""num_stages"": 4, ""num_warps"": 2}",0.007648000027984381,1096.836816070306,4.873311099573991,0.0390625
A,layernorm,layernorm_m4096_n512,4096,512,24,1024,4,1,"{""family"": ""layernorm"", ""group_count"": null, ""k"": null, ""m"": 4096, ""n"": 512}","{""block_size"": 1024, ""num_stages"": 1, ""num_warps"": 4}",0.0077760000713169575,1078.7818831101542,4.85671320265258,0.0390625
A,layernorm,layernorm_m4096_n512,4096,512,25,1024,4,2,"{""family"": ""layernorm"", ""group_count"": null, ""k"": null, ""m"": 4096, ""n"": 512}","{""block_size"": 1024, ""num_stages"": 2, ""num_warps"": 4}",0.0077760000713169575,1078.7818831101542,4.85671320265258,0.0390625
A,layernorm,layernorm_m4096_n512,4096,512,26,1024,4,3,"{""family"": ""layernorm"", ""group_count"": null, ""k"": null, ""m"": 4096, ""n"": 512}","{""block_size"": 1024, ""num_stages"": 3, ""num_warps"": 4}",0.0077760000713169575,1078.7818831101542,4.85671320265258,0.0390625
A,layernorm,layernorm_m4096_n512,4096,512,27,1024,4,4,"{""family"": ""layernorm"", ""group_count"": null, ""k"": null, ""m"": 4096, ""n"": 512}","{""block_size"": 1024, ""num_stages"": 4, ""num_warps"": 4}",0.0077760000713169575,1078.7818831101542,4.85671320265258,0.0390625
A,layernorm,layernorm_m4096_n512,4096,512,28,1024,8,1,"{""family"": ""layernorm"", ""group_count"": null, ""k"": null, ""m"": 4096, ""n"": 512}","{""block_size"": 1024, ""num_stages"": 1, ""num_warps"": 8}",0.010048000141978264,834.8534913882315,4.6003816551262915,0.0390625
A,layernorm,layernorm_m4096_n512,4096,512,29,1024,8,2,"{""family"": ""layernorm"", ""group_count"": null, ""k"": null, ""m"": 4096, ""n"": 512}","{""block_size"": 1024, ""num_stages"": 2, ""num_warps"": 8}",0.010048000141978264,834.8534913882315,4.6003816551262915,0.0390625
A,layernorm,layernorm_m4096_n512,4096,512,30,1024,8,3,"{""family"": ""layernorm"", ""group_count"": null, ""k"": null, ""m"": 4096, ""n"": 512}","{""block_size"": 1024, ""num_stages"": 3, ""num_warps"": 8}",0.010048000141978264,834.8534913882315,4.6003816551262915,0.0390625
A,layernorm,layernorm_m4096_n512,4096,512,31,1024,8,4,"{""family"": ""layernorm"", ""group_count"": null, ""k"": null, ""m"": 4096, ""n"": 512}","{""block_size"": 1024, ""num_stages"": 4, ""num_warps"": 8}",0.010048000141978264,834.8534913882315,4.6003816551262915,0.0390625
A,layernorm,layernorm_m4096_n512,4096,512,32,2048,1,1,"{""family"": ""layernorm"", ""group_count"": null, ""k"": null, ""m"": 4096, ""n"": 512}","{""block_size"": 2048, ""num_stages"": 1, ""num_warps"": 1}",0.007935999892652035,1057.0322723626844,4.836345922526275,0.11328125
A,layernorm,layernorm_m4096_n512,4096,512,33,2048,1,2,"{""family"": ""layernorm"", ""group_count"": null, ""k"": null, ""m"": 4096, ""n"": 512}","{""block_size"": 2048, ""num_stages"": 2, ""num_warps"": 1}",0.007935999892652035,1057.0322723626844,4.836345922526275,0.11328125
A,layernorm,layernorm_m4096_n512,4096,512,34,2048,1,3,"{""family"": ""layernorm"", ""group_count"": null, ""k"": null, ""m"": 4096, ""n"": 512}","{""block_size"": 2048, ""num_stages"": 3, ""num_warps"": 1}",0.007935999892652035,1057.0322723626844,4.836345922526275,0.11328125
A,layernorm,layernorm_m4096_n512,4096,512,35,2048,1,4,"{""family"": ""layernorm"", ""group_count"": null, ""k"": null, ""m"": 4096, ""n"": 512}","{""block_size"": 2048, ""num_stages"": 4, ""num_warps"": 1}",0.007935999892652035,1057.0322723626844,4.836345922526275,0.11328125
A,layernorm,layernorm_m4096_n512,4096,512,36,2048,2,1,"{""family"": ""layernorm"", ""group_count"": null, ""k"": null, ""m"": 4096, ""n"": 512}","{""block_size"": 2048, ""num_stages"": 1, ""num_warps"": 2}",0.00800000037997961,1048.575950195315,4.828313689804851,0.11328125
A,layernorm,layernorm_m4096_n512,4096,512,37,2048,2,2,"{""family"": ""layernorm"", ""group_count"": null, ""k"": null, ""m"": 4096, ""n"": 512}","{""block_size"": 2048, ""num_stages"": 2, ""num_warps"": 2}",0.00800000037997961,1048.575950195315,4.828313689804851,0.11328125
A,layernorm,layernorm_m4096_n512,4096,512,38,2048,2,3,"{""family"": ""layernorm"", ""group_count"": null, ""k"": null, ""m"": 4096, ""n"": 512}","{""block_size"": 2048, ""num_stages"": 3, ""num_warps"": 2}",0.00800000037997961,1048.575950195315,4.828313689804851,0.11328125
A,layernorm,layernorm_m4096_n512,4096,512,39,2048,2,4,"{""family"": ""layernorm"", ""group_count"": null, ""k"": null, ""m"": 4096, ""n"": 512}","{""block_size"": 2048, ""num_stages"": 4, ""num_warps"": 2}",0.00800000037997961,1048.575950195315,4.828313689804851,0.11328125
A,layernorm,layernorm_m4096_n512,4096,512,40,2048,4,1,"{""family"": ""layernorm"", ""group_count"": null, ""k"": null, ""m"": 4096, ""n"": 512}","{""block_size"": 2048, ""num_stages"": 1, ""num_warps"": 4}",0.008128000423312187,1032.0629383753912,4.812440336065281,0.11328125
A,layernorm,layernorm_m4096_n512,4096,512,41,2048,4,2,"{""family"": ""layernorm"", ""group_count"": null, ""k"": null, ""m"": 4096, ""n"": 512}","{""block_size"": 2048, ""num_stages"": 2, ""num_warps"": 4}",0.0081599997356534,1028.0157195775073,4.808511142401539,0.11328125
A,layernorm,layernorm_m4096_n512,4096,512,42,2048,4,3,"{""family"": ""layernorm"", ""group_count"": null, ""k"": null, ""m"": 4096, ""n"": 512}","{""block_size"": 2048, ""num_stages"": 3, ""num_warps"": 4}",0.008128000423312187,1032.0629383753912,4.812440336065281,0.11328125
A,layernorm,layernorm_m4096_n512,4096,512,43,2048,4,4,"{""family"": ""layernorm"", ""group_count"": null, ""k"": null, ""m"": 4096, ""n"": 512}","{""block_size"": 2048, ""num_stages"": 4, ""num_warps"": 4}",0.008128000423312187,1032.0629383753912,4.812440336065281,0.11328125
A,layernorm,layernorm_m4096_n512,4096,512,44,2048,8,1,"{""family"": ""layernorm"", ""group_count"": null, ""k"": null, ""m"": 4096, ""n"": 512}","{""block_size"": 2048, ""num_stages"": 1, ""num_warps"": 8}",0.010432000271975994,804.1226784219647,4.562877247726521,0.11328125
A,layernorm,layernorm_m4096_n512,4096,512,45,2048,8,2,"{""family"": ""layernorm"", ""group_count"": null, ""k"": null, ""m"": 4096, ""n"": 512}","{""block_size"": 2048, ""num_stages"": 2, ""num_warps"": 8}",0.010432000271975994,804.1226784219647,4.562877247726521,0.11328125
A,layernorm,layernorm_m4096_n512,4096,512,46,2048,8,3,"{""family"": ""layernorm"", ""group_count"": null, ""k"": null, ""m"": 4096, ""n"": 512}","{""block_size"": 2048, ""num_stages"": 3, ""num_warps"": 8}",0.010432000271975994,804.1226784219647,4.562877247726521,0.11328125
A,layernorm,layernorm_m4096_n512,4096,512,47,2048,8,4,"{""family"": ""layernorm"", ""group_count"": null, ""k"": null, ""m"": 4096, ""n"": 512}","{""block_size"": 2048, ""num_stages"": 4, ""num_warps"": 8}",0.010432000271975994,804.1226784219647,4.562877247726521,0.11328125
A,layernorm,layernorm_m4096_n512,4096,512,48,4096,1,1,"{""family"": ""layernorm"", ""group_count"": null, ""k"": null, ""m"": 4096, ""n"": 512}","{""block_size"": 4096, ""num_stages"": 1, ""num_warps"": 1}",0.01033599954098463,811.5913673116207,4.572122376351274,0.25390625
A,layernorm,layernorm_m4096_n512,4096,512,49,4096,1,2,"{""family"": ""layernorm"", ""group_count"": null, ""k"": null, ""m"": 4096, ""n"": 512}","{""block_size"": 4096, ""num_stages"": 2, ""num_warps"": 1}",0.01033599954098463,811.5913673116207,4.572122376351274,0.25390625
A,layernorm,layernorm_m4096_n512,4096,512,50,4096,1,3,"{""family"": ""layernorm"", ""group_count"": null, ""k"": null, ""m"": 4096, ""n"": 512}","{""block_size"": 4096, ""num_stages"": 3, ""num_warps"": 1}",0.01033599954098463,811.5913673116207,4.572122376351274,0.25390625
A,layernorm,layernorm_m4096_n512,4096,512,51,4096,1,4,"{""family"": ""layernorm"", ""group_count"": null, ""k"": null, ""m"": 4096, ""n"": 512}","{""block_size"": 4096, ""num_stages"": 4, ""num_warps"": 1}",0.01033599954098463,811.5913673116207,4.572122376351274,0.25390625
A,layernorm,layernorm_m4096_n512,4096,512,52,4096,2,1,"{""family"": ""layernorm"", ""group_count"": null, ""k"": null, ""m"": 4096, ""n"": 512}","{""block_size"": 4096, ""num_stages"": 1, ""num_warps"": 2}",0.009920000098645687,845.625798042607,4.613202347741234,0.25390625
A,layernorm,layernorm_m4096_n512,4096,512,53,4096,2,2,"{""family"": ""layernorm"", ""group_count"": null, ""k"": null, ""m"": 4096, ""n"": 512}","{""block_size"": 4096, ""num_stages"": 2, ""num_warps"": 2}",0.009920000098645687,845.625798042607,4.613202347741234,0.25390625
A,layernorm,layernorm_m4096_n512,4096,512,54,4096,2,3,"{""family"": ""layernorm"", ""group_count"": null, ""k"": null, ""m"": 4096, ""n"": 512}","{""block_size"": 4096, ""num_stages"": 3, ""num_warps"": 2}",0.009920000098645687,845.625798042607,4.613202347741234,0.25390625
A,layernorm,layernorm_m4096_n512,4096,512,55,4096,2,4,"{""family"": ""layernorm"", ""group_count"": null, ""k"": null, ""m"": 4096, ""n"": 512}","{""block_size"": 4096, ""num_stages"": 4, ""num_warps"": 2}",0.009920000098645687,845.625798042607,4.613202347741234,0.25390625
A,layernorm,layernorm_m4096_n512,4096,512,56,4096,4,1,"{""family"": ""layernorm"", ""group_count"": null, ""k"": null, ""m"": 4096, ""n"": 512}","{""block_size"": 4096, ""num_stages"": 1, ""num_warps"": 4}",0.009920000098645687,845.625798042607,4.613202347741234,0.25390625
A,layernorm,layernorm_m4096_n512,4096,512,57,4096,4,2,"{""family"": ""layernorm"", ""group_count"": null, ""k"": null, ""m"": 4096, ""n"": 512}","{""block_size"": 4096, ""num_stages"": 2, ""num_warps"": 4}",0.009920000098645687,845.625798042607,4.613202347741234,0.25390625
A,layernorm,layernorm_m4096_n512,4096,512,58,4096,4,3,"{""family"": ""layernorm"", ""group_count"": null, ""k"": null, ""m"": 4096, ""n"": 512}","{""block_size"": 4096, ""num_stages"": 3, ""num_warps"": 4}",0.009920000098645687,845.625798042607,4.613202347741234,0.25390625
A,layernorm,layernorm_m4096_n512,4096,512,59,4096,4,4,"{""family"": ""layernorm"", ""group_count"": null, ""k"": null, ""m"": 4096, ""n"": 512}","{""block_size"": 4096, ""num_stages"": 4, ""num_warps"": 4}",0.009920000098645687,845.625798042607,4.613202347741234,0.25390625
A,layernorm,layernorm_m4096_n512,4096,512,60,4096,8,1,"{""family"": ""layernorm"", ""group_count"": null, ""k"": null, ""m"": 4096, ""n"": 512}","{""block_size"": 4096, ""num_stages"": 1, ""num_warps"": 8}",0.01142400037497282,734.2968946654958,4.472038840561658,0.25390625
A,layernorm,layernorm_m4096_n512,4096,512,61,4096,8,2,"{""family"": ""layernorm"", ""group_count"": null, ""k"": null, ""m"": 4096, ""n"": 512}","{""block_size"": 4096, ""num_stages"": 2, ""num_warps"": 8}",0.01142400037497282,734.2968946654958,4.472038840561658,0.25390625
A,layernorm,layernorm_m4096_n512,4096,512,62,4096,8,3,"{""family"": ""layernorm"", ""group_count"": null, ""k"": null, ""m"": 4096, ""n"": 512}","{""block_size"": 4096, ""num_stages"": 3, ""num_warps"": 8}",0.01142400037497282,734.2968946654958,4.472038840561658,0.25390625
A,layernorm,layernorm_m4096_n512,4096,512,63,4096,8,4,"{""family"": ""layernorm"", ""group_count"": null, ""k"": null, ""m"": 4096, ""n"": 512}","{""block_size"": 4096, ""num_stages"": 4, ""num_warps"": 8}",0.011455999687314034,732.2458300421608,4.469241696058363,0.25390625
A,layernorm,layernorm_m4096_n512,4096,512,64,8192,1,1,"{""family"": ""layernorm"", ""group_count"": null, ""k"": null, ""m"": 4096, ""n"": 512}","{""block_size"": 8192, ""num_stages"": 1, ""num_warps"": 1}",0.02143999934196472,391.25971350105846,3.8424969734714804,0.5
A,layernorm,layernorm_m4096_n512,4096,512,65,8192,1,2,"{""family"": ""layernorm"", ""group_count"": null, ""k"": null, ""m"": 4096, ""n"": 512}","{""block_size"": 8192, ""num_stages"": 2, ""num_warps"": 1}",0.021503999829292297,390.0952411919765,3.839516322579814,0.5
A,layernorm,layernorm_m4096_n512,4096,512,66,8192,1,3,"{""family"": ""layernorm"", ""group_count"": null, ""k"": null, ""m"": 4096, ""n"": 512}","{""block_size"": 8192, ""num_stages"": 3, ""num_warps"": 1}",0.02147199958562851,390.67660962580334,3.841005537491091,0.5
A,layernorm,layernorm_m4096_n512,4096,512,67,8192,1,4,"{""family"": ""layernorm"", ""group_count"": null, ""k"": null, ""m"": 4096, ""n"": 512}","{""block_size"": 8192, ""num_stages"": 4, ""num_warps"": 1}",0.02147199958562851,390.67660962580334,3.841005537491091,0.5
A,layernorm,layernorm_m4096_n512,4096,512,68,8192,2,1,"{""family"": ""layernorm"", ""group_count"": null, ""k"": null, ""m"": 4096, ""n"": 512}","{""block_size"": 8192, ""num_stages"": 1, ""num_warps"": 2}",0.01539199985563755,544.9979261094878,4.173907394437844,0.5
A,layernorm,layernorm_m4096_n512,4096,512,69,8192,2,2,"{""family"": ""layernorm"", ""group_count"": null, ""k"": null, ""m"": 4096, ""n"": 512}","{""block_size"": 8192, ""num_stages"": 2, ""num_warps"": 2}",0.01539199985563755,544.9979261094878,4.173907394437844,0.5
A,layernorm,layernorm_m4096_n512,4096,512,70,8192,2,3,"{""family"": ""layernorm"", ""group_count"": null, ""k"": null, ""m"": 4096, ""n"": 512}","{""block_size"": 8192, ""num_stages"": 3, ""num_warps"": 2}",0.01539199985563755,544.9979261094878,4.173907394437844,0.5
A,layernorm,layernorm_m4096_n512,4096,512,71,8192,2,4,"{""family"": ""layernorm"", ""group_count"": null, ""k"": null, ""m"": 4096, ""n"": 512}","{""block_size"": 8192, ""num_stages"": 4, ""num_warps"": 2}",0.01539199985563755,544.9979261094878,4.173907394437844,0.5
A,layernorm,layernorm_m4096_n512,4096,512,72,8192,4,1,"{""family"": ""layernorm"", ""group_count"": null, ""k"": null, ""m"": 4096, ""n"": 512}","{""block_size"": 8192, ""num_stages"": 1, ""num_warps"": 4}",0.015135999768972397,554.2156532795398,4.190679281936066,0.5
A,layernorm,layernorm_m4096_n512,4096,512,73,8192,4,2,"{""family"": ""layernorm"", ""group_count"": null, ""k"": null, ""m"": 4096, ""n"": 512}","{""block_size"": 8192, ""num_stages"": 2, ""num_warps"": 4}",0.015168000012636185,553.0464130413768,4.1885673326363895,0.5
A,layernorm,layernorm_m4096_n512,4096,512,74,8192,4,3,"{""family"": ""layernorm"", ""group_count"": null, ""k"": null, ""m"": 4096, ""n"": 512}","{""block_size"": 8192, ""num_stages"": 3, ""num_warps"": 4}",0.015168000012636185,553.0464130413768,4.1885673326363895,0.5
A,layernorm,layernorm_m4096_n512,4096,512,75,8192,4,4,"{""family"": ""layernorm"", ""group_count"": null, ""k"": null, ""m"": 4096, ""n"": 512}","{""block_size"": 8192, ""num_stages"": 4, ""num_warps"": 4}",0.015168000012636185,553.0464130413768,4.1885673326363895,0.5
A,layernorm,layernorm_m4096_n512,4096,512,76,8192,8,1,"{""family"": ""layernorm"", ""group_count"": null, ""k"": null, ""m"": 4096, ""n"": 512}","{""block_size"": 8192, ""num_stages"": 1, ""num_warps"": 8}",0.01539199985563755,544.9979261094878,4.173907394437844,0.5
A,layernorm,layernorm_m4096_n512,4096,512,77,8192,8,2,"{""family"": ""layernorm"", ""group_count"": null, ""k"": null, ""m"": 4096, ""n"": 512}","{""block_size"": 8192, ""num_stages"": 2, ""num_warps"": 8}",0.01539199985563755,544.9979261094878,4.173907394437844,0.5
A,layernorm,layernorm_m4096_n512,4096,512,78,8192,8,3,"{""family"": ""layernorm"", ""group_count"": null, ""k"": null, ""m"": 4096, ""n"": 512}","{""block_size"": 8192, ""num_stages"": 3, ""num_warps"": 8}",0.01539199985563755,544.9979261094878,4.173907394437844,0.5
A,layernorm,layernorm_m4096_n512,4096,512,79,8192,8,4,"{""family"": ""layernorm"", ""group_count"": null, ""k"": null, ""m"": 4096, ""n"": 512}","{""block_size"": 8192, ""num_stages"": 4, ""num_warps"": 8}",0.01539199985563755,544.9979261094878,4.173907394437844,0.5
A,layernorm,layernorm_m4096_n1024,4096,1024,0,1024,1,1,"{""family"": ""layernorm"", ""group_count"": null, ""k"": null, ""m"": 4096, ""n"": 1024}","{""block_size"": 1024, ""num_stages"": 1, ""num_warps"": 1}",0.008767999708652496,1913.459917596005,4.73664658200498,0.001953125
A,layernorm,layernorm_m4096_n1024,4096,1024,1,1024,1,2,"{""family"": ""layernorm"", ""group_count"": null, ""k"": null, ""m"": 4096, ""n"": 1024}","{""block_size"": 1024, ""num_stages"": 2, ""num_warps"": 1}",0.008767999708652496,1913.459917596005,4.73664658200498,0.001953125
A,layernorm,layernorm_m4096_n1024,4096,1024,2,1024,1,3,"{""family"": ""layernorm"", ""group_count"": null, ""k"": null, ""m"": 4096, ""n"": 1024}","{""block_size"": 1024, ""num_stages"": 3, ""num_warps"": 1}",0.008767999708652496,1913.459917596005,4.73664658200498,0.001953125
A,layernorm,layernorm_m4096_n1024,4096,1024,3,1024,1,4,"{""family"": ""layernorm"", ""group_count"": null, ""k"": null, ""m"": 4096, ""n"": 1024}","{""block_size"": 1024, ""num_stages"": 4, ""num_warps"": 1}",0.008767999708652496,1913.459917596005,4.73664658200498,0.001953125
A,layernorm,layernorm_m4096_n1024,4096,1024,4,1024,2,1,"{""family"": ""layernorm"", ""group_count"": null, ""k"": null, ""m"": 4096, ""n"": 1024}","{""block_size"": 1024, ""num_stages"": 1, ""num_warps"": 2}",0.008767999708652496,1913.459917596005,4.73664658200498,0.001953125
A,layernorm,layernorm_m4096_n1024,4096,1024,5,1024,2,2,"{""family"": ""layernorm"", ""group_count"": null, ""k"": null, ""m"": 4096, ""n"": 1024}","{""block_size"": 1024, ""num_stages"": 2, ""num_warps"": 2}",0.008767999708652496,1913.459917596005,4.73664658200498,0.001953125
A,layernorm,layernorm_m4096_n1024,4096,1024,6,1024,2,3,"{""family"": ""layernorm"", ""group_count"": null, ""k"": null, ""m"": 4096, ""n"": 1024}","{""block_size"": 1024, ""num_stages"": 3, ""num_warps"": 2}",0.008767999708652496,1913.459917596005,4.73664658200498,0.001953125
A,layernorm,layernorm_m4096_n1024,4096,1024,7,1024,2,4,"{""family"": ""layernorm"", ""group_count"": null, ""k"": null, ""m"": 4096, ""n"": 1024}","{""block_size"": 1024, ""num_stages"": 4, ""num_warps"": 2}",0.008767999708652496,1913.459917596005,4.73664658200498,0.001953125
A,layernorm,layernorm_m4096_n1024,4096,1024,8,1024,4,1,"{""family"": ""layernorm"", ""group_count"": null, ""k"": null, ""m"": 4096, ""n"": 1024}","{""block_size"": 1024, ""num_stages"": 1, ""num_warps"": 4}",0.009184000082314014,1826.7874400729302,4.690292430442163,0.001953125
A,layernorm,layernorm_m4096_n1024,4096,1024,9,1024,4,2,"{""family"": ""layernorm"", ""group_count"": null, ""k"": null, ""m"": 4096, ""n"": 1024}","{""block_size"": 1024, ""num_stages"": 2, ""num_warps"": 4}",0.009184000082314014,1826.7874400729302,4.690292430442163,0.001953125
A,layernorm,layernorm_m4096_n1024,4096,1024,10,1024,4,3,"{""family"": ""layernorm"", ""group_count"": null, ""k"": null, ""m"": 4096, ""n"": 1024}","{""block_size"": 1024, ""num_stages"": 3, ""num_warps"": 4}",0.009151999838650227,1833.1748574937005,4.693782861974697,0.001953125
A,layernorm,layernorm_m4096_n1024,4096,1024,11,1024,4,4,"{""family"": ""layernorm"", ""group_count"": null, ""k"": null, ""m"": 4096, ""n"": 1024}","{""block_size"": 1024, ""num_stages"": 4, ""num_warps"": 4}",0.009151999838650227,1833.1748574937005,4.693782861974697,0.001953125
A,layernorm,layernorm_m4096_n1024,4096,1024,12,1024,8,1,"{""family"": ""layernorm"", ""group_count"": null, ""k"": null, ""m"": 4096, ""n"": 1024}","{""block_size"": 1024, ""num_stages"": 1, ""num_warps"": 8}",0.011264000087976456,1489.4545338212952,4.486143471756041,0.001953125
A,layernorm,layernorm_m4096_n1024,4096,1024,13,1024,8,2,"{""family"": ""layernorm"", ""group_count"": null, ""k"": null, ""m"": 4096, ""n"": 1024}","{""block_size"": 1024, ""num_stages"": 2, ""num_warps"": 8}",0.011264000087976456,1489.4545338212952,4.486143471756041,0.001953125
A,layernorm,layernorm_m4096_n1024,4096,1024,14,1024,8,3,"{""family"": ""layernorm"", ""group_count"": null, ""k"": null, ""m"": 4096, ""n"": 1024}","{""block_size"": 1024, ""num_stages"": 3, ""num_warps"": 8}",0.011264000087976456,1489.4545338212952,4.486143471756041,0.001953125
A,layernorm,layernorm_m4096_n1024,4096,1024,15,1024,8,4,"{""family"": ""layernorm"", ""group_count"": null, ""k"": null, ""m"": 4096, ""n"": 1024}","{""block_size"": 1024, ""num_stages"": 4, ""num_warps"": 8}",0.011264000087976456,1489.4545338212952,4.486143471756041,0.001953125
A,layernorm,layernorm_m4096_n1024,4096,1024,16,2048,1,1,"{""family"": ""layernorm"", ""group_count"": null, ""k"": null, ""m"": 4096, ""n"": 1024}","{""block_size"": 2048, ""num_stages"": 1, ""num_warps"": 1}",0.009119999594986439,1839.6070992396735,4.69728551930528,0.0234375
A,layernorm,layernorm_m4096_n1024,4096,1024,17,2048,1,2,"{""family"": ""layernorm"", ""group_count"": null, ""k"": null, ""m"": 4096, ""n"": 1024}","{""block_size"": 2048, ""num_stages"": 2, ""num_warps"": 1}",0.009151999838650227,1833.1748574937005,4.693782861974697,0.0234375
A,layernorm,layernorm_m4096_n1024,4096,1024,18,2048,1,3,"{""family"": ""layernorm"", ""group_count"": null, ""k"": null, ""m"": 4096, ""n"": 1024}","{""block_size"": 2048, ""num_stages"": 3, ""num_warps"": 1}",0.009119999594986439,1839.6070992396735,4.69728551930528,0.0234375
A,layernorm,layernorm_m4096_n1024,4096,1024,19,2048,1,4,"{""family"": ""layernorm"", ""group_count"": null, ""k"": null, ""m"": 4096, ""n"": 1024}","{""block_size"": 2048, ""num_stages"": 4, ""num_warps"": 1}",0.009119999594986439,1839.6070992396735,4.69728551930528,0.0234375
A,layernorm,layernorm_m4096_n1024,4096,1024,20,2048,2,1,"{""family"": ""layernorm"", ""group_count"": null, ""k"": null, ""m"": 4096, ""n"": 1024}","{""block_size"": 2048, ""num_stages"": 1, ""num_warps"": 2}",0.009440000168979168,1777.2474258137934,4.662799280924392,0.0234375
A,layernorm,layernorm_m4096_n1024,4096,1024,21,2048,2,2,"{""family"": ""layernorm"", ""group_count"": null, ""k"": null, ""m"": 4096, ""n"": 1024}","{""block_size"": 2048, ""num_stages"": 2, ""num_warps"": 2}",0.009440000168979168,1777.2474258137934,4.662799280924392,0.0234375
A,layernorm,layernorm_m4096_n1024,4096,1024,22,2048,2,3,"{""family"": ""layernorm"", ""group_count"": null, ""k"": null, ""m"": 4096, ""n"": 1024}","{""block_size"": 2048, ""num_stages"": 3, ""num_warps"": 2}",0.009472000412642956,1771.2431660799182,4.659415157275987,0.0234375
A,layernorm,layernorm_m4096_n1024,4096,1024,23,2048,2,4,"{""family"": ""layernorm"", ""group_count"": null, ""k"": null, ""m"": 4096, ""n"": 1024}","{""block_size"": 2048, ""num_stages"": 4, ""num_warps"": 2}",0.009440000168979168,1777.2474258137934,4.662799280924392,0.0234375
A,layernorm,layernorm_m4096_n1024,4096,1024,24,2048,4,1,"{""family"": ""layernorm"", ""group_count"": null, ""k"": null, ""m"": 4096, ""n"": 1024}","{""block_size"": 2048, ""num_stages"": 1, ""num_warps"": 4}",0.009344000369310379,1795.5067783498193,4.673020813372467,0.0234375
A,layernorm,layernorm_m4096_n1024,4096,1024,25,2048,4,2,"{""family"": ""layernorm"", ""group_count"": null, ""k"": null, ""m"": 4096, ""n"": 1024}","{""block_size"": 2048, ""num_stages"": 2, ""num_warps"": 4}",0.009312000125646591,1801.6769516350337,4.676451374500079,0.0234375
A,layernorm,layernorm_m4096_n1024,4096,1024,26,2048,4,3,"{""family"": ""layernorm"", ""group_count"": null, ""k"": null, ""m"": 4096, ""n"": 1024}","{""block_size"": 2048, ""num_stages"": 3, ""num_warps"": 4}",0.009312000125646591,1801.6769516350337,4.676451374500079,0.0234375
A,layernorm,layernorm_m4096_n1024,4096,1024,27,2048,4,4,"{""family"": ""layernorm"", ""group_count"": null, ""k"": null, ""m"": 4096, ""n"": 1024}","{""block_size"": 2048, ""num_stages"": 4, ""num_warps"": 4}",0.009312000125646591,1801.6769516350337,4.676451374500079,0.0234375
A,layernorm,layernorm_m4096_n1024,4096,1024,28,2048,8,1,"{""family"": ""layernorm"", ""group_count"": null, ""k"": null, ""m"": 4096, ""n"": 1024}","{""block_size"": 2048, ""num_stages"": 1, ""num_warps"": 8}",0.011552000418305397,1452.3212770503958,4.46089666062102,0.0234375
A,layernorm,layernorm_m4096_n1024,4096,1024,29,2048,8,2,"{""family"": ""layernorm"", ""group_count"": null, ""k"": null, ""m"": 4096, ""n"": 1024}","{""block_size"": 2048, ""num_stages"": 2, ""num_warps"": 8}",0.011552000418305397,1452.3212770503958,4.46089666062102,0.0234375
A,layernorm,layernorm_m4096_n1024,4096,1024,30,2048,8,3,"{""family"": ""layernorm"", ""group_count"": null, ""k"": null, ""m"": 4096, ""n"": 1024}","{""block_size"": 2048, ""num_stages"": 3, ""num_warps"": 8}",0.011552000418305397,1452.3212770503958,4.46089666062102,0.0234375
A,layernorm,layernorm_m4096_n1024,4096,1024,31,2048,8,4,"{""family"": ""layernorm"", ""group_count"": null, ""k"": null, ""m"": 4096, ""n"": 1024}","{""block_size"": 2048, ""num_stages"": 4, ""num_warps"": 8}",0.011552000418305397,1452.3212770503958,4.46089666062102,0.0234375
A,layernorm,layernorm_m4096_n1024,4096,1024,32,4096,1,1,"{""family"": ""layernorm"", ""group_count"": null, ""k"": null, ""m"": 4096, ""n"": 1024}","{""block_size"": 4096, ""num_stages"": 1, ""num_warps"": 1}",0.01152000017464161,1456.3555334774067,4.46367060855453,0.072265625
A,layernorm,layernorm_m4096_n1024,4096,1024,33,4096,1,2,"{""family"": ""layernorm"", ""group_count"": null, ""k"": null, ""m"": 4096, ""n"": 1024}","{""block_size"": 4096, ""num_stages"": 2, ""num_warps"": 1}",0.01152000017464161,1456.3555334774067,4.46367060855453,0.072265625
A,layernorm,layernorm_m4096_n1024,4096,1024,34,4096,1,3,"{""family"": ""layernorm"", ""group_count"": null, ""k"": null, ""m"": 4096, ""n"": 1024}","{""block_size"": 4096, ""num_stages"": 3, ""num_warps"": 1}",0.01152000017464161,1456.3555334774067,4.46367060855453,0.072265625
A,layernorm,layernorm_m4096_n1024,4096,1024,35,4096,1,4,"{""family"": ""layernorm"", ""group_count"": null, ""k"": null, ""m"": 4096, ""n"": 1024}","{""block_size"": 4096, ""num_stages"": 4, ""num_warps"": 1}",0.01152000017464161,1456.3555334774067,4.46367060855453,0.072265625
A,layernorm,layernorm_m4096_n1024,4096,1024,36,4096,2,1,"{""family"": ""layernorm"", ""group_count"": null, ""k"": null, ""m"": 4096, ""n"": 1024}","{""block_size"": 4096, ""num_stages"": 1, ""num_warps"": 2}",0.011103999800980091,1510.9164535935208,4.500449893140951,0.072265625
A,layernorm,layernorm_m4096_n1024,4096,1024,37,4096,2,2,"{""family"": ""layernorm"", ""group_count"": null, ""k"": null, ""m"": 4096, ""n"": 1024}","{""block_size"": 4096, ""num_stages"": 2, ""num_warps"": 2}",0.011136000044643879,1506.5747066038666,4.497572171381104,0.072265625
A,layernorm,layernorm_m4096_n1024,4096,1024,38,4096,2,3,"{""family"": ""layernorm"", ""group_count"": null, ""k"": null, ""m"": 4096, ""n"": 1024}","{""block_size"": 4096, ""num_stages"": 3, ""num_warps"": 2}",0.011103999800980091,1510.9164535935208,4.500449893140951,0.072265625
A,layernorm,layernorm_m4096_n1024,4096,1024,39,4096,2,4,"{""family"": ""layernorm"", ""group_count"": null, ""k"": null, ""m"": 4096, ""n"": 1024}","{""block_size"": 4096, ""num_stages"": 4, ""num_warps"": 2}",0.011136000044643879,1506.5747066038666,4.497572171381104,0.072265625
A,layernorm,layernorm_m4096_n1024,4096,1024,40,4096,4,1,"{""family"": ""layernorm"", ""group_count"": null, ""k"": null, ""m"": 4096, ""n"": 1024}","{""block_size"": 4096, ""num_stages"": 1, ""num_warps"": 4}",0.011008000001311302,1524.09302307426,4.509132997672027,0.072265625
A,layernorm,layernorm_m4096_n1024,4096,1024,41,4096,4,2,"{""family"": ""layernorm"", ""group_count"": null, ""k"": null, ""m"": 4096, ""n"": 1024}","{""block_size"": 4096, ""num_stages"": 2, ""num_warps"": 4}",0.011008000001311302,1524.09302307426,4.509132997672027,0.072265625
A,layernorm,layernorm_m4096_n1024,4096,1024,42,4096,4,3,"{""family"": ""layernorm"", ""group_count"": null, ""k"": null, ""m"": 4096, ""n"": 1024}","{""block_size"": 4096, ""num_stages"": 3, ""num_warps"": 4}",0.011008000001311302,1524.09302307426,4.509132997672027,0.072265625
A,layernorm,layernorm_m4096_n1024,4096,1024,43,4096,4,4,"{""family"": ""layernorm"", ""group_count"": null, ""k"": null, ""m"": 4096, ""n"": 1024}","{""block_size"": 4096, ""num_stages"": 4, ""num_warps"": 4}",0.011008000001311302,1524.09302307426,4.509132997672027,0.072265625
A,layernorm,layernorm_m4096_n1024,4096,1024,44,4096,8,1,"{""family"": ""layernorm"", ""group_count"": null, ""k"": null, ""m"": 4096, ""n"": 1024}","{""block_size"": 4096, ""num_stages"": 1, ""num_warps"": 8}",0.012191999703645706,1376.0840229501648,4.406975304345122,0.072265625
A,layernorm,layernorm_m4096_n1024,4096,1024,45,4096,8,2,"{""family"": ""layernorm"", ""group_count"": null, ""k"": null, ""m"": 4096, ""n"": 1024}","{""block_size"": 4096, ""num_stages"": 2, ""num_warps"": 8}",0.012191999703645706,1376.0840229501648,4.406975304345122,0.072265625
A,layernorm,layernorm_m4096_n1024,4096,1024,46,4096,8,3,"{""family"": ""layernorm"", ""group_count"": null, ""k"": null, ""m"": 4096, ""n"": 1024}","{""block_size"": 4096, ""num_stages"": 3, ""num_warps"": 8}",0.012191999703645706,1376.0840229501648,4.406975304345122,0.072265625
A,layernorm,layernorm_m4096_n1024,4096,1024,47,4096,8,4,"{""family"": ""layernorm"", ""group_count"": null, ""k"": null, ""m"": 4096, ""n"": 1024}","{""block_size"": 4096, ""num_stages"": 4, ""num_warps"": 8}",0.012191999703645706,1376.0840229501648,4.406975304345122,0.072265625
A,layernorm,layernorm_m4096_n1024,4096,1024,48,8192,1,1,"{""family"": ""layernorm"", ""group_count"": null, ""k"": null, ""m"": 4096, ""n"": 1024}","{""block_size"": 8192, ""num_stages"": 1, ""num_warps"": 1}",0.022272000089287758,753.2873533019333,3.804424990821159,0.162109375
A,layernorm,layernorm_m4096_n1024,4096,1024,49,8192,1,2,"{""family"": ""layernorm"", ""group_count"": null, ""k"": null, ""m"": 4096, ""n"": 1024}","{""block_size"": 8192, ""num_stages"": 2, ""num_warps"": 1}",0.022304000332951546,752.2065884842025,3.8029892294761387,0.162109375
A,layernorm,layernorm_m4096_n1024,4096,1024,50,8192,1,3,"{""family"": ""layernorm"", ""group_count"": null, ""k"": null, ""m"": 4096, ""n"": 1024}","{""block_size"": 8192, ""num_stages"": 3, ""num_warps"": 1}",0.022304000332951546,752.2065884842025,3.8029892294761387,0.162109375
A,layernorm,layernorm_m4096_n1024,4096,1024,51,8192,1,4,"{""family"": ""layernorm"", ""group_count"": null, ""k"": null, ""m"": 4096, ""n"": 1024}","{""block_size"": 8192, ""num_stages"": 4, ""num_warps"": 1}",0.022336000576615334,751.1289204373005,3.801555526586661,0.162109375
A,layernorm,layernorm_m4096_n1024,4096,1024,52,8192,2,1,"{""family"": ""layernorm"", ""group_count"": null, ""k"": null, ""m"": 4096, ""n"": 1024}","{""block_size"": 8192, ""num_stages"": 1, ""num_warps"": 2}",0.016224000602960587,1034.0985808973937,4.121263614408635,0.162109375
A,layernorm,layernorm_m4096_n1024,4096,1024,53,8192,2,2,"{""family"": ""layernorm"", ""group_count"": null, ""k"": null, ""m"": 4096, ""n"": 1024}","{""block_size"": 8192, ""num_stages"": 2, ""num_warps"": 2}",0.016224000602960587,1034.0985808973937,4.121263614408635,0.162109375
A,layernorm,layernorm_m4096_n1024,4096,1024,54,8192,2,3,"{""family"": ""layernorm"", ""group_count"": null, ""k"": null, ""m"": 4096, ""n"": 1024}","{""block_size"": 8192, ""num_stages"": 3, ""num_warps"": 2}",0.016224000602960587,1034.0985808973937,4.121263614408635,0.162109375
A,layernorm,layernorm_m4096_n1024,4096,1024,55,8192,2,4,"{""family"": ""layernorm"", ""group_count"": null, ""k"": null, ""m"": 4096, ""n"": 1024}","{""block_size"": 8192, ""num_stages"": 4, ""num_warps"": 2}",0.016256000846624374,1032.0629383753912,4.119293155505336,0.162109375
A,layernorm,layernorm_m4096_n1024,4096,1024,56,8192,4,1,"{""family"": ""layernorm"", ""group_count"": null, ""k"": null, ""m"": 4096, ""n"": 1024}","{""block_size"": 8192, ""num_stages"": 1, ""num_warps"": 4}",0.01603199914097786,1046.4830900045,4.133168607661404,0.162109375
A,layernorm,layernorm_m4096_n1024,4096,1024,57,8192,4,2,"{""family"": ""layernorm"", ""group_count"": null, ""k"": null, ""m"": 4096, ""n"": 1024}","{""block_size"": 8192, ""num_stages"": 2, ""num_warps"": 4}",0.01603199914097786,1046.4830900045,4.133168607661404,0.162109375
A,layernorm,layernorm_m4096_n1024,4096,1024,58,8192,4,3,"{""family"": ""layernorm"", ""group_count"": null, ""k"": null, ""m"": 4096, ""n"": 1024}","{""block_size"": 8192, ""num_stages"": 3, ""num_warps"": 4}",0.01603199914097786,1046.4830900045,4.133168607661404,0.162109375
A,layernorm,layernorm_m4096_n1024,4096,1024,59,8192,4,4,"{""family"": ""layernorm"", ""group_count"": null, ""k"": null, ""m"": 4096, ""n"": 1024}","{""block_size"": 8192, ""num_stages"": 4, ""num_warps"": 4}",0.01603199914097786,1046.4830900045,4.133168607661404,0.162109375
A,layernorm,layernorm_m4096_n1024,4096,1024,60,8192,8,1,"{""family"": ""layernorm"", ""group_count"": null, ""k"": null, ""m"": 4096, ""n"": 1024}","{""block_size"": 8192, ""num_stages"": 1, ""num_warps"": 8}",0.016127999871969223,1040.2539765119373,4.127198395031595,0.162109375
A,layernorm,layernorm_m4096_n1024,4096,1024,61,8192,8,2,"{""family"": ""layernorm"", ""group_count"": null, ""k"": null, ""m"": 4096, ""n"": 1024}","{""block_size"": 8192, ""num_stages"": 2, ""num_warps"": 8}",0.016095999628305435,1042.3220916641062,4.129184508157165,0.162109375
A,layernorm,layernorm_m4096_n1024,4096,1024,62,8192,8,3,"{""family"": ""layernorm"", ""group_count"": null, ""k"": null, ""m"": 4096, ""n"": 1024}","{""block_size"": 8192, ""num_stages"": 3, ""num_warps"": 8}",0.016095999628305435,1042.3220916641062,4.129184508157165,0.162109375
A,layernorm,layernorm_m4096_n1024,4096,1024,63,8192,8,4,"{""family"": ""layernorm"", ""group_count"": null, ""k"": null, ""m"": 4096, ""n"": 1024}","{""block_size"": 8192, ""num_stages"": 4, ""num_warps"": 8}",0.016095999628305435,1042.3220916641062,4.129184508157165,0.162109375
A,layernorm,layernorm_m4096_n1536,4096,1536,0,2048,1,1,"{""family"": ""layernorm"", ""group_count"": null, ""k"": null, ""m"": 4096, ""n"": 1536}","{""block_size"": 2048, ""num_stages"": 1, ""num_warps"": 1}",0.011136000044643879,2259.8620599058004,4.497572171381104,0.0078125
A,layernorm,layernorm_m4096_n1536,4096,1536,1,2048,1,2,"{""family"": ""layernorm"", ""group_count"": null, ""k"": null, ""m"": 4096, ""n"": 1536}","{""block_size"": 2048, ""num_stages"": 2, ""num_warps"": 1}",0.011168000288307667,2253.386761311902,4.494702707146606,0.0078125
A,layernorm,layernorm_m4096_n1536,4096,1536,2,2048,1,3,"{""family"": ""layernorm"", ""group_count"": null, ""k"": null, ""m"": 4096, ""n"": 1536}","{""block_size"": 2048, ""num_stages"": 3, ""num_warps"": 1}",0.011136000044643879,2259.8620599058004,4.497572171381104,0.0078125
A,layernorm,layernorm_m4096_n1536,4096,1536,3,2048,1,4,"{""family"": ""layernorm"", ""group_count"": null, ""k"": null, ""m"": 4096, ""n"": 1536}","{""block_size"": 2048, ""num_stages"": 4, ""num_warps"": 1}",0.011136000044643879,2259.8620599058004,4.497572171381104,0.0078125
A,layernorm,layernorm_m4096_n1536,4096,1536,4,2048,2,1,"{""family"": ""layernorm"", ""group_count"": null, ""k"": null, ""m"": 4096, ""n"": 1536}","{""block_size"": 2048, ""num_stages"": 1, ""num_warps"": 2}",0.011136000044643879,2259.8620599058004,4.497572171381104,0.0078125
A,layernorm,layernorm_m4096_n1536,4096,1536,5,2048,2,2,"{""family"": ""layernorm"", ""group_count"": null, ""k"": null, ""m"": 4096, ""n"": 1536}","{""block_size"": 2048, ""num_stages"": 2, ""num_warps"": 2}",0.011136000044643879,2259.8620599058004,4.497572171381104,0.0078125
A,layernorm,layernorm_m4096_n1536,4096,1536,6,2048,2,3,"{""family"": ""layernorm"", ""group_count"": null, ""k"": null, ""m"": 4096, ""n"": 1536}","{""block_size"": 2048, ""num_stages"": 3, ""num_warps"": 2}",0.011136000044643879,2259.8620599058004,4.497572171381104,0.0078125
A,layernorm,layernorm_m4096_n1536,4096,1536,7,2048,2,4,"{""family"": ""layernorm"", ""group_count"": null, ""k"": null, ""m"": 4096, ""n"": 1536}","{""block_size"": 2048, ""num_stages"": 4, ""num_warps"": 2}",0.011136000044643879,2259.8620599058004,4.497572171381104,0.0078125
A,layernorm,layernorm_m4096_n1536,4096,1536,8,2048,4,1,"{""family"": ""layernorm"", ""group_count"": null, ""k"": null, ""m"": 4096, ""n"": 1536}","{""block_size"": 2048, ""num_stages"": 1, ""num_warps"": 4}",0.01104000024497509,2279.5129928963856,4.5062302159434156,0.0078125
A,layernorm,layernorm_m4096_n1536,4096,1536,9,2048,4,2,"{""family"": ""layernorm"", ""group_count"": null, ""k"": null, ""m"": 4096, ""n"": 1536}","{""block_size"": 2048, ""num_stages"": 2, ""num_warps"": 4}",0.01104000024497509,2279.5129928963856,4.5062302159434156,0.0078125
A,layernorm,layernorm_m4096_n1536,4096,1536,10,2048,4,3,"{""family"": ""layernorm"", ""group_count"": null, ""k"": null, ""m"": 4096, ""n"": 1536}","{""block_size"": 2048, ""num_stages"": 3, ""num_warps"": 4}",0.01104000024497509,2279.5129928963856,4.5062302159434156,0.0078125
A,layernorm,layernorm_m4096_n1536,4096,1536,11,2048,4,4,"{""family"": ""layernorm"", ""group_count"": null, ""k"": null, ""m"": 4096, ""n"": 1536}","{""block_size"": 2048, ""num_stages"": 4, ""num_warps"": 4}",0.01104000024497509,2279.5129928963856,4.5062302159434156,0.0078125
A,layernorm,layernorm_m4096_n1536,4096,1536,12,2048,8,1,"{""family"": ""layernorm"", ""group_count"": null, ""k"": null, ""m"": 4096, ""n"": 1536}","{""block_size"": 2048, ""num_stages"": 1, ""num_warps"": 8}",0.012671999633312225,1985.9394514062278,4.368360472846918,0.0078125
A,layernorm,layernorm_m4096_n1536,4096,1536,13,2048,8,2,"{""family"": ""layernorm"", ""group_count"": null, ""k"": null, ""m"": 4096, ""n"": 1536}","{""block_size"": 2048, ""num_stages"": 2, ""num_warps"": 8}",0.012671999633312225,1985.9394514062278,4.368360472846918,0.0078125
A,layernorm,layernorm_m4096_n1536,4096,1536,14,2048,8,3,"{""family"": ""layernorm"", ""group_count"": null, ""k"": null, ""m"": 4096, ""n"": 1536}","{""block_size"": 2048, ""num_stages"": 3, ""num_warps"": 8}",0.012671999633312225,1985.9394514062278,4.368360472846918,0.0078125
A,layernorm,layernorm_m4096_n1536,4096,1536,15,2048,8,4,"{""family"": ""layernorm"", ""group_count"": null, ""k"": null, ""m"": 4096, ""n"": 1536}","{""block_size"": 2048, ""num_stages"": 4, ""num_warps"": 8}",0.012671999633312225,1985.9394514062278,4.368360472846918,0.0078125
A,layernorm,layernorm_m4096_n1536,4096,1536,16,4096,1,1,"{""family"": ""layernorm"", ""group_count"": null, ""k"": null, ""m"": 4096, ""n"": 1536}","{""block_size"": 4096, ""num_stages"": 1, ""num_warps"": 1}",0.012608000077307224,1996.0202923297284,4.373423739735013,0.02734375
A,layernorm,layernorm_m4096_n1536,4096,1536,17,4096,1,2,"{""family"": ""layernorm"", ""group_count"": null, ""k"": null, ""m"": 4096, ""n"": 1536}","{""block_size"": 4096, ""num_stages"": 2, ""num_warps"": 1}",0.012640000320971012,1990.967038050419,4.37088886487015,0.02734375
A,layernorm,layernorm_m4096_n1536,4096,1536,18,4096,1,3,"{""family"": ""layernorm"", ""group_count"": null, ""k"": null, ""m"": 4096, ""n"": 1536}","{""block_size"": 4096, ""num_stages"": 3, ""num_warps"": 1}",0.012608000077307224,1996.0202923297284,4.373423739735013,0.02734375
A,layernorm,layernorm_m4096_n1536,4096,1536,19,4096,1,4,"{""family"": ""layernorm"", ""group_count"": null, ""k"": null, ""m"": 4096, ""n"": 1536}","{""block_size"": 4096, ""num_stages"": 4, ""num_warps"": 1}",0.012640000320971012,1990.967038050419,4.37088886487015,0.02734375
A,layernorm,layernorm_m4096_n1536,4096,1536,20,4096,2,1,"{""family"": ""layernorm"", ""group_count"": null, ""k"": null, ""m"": 4096, ""n"": 1536}","{""block_size"": 4096, ""num_stages"": 1, ""num_warps"": 2}",0.01206399966031313,2086.026583935332,4.417529495873605,0.02734375
A,layernorm,layernorm_m4096_n1536,4096,1536,21,4096,2,2,"{""family"": ""layernorm"", ""group_count"": null, ""k"": null, ""m"": 4096, ""n"": 1536}","{""block_size"": 4096, ""num_stages"": 2, ""num_warps"": 2}",0.01206399966031313,2086.026583935332,4.417529495873605,0.02734375
A,layernorm,layernorm_m4096_n1536,4096,1536,22,4096,2,3,"{""family"": ""layernorm"", ""group_count"": null, ""k"": null, ""m"": 4096, ""n"": 1536}","{""block_size"": 4096, ""num_stages"": 3, ""num_warps"": 2}",0.01206399966031313,2086.026583935332,4.417529495873605,0.02734375
A,layernorm,layernorm_m4096_n1536,4096,1536,23,4096,2,4,"{""family"": ""layernorm"", ""group_count"": null, ""k"": null, ""m"": 4096, ""n"": 1536}","{""block_size"": 4096, ""num_stages"": 4, ""num_warps"": 2}",0.01206399966031313,2086.026583935332,4.417529495873605,0.02734375
A,layernorm,layernorm_m4096_n1536,4096,1536,24,4096,4,1,"{""family"": ""layernorm"", ""group_count"": null, ""k"": null, ""m"": 4096, ""n"": 1536}","{""block_size"": 4096, ""num_stages"": 1, ""num_warps"": 4}",0.01235199999064207,2037.388602579804,4.393937286457321,0.02734375
A,layernorm,layernorm_m4096_n1536,4096,1536,25,4096,4,2,"{""family"": ""layernorm"", ""group_count"": null, ""k"": null, ""m"": 4096, ""n"": 1536}","{""block_size"": 4096, ""num_stages"": 2, ""num_warps"": 4}",0.01235199999064207,2037.388602579804,4.393937286457321,0.02734375
A,layernorm,layernorm_m4096_n1536,4096,1536,26,4096,4,3,"{""family"": ""layernorm"", ""group_count"": null, ""k"": null, ""m"": 4096, ""n"": 1536}","{""block_size"": 4096, ""num_stages"": 3, ""num_warps"": 4}",0.012384000234305859,2032.123992559871,4.39134994321472,0.02734375
A,layernorm,layernorm_m4096_n1536,4096,1536,27,4096,4,4,"{""family"": ""layernorm"", ""group_count"": null, ""k"": null, ""m"": 4096, ""n"": 1536}","{""block_size"": 4096, ""num_stages"": 4, ""num_warps"": 4}",0.01235199999064207,2037.388602579804,4.393937286457321,0.02734375
A,layernorm,layernorm_m4096_n1536,4096,1536,28,4096,8,1,"{""family"": ""layernorm"", ""group_count"": null, ""k"": null, ""m"": 4096, ""n"": 1536}","{""block_size"": 4096, ""num_stages"": 1, ""num_warps"": 8}",0.013120000250637531,1918.1267926254143,4.333617476362724,0.02734375
A,layernorm,layernorm_m4096_n1536,4096,1536,29,4096,8,2,"{""family"": ""layernorm"", ""group_count"": null, ""k"": null, ""m"": 4096, ""n"": 1536}","{""block_size"": 4096, ""num_stages"": 2, ""num_warps"": 8}",0.013151999562978745,1913.4599175960047,4.331181473896815,0.02734375
A,layernorm,layernorm_m4096_n1536,4096,1536,30,4096,8,3,"{""family"": ""layernorm"", ""group_count"": null, ""k"": null, ""m"": 4096, ""n"": 1536}","{""block_size"": 4096, ""num_stages"": 3, ""num_warps"": 8}",0.013151999562978745,1913.4599175960047,4.331181473896815,0.02734375
A,layernorm,layernorm_m4096_n1536,4096,1536,31,4096,8,4,"{""family"": ""layernorm"", ""group_count"": null, ""k"": null, ""m"": 4096, ""n"": 1536}","{""block_size"": 4096, ""num_stages"": 4, ""num_warps"": 8}",0.013151999562978745,1913.4599175960047,4.331181473896815,0.02734375
A,layernorm,layernorm_m4096_n1536,4096,1536,32,8192,1,1,"{""family"": ""layernorm"", ""group_count"": null, ""k"": null, ""m"": 4096, ""n"": 1536}","{""block_size"": 8192, ""num_stages"": 1, ""num_warps"": 1}",0.023231999948620796,1083.2396718171485,3.7622246425513217,0.0703125
A,layernorm,layernorm_m4096_n1536,4096,1536,33,8192,1,2,"{""family"": ""layernorm"", ""group_count"": null, ""k"": null, ""m"": 4096, ""n"": 1536}","{""block_size"": 8192, ""num_stages"": 2, ""num_warps"": 1}",0.023231999948620796,1083.2396718171485,3.7622246425513217,0.0703125
A,layernorm,layernorm_m4096_n1536,4096,1536,34,8192,1,3,"{""family"": ""layernorm"", ""group_count"": null, ""k"": null, ""m"": 4096, ""n"": 1536}","{""block_size"": 8192, ""num_stages"": 3, ""num_warps"": 1}",0.023264000192284584,1081.7496471800303,3.7608481693657003,0.0703125
A,layernorm,layernorm_m4096_n1536,4096,1536,35,8192,1,4,"{""family"": ""layernorm"", ""group_count"": null, ""k"": null, ""m"": 4096, ""n"": 1536}","{""block_size"": 8192, ""num_stages"": 4, ""num_warps"": 1}",0.023231999948620796,1083.2396718171485,3.7622246425513217,0.0703125
A,layernorm,layernorm_m4096_n1536,4096,1536,36,8192,2,1,"{""family"": ""layernorm"", ""group_count"": null, ""k"": null, ""m"": 4096, ""n"": 1536}","{""block_size"": 8192, ""num_stages"": 1, ""num_warps"": 2}",0.017152000218629837,1467.2238618948863,4.0656404813471365,0.0703125
A,layernorm,layernorm_m4096_n1536,4096,1536,37,8192,2,2,"{""family"": ""layernorm"", ""group_count"": null, ""k"": null, ""m"": 4096, ""n"": 1536}","{""block_size"": 8192, ""num_stages"": 2, ""num_warps"": 2}",0.017136000096797943,1468.5938292392123,4.066573759627938,0.0703125
A,layernorm,layernorm_m4096_n1536,4096,1536,38,8192,2,3,"{""family"": ""layernorm"", ""group_count"": null, ""k"": null, ""m"": 4096, ""n"": 1536}","{""block_size"": 8192, ""num_stages"": 3, ""num_warps"": 2}",0.017152000218629837,1467.2238618948863,4.0656404813471365,0.0703125
A,layernorm,layernorm_m4096_n1536,4096,1536,39,8192,2,4,"{""family"": ""layernorm"", ""group_count"": null, ""k"": null, ""m"": 4096, ""n"": 1536}","{""block_size"": 8192, ""num_stages"": 4, ""num_warps"": 2}",0.017152000218629837,1467.2238618948863,4.0656404813471365,0.0703125
A,layernorm,layernorm_m4096_n1536,4096,1536,40,8192,4,1,"{""family"": ""layernorm"", ""group_count"": null, ""k"": null, ""m"": 4096, ""n"": 1536}","{""block_size"": 8192, ""num_stages"": 1, ""num_warps"": 4}",0.016992000862956047,1481.0394728064991,4.075012583136591,0.0703125
A,layernorm,layernorm_m4096_n1536,4096,1536,41,8192,4,2,"{""family"": ""layernorm"", ""group_count"": null, ""k"": null, ""m"": 4096, ""n"": 1536}","{""block_size"": 8192, ""num_stages"": 2, ""num_warps"": 4}",0.017023999243974686,1478.2557047461662,4.073131210232286,0.0703125
A,layernorm,layernorm_m4096_n1536,4096,1536,42,8192,4,3,"{""family"": ""layernorm"", ""group_count"": null, ""k"": null, ""m"": 4096, ""n"": 1536}","{""block_size"": 8192, ""num_stages"": 3, ""num_warps"": 4}",0.016992000862956047,1481.0394728064991,4.075012583136591,0.0703125
A,layernorm,layernorm_m4096_n1536,4096,1536,43,8192,4,4,"{""family"": ""layernorm"", ""group_count"": null, ""k"": null, ""m"": 4096, ""n"": 1536}","{""block_size"": 8192, ""num_stages"": 4, ""num_warps"": 4}",0.016992000862956047,1481.0394728064991,4.075012583136591,0.0703125
A,layernorm,layernorm_m4096_n1536,4096,1536,44,8192,8,1,"{""family"": ""layernorm"", ""group_count"": null, ""k"": null, ""m"": 4096, ""n"": 1536}","{""block_size"": 8192, ""num_stages"": 1, ""num_warps"": 8}",0.016992000862956047,1481.0394728064991,4.075012583136591,0.0703125
A,layernorm,layernorm_m4096_n1536,4096,1536,45,8192,8,2,"{""family"": ""layernorm"", ""group_count"": null, ""k"": null, ""m"": 4096, ""n"": 1536}","{""block_size"": 8192, ""num_stages"": 2, ""num_warps"": 8}",0.016992000862956047,1481.0394728064991,4.075012583136591,0.0703125
A,layernorm,layernorm_m4096_n1536,4096,1536,46,8192,8,3,"{""family"": ""layernorm"", ""group_count"": null, ""k"": null, ""m"": 4096, ""n"": 1536}","{""block_size"": 8192, ""num_stages"": 3, ""num_warps"": 8}",0.016992000862956047,1481.0394728064991,4.075012583136591,0.0703125
A,layernorm,layernorm_m4096_n1536,4096,1536,47,8192,8,4,"{""family"": ""layernorm"", ""group_count"": null, ""k"": null, ""m"": 4096, ""n"": 1536}","{""block_size"": 8192, ""num_stages"": 4, ""num_warps"": 8}",0.016992000862956047,1481.0394728064991,4.075012583136591,0.0703125
A,layernorm,layernorm_m4096_n2048,4096,2048,0,2048,1,1,"{""family"": ""layernorm"", ""group_count"": null, ""k"": null, ""m"": 4096, ""n"": 2048}","{""block_size"": 2048, ""num_stages"": 1, ""num_warps"": 1}",0.012959999963641167,2589.076550473442,4.345887590863474,0.001953125
A,layernorm,layernorm_m4096_n2048,4096,2048,1,2048,1,2,"{""family"": ""layernorm"", ""group_count"": null, ""k"": null, ""m"": 4096, ""n"": 2048}","{""block_size"": 2048, ""num_stages"": 2, ""num_warps"": 1}",0.012959999963641167,2589.076550473442,4.345887590863474,0.001953125
A,layernorm,layernorm_m4096_n2048,4096,2048,2,2048,1,3,"{""family"": ""layernorm"", ""group_count"": null, ""k"": null, ""m"": 4096, ""n"": 2048}","{""block_size"": 2048, ""num_stages"": 3, ""num_warps"": 1}",0.012959999963641167,2589.076550473442,4.345887590863474,0.001953125
A,layernorm,layernorm_m4096_n2048,4096,2048,3,2048,1,4,"{""family"": ""layernorm"", ""group_count"": null, ""k"": null, ""m"": 4096, ""n"": 2048}","{""block_size"": 2048, ""num_stages"": 4, ""num_warps"": 1}",0.012959999963641167,2589.076550473442,4.345887590863474,0.001953125
A,layernorm,layernorm_m4096_n2048,4096,2048,4,2048,2,1,"{""family"": ""layernorm"", ""group_count"": null, ""k"": null, ""m"": 4096, ""n"": 2048}","{""block_size"": 2048, ""num_stages"": 1, ""num_warps"": 2}",0.013120000250637531,2557.5023901672193,4.333617476362724,0.001953125
A,layernorm,layernorm_m4096_n2048,4096,2048,5,2048,2,2,"{""family"": ""layernorm"", ""group_count"": null, ""k"": null, ""m"": 4096, ""n"": 2048}","{""block_size"": 2048, ""num_stages"": 2, ""num_warps"": 2}",0.013120000250637531,2557.5023901672193,4.333617476362724,0.001953125
A,layernorm,layernorm_m4096_n2048,4096,2048,6,2048,2,3,"{""family"": ""layernorm"", ""group_count"": null, ""k"": null, ""m"": 4096, ""n"": 2048}","{""block_size"": 2048, ""num_stages"": 3, ""num_warps"": 2}",0.013088000006973743,2563.7554998564356,4.336059498588911,0.001953125
A,layernorm,layernorm_m4096_n2048,4096,2048,7,2048,2,4,"{""family"": ""layernorm"", ""group_count"": null, ""k"": null, ""m"": 4096, ""n"": 2048}","{""block_size"": 2048, ""num_stages"": 4, ""num_warps"": 2}",0.013088000006973743,2563.7554998564356,4.336059498588911,0.001953125
A,layernorm,layernorm_m4096_n2048,4096,2048,8,2048,4,1,"{""family"": ""layernorm"", ""group_count"": null, ""k"": null, ""m"": 4096, ""n"": 2048}","{""block_size"": 2048, ""num_stages"": 1, ""num_warps"": 4}",0.013120000250637531,2557.5023901672193,4.333617476362724,0.001953125
A,layernorm,layernorm_m4096_n2048,4096,2048,9,2048,4,2,"{""family"": ""layernorm"", ""group_count"": null, ""k"": null, ""m"": 4096, ""n"": 2048}","{""block_size"": 2048, ""num_stages"": 2, ""num_warps"": 4}",0.013088000006973743,2563.7554998564356,4.336059498588911,0.001953125
A,layernorm,layernorm_m4096_n2048,4096,2048,10,2048,4,3,"{""family"": ""layernorm"", ""group_count"": null, ""k"": null, ""m"": 4096, ""n"": 2048}","{""block_size"": 2048, ""num_stages"": 3, ""num_warps"": 4}",0.013088000006973743,2563.7554998564356,4.336059498588911,0.001953125
A,layernorm,layernorm_m4096_n2048,4096,2048,11,2048,4,4,"{""family"": ""layernorm"", ""group_count"": null, ""k"": null, ""m"": 4096, ""n"": 2048}","{""block_size"": 2048, ""num_stages"": 4, ""num_warps"": 4}",0.013088000006973743,2563.7554998564356,4.336059498588911,0.001953125
A,layernorm,layernorm_m4096_n2048,4096,2048,12,2048,8,1,"{""family"": ""layernorm"", ""group_count"": null, ""k"": null, ""m"": 4096, ""n"": 2048}","{""block_size"": 2048, ""num_stages"": 1, ""num_warps"": 8}",0.013791999779641628,2432.8909901470342,4.28366658103806,0.001953125
A,layernorm,layernorm_m4096_n2048,4096,2048,13,2048,8,2,"{""family"": ""layernorm"", ""group_count"": null, ""k"": null, ""m"": 4096, ""n"": 2048}","{""block_size"": 2048, ""num_stages"": 2, ""num_warps"": 8}",0.013791999779641628,2432.8909901470342,4.28366658103806,0.001953125
A,layernorm,layernorm_m4096_n2048,4096,2048,14,2048,8,3,"{""family"": ""layernorm"", ""group_count"": null, ""k"": null, ""m"": 4096, ""n"": 2048}","{""block_size"": 2048, ""num_stages"": 3, ""num_warps"": 8}",0.013791999779641628,2432.8909901470342,4.28366658103806,0.001953125
A,layernorm,layernorm_m4096_n2048,4096,2048,15,2048,8,4,"{""family"": ""layernorm"", ""group_count"": null, ""k"": null, ""m"": 4096, ""n"": 2048}","{""block_size"": 2048, ""num_stages"": 4, ""num_warps"": 8}",0.013791999779641628,2432.8909901470342,4.28366658103806,0.001953125
A,layernorm,layernorm_m4096_n2048,4096,2048,16,4096,1,1,"{""family"": ""layernorm"", ""group_count"": null, ""k"": null, ""m"": 4096, ""n"": 2048}","{""block_size"": 4096, ""num_stages"": 1, ""num_warps"": 1}",0.013663999736309052,2455.681546219335,4.292990661234148,0.009765625
A,layernorm,layernorm_m4096_n2048,4096,2048,17,4096,1,2,"{""family"": ""layernorm"", ""group_count"": null, ""k"": null, ""m"": 4096, ""n"": 2048}","{""block_size"": 4096, ""num_stages"": 2, ""num_warps"": 1}",0.01369599997997284,2449.9439288161084,4.290651461045014,0.009765625
A,layernorm,layernorm_m4096_n2048,4096,2048,18,4096,1,3,"{""family"": ""layernorm"", ""group_count"": null, ""k"": null, ""m"": 4096, ""n"": 2048}","{""block_size"": 4096, ""num_stages"": 3, ""num_warps"": 1}",0.013663999736309052,2455.681546219335,4.292990661234148,0.009765625
A,layernorm,layernorm_m4096_n2048,4096,2048,19,4096,1,4,"{""family"": ""layernorm"", ""group_count"": null, ""k"": null, ""m"": 4096, ""n"": 2048}","{""block_size"": 4096, ""num_stages"": 4, ""num_warps"": 1}",0.013663999736309052,2455.681546219335,4.292990661234148,0.009765625
A,layernorm,layernorm_m4096_n2048,4096,2048,20,4096,2,1,"{""family"": ""layernorm"", ""group_count"": null, ""k"": null, ""m"": 4096, ""n"": 2048}","{""block_size"": 4096, ""num_stages"": 1, ""num_warps"": 2}",0.013472000136971474,2490.679309593823,4.307141811315044,0.009765625
A,layernorm,layernorm_m4096_n2048,4096,2048,21,4096,2,2,"{""family"": ""layernorm"", ""group_count"": null, ""k"": null, ""m"": 4096, ""n"": 2048}","{""block_size"": 4096, ""num_stages"": 2, ""num_warps"": 2}",0.013472000136971474,2490.679309593823,4.307141811315044,0.009765625
A,layernorm,layernorm_m4096_n2048,4096,2048,22,4096,2,3,"{""family"": ""layernorm"", ""group_count"": null, ""k"": null, ""m"": 4096, ""n"": 2048}","{""block_size"": 4096, ""num_stages"": 3, ""num_warps"": 2}",0.013472000136971474,2490.679309593823,4.307141811315044,0.009765625
A,layernorm,layernorm_m4096_n2048,4096,2048,23,4096,2,4,"{""family"": ""layernorm"", ""group_count"": null, ""k"": null, ""m"": 4096, ""n"": 2048}","{""block_size"": 4096, ""num_stages"": 4, ""num_warps"": 2}",0.013472000136971474,2490.679309593823,4.307141811315044,0.009765625
A,layernorm,layernorm_m4096_n2048,4096,2048,24,4096,4,1,"{""family"": ""layernorm"", ""group_count"": null, ""k"": null, ""m"": 4096, ""n"": 2048}","{""block_size"": 4096, ""num_stages"": 1, ""num_warps"": 4}",0.013663999736309052,2455.681546219335,4.292990661234148,0.009765625
A,layernorm,layernorm_m4096_n2048,4096,2048,25,4096,4,2,"{""family"": ""layernorm"", ""group_count"": null, ""k"": null, ""m"": 4096, ""n"": 2048}","{""block_size"": 4096, ""num_stages"": 2, ""num_warps"": 4}",0.013663999736309052,2455.681546219335,4.292990661234148,0.009765625
A,layernorm,layernorm_m4096_n2048,4096,2048,26,4096,4,3,"{""family"": ""layernorm"", ""group_count"": null, ""k"": null, ""m"": 4096, ""n"": 2048}","{""block_size"": 4096, ""num_stages"": 3, ""num_warps"": 4}",0.013663999736309052,2455.681546219335,4.292990661234148,0.009765625
A,layernorm,layernorm_m4096_n2048,4096,2048,27,4096,4,4,"{""family"": ""layernorm"", ""group_count"": null, ""k"": null, ""m"": 4096, ""n"": 2048}","{""block_size"": 4096, ""num_stages"": 4, ""num_warps"": 4}",0.013663999736309052,2455.681546219335,4.292990661234148,0.009765625
A,layernorm,layernorm_m4096_n2048,4096,2048,28,4096,8,1,"{""family"": ""layernorm"", ""group_count"": null, ""k"": null, ""m"": 4096, ""n"": 2048}","{""block_size"": 4096, ""num_stages"": 1, ""num_warps"": 8}",0.014112000353634357,2377.723296425407,4.260729754658578,0.009765625
A,layernorm,layernorm_m4096_n2048,4096,2048,29,4096,8,2,"{""family"": ""layernorm"", ""group_count"": null, ""k"": null, ""m"": 4096, ""n"": 2048}","{""block_size"": 4096, ""num_stages"": 2, ""num_warps"": 8}",0.01408000010997057,2383.1272541140725,4.262999920441831,0.009765625
A,layernorm,layernorm_m4096_n2048,4096,2048,30,4096,8,3,"{""family"": ""layernorm"", ""group_count"": null, ""k"": null, ""m"": 4096, ""n"": 2048}","{""block_size"": 4096, ""num_stages"": 3, ""num_warps"": 8}",0.01408000010997057,2383.1272541140725,4.262999920441831,0.009765625
A,layernorm,layernorm_m4096_n2048,4096,2048,31,4096,8,4,"{""family"": ""layernorm"", ""group_count"": null, ""k"": null, ""m"": 4096, ""n"": 2048}","{""block_size"": 4096, ""num_stages"": 4, ""num_warps"": 8}",0.014112000353634357,2377.723296425407,4.260729754658578,0.009765625
A,layernorm,layernorm_m4096_n2048,4096,2048,32,8192,1,1,"{""family"": ""layernorm"", ""group_count"": null, ""k"": null, ""m"": 4096, ""n"": 2048}","{""block_size"": 8192, ""num_stages"": 1, ""num_warps"": 1}",0.024159999564290047,1388.8424091528339,3.7230569239498754,0.03125
A,layernorm,layernorm_m4096_n2048,4096,2048,33,8192,1,2,"{""family"": ""layernorm"", ""group_count"": null, ""k"": null, ""m"": 4096, ""n"": 2048}","{""block_size"": 8192, ""num_stages"": 2, ""num_warps"": 1}",0.024191999807953835,1387.0053020159164,3.7217332869234308,0.03125
A,layernorm,layernorm_m4096_n2048,4096,2048,34,8192,1,3,"{""family"": ""layernorm"", ""group_count"": null, ""k"": null, ""m"": 4096, ""n"": 2048}","{""block_size"": 8192, ""num_stages"": 3, ""num_warps"": 1}",0.024159999564290047,1388.8424091528339,3.7230569239498754,0.03125
A,layernorm,layernorm_m4096_n2048,4096,2048,35,8192,1,4,"{""family"": ""layernorm"", ""group_count"": null, ""k"": null, ""m"": 4096, ""n"": 2048}","{""block_size"": 8192, ""num_stages"": 4, ""num_warps"": 1}",0.024159999564290047,1388.8424091528339,3.7230569239498754,0.03125
A,layernorm,layernorm_m4096_n2048,4096,2048,36,8192,2,1,"{""family"": ""layernorm"", ""group_count"": null, ""k"": null, ""m"": 4096, ""n"": 2048}","{""block_size"": 8192, ""num_stages"": 1, ""num_warps"": 2}",0.018239999189972878,1839.6070992396735,4.004138338745334,0.03125
A,layernorm,layernorm_m4096_n2048,4096,2048,37,8192,2,2,"{""family"": ""layernorm"", ""group_count"": null, ""k"": null, ""m"": 4096, ""n"": 2048}","{""block_size"": 8192, ""num_stages"": 2, ""num_warps"": 2}",0.018271999433636665,1836.3853458877697,4.00238547650478,0.03125
A,layernorm,layernorm_m4096_n2048,4096,2048,38,8192,2,3,"{""family"": ""layernorm"", ""group_count"": null, ""k"": null, ""m"": 4096, ""n"": 2048}","{""block_size"": 8192, ""num_stages"": 3, ""num_warps"": 2}",0.018239999189972878,1839.6070992396735,4.004138338745334,0.03125
A,layernorm,layernorm_m4096_n2048,4096,2048,39,8192,2,4,"{""family"": ""layernorm"", ""group_count"": null, ""k"": null, ""m"": 4096, ""n"": 2048}","{""block_size"": 8192, ""num_stages"": 4, ""num_warps"": 2}",0.018271999433636665,1836.3853458877697,4.00238547650478,0.03125
A,layernorm,layernorm_m4096_n2048,4096,2048,40,8192,4,1,"{""family"": ""layernorm"", ""group_count"": null, ""k"": null, ""m"": 4096, ""n"": 2048}","{""block_size"": 8192, ""num_stages"": 1, ""num_warps"": 4}",0.018464000895619392,1817.2893399263662,3.9919323401501994,0.03125
A,layernorm,layernorm_m4096_n2048,4096,2048,41,8192,4,2,"{""family"": ""layernorm"", ""group_count"": null, ""k"": null, ""m"": 4096, ""n"": 2048}","{""block_size"": 8192, ""num_stages"": 2, ""num_warps"": 4}",0.018464000895619392,1817.2893399263662,3.9919323401501994,0.03125
A,layernorm,layernorm_m4096_n2048,4096,2048,42,8192,4,3,"{""family"": ""layernorm"", ""group_count"": null, ""k"": null, ""m"": 4096, ""n"": 2048}","{""block_size"": 8192, ""num_stages"": 3, ""num_warps"": 4}",0.018432000651955605,1820.4443800537697,3.993666959097802,0.03125
A,layernorm,layernorm_m4096_n2048,4096,2048,43,8192,4,4,"{""family"": ""layernorm"", ""group_count"": null, ""k"": null, ""m"": 4096, ""n"": 2048}","{""block_size"": 8192, ""num_stages"": 4, ""num_warps"": 4}",0.018464000895619392,1817.2893399263662,3.9919323401501994,0.03125
A,layernorm,layernorm_m4096_n2048,4096,2048,44,8192,8,1,"{""family"": ""layernorm"", ""group_count"": null, ""k"": null, ""m"": 4096, ""n"": 2048}","{""block_size"": 8192, ""num_stages"": 1, ""num_warps"": 8}",0.017983999103307724,1865.7936873355645,4.018272855131416,0.03125
A,layernorm,layernorm_m4096_n2048,4096,2048,45,8192,8,2,"{""family"": ""layernorm"", ""group_count"": null, ""k"": null, ""m"": 4096, ""n"": 2048}","{""block_size"": 8192, ""num_stages"": 2, ""num_warps"": 8}",0.018015999346971512,1862.4796412218177,4.016495063271998,0.03125
A,layernorm,layernorm_m4096_n2048,4096,2048,46,8192,8,3,"{""family"": ""layernorm"", ""group_count"": null, ""k"": null, ""m"": 4096, ""n"": 2048}","{""block_size"": 8192, ""num_stages"": 3, ""num_warps"": 8}",0.017983999103307724,1865.7936873355645,4.018272855131416,0.03125
A,layernorm,layernorm_m4096_n2048,4096,2048,47,8192,8,4,"{""family"": ""layernorm"", ""group_count"": null, ""k"": null, ""m"": 4096, ""n"": 2048}","{""block_size"": 8192, ""num_stages"": 4, ""num_warps"": 8}",0.018015999346971512,1862.4796412218177,4.016495063271998,0.03125
A,layernorm,layernorm_m4096_n3072,4096,3072,0,4096,1,1,"{""family"": ""layernorm"", ""group_count"": null, ""k"": null, ""m"": 4096, ""n"": 3072}","{""block_size"": 4096, ""num_stages"": 1, ""num_warps"": 1}",0.018592000007629395,2707.1669524174886,3.9850238979022774,0.00390625
A,layernorm,layernorm_m4096_n3072,4096,3072,1,4096,1,2,"{""family"": ""layernorm"", ""group_count"": null, ""k"": null, ""m"": 4096, ""n"": 3072}","{""block_size"": 4096, ""num_stages"": 2, ""num_warps"": 1}",0.018592000007629395,2707.1669524174886,3.9850238979022774,0.00390625
A,layernorm,layernorm_m4096_n3072,4096,3072,2,4096,1,3,"{""family"": ""layernorm"", ""group_count"": null, ""k"": null, ""m"": 4096, ""n"": 3072}","{""block_size"": 4096, ""num_stages"": 3, ""num_warps"": 1}",0.018592000007629395,2707.1669524174886,3.9850238979022774,0.00390625
A,layernorm,layernorm_m4096_n3072,4096,3072,3,4096,1,4,"{""family"": ""layernorm"", ""group_count"": null, ""k"": null, ""m"": 4096, ""n"": 3072}","{""block_size"": 4096, ""num_stages"": 4, ""num_warps"": 1}",0.018592000007629395,2707.1669524174886,3.9850238979022774,0.00390625
A,layernorm,layernorm_m4096_n3072,4096,3072,4,4096,2,1,"{""family"": ""layernorm"", ""group_count"": null, ""k"": null, ""m"": 4096, ""n"": 3072}","{""block_size"": 4096, ""num_stages"": 1, ""num_warps"": 2}",0.017311999574303627,2907.3272433941006,4.056355400907736,0.00390625
A,layernorm,layernorm_m4096_n3072,4096,3072,5,4096,2,2,"{""family"": ""layernorm"", ""group_count"": null, ""k"": null, ""m"": 4096, ""n"": 3072}","{""block_size"": 4096, ""num_stages"": 2, ""num_warps"": 2}",0.017343999817967415,2901.9631300883216,4.0545086642203225,0.00390625
A,layernorm,layernorm_m4096_n3072,4096,3072,6,4096,2,3,"{""family"": ""layernorm"", ""group_count"": null, ""k"": null, ""m"": 4096, ""n"": 3072}","{""block_size"": 4096, ""num_stages"": 3, ""num_warps"": 2}",0.017311999574303627,2907.3272433941006,4.056355400907736,0.00390625
A,layernorm,layernorm_m4096_n3072,4096,3072,7,4096,2,4,"{""family"": ""layernorm"", ""group_count"": null, ""k"": null, ""m"": 4096, ""n"": 3072}","{""block_size"": 4096, ""num_stages"": 4, ""num_warps"": 2}",0.017311999574303627,2907.3272433941006,4.056355400907736,0.00390625
A,layernorm,layernorm_m4096_n3072,4096,3072,8,4096,4,1,"{""family"": ""layernorm"", ""group_count"": null, ""k"": null, ""m"": 4096, ""n"": 3072}","{""block_size"": 4096, ""num_stages"": 1, ""num_warps"": 4}",0.017055999487638474,2950.964441367298,4.071253261038661,0.00390625
A,layernorm,layernorm_m4096_n3072,4096,3072,9,4096,4,2,"{""family"": ""layernorm"", ""group_count"": null, ""k"": null, ""m"": 4096, ""n"": 3072}","{""block_size"": 4096, ""num_stages"": 2, ""num_warps"": 4}",0.01708799973130226,2945.4382485623014,4.069378831928706,0.00390625
A,layernorm,layernorm_m4096_n3072,4096,3072,10,4096,4,3,"{""family"": ""layernorm"", ""group_count"": null, ""k"": null, ""m"": 4096, ""n"": 3072}","{""block_size"": 4096, ""num_stages"": 3, ""num_warps"": 4}",0.01708799973130226,2945.4382485623014,4.069378831928706,0.00390625
A,layernorm,layernorm_m4096_n3072,4096,3072,11,4096,4,4,"{""family"": ""layernorm"", ""group_count"": null, ""k"": null, ""m"": 4096, ""n"": 3072}","{""block_size"": 4096, ""num_stages"": 4, ""num_warps"": 4}",0.01708799973130226,2945.4382485623014,4.069378831928706,0.00390625
A,layernorm,layernorm_m4096_n3072,4096,3072,12,4096,8,1,"{""family"": ""layernorm"", ""group_count"": null, ""k"": null, ""m"": 4096, ""n"": 3072}","{""block_size"": 4096, ""num_stages"": 1, ""num_warps"": 8}",0.016992000862956047,2962.0789456129983,4.075012583136591,0.00390625
A,layernorm,layernorm_m4096_n3072,4096,3072,13,4096,8,2,"{""family"": ""layernorm"", ""group_count"": null, ""k"": null, ""m"": 4096, ""n"": 3072}","{""block_size"": 4096, ""num_stages"": 2, ""num_warps"": 8}",0.016992000862956047,2962.0789456129983,4.075012583136591,0.00390625
A,layernorm,layernorm_m4096_n3072,4096,3072,14,4096,8,3,"{""family"": ""layernorm"", ""group_count"": null, ""k"": null, ""m"": 4096, ""n"": 3072}","{""block_size"": 4096, ""num_stages"": 3, ""num_warps"": 8}",0.016992000862956047,2962.0789456129983,4.075012583136591,0.00390625
A,layernorm,layernorm_m4096_n3072,4096,3072,15,4096,8,4,"{""family"": ""layernorm"", ""group_count"": null, ""k"": null, ""m"": 4096, ""n"": 3072}","{""block_size"": 4096, ""num_stages"": 4, ""num_warps"": 8}",0.016992000862956047,2962.0789456129983,4.075012583136591,0.00390625
A,layernorm,layernorm_m4096_n3072,4096,3072,16,8192,1,1,"{""family"": ""layernorm"", ""group_count"": null, ""k"": null, ""m"": 4096, ""n"": 3072}","{""block_size"": 8192, ""num_stages"": 1, ""num_warps"": 1}",0.02993600070476532,1681.3083516525983,3.5086934859080023,0.013671875
A,layernorm,layernorm_m4096_n3072,4096,3072,17,8192,1,2,"{""family"": ""layernorm"", ""group_count"": null, ""k"": null, ""m"": 4096, ""n"": 3072}","{""block_size"": 8192, ""num_stages"": 2, ""num_warps"": 1}",0.029952000826597214,1680.4102100353098,3.5081591510895596,0.013671875
A,layernorm,layernorm_m4096_n3072,4096,3072,18,8192,1,3,"{""family"": ""layernorm"", ""group_count"": null, ""k"": null, ""m"": 4096, ""n"": 3072}","{""block_size"": 8192, ""num_stages"": 3, ""num_warps"": 1}",0.029952000826597214,1680.4102100353098,3.5081591510895596,0.013671875
A,layernorm,layernorm_m4096_n3072,4096,3072,19,8192,1,4,"{""family"": ""layernorm"", ""group_count"": null, ""k"": null, ""m"": 4096, ""n"": 3072}","{""block_size"": 8192, ""num_stages"": 4, ""num_warps"": 1}",0.029952000826597214,1680.4102100353098,3.5081591510895596,0.013671875
A,layernorm,layernorm_m4096_n3072,4096,3072,20,8192,2,1,"{""family"": ""layernorm"", ""group_count"": null, ""k"": null, ""m"": 4096, ""n"": 3072}","{""block_size"": 8192, ""num_stages"": 1, ""num_warps"": 2}",0.02067199908196926,2434.7741019348623,3.8789751957913285,0.013671875
A,layernorm,layernorm_m4096_n3072,4096,3072,21,8192,2,2,"{""family"": ""layernorm"", ""group_count"": null, ""k"": null, ""m"": 4096, ""n"": 3072}","{""block_size"": 8192, ""num_stages"": 2, ""num_warps"": 2}",0.02067199908196926,2434.7741019348623,3.8789751957913285,0.013671875
A,layernorm,layernorm_m4096_n3072,4096,3072,22,8192,2,3,"{""family"": ""layernorm"", ""group_count"": null, ""k"": null, ""m"": 4096, ""n"": 3072}","{""block_size"": 8192, ""num_stages"": 3, ""num_warps"": 2}",0.020640000700950623,2438.54875439427,3.88052430440799,0.013671875
A,layernorm,layernorm_m4096_n3072,4096,3072,23,8192,2,4,"{""family"": ""layernorm"", ""group_count"": null, ""k"": null, ""m"": 4096, ""n"": 3072}","{""block_size"": 8192, ""num_stages"": 4, ""num_warps"": 2}",0.02067199908196926,2434.7741019348623,3.8789751957913285,0.013671875
A,layernorm,layernorm_m4096_n3072,4096,3072,24,8192,4,1,"{""family"": ""layernorm"", ""group_count"": null, ""k"": null, ""m"": 4096, ""n"": 3072}","{""block_size"": 8192, ""num_stages"": 1, ""num_warps"": 4}",0.020576000213623047,2446.1337226598685,3.8836299205447817,0.013671875
A,layernorm,layernorm_m4096_n3072,4096,3072,25,8192,4,2,"{""family"": ""layernorm"", ""group_count"": null, ""k"": null, ""m"": 4096, ""n"": 3072}","{""block_size"": 8192, ""num_stages"": 2, ""num_warps"": 4}",0.020608000457286835,2442.3353495318424,3.8820759068704214,0.013671875
A,layernorm,layernorm_m4096_n3072,4096,3072,26,8192,4,3,"{""family"": ""layernorm"", ""group_count"": null, ""k"": null, ""m"": 4096, ""n"": 3072}","{""block_size"": 8192, ""num_stages"": 3, ""num_warps"": 4}",0.020576000213623047,2446.1337226598685,3.8836299205447817,0.013671875
A,layernorm,layernorm_m4096_n3072,4096,3072,27,8192,4,4,"{""family"": ""layernorm"", ""group_count"": null, ""k"": null, ""m"": 4096, ""n"": 3072}","{""block_size"": 8192, ""num_stages"": 4, ""num_warps"": 4}",0.020608000457286835,2442.3353495318424,3.8820759068704214,0.013671875
A,layernorm,layernorm_m4096_n3072,4096,3072,28,8192,8,1,"{""family"": ""layernorm"", ""group_count"": null, ""k"": null, ""m"": 4096, ""n"": 3072}","{""block_size"": 8192, ""num_stages"": 1, ""num_warps"": 8}",0.020447999238967896,2461.4461009995844,3.8898702380049373,0.013671875
A,layernorm,layernorm_m4096_n3072,4096,3072,29,8192,8,2,"{""family"": ""layernorm"", ""group_count"": null, ""k"": null, ""m"": 4096, ""n"": 3072}","{""block_size"": 8192, ""num_stages"": 2, ""num_warps"": 8}",0.020447999238967896,2461.4461009995844,3.8898702380049373,0.013671875
A,layernorm,layernorm_m4096_n3072,4096,3072,30,8192,8,3,"{""family"": ""layernorm"", ""group_count"": null, ""k"": null, ""m"": 4096, ""n"": 3072}","{""block_size"": 8192, ""num_stages"": 3, ""num_warps"": 8}",0.020447999238967896,2461.4461009995844,3.8898702380049373,0.013671875
A,layernorm,layernorm_m4096_n3072,4096,3072,31,8192,8,4,"{""family"": ""layernorm"", ""group_count"": null, ""k"": null, ""m"": 4096, ""n"": 3072}","{""block_size"": 8192, ""num_stages"": 4, ""num_warps"": 8}",0.02046399936079979,2459.5215779968094,3.889088065381001,0.013671875
A,layernorm,layernorm_m4096_n4096,4096,4096,0,4096,1,1,"{""family"": ""layernorm"", ""group_count"": null, ""k"": null, ""m"": 4096, ""n"": 4096}","{""block_size"": 4096, ""num_stages"": 1, ""num_warps"": 1}",0.02163200080394745,3102.2957426921807,3.8335815419568537,0.001953125
A,layernorm,layernorm_m4096_n4096,4096,4096,1,4096,1,2,"{""family"": ""layernorm"", ""group_count"": null, ""k"": null, ""m"": 4096, ""n"": 4096}","{""block_size"": 4096, ""num_stages"": 2, ""num_warps"": 1}",0.02163200080394745,3102.2957426921807,3.8335815419568537,0.001953125
A,layernorm,layernorm_m4096_n4096,4096,4096,2,4096,1,3,"{""family"": ""layernorm"", ""group_count"": null, ""k"": null, ""m"": 4096, ""n"": 4096}","{""block_size"": 4096, ""num_stages"": 3, ""num_warps"": 1}",0.02160000056028366,3106.891771262005,3.83506193835296,0.001953125
A,layernorm,layernorm_m4096_n4096,4096,4096,3,4096,1,4,"{""family"": ""layernorm"", ""group_count"": null, ""k"": null, ""m"": 4096, ""n"": 4096}","{""block_size"": 4096, ""num_stages"": 4, ""num_warps"": 1}",0.02163200080394745,3102.2957426921807,3.8335815419568537,0.001953125
A,layernorm,layernorm_m4096_n4096,4096,4096,4,4096,2,1,"{""family"": ""layernorm"", ""group_count"": null, ""k"": null, ""m"": 4096, ""n"": 4096}","{""block_size"": 4096, ""num_stages"": 1, ""num_warps"": 2}",0.020927999168634415,3206.6545616352373,3.866667343432387,0.001953125
A,layernorm,layernorm_m4096_n4096,4096,4096,5,4096,2,2,"{""family"": ""layernorm"", ""group_count"": null, ""k"": null, ""m"": 4096, ""n"": 4096}","{""block_size"": 4096, ""num_stages"": 2, ""num_warps"": 2}",0.020896000787615776,3211.564963175764,3.8681974881959382,0.001953125
A,layernorm,layernorm_m4096_n4096,4096,4096,6,4096,2,3,"{""family"": ""layernorm"", ""group_count"": null, ""k"": null, ""m"": 4096, ""n"": 4096}","{""block_size"": 4096, ""num_stages"": 3, ""num_warps"": 2}",0.020927999168634415,3206.6545616352373,3.866667343432387,0.001953125
A,layernorm,layernorm_m4096_n4096,4096,4096,7,4096,2,4,"{""family"": ""layernorm"", ""group_count"": null, ""k"": null, ""m"": 4096, ""n"": 4096}","{""block_size"": 4096, ""num_stages"": 4, ""num_warps"": 2}",0.020927999168634415,3206.6545616352373,3.866667343432387,0.001953125
A,layernorm,layernorm_m4096_n4096,4096,4096,8,4096,4,1,"{""family"": ""layernorm"", ""group_count"": null, ""k"": null, ""m"": 4096, ""n"": 4096}","{""block_size"": 4096, ""num_stages"": 1, ""num_warps"": 4}",0.021023999899625778,3192.012191799645,3.8620906414542056,0.001953125
A,layernorm,layernorm_m4096_n4096,4096,4096,9,4096,4,2,"{""family"": ""layernorm"", ""group_count"": null, ""k"": null, ""m"": 4096, ""n"": 4096}","{""block_size"": 4096, ""num_stages"": 2, ""num_warps"": 4}",0.021056000143289566,3187.1610725357655,3.860569717034065,0.001953125
A,layernorm,layernorm_m4096_n4096,4096,4096,10,4096,4,3,"{""family"": ""layernorm"", ""group_count"": null, ""k"": null, ""m"": 4096, ""n"": 4096}","{""block_size"": 4096, ""num_stages"": 3, ""num_warps"": 4}",0.021023999899625778,3192.012191799645,3.8620906414542056,0.001953125
A,layernorm,layernorm_m4096_n4096,4096,4096,11,4096,4,4,"{""family"": ""layernorm"", ""group_count"": null, ""k"": null, ""m"": 4096, ""n"": 4096}","{""block_size"": 4096, ""num_stages"": 4, ""num_warps"": 4}",0.021023999899625778,3192.012191799645,3.8620906414542056,0.001953125
A,layernorm,layernorm_m4096_n4096,4096,4096,12,4096,8,1,"{""family"": ""layernorm"", ""group_count"": null, ""k"": null, ""m"": 4096, ""n"": 4096}","{""block_size"": 4096, ""num_stages"": 1, ""num_warps"": 8}",0.021215999498963356,3163.125263237258,3.852999688594666,0.001953125
A,layernorm,layernorm_m4096_n4096,4096,4096,13,4096,8,2,"{""family"": ""layernorm"", ""group_count"": null, ""k"": null, ""m"": 4096, ""n"": 4096}","{""block_size"": 4096, ""num_stages"": 2, ""num_warps"": 8}",0.021183999255299568,3167.9034346270323,3.85450913438145,0.001953125
A,layernorm,layernorm_m4096_n4096,4096,4096,14,4096,8,3,"{""family"": ""layernorm"", ""group_count"": null, ""k"": null, ""m"": 4096, ""n"": 4096}","{""block_size"": 4096, ""num_stages"": 3, ""num_warps"": 8}",0.021215999498963356,3163.125263237258,3.852999688594666,0.001953125
A,layernorm,layernorm_m4096_n4096,4096,4096,15,4096,8,4,"{""family"": ""layernorm"", ""group_count"": null, ""k"": null, ""m"": 4096, ""n"": 4096}","{""block_size"": 4096, ""num_stages"": 4, ""num_warps"": 8}",0.021183999255299568,3167.9034346270323,3.85450913438145,0.001953125
A,layernorm,layernorm_m4096_n4096,4096,4096,16,8192,1,1,"{""family"": ""layernorm"", ""group_count"": null, ""k"": null, ""m"": 4096, ""n"": 4096}","{""block_size"": 8192, ""num_stages"": 1, ""num_warps"": 1}",0.03244800120592117,2068.1971617947875,3.428116433848689,0.0078125
A,layernorm,layernorm_m4096_n4096,4096,4096,17,8192,1,2,"{""family"": ""layernorm"", ""group_count"": null, ""k"": null, ""m"": 4096, ""n"": 4096}","{""block_size"": 8192, ""num_stages"": 2, ""num_warps"": 1}",0.03248000144958496,2066.159513698468,3.427130719058582,0.0078125
A,layernorm,layernorm_m4096_n4096,4096,4096,18,8192,1,3,"{""family"": ""layernorm"", ""group_count"": null, ""k"": null, ""m"": 4096, ""n"": 4096}","{""block_size"": 8192, ""num_stages"": 3, ""num_warps"": 1}",0.03248000144958496,2066.159513698468,3.427130719058582,0.0078125
A,layernorm,layernorm_m4096_n4096,4096,4096,19,8192,1,4,"{""family"": ""layernorm"", ""group_count"": null, ""k"": null, ""m"": 4096, ""n"": 4096}","{""block_size"": 8192, ""num_stages"": 4, ""num_warps"": 1}",0.03248000144958496,2066.159513698468,3.427130719058582,0.0078125
A,layernorm,layernorm_m4096_n4096,4096,4096,20,8192,2,1,"{""family"": ""layernorm"", ""group_count"": null, ""k"": null, ""m"": 4096, ""n"": 4096}","{""block_size"": 8192, ""num_stages"": 1, ""num_warps"": 2}",0.02287999913096428,2933.0798316849277,3.777492150452871,0.0078125
A,layernorm,layernorm_m4096_n4096,4096,4096,21,8192,2,2,"{""family"": ""layernorm"", ""group_count"": null, ""k"": null, ""m"": 4096, ""n"": 4096}","{""block_size"": 8192, ""num_stages"": 2, ""num_warps"": 2}",0.02287999913096428,2933.0798316849277,3.777492150452871,0.0078125
A,layernorm,layernorm_m4096_n4096,4096,4096,22,8192,2,3,"{""family"": ""layernorm"", ""group_count"": null, ""k"": null, ""m"": 4096, ""n"": 4096}","{""block_size"": 8192, ""num_stages"": 3, ""num_warps"": 2}",0.02287999913096428,2933.0798316849277,3.777492150452871,0.0078125
A,layernorm,layernorm_m4096_n4096,4096,4096,23,8192,2,4,"{""family"": ""layernorm"", ""group_count"": null, ""k"": null, ""m"": 4096, ""n"": 4096}","{""block_size"": 8192, ""num_stages"": 4, ""num_warps"": 2}",0.022911999374628067,2928.9833201686433,3.7760945154984173,0.0078125
A,layernorm,layernorm_m4096_n4096,4096,4096,24,8192,4,1,"{""family"": ""layernorm"", ""group_count"": null, ""k"": null, ""m"": 4096, ""n"": 4096}","{""block_size"": 8192, ""num_stages"": 1, ""num_warps"": 4}",0.02284800074994564,2937.187578661983,3.7788916600017126,0.0078125
A,layernorm,layernorm_m4096_n4096,4096,4096,25,8192,4,2,"{""family"": ""layernorm"", ""group_count"": null, ""k"": null, ""m"": 4096, ""n"": 4096}","{""block_size"": 8192, ""num_stages"": 2, ""num_warps"": 4}",0.02284800074994564,2937.187578661983,3.7788916600017126,0.0078125
A,layernorm,layernorm_m4096_n4096,4096,4096,26,8192,4,3,"{""family"": ""layernorm"", ""group_count"": null, ""k"": null, ""m"": 4096, ""n"": 4096}","{""block_size"": 8192, ""num_stages"": 3, ""num_warps"": 4}",0.02284800074994564,2937.187578661983,3.7788916600017126,0.0078125
A,layernorm,layernorm_m4096_n4096,4096,4096,27,8192,4,4,"{""family"": ""layernorm"", ""group_count"": null, ""k"": null, ""m"": 4096, ""n"": 4096}","{""block_size"": 8192, ""num_stages"": 4, ""num_warps"": 4}",0.02284800074994564,2937.187578661983,3.7788916600017126,0.0078125
A,layernorm,layernorm_m4096_n4096,4096,4096,28,8192,8,1,"{""family"": ""layernorm"", ""group_count"": null, ""k"": null, ""m"": 4096, ""n"": 4096}","{""block_size"": 8192, ""num_stages"": 1, ""num_warps"": 8}",0.02271999977529049,2953.7352404811795,3.78450969501957,0.0078125
A,layernorm,layernorm_m4096_n4096,4096,4096,29,8192,8,2,"{""family"": ""layernorm"", ""group_count"": null, ""k"": null, ""m"": 4096, ""n"": 4096}","{""block_size"": 8192, ""num_stages"": 2, ""num_warps"": 8}",0.02271999977529049,2953.7352404811795,3.78450969501957,0.0078125
A,layernorm,layernorm_m4096_n4096,4096,4096,30,8192,8,3,"{""family"": ""layernorm"", ""group_count"": null, ""k"": null, ""m"": 4096, ""n"": 4096}","{""block_size"": 8192, ""num_stages"": 3, ""num_warps"": 8}",0.02271999977529049,2953.7352404811795,3.78450969501957,0.0078125
A,layernorm,layernorm_m4096_n4096,4096,4096,31,8192,8,4,"{""family"": ""layernorm"", ""group_count"": null, ""k"": null, ""m"": 4096, ""n"": 4096}","{""block_size"": 8192, ""num_stages"": 4, ""num_warps"": 8}",0.02271999977529049,2953.7352404811795,3.78450969501957,0.0078125
A,layernorm,layernorm_m4096_n6144,4096,6144,0,8192,1,1,"{""family"": ""layernorm"", ""group_count"": null, ""k"": null, ""m"": 4096, ""n"": 6144}","{""block_size"": 8192, ""num_stages"": 1, ""num_warps"": 1}",0.040063999593257904,2512.5623258277974,3.2172771136568126,0.00390625
A,layernorm,layernorm_m4096_n6144,4096,6144,1,8192,1,2,"{""family"": ""layernorm"", ""group_count"": null, ""k"": null, ""m"": 4096, ""n"": 6144}","{""block_size"": 8192, ""num_stages"": 2, ""num_warps"": 1}",0.040063999593257904,2512.5623258277974,3.2172771136568126,0.00390625
A,layernorm,layernorm_m4096_n6144,4096,6144,2,8192,1,3,"{""family"": ""layernorm"", ""group_count"": null, ""k"": null, ""m"": 4096, ""n"": 6144}","{""block_size"": 8192, ""num_stages"": 3, ""num_warps"": 1}",0.040063999593257904,2512.5623258277974,3.2172771136568126,0.00390625
A,layernorm,layernorm_m4096_n6144,4096,6144,3,8192,1,4,"{""family"": ""layernorm"", ""group_count"": null, ""k"": null, ""m"": 4096, ""n"": 6144}","{""block_size"": 8192, ""num_stages"": 4, ""num_warps"": 1}",0.04009599983692169,2510.557073259612,3.2164787043356755,0.00390625
A,layernorm,layernorm_m4096_n6144,4096,6144,4,8192,2,1,"{""family"": ""layernorm"", ""group_count"": null, ""k"": null, ""m"": 4096, ""n"": 6144}","{""block_size"": 8192, ""num_stages"": 1, ""num_warps"": 2}",0.0318400003015995,3161.5356484447993,3.4470319085336087,0.00390625
A,layernorm,layernorm_m4096_n6144,4096,6144,5,8192,2,2,"{""family"": ""layernorm"", ""group_count"": null, ""k"": null, ""m"": 4096, ""n"": 6144}","{""block_size"": 8192, ""num_stages"": 2, ""num_warps"": 2}",0.0318400003015995,3161.5356484447993,3.4470319085336087,0.00390625
A,layernorm,layernorm_m4096_n6144,4096,6144,6,8192,2,3,"{""family"": ""layernorm"", ""group_count"": null, ""k"": null, ""m"": 4096, ""n"": 6144}","{""block_size"": 8192, ""num_stages"": 3, ""num_warps"": 2}",0.0318400003015995,3161.5356484447993,3.4470319085336087,0.00390625
A,layernorm,layernorm_m4096_n6144,4096,6144,7,8192,2,4,"{""family"": ""layernorm"", ""group_count"": null, ""k"": null, ""m"": 4096, ""n"": 6144}","{""block_size"": 8192, ""num_stages"": 4, ""num_warps"": 2}",0.03187200054526329,3158.3613917501716,3.44602738047204,0.00390625
A,layernorm,layernorm_m4096_n6144,4096,6144,8,8192,4,1,"{""family"": ""layernorm"", ""group_count"": null, ""k"": null, ""m"": 4096, ""n"": 6144}","{""block_size"": 8192, ""num_stages"": 1, ""num_warps"": 4}",0.029759999364614487,3382.503298023978,3.514590090367566,0.00390625
A,layernorm,layernorm_m4096_n6144,4096,6144,9,8192,4,2,"{""family"": ""layernorm"", ""group_count"": null, ""k"": null, ""m"": 4096, ""n"": 6144}","{""block_size"": 8192, ""num_stages"": 2, ""num_warps"": 4}",0.029791999608278275,3378.8700766506718,3.5135153910360346,0.00390625
A,layernorm,layernorm_m4096_n6144,4096,6144,10,8192,4,3,"{""family"": ""layernorm"", ""group_count"": null, ""k"": null, ""m"": 4096, ""n"": 6144}","{""block_size"": 8192, ""num_stages"": 3, ""num_warps"": 4}",0.029759999364614487,3382.503298023978,3.514590090367566,0.00390625
A,layernorm,layernorm_m4096_n6144,4096,6144,11,8192,4,4,"{""family"": ""layernorm"", ""group_count"": null, ""k"": null, ""m"": 4096, ""n"": 6144}","{""block_size"": 8192, ""num_stages"": 4, ""num_warps"": 4}",0.029791999608278275,3378.8700766506718,3.5135153910360346,0.00390625
A,layernorm,layernorm_m4096_n6144,4096,6144,12,8192,8,1,"{""family"": ""layernorm"", ""group_count"": null, ""k"": null, ""m"": 4096, ""n"": 6144}","{""block_size"": 8192, ""num_stages"": 1, ""num_warps"": 8}",0.029184000566601753,3449.2630909279565,3.5341346456754086,0.00390625
A,layernorm,layernorm_m4096_n6144,4096,6144,13,8192,8,2,"{""family"": ""layernorm"", ""group_count"": null, ""k"": null, ""m"": 4096, ""n"": 6144}","{""block_size"": 8192, ""num_stages"": 2, ""num_warps"": 8}",0.029184000566601753,3449.2630909279565,3.5341346456754086,0.00390625
A,layernorm,layernorm_m4096_n6144,4096,6144,14,8192,8,3,"{""family"": ""layernorm"", ""group_count"": null, ""k"": null, ""m"": 4096, ""n"": 6144}","{""block_size"": 8192, ""num_stages"": 3, ""num_warps"": 8}",0.029184000566601753,3449.2630909279565,3.5341346456754086,0.00390625
A,layernorm,layernorm_m4096_n6144,4096,6144,15,8192,8,4,"{""family"": ""layernorm"", ""group_count"": null, ""k"": null, ""m"": 4096, ""n"": 6144}","{""block_size"": 8192, ""num_stages"": 4, ""num_warps"": 8}",0.029184000566601753,3449.2630909279565,3.5341346456754086,0.00390625
A,layernorm,layernorm_m4096_n8192,4096,8192,0,8192,1,1,"{""family"": ""layernorm"", ""group_count"": null, ""k"": null, ""m"": 4096, ""n"": 8192}","{""block_size"": 8192, ""num_stages"": 1, ""num_warps"": 1}",0.04896000027656555,2741.3751479131956,3.01675163512926,0.001953125
A,layernorm,layernorm_m4096_n8192,4096,8192,1,8192,1,2,"{""family"": ""layernorm"", ""group_count"": null, ""k"": null, ""m"": 4096, ""n"": 8192}","{""block_size"": 8192, ""num_stages"": 2, ""num_warps"": 1}",0.04896000027656555,2741.3751479131956,3.01675163512926,0.001953125
A,layernorm,layernorm_m4096_n8192,4096,8192,2,8192,1,3,"{""family"": ""layernorm"", ""group_count"": null, ""k"": null, ""m"": 4096, ""n"": 8192}","{""block_size"": 8192, ""num_stages"": 3, ""num_warps"": 1}",0.04896000027656555,2741.3751479131956,3.01675163512926,0.001953125
A,layernorm,layernorm_m4096_n8192,4096,8192,3,8192,1,4,"{""family"": ""layernorm"", ""group_count"": null, ""k"": null, ""m"": 4096, ""n"": 8192}","{""block_size"": 8192, ""num_stages"": 4, ""num_warps"": 1}",0.04902400076389313,2737.7963019871127,3.0154452892819874,0.001953125
A,layernorm,layernorm_m4096_n8192,4096,8192,4,8192,2,1,"{""family"": ""layernorm"", ""group_count"": null, ""k"": null, ""m"": 4096, ""n"": 8192}","{""block_size"": 8192, ""num_stages"": 1, ""num_warps"": 2}",0.037856001406908035,3545.4808487910636,3.273965754021431,0.001953125
A,layernorm,layernorm_m4096_n8192,4096,8192,5,8192,2,2,"{""family"": ""layernorm"", ""group_count"": null, ""k"": null, ""m"": 4096, ""n"": 8192}","{""block_size"": 8192, ""num_stages"": 2, ""num_warps"": 2}",0.03920000046491623,3423.921592044982,3.2390785203256125,0.001953125
A,layernorm,layernorm_m4096_n8192,4096,8192,6,8192,2,3,"{""family"": ""layernorm"", ""group_count"": null, ""k"": null, ""m"": 4096, ""n"": 8192}","{""block_size"": 8192, ""num_stages"": 3, ""num_warps"": 2}",0.03787200152873993,3543.9829579153925,3.273543185844542,0.001953125
A,layernorm,layernorm_m4096_n8192,4096,8192,7,8192,2,4,"{""family"": ""layernorm"", ""group_count"": null, ""k"": null, ""m"": 4096, ""n"": 8192}","{""block_size"": 8192, ""num_stages"": 4, ""num_warps"": 2}",0.03788800165057182,3542.4863321598364,3.273120796156096,0.001953125
A,layernorm,layernorm_m4096_n8192,4096,8192,8,8192,4,1,"{""family"": ""layernorm"", ""group_count"": null, ""k"": null, ""m"": 4096, ""n"": 8192}","{""block_size"": 8192, ""num_stages"": 1, ""num_warps"": 4}",0.03766399994492531,3563.554805550704,3.2790505493665343,0.001953125
A,layernorm,layernorm_m4096_n8192,4096,8192,9,8192,4,2,"{""family"": ""layernorm"", ""group_count"": null, ""k"": null, ""m"": 4096, ""n"": 8192}","{""block_size"": 8192, ""num_stages"": 2, ""num_warps"": 4}",0.038416000083088875,3493.7975767832227,3.259281237340368,0.001953125
A,layernorm,layernorm_m4096_n8192,4096,8192,10,8192,4,3,"{""family"": ""layernorm"", ""group_count"": null, ""k"": null, ""m"": 4096, ""n"": 8192}","{""block_size"": 8192, ""num_stages"": 3, ""num_warps"": 4}",0.037696000188589096,3560.529693562259,3.2782012859501215,0.001953125
A,layernorm,layernorm_m4096_n8192,4096,8192,11,8192,4,4,"{""family"": ""layernorm"", ""group_count"": null, ""k"": null, ""m"": 4096, ""n"": 8192}","{""block_size"": 8192, ""num_stages"": 4, ""num_warps"": 4}",0.03763199970126152,3566.585062326642,3.2799005346443915,0.001953125
A,layernorm,layernorm_m4096_n8192,4096,8192,12,8192,8,1,"{""family"": ""layernorm"", ""group_count"": null, ""k"": null, ""m"": 4096, ""n"": 8192}","{""block_size"": 8192, ""num_stages"": 1, ""num_warps"": 8}",0.037248000502586365,3603.3539032700673,3.2901570133801887,0.001953125
A,layernorm,layernorm_m4096_n8192,4096,8192,13,8192,8,2,"{""family"": ""layernorm"", ""group_count"": null, ""k"": null, ""m"": 4096, ""n"": 8192}","{""block_size"": 8192, ""num_stages"": 2, ""num_warps"": 8}",0.03721600025892258,3606.4522534987127,3.291016495688591,0.001953125
A,layernorm,layernorm_m4096_n8192,4096,8192,14,8192,8,3,"{""family"": ""layernorm"", ""group_count"": null, ""k"": null, ""m"": 4096, ""n"": 8192}","{""block_size"": 8192, ""num_stages"": 3, ""num_warps"": 8}",0.037248000502586365,3603.3539032700673,3.2901570133801887,0.001953125
A,layernorm,layernorm_m4096_n8192,4096,8192,15,8192,8,4,"{""family"": ""layernorm"", ""group_count"": null, ""k"": null, ""m"": 4096, ""n"": 8192}","{""block_size"": 8192, ""num_stages"": 4, ""num_warps"": 8}",0.03721600025892258,3606.4522534987127,3.291016495688591,0.001953125
B,grouped_gemm,grouped_gemm_g4_k512_m4096_n256,4096,256,0,256,1,1,"{""family"": ""grouped_gemm"", ""group_count"": 4, ""k"": 512, ""m"": 4096, ""n"": 256}","{""block_size"": 256, ""num_stages"": 1, ""num_warps"": 1}",0.08028800040483475,91.4212829188607,2.522135103755843,0.0625
B,grouped_gemm,grouped_gemm_g4_k512_m4096_n256,4096,256,1,256,1,2,"{""family"": ""grouped_gemm"", ""group_count"": 4, ""k"": 512, ""m"": 4096, ""n"": 256}","{""block_size"": 256, ""num_stages"": 2, ""num_warps"": 1}",0.06419199705123901,114.3449703573029,2.7458767325792484,0.0625
B,grouped_gemm,grouped_gemm_g4_k512_m4096_n256,4096,256,2,256,1,3,"{""family"": ""grouped_gemm"", ""group_count"": 4, ""k"": 512, ""m"": 4096, ""n"": 256}","{""block_size"": 256, ""num_stages"": 3, ""num_warps"": 1}",0.04291199892759323,171.04847556472646,3.1486037968737057,0.0625
B,grouped_gemm,grouped_gemm_g4_k512_m4096_n256,4096,256,3,256,1,4,"{""family"": ""grouped_gemm"", ""group_count"": 4, ""k"": 512, ""m"": 4096, ""n"": 256}","{""block_size"": 256, ""num_stages"": 4, ""num_warps"": 1}",0.0424639992415905,172.85305508415124,3.1590986386923983,0.0625
B,grouped_gemm,grouped_gemm_g4_k512_m4096_n256,4096,256,4,256,2,1,"{""family"": ""grouped_gemm"", ""group_count"": 4, ""k"": 512, ""m"": 4096, ""n"": 256}","{""block_size"": 256, ""num_stages"": 1, ""num_warps"": 2}",0.0894400030374527,82.06654461903793,2.4141872356145626,0.0625
B,grouped_gemm,grouped_gemm_g4_k512_m4096_n256,4096,256,5,256,2,2,"{""family"": ""grouped_gemm"", ""group_count"": 4, ""k"": 512, ""m"": 4096, ""n"": 256}","{""block_size"": 256, ""num_stages"": 2, ""num_warps"": 2}",0.0650240033864975,112.88188388480843,2.732998794385445,0.0625
B,grouped_gemm,grouped_gemm_g4_k512_m4096_n256,4096,256,6,256,2,3,"{""family"": ""grouped_gemm"", ""group_count"": 4, ""k"": 512, ""m"": 4096, ""n"": 256}","{""block_size"": 256, ""num_stages"": 3, ""num_warps"": 2}",0.03951999917626381,185.72955852712954,3.2309484269459974,0.0625
B,grouped_gemm,grouped_gemm_g4_k512_m4096_n256,4096,256,7,256,2,4,"{""family"": ""grouped_gemm"", ""group_count"": 4, ""k"": 512, ""m"": 4096, ""n"": 256}","{""block_size"": 256, ""num_stages"": 4, ""num_warps"": 2}",0.03276799991726875,224.00000056554563,3.4183028520898517,0.0625
B,grouped_gemm,grouped_gemm_g4_k512_m4096_n256,4096,256,8,256,4,1,"{""family"": ""grouped_gemm"", ""group_count"": 4, ""k"": 512, ""m"": 4096, ""n"": 256}","{""block_size"": 256, ""num_stages"": 1, ""num_warps"": 4}",0.07833600044250488,93.69934587593931,2.546748005883525,0.0625
B,grouped_gemm,grouped_gemm_g4_k512_m4096_n256,4096,256,9,256,4,2,"{""family"": ""grouped_gemm"", ""group_count"": 4, ""k"": 512, ""m"": 4096, ""n"": 256}","{""block_size"": 256, ""num_stages"": 2, ""num_warps"": 4}",0.0560000017285347,131.0719959542412,2.882403557380297,0.0625
B,grouped_gemm,grouped_gemm_g4_k512_m4096_n256,4096,256,10,256,4,3,"{""family"": ""grouped_gemm"", ""group_count"": 4, ""k"": 512, ""m"": 4096, ""n"": 256}","{""block_size"": 256, ""num_stages"": 3, ""num_warps"": 4}",0.03638400137424469,201.7378991524506,3.313626123643435,0.0625
B,grouped_gemm,grouped_gemm_g4_k512_m4096_n256,4096,256,11,256,4,4,"{""family"": ""grouped_gemm"", ""group_count"": 4, ""k"": 512, ""m"": 4096, ""n"": 256}","{""block_size"": 256, ""num_stages"": 4, ""num_warps"": 4}",0.030239999294281006,242.7259315904861,3.4985897510080735,0.0625
B,grouped_gemm,grouped_gemm_g4_k512_m4096_n256,4096,256,12,256,8,1,"{""family"": ""grouped_gemm"", ""group_count"": 4, ""k"": 512, ""m"": 4096, ""n"": 256}","{""block_size"": 256, ""num_stages"": 1, ""num_warps"": 8}",0.05990400165319443,122.52991114840802,2.815011970529614,0.0625
B,grouped_gemm,grouped_gemm_g4_k512_m4096_n256,4096,256,13,256,8,2,"{""family"": ""grouped_gemm"", ""group_count"": 4, ""k"": 512, ""m"": 4096, ""n"": 256}","{""block_size"": 256, ""num_stages"": 2, ""num_warps"": 8}",0.05721599981188774,128.28635388933577,2.8609217027188443,0.0625
B,grouped_gemm,grouped_gemm_g4_k512_m4096_n256,4096,256,14,256,8,3,"{""family"": ""grouped_gemm"", ""group_count"": 4, ""k"": 512, ""m"": 4096, ""n"": 256}","{""block_size"": 256, ""num_stages"": 3, ""num_warps"": 8}",0.03763199970126152,195.0476205959882,3.2799005346443915,0.0625
B,grouped_gemm,grouped_gemm_g4_k512_m4096_n256,4096,256,15,256,8,4,"{""family"": ""grouped_gemm"", ""group_count"": 4, ""k"": 512, ""m"": 4096, ""n"": 256}","{""block_size"": 256, ""num_stages"": 4, ""num_warps"": 8}",0.03145600110292435,233.34281989574396,3.4591654999549344,0.0625
B,grouped_gemm,grouped_gemm_g4_k512_m4096_n256,4096,256,16,512,1,1,"{""family"": ""grouped_gemm"", ""group_count"": 4, ""k"": 512, ""m"": 4096, ""n"": 256}","{""block_size"": 512, ""num_stages"": 1, ""num_warps"": 1}",1.89683198928833,3.8696268522727184,-0.6401851204983846,0.0625
B,grouped_gemm,grouped_gemm_g4_k512_m4096_n256,4096,256,17,512,1,2,"{""family"": ""grouped_gemm"", ""group_count"": 4, ""k"": 512, ""m"": 4096, ""n"": 256}","{""block_size"": 512, ""num_stages"": 2, ""num_warps"": 1}",0.5560959875583649,13.199217696620458,0.5868143601385751,0.0625
B,grouped_gemm,grouped_gemm_g4_k512_m4096_n256,4096,256,18,512,1,3,"{""family"": ""grouped_gemm"", ""group_count"": 4, ""k"": 512, ""m"": 4096, ""n"": 256}","{""block_size"": 512, ""num_stages"": 3, ""num_warps"": 1}",0.4520159959793091,16.23843418217436,0.794037710441339,0.0625
B,grouped_gemm,grouped_gemm_g4_k512_m4096_n256,4096,256,19,512,1,4,"{""family"": ""grouped_gemm"", ""group_count"": 4, ""k"": 512, ""m"": 4096, ""n"": 256}","{""block_size"": 512, ""num_stages"": 4, ""num_warps"": 1}",0.34169599413871765,21.481176618711487,1.0738338432579162,0.0625
B,grouped_gemm,grouped_gemm_g4_k512_m4096_n256,4096,256,20,512,2,1,"{""family"": ""grouped_gemm"", ""group_count"": 4, ""k"": 512, ""m"": 4096, ""n"": 256}","{""block_size"": 512, ""num_stages"": 1, ""num_warps"": 2}",2.0471999645233154,3.5854006092214377,-0.7164729885340727,0.0625
B,grouped_gemm,grouped_gemm_g4_k512_m4096_n256,4096,256,21,512,2,2,"{""family"": ""grouped_gemm"", ""group_count"": 4, ""k"": 512, ""m"": 4096, ""n"": 256}","{""block_size"": 512, ""num_stages"": 2, ""num_warps"": 2}",0.1438080072402954,51.040495872633876,1.9392761520723159,0.0625
B,grouped_gemm,grouped_gemm_g4_k512_m4096_n256,4096,256,22,512,2,3,"{""family"": ""grouped_gemm"", ""group_count"": 4, ""k"": 512, ""m"": 4096, ""n"": 256}","{""block_size"": 512, ""num_stages"": 3, ""num_warps"": 2}",0.11475200206041336,63.96430448451524,2.1649819830441106,0.0625
B,grouped_gemm,grouped_gemm_g4_k512_m4096_n256,4096,256,23,512,2,4,"{""family"": ""grouped_gemm"", ""group_count"": 4, ""k"": 512, ""m"": 4096, ""n"": 256}","{""block_size"": 512, ""num_stages"": 4, ""num_warps"": 2}",0.12246400117874146,59.9362419106894,2.0999381601136373,0.0625
B,grouped_gemm,grouped_gemm_g4_k512_m4096_n256,4096,256,24,512,4,1,"{""family"": ""grouped_gemm"", ""group_count"": 4, ""k"": 512, ""m"": 4096, ""n"": 256}","{""block_size"": 512, ""num_stages"": 1, ""num_warps"": 4}",0.07919999957084656,92.67717221935261,2.535778985580361,0.0625
B,grouped_gemm,grouped_gemm_g4_k512_m4096_n256,4096,256,25,512,4,2,"{""family"": ""grouped_gemm"", ""group_count"": 4, ""k"": 512, ""m"": 4096, ""n"": 256}","{""block_size"": 512, ""num_stages"": 2, ""num_warps"": 4}",0.0663359984755516,110.6493030734315,2.7130225657094784,0.0625
B,grouped_gemm,grouped_gemm_g4_k512_m4096_n256,4096,256,26,512,4,3,"{""family"": ""grouped_gemm"", ""group_count"": 4, ""k"": 512, ""m"": 4096, ""n"": 256}","{""block_size"": 512, ""num_stages"": 3, ""num_warps"": 4}",0.04281599819660187,171.43199526252195,3.150843456596099,0.0625
B,grouped_gemm,grouped_gemm_g4_k512_m4096_n256,4096,256,27,512,4,4,"{""family"": ""grouped_gemm"", ""group_count"": 4, ""k"": 512, ""m"": 4096, ""n"": 256}","{""block_size"": 512, ""num_stages"": 4, ""num_warps"": 4}",0.035392001271247864,207.39239761394828,3.341269437163194,0.0625
B,grouped_gemm,grouped_gemm_g4_k512_m4096_n256,4096,256,28,512,8,1,"{""family"": ""grouped_gemm"", ""group_count"": 4, ""k"": 512, ""m"": 4096, ""n"": 256}","{""block_size"": 512, ""num_stages"": 1, ""num_warps"": 8}",0.07571200281381607,96.94674195913065,2.5808185734614857,0.0625
B,grouped_gemm,grouped_gemm_g4_k512_m4096_n256,4096,256,29,512,8,2,"{""family"": ""grouped_gemm"", ""group_count"": 4, ""k"": 512, ""m"": 4096, ""n"": 256}","{""block_size"": 512, ""num_stages"": 2, ""num_warps"": 8}",0.0650240033864975,112.88188388480843,2.732998794385445,0.0625
B,grouped_gemm,grouped_gemm_g4_k512_m4096_n256,4096,256,30,512,8,3,"{""family"": ""grouped_gemm"", ""group_count"": 4, ""k"": 512, ""m"": 4096, ""n"": 256}","{""block_size"": 512, ""num_stages"": 3, ""num_warps"": 8}",0.04335999861359596,169.28118622444924,3.1382179538250097,0.0625
B,grouped_gemm,grouped_gemm_g4_k512_m4096_n256,4096,256,31,512,8,4,"{""family"": ""grouped_gemm"", ""group_count"": 4, ""k"": 512, ""m"": 4096, ""n"": 256}","{""block_size"": 512, ""num_stages"": 4, ""num_warps"": 8}",0.036031998693943024,203.7087107586363,3.3233478827120533,0.0625
B,grouped_gemm,grouped_gemm_g4_k512_m4096_n256,4096,256,32,1024,1,1,"{""family"": ""grouped_gemm"", ""group_count"": 4, ""k"": 512, ""m"": 4096, ""n"": 256}","{""block_size"": 1024, ""num_stages"": 1, ""num_warps"": 1}",8.750224113464355,0.838839314836013,-2.1690793130088717,0.0625
B,grouped_gemm,grouped_gemm_g4_k512_m4096_n256,4096,256,33,1024,1,2,"{""family"": ""grouped_gemm"", ""group_count"": 4, ""k"": 512, ""m"": 4096, ""n"": 256}","{""block_size"": 1024, ""num_stages"": 2, ""num_warps"": 1}",2.6104800701141357,2.811755616919564,-0.9595341393302811,0.0625
B,grouped_gemm,grouped_gemm_g4_k512_m4096_n256,4096,256,34,1024,1,3,"{""family"": ""grouped_gemm"", ""group_count"": 4, ""k"": 512, ""m"": 4096, ""n"": 256}","{""block_size"": 1024, ""num_stages"": 3, ""num_warps"": 1}",2.452672004699707,2.992667582919909,-0.8971780444322079,0.0625
B,grouped_gemm,grouped_gemm_g4_k512_m4096_n256,4096,256,35,1024,1,4,"{""family"": ""grouped_gemm"", ""group_count"": 4, ""k"": 512, ""m"": 4096, ""n"": 256}","{""block_size"": 1024, ""num_stages"": 4, ""num_warps"": 1}",2.4774879217147827,2.96269133571381,-0.9072451120193181,0.0625
B,grouped_gemm,grouped_gemm_g4_k512_m4096_n256,4096,256,36,1024,2,1,"{""family"": ""grouped_gemm"", ""group_count"": 4, ""k"": 512, ""m"": 4096, ""n"": 256}","{""block_size"": 1024, ""num_stages"": 1, ""num_warps"": 2}",9.2774076461792,0.791172737033164,-2.227582159300988,0.0625
B,grouped_gemm,grouped_gemm_g4_k512_m4096_n256,4096,256,37,1024,2,2,"{""family"": ""grouped_gemm"", ""group_count"": 4, ""k"": 512, ""m"": 4096, ""n"": 256}","{""block_size"": 1024, ""num_stages"": 2, ""num_warps"": 2}",1.361568033695221,5.3908668669897875,-0.30863700154553486,0.0625
B,grouped_gemm,grouped_gemm_g4_k512_m4096_n256,4096,256,38,1024,2,3,"{""family"": ""grouped_gemm"", ""group_count"": 4, ""k"": 512, ""m"": 4096, ""n"": 256}","{""block_size"": 1024, ""num_stages"": 3, ""num_warps"": 2}",1.6991360187530518,4.3198613406986945,-0.5301198976095355,0.0625
B,grouped_gemm,grouped_gemm_g4_k512_m4096_n256,4096,256,39,1024,2,4,"{""family"": ""grouped_gemm"", ""group_count"": 4, ""k"": 512, ""m"": 4096, ""n"": 256}","{""block_size"": 1024, ""num_stages"": 4, ""num_warps"": 2}",1.508624017238617,4.865381908366529,-0.4111979885271715,0.0625
B,grouped_gemm,grouped_gemm_g4_k512_m4096_n256,4096,256,40,1024,4,1,"{""family"": ""grouped_gemm"", ""group_count"": 4, ""k"": 512, ""m"": 4096, ""n"": 256}","{""block_size"": 1024, ""num_stages"": 1, ""num_warps"": 4}",0.6822400093078613,10.758724055844407,0.3823737632416774,0.0625
B,grouped_gemm,grouped_gemm_g4_k512_m4096_n256,4096,256,41,1024,4,2,"{""family"": ""grouped_gemm"", ""group_count"": 4, ""k"": 512, ""m"": 4096, ""n"": 256}","{""block_size"": 1024, ""num_stages"": 2, ""num_warps"": 4}",0.8196160197257996,8.955452093842174,0.19891931702290416,0.0625
B,grouped_gemm,grouped_gemm_g4_k512_m4096_n256,4096,256,42,1024,4,3,"{""family"": ""grouped_gemm"", ""group_count"": 4, ""k"": 512, ""m"": 4096, ""n"": 256}","{""block_size"": 1024, ""num_stages"": 3, ""num_warps"": 4}",0.8081279993057251,9.082759174667789,0.21303481802503693,0.0625
B,grouped_gemm,grouped_gemm_g4_k512_m4096_n256,4096,256,43,1024,4,4,"{""family"": ""grouped_gemm"", ""group_count"": 4, ""k"": 512, ""m"": 4096, ""n"": 256}","{""block_size"": 1024, ""num_stages"": 4, ""num_warps"": 4}",0.7135999798774719,10.285919572559845,0.3374327259149478,0.0625
B,grouped_gemm,grouped_gemm_g4_k512_m4096_n256,4096,256,44,1024,8,1,"{""family"": ""grouped_gemm"", ""group_count"": 4, ""k"": 512, ""m"": 4096, ""n"": 256}","{""block_size"": 1024, ""num_stages"": 1, ""num_warps"": 8}",0.4909439980983734,14.950853923117384,0.7114252145187143,0.0625
B,grouped_gemm,grouped_gemm_g4_k512_m4096_n256,4096,256,45,1024,8,2,"{""family"": ""grouped_gemm"", ""group_count"": 4, ""k"": 512, ""m"": 4096, ""n"": 256}","{""block_size"": 1024, ""num_stages"": 2, ""num_warps"": 8}",0.3901120126247406,18.815190925844618,0.9413213692375657,0.0625
B,grouped_gemm,grouped_gemm_g4_k512_m4096_n256,4096,256,46,1024,8,3,"{""family"": ""grouped_gemm"", ""group_count"": 4, ""k"": 512, ""m"": 4096, ""n"": 256}","{""block_size"": 1024, ""num_stages"": 3, ""num_warps"": 8}",0.37363201379776,19.645083207385493,0.9844838862618002,0.0625
B,grouped_gemm,grouped_gemm_g4_k512_m4096_n256,4096,256,47,1024,8,4,"{""family"": ""grouped_gemm"", ""group_count"": 4, ""k"": 512, ""m"": 4096, ""n"": 256}","{""block_size"": 1024, ""num_stages"": 4, ""num_warps"": 8}",0.36665600538253784,20.018851163618695,1.0033311855159488,0.0625
B,grouped_gemm,grouped_gemm_g4_k512_m4096_n512,4096,512,0,256,1,1,"{""family"": ""grouped_gemm"", ""group_count"": 4, ""k"": 512, ""m"": 4096, ""n"": 512}","{""block_size"": 256, ""num_stages"": 1, ""num_warps"": 1}",0.08198399841785431,127.90008053225704,2.5012311920060935,0.0625
B,grouped_gemm,grouped_gemm_g4_k512_m4096_n512,4096,512,1,256,1,2,"{""family"": ""grouped_gemm"", ""group_count"": 4, ""k"": 512, ""m"": 4096, ""n"": 512}","{""block_size"": 256, ""num_stages"": 2, ""num_warps"": 1}",0.06627199798822403,158.22308544044844,2.713987824125313,0.0625
B,grouped_gemm,grouped_gemm_g4_k512_m4096_n512,4096,512,2,256,1,3,"{""family"": ""grouped_gemm"", ""group_count"": 4, ""k"": 512, ""m"": 4096, ""n"": 512}","{""block_size"": 256, ""num_stages"": 3, ""num_warps"": 1}",0.04447999969124794,235.74100883060976,3.1127156359811785,0.0625
B,grouped_gemm,grouped_gemm_g4_k512_m4096_n512,4096,512,3,256,1,4,"{""family"": ""grouped_gemm"", ""group_count"": 4, ""k"": 512, ""m"": 4096, ""n"": 512}","{""block_size"": 256, ""num_stages"": 4, ""num_warps"": 1}",0.04412800073623657,237.62146086508315,3.120660760687132,0.0625
B,grouped_gemm,grouped_gemm_g4_k512_m4096_n512,4096,512,4,256,2,1,"{""family"": ""grouped_gemm"", ""group_count"": 4, ""k"": 512, ""m"": 4096, ""n"": 512}","{""block_size"": 256, ""num_stages"": 1, ""num_warps"": 2}",0.09116800129413605,115.0157933831379,2.3950513064715704,0.0625
B,grouped_gemm,grouped_gemm_g4_k512_m4096_n512,4096,512,5,256,2,2,"{""family"": ""grouped_gemm"", ""group_count"": 4, ""k"": 512, ""m"": 4096, ""n"": 512}","{""block_size"": 256, ""num_stages"": 2, ""num_warps"": 2}",0.06623999774456024,158.29952229823425,2.7144708029546467,0.0625
