data/qwen_05b_measurements.csv
family_group,family,task_id,m,n,k,config_id,block_size,num_warps,num_stages,shape_json,config_json,median_ms,effective_gbps,score,validation_error
QWEN,rmsnorm,qwen05b_rmsnorm_prefill_m128_n896_seq128_ctx128,128,896,0,0,1024,1,1,"{""ctx_len"": 128, ""dtype"": ""bfloat16"", ""family"": ""rmsnorm"", ""family_group"": ""QWEN"", ""head_dim"": 64, ""hidden_size"": 896, ""intermediate_size"": 4864, ""k"": 0, ""m"": 128, ""mode"": ""prefill"", ""mode_id"": 1, ""model_id"": ""Qwen/Qwen2.5-0.5B"", ""n"": 896, ""num_attention_heads"": 14, ""num_key_value_heads"": 2, ""role"": ""rmsnorm"", ""role_id"": 1, ""seq_len"": 128}","{""block_size"": 1024, ""num_stages"": 1, ""num_warps"": 1}",0.0048160001169890165,95.25581163955904,5.335811546683878,0.00186920166015625
QWEN,rmsnorm,qwen05b_rmsnorm_prefill_m128_n896_seq128_ctx128,128,896,0,1,1024,1,2,"{""ctx_len"": 128, ""dtype"": ""bfloat16"", ""family"": ""rmsnorm"", ""family_group"": ""QWEN"", ""head_dim"": 64, ""hidden_size"": 896, ""intermediate_size"": 4864, ""k"": 0, ""m"": 128, ""mode"": ""prefill"", ""mode_id"": 1, ""model_id"": ""Qwen/Qwen2.5-0.5B"", ""n"": 896, ""num_attention_heads"": 14, ""num_key_value_heads"": 2, ""role"": ""rmsnorm"", ""role_id"": 1, ""seq_len"": 128}","{""block_size"": 1024, ""num_stages"": 2, ""num_warps"": 1}",0.004832000005990267,94.94039723329506,5.332494817109915,0.00186920166015625
QWEN,rmsnorm,qwen05b_rmsnorm_prefill_m128_n896_seq128_ctx128,128,896,0,2,1024,1,3,"{""ctx_len"": 128, ""dtype"": ""bfloat16"", ""family"": ""rmsnorm"", ""family_group"": ""QWEN"", ""head_dim"": 64, ""hidden_size"": 896, ""intermediate_size"": 4864, ""k"": 0, ""m"": 128, ""mode"": ""prefill"", ""mode_id"": 1, ""model_id"": ""Qwen/Qwen2.5-0.5B"", ""n"": 896, ""num_attention_heads"": 14, ""num_key_value_heads"": 2, ""role"": ""rmsnorm"", ""role_id"": 1, ""seq_len"": 128}","{""block_size"": 1024, ""num_stages"": 3, ""num_warps"": 1}",0.004800000227987766,95.5733287938438,5.339139313570842,0.00186920166015625
QWEN,rmsnorm,qwen05b_rmsnorm_prefill_m128_n896_seq128_ctx128,128,896,0,3,1024,1,4,"{""ctx_len"": 128, ""dtype"": ""bfloat16"", ""family"": ""rmsnorm"", ""family_group"": ""QWEN"", ""head_dim"": 64, ""hidden_size"": 896, ""intermediate_size"": 4864, ""k"": 0, ""m"": 128, ""mode"": ""prefill"", ""mode_id"": 1, ""model_id"": ""Qwen/Qwen2.5-0.5B"", ""n"": 896, ""num_attention_heads"": 14, ""num_key_value_heads"": 2, ""role"": ""rmsnorm"", ""role_id"": 1, ""seq_len"": 128}","{""block_size"": 1024, ""num_stages"": 4, ""num_warps"": 1}",0.004832000005990267,94.94039723329506,5.332494817109915,0.00186920166015625
QWEN,rmsnorm,qwen05b_rmsnorm_prefill_m128_n896_seq128_ctx128,128,896,0,4,1024,2,1,"{""ctx_len"": 128, ""dtype"": ""bfloat16"", ""family"": ""rmsnorm"", ""family_group"": ""QWEN"", ""head_dim"": 64, ""hidden_size"": 896, ""intermediate_size"": 4864, ""k"": 0, ""m"": 128, ""mode"": ""prefill"", ""mode_id"": 1, ""model_id"": ""Qwen/Qwen2.5-0.5B"", ""n"": 896, ""num_attention_heads"": 14, ""num_key_value_heads"": 2, ""role"": ""rmsnorm"", ""role_id"": 1, ""seq_len"": 128}","{""block_size"": 1024, ""num_stages"": 1, ""num_warps"": 2}",0.004832000005990267,94.94039723329506,5.332494817109915,0.00186920166015625
QWEN,rmsnorm,qwen05b_rmsnorm_prefill_m128_n896_seq128_ctx128,128,896,0,5,1024,2,2,"{""ctx_len"": 128, ""dtype"": ""bfloat16"", ""family"": ""rmsnorm"", ""family_group"": ""QWEN"", ""head_dim"": 64, ""hidden_size"": 896, ""intermediate_size"": 4864, ""k"": 0, ""m"": 128, ""mode"": ""prefill"", ""mode_id"": 1, ""model_id"": ""Qwen/Qwen2.5-0.5B"", ""n"": 896, ""num_attention_heads"": 14, ""num_key_value_heads"": 2, ""role"": ""rmsnorm"", ""role_id"": 1, ""seq_len"": 128}","{""block_size"": 1024, ""num_stages"": 2, ""num_warps"": 2}",0.004832000005990267,94.94039723329506,5.332494817109915,0.00186920166015625
QWEN,rmsnorm,qwen05b_rmsnorm_prefill_m128_n896_seq128_ctx128,128,896,0,6,1024,2,3,"{""ctx_len"": 128, ""dtype"": ""bfloat16"", ""family"": ""rmsnorm"", ""family_group"": ""QWEN"", ""head_dim"": 64, ""hidden_size"": 896, ""intermediate_size"": 4864, ""k"": 0, ""m"": 128, ""mode"": ""prefill"", ""mode_id"": 1, ""model_id"": ""Qwen/Qwen2.5-0.5B"", ""n"": 896, ""num_attention_heads"": 14, ""num_key_value_heads"": 2, ""role"": ""rmsnorm"", ""role_id"": 1, ""seq_len"": 128}","{""block_size"": 1024, ""num_stages"": 3, ""num_warps"": 2}",0.004832000005990267,94.94039723329506,5.332494817109915,0.00186920166015625
QWEN,rmsnorm,qwen05b_rmsnorm_prefill_m128_n896_seq128_ctx128,128,896,0,7,1024,2,4,"{""ctx_len"": 128, ""dtype"": ""bfloat16"", ""family"": ""rmsnorm"", ""family_group"": ""QWEN"", ""head_dim"": 64, ""hidden_size"": 896, ""intermediate_size"": 4864, ""k"": 0, ""m"": 128, ""mode"": ""prefill"", ""mode_id"": 1, ""model_id"": ""Qwen/Qwen2.5-0.5B"", ""n"": 896, ""num_attention_heads"": 14, ""num_key_value_heads"": 2, ""role"": ""rmsnorm"", ""role_id"": 1, ""seq_len"": 128}","{""block_size"": 1024, ""num_stages"": 4, ""num_warps"": 2}",0.004832000005990267,94.94039723329506,5.332494817109915,0.00186920166015625
QWEN,rmsnorm,qwen05b_rmsnorm_prefill_m128_n896_seq128_ctx128,128,896,0,8,1024,4,1,"{""ctx_len"": 128, ""dtype"": ""bfloat16"", ""family"": ""rmsnorm"", ""family_group"": ""QWEN"", ""head_dim"": 64, ""hidden_size"": 896, ""intermediate_size"": 4864, ""k"": 0, ""m"": 128, ""mode"": ""prefill"", ""mode_id"": 1, ""model_id"": ""Qwen/Qwen2.5-0.5B"", ""n"": 896, ""num_attention_heads"": 14, ""num_key_value_heads"": 2, ""role"": ""rmsnorm"", ""role_id"": 1, ""seq_len"": 128}","{""block_size"": 1024, ""num_stages"": 1, ""num_warps"": 4}",0.004832000005990267,94.94039723329506,5.332494817109915,0.00186920166015625
QWEN,rmsnorm,qwen05b_rmsnorm_prefill_m128_n896_seq128_ctx128,128,896,0,9,1024,4,2,"{""ctx_len"": 128, ""dtype"": ""bfloat16"", ""family"": ""rmsnorm"", ""family_group"": ""QWEN"", ""head_dim"": 64, ""hidden_size"": 896, ""intermediate_size"": 4864, ""k"": 0, ""m"": 128, ""mode"": ""prefill"", ""mode_id"": 1, ""model_id"": ""Qwen/Qwen2.5-0.5B"", ""n"": 896, ""num_attention_heads"": 14, ""num_key_value_heads"": 2, ""role"": ""rmsnorm"", ""role_id"": 1, ""seq_len"": 128}","{""block_size"": 1024, ""num_stages"": 2, ""num_warps"": 4}",0.004832000005990267,94.94039723329506,5.332494817109915,0.00186920166015625
QWEN,rmsnorm,qwen05b_rmsnorm_prefill_m128_n896_seq128_ctx128,128,896,0,10,1024,4,3,"{""ctx_len"": 128, ""dtype"": ""bfloat16"", ""family"": ""rmsnorm"", ""family_group"": ""QWEN"", ""head_dim"": 64, ""hidden_size"": 896, ""intermediate_size"": 4864, ""k"": 0, ""m"": 128, ""mode"": ""prefill"", ""mode_id"": 1, ""model_id"": ""Qwen/Qwen2.5-0.5B"", ""n"": 896, ""num_attention_heads"": 14, ""num_key_value_heads"": 2, ""role"": ""rmsnorm"", ""role_id"": 1, ""seq_len"": 128}","{""block_size"": 1024, ""num_stages"": 3, ""num_warps"": 4}",0.004832000005990267,94.94039723329506,5.332494817109915,0.00186920166015625
QWEN,rmsnorm,qwen05b_rmsnorm_prefill_m128_n896_seq128_ctx128,128,896,0,11,1024,4,4,"{""ctx_len"": 128, ""dtype"": ""bfloat16"", ""family"": ""rmsnorm"", ""family_group"": ""QWEN"", ""head_dim"": 64, ""hidden_size"": 896, ""intermediate_size"": 4864, ""k"": 0, ""m"": 128, ""mode"": ""prefill"", ""mode_id"": 1, ""model_id"": ""Qwen/Qwen2.5-0.5B"", ""n"": 896, ""num_attention_heads"": 14, ""num_key_value_heads"": 2, ""role"": ""rmsnorm"", ""role_id"": 1, ""seq_len"": 128}","{""block_size"": 1024, ""num_stages"": 4, ""num_warps"": 4}",0.004832000005990267,94.94039723329506,5.332494817109915,0.00186920166015625
QWEN,rmsnorm,qwen05b_rmsnorm_prefill_m128_n896_seq128_ctx128,128,896,0,12,1024,8,1,"{""ctx_len"": 128, ""dtype"": ""bfloat16"", ""family"": ""rmsnorm"", ""family_group"": ""QWEN"", ""head_dim"": 64, ""hidden_size"": 896, ""intermediate_size"": 4864, ""k"": 0, ""m"": 128, ""mode"": ""prefill"", ""mode_id"": 1, ""model_id"": ""Qwen/Qwen2.5-0.5B"", ""n"": 896, ""num_attention_heads"": 14, ""num_key_value_heads"": 2, ""role"": ""rmsnorm"", ""role_id"": 1, ""seq_len"": 128}","{""block_size"": 1024, ""num_stages"": 1, ""num_warps"": 8}",0.004832000005990267,94.94039723329506,5.332494817109915,0.00186920166015625
QWEN,rmsnorm,qwen05b_rmsnorm_prefill_m128_n896_seq128_ctx128,128,896,0,13,1024,8,2,"{""ctx_len"": 128, ""dtype"": ""bfloat16"", ""family"": ""rmsnorm"", ""family_group"": ""QWEN"", ""head_dim"": 64, ""hidden_size"": 896, ""intermediate_size"": 4864, ""k"": 0, ""m"": 128, ""mode"": ""prefill"", ""mode_id"": 1, ""model_id"": ""Qwen/Qwen2.5-0.5B"", ""n"": 896, ""num_attention_heads"": 14, ""num_key_value_heads"": 2, ""role"": ""rmsnorm"", ""role_id"": 1, ""seq_len"": 128}","{""block_size"": 1024, ""num_stages"": 2, ""num_warps"": 8}",0.004832000005990267,94.94039723329506,5.332494817109915,0.00186920166015625
QWEN,rmsnorm,qwen05b_rmsnorm_prefill_m128_n896_seq128_ctx128,128,896,0,14,1024,8,3,"{""ctx_len"": 128, ""dtype"": ""bfloat16"", ""family"": ""rmsnorm"", ""family_group"": ""QWEN"", ""head_dim"": 64, ""hidden_size"": 896, ""intermediate_size"": 4864, ""k"": 0, ""m"": 128, ""mode"": ""prefill"", ""mode_id"": 1, ""model_id"": ""Qwen/Qwen2.5-0.5B"", ""n"": 896, ""num_attention_heads"": 14, ""num_key_value_heads"": 2, ""role"": ""rmsnorm"", ""role_id"": 1, ""seq_len"": 128}","{""block_size"": 1024, ""num_stages"": 3, ""num_warps"": 8}",0.004832000005990267,94.94039723329506,5.332494817109915,0.00186920166015625
QWEN,rmsnorm,qwen05b_rmsnorm_prefill_m128_n896_seq128_ctx128,128,896,0,15,1024,8,4,"{""ctx_len"": 128, ""dtype"": ""bfloat16"", ""family"": ""rmsnorm"", ""family_group"": ""QWEN"", ""head_dim"": 64, ""hidden_size"": 896, ""intermediate_size"": 4864, ""k"": 0, ""m"": 128, ""mode"": ""prefill"", ""mode_id"": 1, ""model_id"": ""Qwen/Qwen2.5-0.5B"", ""n"": 896, ""num_attention_heads"": 14, ""num_key_value_heads"": 2, ""role"": ""rmsnorm"", ""role_id"": 1, ""seq_len"": 128}","{""block_size"": 1024, ""num_stages"": 4, ""num_warps"": 8}",0.004832000005990267,94.94039723329506,5.332494817109915,0.00186920166015625
QWEN,rmsnorm,qwen05b_rmsnorm_prefill_m128_n896_seq128_ctx128,128,896,0,16,2048,1,1,"{""ctx_len"": 128, ""dtype"": ""bfloat16"", ""family"": ""rmsnorm"", ""family_group"": ""QWEN"", ""head_dim"": 64, ""hidden_size"": 896, ""intermediate_size"": 4864, ""k"": 0, ""m"": 128, ""mode"": ""prefill"", ""mode_id"": 1, ""model_id"": ""Qwen/Qwen2.5-0.5B"", ""n"": 896, ""num_attention_heads"": 14, ""num_key_value_heads"": 2, ""role"": ""rmsnorm"", ""role_id"": 1, ""seq_len"": 128}","{""block_size"": 2048, ""num_stages"": 1, ""num_warps"": 1}",0.005375999957323074,85.33333401074486,5.225810683699705,0.00186920166015625
QWEN,rmsnorm,qwen05b_rmsnorm_prefill_m128_n896_seq128_ctx128,128,896,0,17,2048,1,2,"{""ctx_len"": 128, ""dtype"": ""bfloat16"", ""family"": ""rmsnorm"", ""family_group"": ""QWEN"", ""head_dim"": 64, ""hidden_size"": 896, ""intermediate_size"": 4864, ""k"": 0, ""m"": 128, ""mode"": ""prefill"", ""mode_id"": 1, ""model_id"": ""Qwen/Qwen2.5-0.5B"", ""n"": 896, ""num_attention_heads"": 14, ""num_key_value_heads"": 2, ""role"": ""rmsnorm"", ""role_id"": 1, ""seq_len"": 128}","{""block_size"": 2048, ""num_stages"": 2, ""num_warps"": 1}",0.005344000179320574,85.84430849669711,5.231780809192297,0.00186920166015625
QWEN,rmsnorm,qwen05b_rmsnorm_prefill_m128_n896_seq128_ctx128,128,896,0,18,2048,1,3,"{""ctx_len"": 128, ""dtype"": ""bfloat16"", ""family"": ""rmsnorm"", ""family_group"": ""QWEN"", ""head_dim"": 64, ""hidden_size"": 896, ""intermediate_size"": 4864, ""k"": 0, ""m"": 128, ""mode"": ""prefill"", ""mode_id"": 1, ""model_id"": ""Qwen/Qwen2.5-0.5B"", ""n"": 896, ""num_attention_heads"": 14, ""num_key_value_heads"": 2, ""role"": ""rmsnorm"", ""role_id"": 1, ""seq_len"": 128}","{""block_size"": 2048, ""num_stages"": 3, ""num_warps"": 1}",0.005311999935656786,86.36144682921179,5.237786878920808,0.00186920166015625
QWEN,rmsnorm,qwen05b_rmsnorm_prefill_m128_n896_seq128_ctx128,128,896,0,19,2048,1,4,"{""ctx_len"": 128, ""dtype"": ""bfloat16"", ""family"": ""rmsnorm"", ""family_group"": ""QWEN"", ""head_dim"": 64, ""hidden_size"": 896, ""intermediate_size"": 4864, ""k"": 0, ""m"": 128, ""mode"": ""prefill"", ""mode_id"": 1, ""model_id"": ""Qwen/Qwen2.5-0.5B"", ""n"": 896, ""num_attention_heads"": 14, ""num_key_value_heads"": 2, ""role"": ""rmsnorm"", ""role_id"": 1, ""seq_len"": 128}","{""block_size"": 2048, ""num_stages"": 4, ""num_warps"": 1}",0.005311999935656786,86.36144682921179,5.237786878920808,0.00186920166015625
QWEN,rmsnorm,qwen05b_rmsnorm_prefill_m128_n896_seq128_ctx128,128,896,0,20,2048,2,1,"{""ctx_len"": 128, ""dtype"": ""bfloat16"", ""family"": ""rmsnorm"", ""family_group"": ""QWEN"", ""head_dim"": 64, ""hidden_size"": 896, ""intermediate_size"": 4864, ""k"": 0, ""m"": 128, ""mode"": ""prefill"", ""mode_id"": 1, ""model_id"": ""Qwen/Qwen2.5-0.5B"", ""n"": 896, ""num_attention_heads"": 14, ""num_key_value_heads"": 2, ""role"": ""rmsnorm"", ""role_id"": 1, ""seq_len"": 128}","{""block_size"": 2048, ""num_stages"": 1, ""num_warps"": 2}",0.004863999783992767,94.31579366219029,5.325894178727654,0.00186920166015625
QWEN,rmsnorm,qwen05b_rmsnorm_prefill_m128_n896_seq128_ctx128,128,896,0,21,2048,2,2,"{""ctx_len"": 128, ""dtype"": ""bfloat16"", ""family"": ""rmsnorm"", ""family_group"": ""QWEN"", ""head_dim"": 64, ""hidden_size"": 896, ""intermediate_size"": 4864, ""k"": 0, ""m"": 128, ""mode"": ""prefill"", ""mode_id"": 1, ""model_id"": ""Qwen/Qwen2.5-0.5B"", ""n"": 896, ""num_attention_heads"": 14, ""num_key_value_heads"": 2, ""role"": ""rmsnorm"", ""role_id"": 1, ""seq_len"": 128}","{""block_size"": 2048, ""num_stages"": 2, ""num_warps"": 2}",0.004863999783992767,94.31579366219029,5.325894178727654,0.00186920166015625
QWEN,rmsnorm,qwen05b_rmsnorm_prefill_m128_n896_seq128_ctx128,128,896,0,22,2048,2,3,"{""ctx_len"": 128, ""dtype"": ""bfloat16"", ""family"": ""rmsnorm"", ""family_group"": ""QWEN"", ""head_dim"": 64, ""hidden_size"": 896, ""intermediate_size"": 4864, ""k"": 0, ""m"": 128, ""mode"": ""prefill"", ""mode_id"": 1, ""model_id"": ""Qwen/Qwen2.5-0.5B"", ""n"": 896, ""num_attention_heads"": 14, ""num_key_value_heads"": 2, ""role"": ""rmsnorm"", ""role_id"": 1, ""seq_len"": 128}","{""block_size"": 2048, ""num_stages"": 3, ""num_warps"": 2}",0.004896000027656555,93.69934587593931,5.3193367281233055,0.00186920166015625
QWEN,rmsnorm,qwen05b_rmsnorm_prefill_m128_n896_seq128_ctx128,128,896,0,23,2048,2,4,"{""ctx_len"": 128, ""dtype"": ""bfloat16"", ""family"": ""rmsnorm"", ""family_group"": ""QWEN"", ""head_dim"": 64, ""hidden_size"": 896, ""intermediate_size"": 4864, ""k"": 0, ""m"": 128, ""mode"": ""prefill"", ""mode_id"": 1, ""model_id"": ""Qwen/Qwen2.5-0.5B"", ""n"": 896, ""num_attention_heads"": 14, ""num_key_value_heads"": 2, ""role"": ""rmsnorm"", ""role_id"": 1, ""seq_len"": 128}","{""block_size"": 2048, ""num_stages"": 4, ""num_warps"": 2}",0.004896000027656555,93.69934587593931,5.3193367281233055,0.00186920166015625
QWEN,rmsnorm,qwen05b_rmsnorm_prefill_m128_n896_seq128_ctx128,128,896,0,24,2048,4,1,"{""ctx_len"": 128, ""dtype"": ""bfloat16"", ""family"": ""rmsnorm"", ""family_group"": ""QWEN"", ""head_dim"": 64, ""hidden_size"": 896, ""intermediate_size"": 4864, ""k"": 0, ""m"": 128, ""mode"": ""prefill"", ""mode_id"": 1, ""model_id"": ""Qwen/Qwen2.5-0.5B"", ""n"": 896, ""num_attention_heads"": 14, ""num_key_value_heads"": 2, ""role"": ""rmsnorm"", ""role_id"": 1, ""seq_len"": 128}","{""block_size"": 2048, ""num_stages"": 1, ""num_warps"": 4}",0.004863999783992767,94.31579366219029,5.325894178727654,0.00186920166015625
QWEN,rmsnorm,qwen05b_rmsnorm_prefill_m128_n896_seq128_ctx128,128,896,0,25,2048,4,2,"{""ctx_len"": 128, ""dtype"": ""bfloat16"", ""family"": ""rmsnorm"", ""family_group"": ""QWEN"", ""head_dim"": 64, ""hidden_size"": 896, ""intermediate_size"": 4864, ""k"": 0, ""m"": 128, ""mode"": ""prefill"", ""mode_id"": 1, ""model_id"": ""Qwen/Qwen2.5-0.5B"", ""n"": 896, ""num_attention_heads"": 14, ""num_key_value_heads"": 2, ""role"": ""rmsnorm"", ""role_id"": 1, ""seq_len"": 128}","{""block_size"": 2048, ""num_stages"": 2, ""num_warps"": 4}",0.004863999783992767,94.31579366219029,5.325894178727654,0.00186920166015625
QWEN,rmsnorm,qwen05b_rmsnorm_prefill_m128_n896_seq128_ctx128,128,896,0,26,2048,4,3,"{""ctx_len"": 128, ""dtype"": ""bfloat16"", ""family"": ""rmsnorm"", ""family_group"": ""QWEN"", ""head_dim"": 64, ""hidden_size"": 896, ""intermediate_size"": 4864, ""k"": 0, ""m"": 128, ""mode"": ""prefill"", ""mode_id"": 1, ""model_id"": ""Qwen/Qwen2.5-0.5B"", ""n"": 896, ""num_attention_heads"": 14, ""num_key_value_heads"": 2, ""role"": ""rmsnorm"", ""role_id"": 1, ""seq_len"": 128}","{""block_size"": 2048, ""num_stages"": 3, ""num_warps"": 4}",0.004863999783992767,94.31579366219029,5.325894178727654,0.00186920166015625
QWEN,rmsnorm,qwen05b_rmsnorm_prefill_m128_n896_seq128_ctx128,128,896,0,27,2048,4,4,"{""ctx_len"": 128, ""dtype"": ""bfloat16"", ""family"": ""rmsnorm"", ""family_group"": ""QWEN"", ""head_dim"": 64, ""hidden_size"": 896, ""intermediate_size"": 4864, ""k"": 0, ""m"": 128, ""mode"": ""prefill"", ""mode_id"": 1, ""model_id"": ""Qwen/Qwen2.5-0.5B"", ""n"": 896, ""num_attention_heads"": 14, ""num_key_value_heads"": 2, ""role"": ""rmsnorm"", ""role_id"": 1, ""seq_len"": 128}","{""block_size"": 2048, ""num_stages"": 4, ""num_warps"": 4}",0.004863999783992767,94.31579366219029,5.325894178727654,0.00186920166015625
QWEN,rmsnorm,qwen05b_rmsnorm_prefill_m128_n896_seq128_ctx128,128,896,0,28,2048,8,1,"{""ctx_len"": 128, ""dtype"": ""bfloat16"", ""family"": ""rmsnorm"", ""family_group"": ""QWEN"", ""head_dim"": 64, ""hidden_size"": 896, ""intermediate_size"": 4864, ""k"": 0, ""m"": 128, ""mode"": ""prefill"", ""mode_id"": 1, ""model_id"": ""Qwen/Qwen2.5-0.5B"", ""n"": 896, ""num_attention_heads"": 14, ""num_key_value_heads"": 2, ""role"": ""rmsnorm"", ""role_id"": 1, ""seq_len"": 128}","{""block_size"": 2048, ""num_stages"": 1, ""num_warps"": 8}",0.004863999783992767,94.31579366219029,5.325894178727654,0.00186920166015625
QWEN,rmsnorm,qwen05b_rmsnorm_prefill_m128_n896_seq128_ctx128,128,896,0,29,2048,8,2,"{""ctx_len"": 128, ""dtype"": ""bfloat16"", ""family"": ""rmsnorm"", ""family_group"": ""QWEN"", ""head_dim"": 64, ""hidden_size"": 896, ""intermediate_size"": 4864, ""k"": 0, ""m"": 128, ""mode"": ""prefill"", ""mode_id"": 1, ""model_id"": ""Qwen/Qwen2.5-0.5B"", ""n"": 896, ""num_attention_heads"": 14, ""num_key_value_heads"": 2, ""role"": ""rmsnorm"", ""role_id"": 1, ""seq_len"": 128}","{""block_size"": 2048, ""num_stages"": 2, ""num_warps"": 8}",0.004863999783992767,94.31579366219029,5.325894178727654,0.00186920166015625
QWEN,rmsnorm,qwen05b_rmsnorm_prefill_m128_n896_seq128_ctx128,128,896,0,30,2048,8,3,"{""ctx_len"": 128, ""dtype"": ""bfloat16"", ""family"": ""rmsnorm"", ""family_group"": ""QWEN"", ""head_dim"": 64, ""hidden_size"": 896, ""intermediate_size"": 4864, ""k"": 0, ""m"": 128, ""mode"": ""prefill"", ""mode_id"": 1, ""model_id"": ""Qwen/Qwen2.5-0.5B"", ""n"": 896, ""num_attention_heads"": 14, ""num_key_value_heads"": 2, ""role"": ""rmsnorm"", ""role_id"": 1, ""seq_len"": 128}","{""block_size"": 2048, ""num_stages"": 3, ""num_warps"": 8}",0.004863999783992767,94.31579366219029,5.325894178727654,0.00186920166015625
QWEN,rmsnorm,qwen05b_rmsnorm_prefill_m128_n896_seq128_ctx128,128,896,0,31,2048,8,4,"{""ctx_len"": 128, ""dtype"": ""bfloat16"", ""family"": ""rmsnorm"", ""family_group"": ""QWEN"", ""head_dim"": 64, ""hidden_size"": 896, ""intermediate_size"": 4864, ""k"": 0, ""m"": 128, ""mode"": ""prefill"", ""mode_id"": 1, ""model_id"": ""Qwen/Qwen2.5-0.5B"", ""n"": 896, ""num_attention_heads"": 14, ""num_key_value_heads"": 2, ""role"": ""rmsnorm"", ""role_id"": 1, ""seq_len"": 128}","{""block_size"": 2048, ""num_stages"": 4, ""num_warps"": 8}",0.004863999783992767,94.31579366219029,5.325894178727654,0.00186920166015625
QWEN,rmsnorm,qwen05b_rmsnorm_prefill_m128_n896_seq128_ctx128,128,896,0,32,4096,1,1,"{""ctx_len"": 128, ""dtype"": ""bfloat16"", ""family"": ""rmsnorm"", ""family_group"": ""QWEN"", ""head_dim"": 64, ""hidden_size"": 896, ""intermediate_size"": 4864, ""k"": 0, ""m"": 128, ""mode"": ""prefill"", ""mode_id"": 1, ""model_id"": ""Qwen/Qwen2.5-0.5B"", ""n"": 896, ""num_attention_heads"": 14, ""num_key_value_heads"": 2, ""role"": ""rmsnorm"", ""role_id"": 1, ""seq_len"": 128}","{""block_size"": 4096, ""num_stages"": 1, ""num_warps"": 1}",0.005119999870657921,89.60000226348645,5.274600865192846,0.00186920166015625
QWEN,rmsnorm,qwen05b_rmsnorm_prefill_m128_n896_seq128_ctx128,128,896,0,33,4096,1,2,"{""ctx_len"": 128, ""dtype"": ""bfloat16"", ""family"": ""rmsnorm"", ""family_group"": ""QWEN"", ""head_dim"": 64, ""hidden_size"": 896, ""intermediate_size"": 4864, ""k"": 0, ""m"": 128, ""mode"": ""prefill"", ""mode_id"": 1, ""model_id"": ""Qwen/Qwen2.5-0.5B"", ""n"": 896, ""num_attention_heads"": 14, ""num_key_value_heads"": 2, ""role"": ""rmsnorm"", ""role_id"": 1, ""seq_len"": 128}","{""block_size"": 4096, ""num_stages"": 2, ""num_warps"": 1}",0.005119999870657921,89.60000226348645,5.274600865192846,0.00186920166015625
QWEN,rmsnorm,qwen05b_rmsnorm_prefill_m128_n896_seq128_ctx128,128,896,0,34,4096,1,3,"{""ctx_len"": 128, ""dtype"": ""bfloat16"", ""family"": ""rmsnorm"", ""family_group"": ""QWEN"", ""head_dim"": 64, ""hidden_size"": 896, ""intermediate_size"": 4864, ""k"": 0, ""m"": 128, ""mode"": ""prefill"", ""mode_id"": 1, ""model_id"": ""Qwen/Qwen2.5-0.5B"", ""n"": 896, ""num_attention_heads"": 14, ""num_key_value_heads"": 2, ""role"": ""rmsnorm"", ""role_id"": 1, ""seq_len"": 128}","{""block_size"": 4096, ""num_stages"": 3, ""num_warps"": 1}",0.005119999870657921,89.60000226348645,5.274600865192846,0.00186920166015625
QWEN,rmsnorm,qwen05b_rmsnorm_prefill_m128_n896_seq128_ctx128,128,896,0,35,4096,1,4,"{""ctx_len"": 128, ""dtype"": ""bfloat16"", ""family"": ""rmsnorm"", ""family_group"": ""QWEN"", ""head_dim"": 64, ""hidden_size"": 896, ""intermediate_size"": 4864, ""k"": 0, ""m"": 128, ""mode"": ""prefill"", ""mode_id"": 1, ""model_id"": ""Qwen/Qwen2.5-0.5B"", ""n"": 896, ""num_attention_heads"": 14, ""num_key_value_heads"": 2, ""role"": ""rmsnorm"", ""role_id"": 1, ""seq_len"": 128}","{""block_size"": 4096, ""num_stages"": 4, ""num_warps"": 1}",0.005119999870657921,89.60000226348645,5.274600865192846,0.00186920166015625
QWEN,rmsnorm,qwen05b_rmsnorm_prefill_m128_n896_seq128_ctx128,128,896,0,36,4096,2,1,"{""ctx_len"": 128, ""dtype"": ""bfloat16"", ""family"": ""rmsnorm"", ""family_group"": ""QWEN"", ""head_dim"": 64, ""hidden_size"": 896, ""intermediate_size"": 4864, ""k"": 0, ""m"": 128, ""mode"": ""prefill"", ""mode_id"": 1, ""model_id"": ""Qwen/Qwen2.5-0.5B"", ""n"": 896, ""num_attention_heads"": 14, ""num_key_value_heads"": 2, ""role"": ""rmsnorm"", ""role_id"": 1, ""seq_len"": 128}","{""block_size"": 4096, ""num_stages"": 1, ""num_warps"": 2}",0.004991999827325344,91.89743907619365,5.299918682505287,0.00186920166015625
QWEN,rmsnorm,qwen05b_rmsnorm_prefill_m128_n896_seq128_ctx128,128,896,0,37,4096,2,2,"{""ctx_len"": 128, ""dtype"": ""bfloat16"", ""family"": ""rmsnorm"", ""family_group"": ""QWEN"", ""head_dim"": 64, ""hidden_size"": 896, ""intermediate_size"": 4864, ""k"": 0, ""m"": 128, ""mode"": ""prefill"", ""mode_id"": 1, ""model_id"": ""Qwen/Qwen2.5-0.5B"", ""n"": 896, ""num_attention_heads"": 14, ""num_key_value_heads"": 2, ""role"": ""rmsnorm"", ""role_id"": 1, ""seq_len"": 128}","{""block_size"": 4096, ""num_stages"": 2, ""num_warps"": 2}",0.004991999827325344,91.89743907619365,5.299918682505287,0.00186920166015625
QWEN,rmsnorm,qwen05b_rmsnorm_prefill_m128_n896_seq128_ctx128,128,896,0,38,4096,2,3,"{""ctx_len"": 128, ""dtype"": ""bfloat16"", ""family"": ""rmsnorm"", ""family_group"": ""QWEN"", ""head_dim"": 64, ""hidden_size"": 896, ""intermediate_size"": 4864, ""k"": 0, ""m"": 128, ""mode"": ""prefill"", ""mode_id"": 1, ""model_id"": ""Qwen/Qwen2.5-0.5B"", ""n"": 896, ""num_attention_heads"": 14, ""num_key_value_heads"": 2, ""role"": ""rmsnorm"", ""role_id"": 1, ""seq_len"": 128}","{""block_size"": 4096, ""num_stages"": 3, ""num_warps"": 2}",0.004991999827325344,91.89743907619365,5.299918682505287,0.00186920166015625
QWEN,rmsnorm,qwen05b_rmsnorm_prefill_m128_n896_seq128_ctx128,128,896,0,39,4096,2,4,"{""ctx_len"": 128, ""dtype"": ""bfloat16"", ""family"": ""rmsnorm"", ""family_group"": ""QWEN"", ""head_dim"": 64, ""hidden_size"": 896, ""intermediate_size"": 4864, ""k"": 0, ""m"": 128, ""mode"": ""prefill"", ""mode_id"": 1, ""model_id"": ""Qwen/Qwen2.5-0.5B"", ""n"": 896, ""num_attention_heads"": 14, ""num_key_value_heads"": 2, ""role"": ""rmsnorm"", ""role_id"": 1, ""seq_len"": 128}","{""block_size"": 4096, ""num_stages"": 4, ""num_warps"": 2}",0.004991999827325344,91.89743907619365,5.299918682505287,0.00186920166015625
QWEN,rmsnorm,qwen05b_rmsnorm_prefill_m128_n896_seq128_ctx128,128,896,0,40,4096,4,1,"{""ctx_len"": 128, ""dtype"": ""bfloat16"", ""family"": ""rmsnorm"", ""family_group"": ""QWEN"", ""head_dim"": 64, ""hidden_size"": 896, ""intermediate_size"": 4864, ""k"": 0, ""m"": 128, ""mode"": ""prefill"", ""mode_id"": 1, ""model_id"": ""Qwen/Qwen2.5-0.5B"", ""n"": 896, ""num_attention_heads"": 14, ""num_key_value_heads"": 2, ""role"": ""rmsnorm"", ""role_id"": 1, ""seq_len"": 128}","{""block_size"": 4096, ""num_stages"": 1, ""num_warps"": 4}",0.004896000027656555,93.69934587593931,5.3193367281233055,0.00186920166015625
QWEN,rmsnorm,qwen05b_rmsnorm_prefill_m128_n896_seq128_ctx128,128,896,0,41,4096,4,2,"{""ctx_len"": 128, ""dtype"": ""bfloat16"", ""family"": ""rmsnorm"", ""family_group"": ""QWEN"", ""head_dim"": 64, ""hidden_size"": 896, ""intermediate_size"": 4864, ""k"": 0, ""m"": 128, ""mode"": ""prefill"", ""mode_id"": 1, ""model_id"": ""Qwen/Qwen2.5-0.5B"", ""n"": 896, ""num_attention_heads"": 14, ""num_key_value_heads"": 2, ""role"": ""rmsnorm"", ""role_id"": 1, ""seq_len"": 128}","{""block_size"": 4096, ""num_stages"": 2, ""num_warps"": 4}",0.004896000027656555,93.69934587593931,5.3193367281233055,0.00186920166015625
QWEN,rmsnorm,qwen05b_rmsnorm_prefill_m128_n896_seq128_ctx128,128,896,0,42,4096,4,3,"{""ctx_len"": 128, ""dtype"": ""bfloat16"", ""family"": ""rmsnorm"", ""family_group"": ""QWEN"", ""head_dim"": 64, ""hidden_size"": 896, ""intermediate_size"": 4864, ""k"": 0, ""m"": 128, ""mode"": ""prefill"", ""mode_id"": 1, ""model_id"": ""Qwen/Qwen2.5-0.5B"", ""n"": 896, ""num_attention_heads"": 14, ""num_key_value_heads"": 2, ""role"": ""rmsnorm"", ""role_id"": 1, ""seq_len"": 128}","{""block_size"": 4096, ""num_stages"": 3, ""num_warps"": 4}",0.004896000027656555,93.69934587593931,5.3193367281233055,0.00186920166015625
QWEN,rmsnorm,qwen05b_rmsnorm_prefill_m128_n896_seq128_ctx128,128,896,0,43,4096,4,4,"{""ctx_len"": 128, ""dtype"": ""bfloat16"", ""family"": ""rmsnorm"", ""family_group"": ""QWEN"", ""head_dim"": 64, ""hidden_size"": 896, ""intermediate_size"": 4864, ""k"": 0, ""m"": 128, ""mode"": ""prefill"", ""mode_id"": 1, ""model_id"": ""Qwen/Qwen2.5-0.5B"", ""n"": 896, ""num_attention_heads"": 14, ""num_key_value_heads"": 2, ""role"": ""rmsnorm"", ""role_id"": 1, ""seq_len"": 128}","{""block_size"": 4096, ""num_stages"": 4, ""num_warps"": 4}",0.004896000027656555,93.69934587593931,5.3193367281233055,0.00186920166015625
QWEN,rmsnorm,qwen05b_rmsnorm_prefill_m128_n896_seq128_ctx128,128,896,0,44,4096,8,1,"{""ctx_len"": 128, ""dtype"": ""bfloat16"", ""family"": ""rmsnorm"", ""family_group"": ""QWEN"", ""head_dim"": 64, ""hidden_size"": 896, ""intermediate_size"": 4864, ""k"": 0, ""m"": 128, ""mode"": ""prefill"", ""mode_id"": 1, ""model_id"": ""Qwen/Qwen2.5-0.5B"", ""n"": 896, ""num_attention_heads"": 14, ""num_key_value_heads"": 2, ""role"": ""rmsnorm"", ""role_id"": 1, ""seq_len"": 128}","{""block_size"": 4096, ""num_stages"": 1, ""num_warps"": 8}",0.004896000027656555,93.69934587593931,5.3193367281233055,0.00186920166015625
QWEN,rmsnorm,qwen05b_rmsnorm_prefill_m128_n896_seq128_ctx128,128,896,0,45,4096,8,2,"{""ctx_len"": 128, ""dtype"": ""bfloat16"", ""family"": ""rmsnorm"", ""family_group"": ""QWEN"", ""head_dim"": 64, ""hidden_size"": 896, ""intermediate_size"": 4864, ""k"": 0, ""m"": 128, ""mode"": ""prefill"", ""mode_id"": 1, ""model_id"": ""Qwen/Qwen2.5-0.5B"", ""n"": 896, ""num_attention_heads"": 14, ""num_key_value_heads"": 2, ""role"": ""rmsnorm"", ""role_id"": 1, ""seq_len"": 128}","{""block_size"": 4096, ""num_stages"": 2, ""num_warps"": 8}",0.004896000027656555,93.69934587593931,5.3193367281233055,0.00186920166015625
QWEN,rmsnorm,qwen05b_rmsnorm_prefill_m128_n896_seq128_ctx128,128,896,0,46,4096,8,3,"{""ctx_len"": 128, ""dtype"": ""bfloat16"", ""family"": ""rmsnorm"", ""family_group"": ""QWEN"", ""head_dim"": 64, ""hidden_size"": 896, ""intermediate_size"": 4864, ""k"": 0, ""m"": 128, ""mode"": ""prefill"", ""mode_id"": 1, ""model_id"": ""Qwen/Qwen2.5-0.5B"", ""n"": 896, ""num_attention_heads"": 14, ""num_key_value_heads"": 2, ""role"": ""rmsnorm"", ""role_id"": 1, ""seq_len"": 128}","{""block_size"": 4096, ""num_stages"": 3, ""num_warps"": 8}",0.004896000027656555,93.69934587593931,5.3193367281233055,0.00186920166015625
QWEN,rmsnorm,qwen05b_rmsnorm_prefill_m128_n896_seq128_ctx128,128,896,0,47,4096,8,4,"{""ctx_len"": 128, ""dtype"": ""bfloat16"", ""family"": ""rmsnorm"", ""family_group"": ""QWEN"", ""head_dim"": 64, ""hidden_size"": 896, ""intermediate_size"": 4864, ""k"": 0, ""m"": 128, ""mode"": ""prefill"", ""mode_id"": 1, ""model_id"": ""Qwen/Qwen2.5-0.5B"", ""n"": 896, ""num_attention_heads"": 14, ""num_key_value_heads"": 2, ""role"": ""rmsnorm"", ""role_id"": 1, ""seq_len"": 128}","{""block_size"": 4096, ""num_stages"": 4, ""num_warps"": 8}",0.004896000027656555,93.69934587593931,5.3193367281233055,0.00186920166015625
QWEN,rmsnorm,qwen05b_rmsnorm_prefill_m128_n896_seq128_ctx128,128,896,0,48,8192,1,1,"{""ctx_len"": 128, ""dtype"": ""bfloat16"", ""family"": ""rmsnorm"", ""family_group"": ""QWEN"", ""head_dim"": 64, ""hidden_size"": 896, ""intermediate_size"": 4864, ""k"": 0, ""m"": 128, ""mode"": ""prefill"", ""mode_id"": 1, ""model_id"": ""Qwen/Qwen2.5-0.5B"", ""n"": 896, ""num_attention_heads"": 14, ""num_key_value_heads"": 2, ""role"": ""rmsnorm"", ""role_id"": 1, ""seq_len"": 128}","{""block_size"": 8192, ""num_stages"": 1, ""num_warps"": 1}",0.005727999843657017,80.08938766086135,5.162388876618309,0.00186920166015625
QWEN,rmsnorm,qwen05b_rmsnorm_prefill_m128_n896_seq128_ctx128,128,896,0,49,8192,1,2,"{""ctx_len"": 128, ""dtype"": ""bfloat16"", ""family"": ""rmsnorm"", ""family_group"": ""QWEN"", ""head_dim"": 64, ""hidden_size"": 896, ""intermediate_size"": 4864, ""k"": 0, ""m"": 128, ""mode"": ""prefill"", ""mode_id"": 1, ""model_id"": ""Qwen/Qwen2.5-0.5B"", ""n"": 896, ""num_attention_heads"": 14, ""num_key_value_heads"": 2, ""role"": ""rmsnorm"", ""role_id"": 1, ""seq_len"": 128}","{""block_size"": 8192, ""num_stages"": 2, ""num_warps"": 1}",0.005727999843657017,80.08938766086135,5.162388876618309,0.00186920166015625
QWEN,rmsnorm,qwen05b_rmsnorm_prefill_m128_n896_seq128_ctx128,128,896,0,50,8192,1,3,"{""ctx_len"": 128, ""dtype"": ""bfloat16"", ""family"": ""rmsnorm"", ""family_group"": ""QWEN"", ""head_dim"": 64, ""hidden_size"": 896, ""intermediate_size"": 4864, ""k"": 0, ""m"": 128, ""mode"": ""prefill"", ""mode_id"": 1, ""model_id"": ""Qwen/Qwen2.5-0.5B"", ""n"": 896, ""num_attention_heads"": 14, ""num_key_value_heads"": 2, ""role"": ""rmsnorm"", ""role_id"": 1, ""seq_len"": 128}","{""block_size"": 8192, ""num_stages"": 3, ""num_warps"": 1}",0.005727999843657017,80.08938766086135,5.162388876618309,0.00186920166015625
QWEN,rmsnorm,qwen05b_rmsnorm_prefill_m128_n896_seq128_ctx128,128,896,0,51,8192,1,4,"{""ctx_len"": 128, ""dtype"": ""bfloat16"", ""family"": ""rmsnorm"", ""family_group"": ""QWEN"", ""head_dim"": 64, ""hidden_size"": 896, ""intermediate_size"": 4864, ""k"": 0, ""m"": 128, ""mode"": ""prefill"", ""mode_id"": 1, ""model_id"": ""Qwen/Qwen2.5-0.5B"", ""n"": 896, ""num_attention_heads"": 14, ""num_key_value_heads"": 2, ""role"": ""rmsnorm"", ""role_id"": 1, ""seq_len"": 128}","{""block_size"": 8192, ""num_stages"": 4, ""num_warps"": 1}",0.005727999843657017,80.08938766086135,5.162388876618309,0.00186920166015625
QWEN,rmsnorm,qwen05b_rmsnorm_prefill_m128_n896_seq128_ctx128,128,896,0,52,8192,2,1,"{""ctx_len"": 128, ""dtype"": ""bfloat16"", ""family"": ""rmsnorm"", ""family_group"": ""QWEN"", ""head_dim"": 64, ""hidden_size"": 896, ""intermediate_size"": 4864, ""k"": 0, ""m"": 128, ""mode"": ""prefill"", ""mode_id"": 1, ""model_id"": ""Qwen/Qwen2.5-0.5B"", ""n"": 896, ""num_attention_heads"": 14, ""num_key_value_heads"": 2, ""role"": ""rmsnorm"", ""role_id"": 1, ""seq_len"": 128}","{""block_size"": 8192, ""num_stages"": 1, ""num_warps"": 2}",0.005183999892324209,88.49382899858082,5.262178340702957,0.00186920166015625
QWEN,rmsnorm,qwen05b_rmsnorm_prefill_m128_n896_seq128_ctx128,128,896,0,53,8192,2,2,"{""ctx_len"": 128, ""dtype"": ""bfloat16"", ""family"": ""rmsnorm"", ""family_group"": ""QWEN"", ""head_dim"": 64, ""hidden_size"": 896, ""intermediate_size"": 4864, ""k"": 0, ""m"": 128, ""mode"": ""prefill"", ""mode_id"": 1, ""model_id"": ""Qwen/Qwen2.5-0.5B"", ""n"": 896, ""num_attention_heads"": 14, ""num_key_value_heads"": 2, ""role"": ""rmsnorm"", ""role_id"": 1, ""seq_len"": 128}","{""block_size"": 8192, ""num_stages"": 2, ""num_warps"": 2}",0.005183999892324209,88.49382899858082,5.262178340702957,0.00186920166015625
QWEN,rmsnorm,qwen05b_rmsnorm_prefill_m128_n896_seq128_ctx128,128,896,0,54,8192,2,3,"{""ctx_len"": 128, ""dtype"": ""bfloat16"", ""family"": ""rmsnorm"", ""family_group"": ""QWEN"", ""head_dim"": 64, ""hidden_size"": 896, ""intermediate_size"": 4864, ""k"": 0, ""m"": 128, ""mode"": ""prefill"", ""mode_id"": 1, ""model_id"": ""Qwen/Qwen2.5-0.5B"", ""n"": 896, ""num_attention_heads"": 14, ""num_key_value_heads"": 2, ""role"": ""rmsnorm"", ""role_id"": 1, ""seq_len"": 128}","{""block_size"": 8192, ""num_stages"": 3, ""num_warps"": 2}",0.005183999892324209,88.49382899858082,5.262178340702957,0.00186920166015625
QWEN,rmsnorm,qwen05b_rmsnorm_prefill_m128_n896_seq128_ctx128,128,896,0,55,8192,2,4,"{""ctx_len"": 128, ""dtype"": ""bfloat16"", ""family"": ""rmsnorm"", ""family_group"": ""QWEN"", ""head_dim"": 64, ""hidden_size"": 896, ""intermediate_size"": 4864, ""k"": 0, ""m"": 128, ""mode"": ""prefill"", ""mode_id"": 1, ""model_id"": ""Qwen/Qwen2.5-0.5B"", ""n"": 896, ""num_attention_heads"": 14, ""num_key_value_heads"": 2, ""role"": ""rmsnorm"", ""role_id"": 1, ""seq_len"": 128}","{""block_size"": 8192, ""num_stages"": 4, ""num_warps"": 2}",0.005183999892324209,88.49382899858082,5.262178340702957,0.00186920166015625
QWEN,rmsnorm,qwen05b_rmsnorm_prefill_m128_n896_seq128_ctx128,128,896,0,56,8192,4,1,"{""ctx_len"": 128, ""dtype"": ""bfloat16"", ""family"": ""rmsnorm"", ""family_group"": ""QWEN"", ""head_dim"": 64, ""hidden_size"": 896, ""intermediate_size"": 4864, ""k"": 0, ""m"": 128, ""mode"": ""prefill"", ""mode_id"": 1, ""model_id"": ""Qwen/Qwen2.5-0.5B"", ""n"": 896, ""num_attention_heads"": 14, ""num_key_value_heads"": 2, ""role"": ""rmsnorm"", ""role_id"": 1, ""seq_len"": 128}","{""block_size"": 8192, ""num_stages"": 1, ""num_warps"": 4}",0.004991999827325344,91.89743907619365,5.299918682505287,0.00186920166015625
QWEN,rmsnorm,qwen05b_rmsnorm_prefill_m128_n896_seq128_ctx128,128,896,0,57,8192,4,2,"{""ctx_len"": 128, ""dtype"": ""bfloat16"", ""family"": ""rmsnorm"", ""family_group"": ""QWEN"", ""head_dim"": 64, ""hidden_size"": 896, ""intermediate_size"": 4864, ""k"": 0, ""m"": 128, ""mode"": ""prefill"", ""mode_id"": 1, ""model_id"": ""Qwen/Qwen2.5-0.5B"", ""n"": 896, ""num_attention_heads"": 14, ""num_key_value_heads"": 2, ""role"": ""rmsnorm"", ""role_id"": 1, ""seq_len"": 128}","{""block_size"": 8192, ""num_stages"": 2, ""num_warps"": 4}",0.004991999827325344,91.89743907619365,5.299918682505287,0.00186920166015625
QWEN,rmsnorm,qwen05b_rmsnorm_prefill_m128_n896_seq128_ctx128,128,896,0,58,8192,4,3,"{""ctx_len"": 128, ""dtype"": ""bfloat16"", ""family"": ""rmsnorm"", ""family_group"": ""QWEN"", ""head_dim"": 64, ""hidden_size"": 896, ""intermediate_size"": 4864, ""k"": 0, ""m"": 128, ""mode"": ""prefill"", ""mode_id"": 1, ""model_id"": ""Qwen/Qwen2.5-0.5B"", ""n"": 896, ""num_attention_heads"": 14, ""num_key_value_heads"": 2, ""role"": ""rmsnorm"", ""role_id"": 1, ""seq_len"": 128}","{""block_size"": 8192, ""num_stages"": 3, ""num_warps"": 4}",0.004991999827325344,91.89743907619365,5.299918682505287,0.00186920166015625
QWEN,rmsnorm,qwen05b_rmsnorm_prefill_m128_n896_seq128_ctx128,128,896,0,59,8192,4,4,"{""ctx_len"": 128, ""dtype"": ""bfloat16"", ""family"": ""rmsnorm"", ""family_group"": ""QWEN"", ""head_dim"": 64, ""hidden_size"": 896, ""intermediate_size"": 4864, ""k"": 0, ""m"": 128, ""mode"": ""prefill"", ""mode_id"": 1, ""model_id"": ""Qwen/Qwen2.5-0.5B"", ""n"": 896, ""num_attention_heads"": 14, ""num_key_value_heads"": 2, ""role"": ""rmsnorm"", ""role_id"": 1, ""seq_len"": 128}","{""block_size"": 8192, ""num_stages"": 4, ""num_warps"": 4}",0.004991999827325344,91.89743907619365,5.299918682505287,0.00186920166015625
QWEN,rmsnorm,qwen05b_rmsnorm_prefill_m128_n896_seq128_ctx128,128,896,0,60,8192,8,1,"{""ctx_len"": 128, ""dtype"": ""bfloat16"", ""family"": ""rmsnorm"", ""family_group"": ""QWEN"", ""head_dim"": 64, ""hidden_size"": 896, ""intermediate_size"": 4864, ""k"": 0, ""m"": 128, ""mode"": ""prefill"", ""mode_id"": 1, ""model_id"": ""Qwen/Qwen2.5-0.5B"", ""n"": 896, ""num_attention_heads"": 14, ""num_key_value_heads"": 2, ""role"": ""rmsnorm"", ""role_id"": 1, ""seq_len"": 128}","{""block_size"": 8192, ""num_stages"": 1, ""num_warps"": 8}",0.0049600000493228436,92.49032166091014,5.30634952830118,0.00186920166015625
QWEN,rmsnorm,qwen05b_rmsnorm_prefill_m128_n896_seq128_ctx128,128,896,0,61,8192,8,2,"{""ctx_len"": 128, ""dtype"": ""bfloat16"", ""family"": ""rmsnorm"", ""family_group"": ""QWEN"", ""head_dim"": 64, ""hidden_size"": 896, ""intermediate_size"": 4864, ""k"": 0, ""m"": 128, ""mode"": ""prefill"", ""mode_id"": 1, ""model_id"": ""Qwen/Qwen2.5-0.5B"", ""n"": 896, ""num_attention_heads"": 14, ""num_key_value_heads"": 2, ""role"": ""rmsnorm"", ""role_id"": 1, ""seq_len"": 128}","{""block_size"": 8192, ""num_stages"": 2, ""num_warps"": 8}",0.0049600000493228436,92.49032166091014,5.30634952830118,0.00186920166015625
QWEN,rmsnorm,qwen05b_rmsnorm_prefill_m128_n896_seq128_ctx128,128,896,0,62,8192,8,3,"{""ctx_len"": 128, ""dtype"": ""bfloat16"", ""family"": ""rmsnorm"", ""family_group"": ""QWEN"", ""head_dim"": 64, ""hidden_size"": 896, ""intermediate_size"": 4864, ""k"": 0, ""m"": 128, ""mode"": ""prefill"", ""mode_id"": 1, ""model_id"": ""Qwen/Qwen2.5-0.5B"", ""n"": 896, ""num_attention_heads"": 14, ""num_key_value_heads"": 2, ""role"": ""rmsnorm"", ""role_id"": 1, ""seq_len"": 128}","{""block_size"": 8192, ""num_stages"": 3, ""num_warps"": 8}",0.0049600000493228436,92.49032166091014,5.30634952830118,0.00186920166015625
QWEN,rmsnorm,qwen05b_rmsnorm_prefill_m128_n896_seq128_ctx128,128,896,0,63,8192,8,4,"{""ctx_len"": 128, ""dtype"": ""bfloat16"", ""family"": ""rmsnorm"", ""family_group"": ""QWEN"", ""head_dim"": 64, ""hidden_size"": 896, ""intermediate_size"": 4864, ""k"": 0, ""m"": 128, ""mode"": ""prefill"", ""mode_id"": 1, ""model_id"": ""Qwen/Qwen2.5-0.5B"", ""n"": 896, ""num_attention_heads"": 14, ""num_key_value_heads"": 2, ""role"": ""rmsnorm"", ""role_id"": 1, ""seq_len"": 128}","{""block_size"": 8192, ""num_stages"": 4, ""num_warps"": 8}",0.0049600000493228436,92.49032166091014,5.30634952830118,0.00186920166015625
QWEN,softmax,qwen05b_attn_softmax_prefill_m1792_n128_seq128_ctx128,1792,128,0,0,256,1,1,"{""ctx_len"": 128, ""dtype"": ""bfloat16"", ""family"": ""softmax"", ""family_group"": ""QWEN"", ""head_dim"": 64, ""hidden_size"": 896, ""intermediate_size"": 4864, ""k"": 0, ""m"": 1792, ""mode"": ""prefill"", ""mode_id"": 1, ""model_id"": ""Qwen/Qwen2.5-0.5B"", ""n"": 128, ""num_attention_heads"": 14, ""num_key_value_heads"": 2, ""role"": ""attn_softmax"", ""role_id"": 2, ""seq_len"": 128}","{""block_size"": 256, ""num_stages"": 1, ""num_warps"": 1}",0.005504000000655651,166.69767439874718,5.202280178231971,3.0517578125e-05
QWEN,softmax,qwen05b_attn_softmax_prefill_m1792_n128_seq128_ctx128,1792,128,0,1,256,1,2,"{""ctx_len"": 128, ""dtype"": ""bfloat16"", ""family"": ""softmax"", ""family_group"": ""QWEN"", ""head_dim"": 64, ""hidden_size"": 896, ""intermediate_size"": 4864, ""k"": 0, ""m"": 1792, ""mode"": ""prefill"", ""mode_id"": 1, ""model_id"": ""Qwen/Qwen2.5-0.5B"", ""n"": 128, ""num_attention_heads"": 14, ""num_key_value_heads"": 2, ""role"": ""attn_softmax"", ""role_id"": 2, ""seq_len"": 128}","{""block_size"": 256, ""num_stages"": 2, ""num_warps"": 1}",0.005504000000655651,166.69767439874718,5.202280178231971,3.0517578125e-05
QWEN,softmax,qwen05b_attn_softmax_prefill_m1792_n128_seq128_ctx128,1792,128,0,2,256,1,3,"{""ctx_len"": 128, ""dtype"": ""bfloat16"", ""family"": ""softmax"", ""family_group"": ""QWEN"", ""head_dim"": 64, ""hidden_size"": 896, ""intermediate_size"": 4864, ""k"": 0, ""m"": 1792, ""mode"": ""prefill"", ""mode_id"": 1, ""model_id"": ""Qwen/Qwen2.5-0.5B"", ""n"": 128, ""num_attention_heads"": 14, ""num_key_value_heads"": 2, ""role"": ""attn_softmax"", ""role_id"": 2, ""seq_len"": 128}","{""block_size"": 256, ""num_stages"": 3, ""num_warps"": 1}",0.005504000000655651,166.69767439874718,5.202280178231971,3.0517578125e-05
QWEN,softmax,qwen05b_attn_softmax_prefill_m1792_n128_seq128_ctx128,1792,128,0,3,256,1,4,"{""ctx_len"": 128, ""dtype"": ""bfloat16"", ""family"": ""softmax"", ""family_group"": ""QWEN"", ""head_dim"": 64, ""hidden_size"": 896, ""intermediate_size"": 4864, ""k"": 0, ""m"": 1792, ""mode"": ""prefill"", ""mode_id"": 1, ""model_id"": ""Qwen/Qwen2.5-0.5B"", ""n"": 128, ""num_attention_heads"": 14, ""num_key_value_heads"": 2, ""role"": ""attn_softmax"", ""role_id"": 2, ""seq_len"": 128}","{""block_size"": 256, ""num_stages"": 4, ""num_warps"": 1}",0.005504000000655651,166.69767439874718,5.202280178231971,3.0517578125e-05
QWEN,softmax,qwen05b_attn_softmax_prefill_m1792_n128_seq128_ctx128,1792,128,0,4,256,2,1,"{""ctx_len"": 128, ""dtype"": ""bfloat16"", ""family"": ""softmax"", ""family_group"": ""QWEN"", ""head_dim"": 64, ""hidden_size"": 896, ""intermediate_size"": 4864, ""k"": 0, ""m"": 1792, ""mode"": ""prefill"", ""mode_id"": 1, ""model_id"": ""Qwen/Qwen2.5-0.5B"", ""n"": 128, ""num_attention_heads"": 14, ""num_key_value_heads"": 2, ""role"": ""attn_softmax"", ""role_id"": 2, ""seq_len"": 128}","{""block_size"": 256, ""num_stages"": 1, ""num_warps"": 2}",0.005632000043988228,162.90908963670415,5.179290652315986,3.0517578125e-05
QWEN,softmax,qwen05b_attn_softmax_prefill_m1792_n128_seq128_ctx128,1792,128,0,5,256,2,2,"{""ctx_len"": 128, ""dtype"": ""bfloat16"", ""family"": ""softmax"", ""family_group"": ""QWEN"", ""head_dim"": 64, ""hidden_size"": 896, ""intermediate_size"": 4864, ""k"": 0, ""m"": 1792, ""mode"": ""prefill"", ""mode_id"": 1, ""model_id"": ""Qwen/Qwen2.5-0.5B"", ""n"": 128, ""num_attention_heads"": 14, ""num_key_value_heads"": 2, ""role"": ""attn_softmax"", ""role_id"": 2, ""seq_len"": 128}","{""block_size"": 256, ""num_stages"": 2, ""num_warps"": 2}",0.00559999980032444,163.8400058419366,5.184988716897384,3.0517578125e-05
QWEN,softmax,qwen05b_attn_softmax_prefill_m1792_n128_seq128_ctx128,1792,128,0,6,256,2,3,"{""ctx_len"": 128, ""dtype"": ""bfloat16"", ""family"": ""softmax"", ""family_group"": ""QWEN"", ""head_dim"": 64, ""hidden_size"": 896, ""intermediate_size"": 4864, ""k"": 0, ""m"": 1792, ""mode"": ""prefill"", ""mode_id"": 1, ""model_id"": ""Qwen/Qwen2.5-0.5B"", ""n"": 128, ""num_attention_heads"": 14, ""num_key_value_heads"": 2, ""role"": ""attn_softmax"", ""role_id"": 2, ""seq_len"": 128}","{""block_size"": 256, ""num_stages"": 3, ""num_warps"": 2}",0.005632000043988228,162.90908963670415,5.179290652315986,3.0517578125e-05
QWEN,softmax,qwen05b_attn_softmax_prefill_m1792_n128_seq128_ctx128,1792,128,0,7,256,2,4,"{""ctx_len"": 128, ""dtype"": ""bfloat16"", ""family"": ""softmax"", ""family_group"": ""QWEN"", ""head_dim"": 64, ""hidden_size"": 896, ""intermediate_size"": 4864, ""k"": 0, ""m"": 1792, ""mode"": ""prefill"", ""mode_id"": 1, ""model_id"": ""Qwen/Qwen2.5-0.5B"", ""n"": 128, ""num_attention_heads"": 14, ""num_key_value_heads"": 2, ""role"": ""attn_softmax"", ""role_id"": 2, ""seq_len"": 128}","{""block_size"": 256, ""num_stages"": 4, ""num_warps"": 2}",0.005632000043988228,162.90908963670415,5.179290652315986,3.0517578125e-05
QWEN,softmax,qwen05b_attn_softmax_prefill_m1792_n128_seq128_ctx128,1792,128,0,8,256,4,1,"{""ctx_len"": 128, ""dtype"": ""bfloat16"", ""family"": ""softmax"", ""family_group"": ""QWEN"", ""head_dim"": 64, ""hidden_size"": 896, ""intermediate_size"": 4864, ""k"": 0, ""m"": 1792, ""mode"": ""prefill"", ""mode_id"": 1, ""model_id"": ""Qwen/Qwen2.5-0.5B"", ""n"": 128, ""num_attention_heads"": 14, ""num_key_value_heads"": 2, ""role"": ""attn_softmax"", ""role_id"": 2, ""seq_len"": 128}","{""block_size"": 256, ""num_stages"": 1, ""num_warps"": 4}",0.005727999843657017,160.1787753217227,5.162388876618309,3.0517578125e-05
QWEN,softmax,qwen05b_attn_softmax_prefill_m1792_n128_seq128_ctx128,1792,128,0,9,256,4,2,"{""ctx_len"": 128, ""dtype"": ""bfloat16"", ""family"": ""softmax"", ""family_group"": ""QWEN"", ""head_dim"": 64, ""hidden_size"": 896, ""intermediate_size"": 4864, ""k"": 0, ""m"": 1792, ""mode"": ""prefill"", ""mode_id"": 1, ""model_id"": ""Qwen/Qwen2.5-0.5B"", ""n"": 128, ""num_attention_heads"": 14, ""num_key_value_heads"": 2, ""role"": ""attn_softmax"", ""role_id"": 2, ""seq_len"": 128}","{""block_size"": 256, ""num_stages"": 2, ""num_warps"": 4}",0.005727999843657017,160.1787753217227,5.162388876618309,3.0517578125e-05
QWEN,softmax,qwen05b_attn_softmax_prefill_m1792_n128_seq128_ctx128,1792,128,0,10,256,4,3,"{""ctx_len"": 128, ""dtype"": ""bfloat16"", ""family"": ""softmax"", ""family_group"": ""QWEN"", ""head_dim"": 64, ""hidden_size"": 896, ""intermediate_size"": 4864, ""k"": 0, ""m"": 1792, ""mode"": ""prefill"", ""mode_id"": 1, ""model_id"": ""Qwen/Qwen2.5-0.5B"", ""n"": 128, ""num_attention_heads"": 14, ""num_key_value_heads"": 2, ""role"": ""attn_softmax"", ""role_id"": 2, ""seq_len"": 128}","{""block_size"": 256, ""num_stages"": 3, ""num_warps"": 4}",0.005696000065654516,161.0786498287323,5.167991093346037,3.0517578125e-05
QWEN,softmax,qwen05b_attn_softmax_prefill_m1792_n128_seq128_ctx128,1792,128,0,11,256,4,4,"{""ctx_len"": 128, ""dtype"": ""bfloat16"", ""family"": ""softmax"", ""family_group"": ""QWEN"", ""head_dim"": 64, ""hidden_size"": 896, ""intermediate_size"": 4864, ""k"": 0, ""m"": 1792, ""mode"": ""prefill"", ""mode_id"": 1, ""model_id"": ""Qwen/Qwen2.5-0.5B"", ""n"": 128, ""num_attention_heads"": 14, ""num_key_value_heads"": 2, ""role"": ""attn_softmax"", ""role_id"": 2, ""seq_len"": 128}","{""block_size"": 256, ""num_stages"": 4, ""num_warps"": 4}",0.005696000065654516,161.0786498287323,5.167991093346037,3.0517578125e-05
QWEN,softmax,qwen05b_attn_softmax_prefill_m1792_n128_seq128_ctx128,1792,128,0,12,256,8,1,"{""ctx_len"": 128, ""dtype"": ""bfloat16"", ""family"": ""softmax"", ""family_group"": ""QWEN"", ""head_dim"": 64, ""hidden_size"": 896, ""intermediate_size"": 4864, ""k"": 0, ""m"": 1792, ""mode"": ""prefill"", ""mode_id"": 1, ""model_id"": ""Qwen/Qwen2.5-0.5B"", ""n"": 128, ""num_attention_heads"": 14, ""num_key_value_heads"": 2, ""role"": ""attn_softmax"", ""role_id"": 2, ""seq_len"": 128}","{""block_size"": 256, ""num_stages"": 1, ""num_warps"": 8}",0.006527999881654978,140.54902215583292,5.031654679449164,3.0517578125e-05
QWEN,softmax,qwen05b_attn_softmax_prefill_m1792_n128_seq128_ctx128,1792,128,0,13,256,8,2,"{""ctx_len"": 128, ""dtype"": ""bfloat16"", ""family"": ""softmax"", ""family_group"": ""QWEN"", ""head_dim"": 64, ""hidden_size"": 896, ""intermediate_size"": 4864, ""k"": 0, ""m"": 1792, ""mode"": ""prefill"", ""mode_id"": 1, ""model_id"": ""Qwen/Qwen2.5-0.5B"", ""n"": 128, ""num_attention_heads"": 14, ""num_key_value_heads"": 2, ""role"": ""attn_softmax"", ""role_id"": 2, ""seq_len"": 128}","{""block_size"": 256, ""num_stages"": 2, ""num_warps"": 8}",0.006527999881654978,140.54902215583292,5.031654679449164,3.0517578125e-05
QWEN,softmax,qwen05b_attn_softmax_prefill_m1792_n128_seq128_ctx128,1792,128,0,14,256,8,3,"{""ctx_len"": 128, ""dtype"": ""bfloat16"", ""family"": ""softmax"", ""family_group"": ""QWEN"", ""head_dim"": 64, ""hidden_size"": 896, ""intermediate_size"": 4864, ""k"": 0, ""m"": 1792, ""mode"": ""prefill"", ""mode_id"": 1, ""model_id"": ""Qwen/Qwen2.5-0.5B"", ""n"": 128, ""num_attention_heads"": 14, ""num_key_value_heads"": 2, ""role"": ""attn_softmax"", ""role_id"": 2, ""seq_len"": 128}","{""block_size"": 256, ""num_stages"": 3, ""num_warps"": 8}",0.006527999881654978,140.54902215583292,5.031654679449164,3.0517578125e-05
QWEN,softmax,qwen05b_attn_softmax_prefill_m1792_n128_seq128_ctx128,1792,128,0,15,256,8,4,"{""ctx_len"": 128, ""dtype"": ""bfloat16"", ""family"": ""softmax"", ""family_group"": ""QWEN"", ""head_dim"": 64, ""hidden_size"": 896, ""intermediate_size"": 4864, ""k"": 0, ""m"": 1792, ""mode"": ""prefill"", ""mode_id"": 1, ""model_id"": ""Qwen/Qwen2.5-0.5B"", ""n"": 128, ""num_attention_heads"": 14, ""num_key_value_heads"": 2, ""role"": ""attn_softmax"", ""role_id"": 2, ""seq_len"": 128}","{""block_size"": 256, ""num_stages"": 4, ""num_warps"": 8}",0.006527999881654978,140.54902215583292,5.031654679449164,3.0517578125e-05
QWEN,softmax,qwen05b_attn_softmax_prefill_m1792_n128_seq128_ctx128,1792,128,0,16,512,1,1,"{""ctx_len"": 128, ""dtype"": ""bfloat16"", ""family"": ""softmax"", ""family_group"": ""QWEN"", ""head_dim"": 64, ""hidden_size"": 896, ""intermediate_size"": 4864, ""k"": 0, ""m"": 1792, ""mode"": ""prefill"", ""mode_id"": 1, ""model_id"": ""Qwen/Qwen2.5-0.5B"", ""n"": 128, ""num_attention_heads"": 14, ""num_key_value_heads"": 2, ""role"": ""attn_softmax"", ""role_id"": 2, ""seq_len"": 128}","{""block_size"": 512, ""num_stages"": 1, ""num_warps"": 1}",0.0055680000223219395,164.78160853479795,5.190719351941049,3.0517578125e-05
QWEN,softmax,qwen05b_attn_softmax_prefill_m1792_n128_seq128_ctx128,1792,128,0,17,512,1,2,"{""ctx_len"": 128, ""dtype"": ""bfloat16"", ""family"": ""softmax"", ""family_group"": ""QWEN"", ""head_dim"": 64, ""hidden_size"": 896, ""intermediate_size"": 4864, ""k"": 0, ""m"": 1792, ""mode"": ""prefill"", ""mode_id"": 1, ""model_id"": ""Qwen/Qwen2.5-0.5B"", ""n"": 128, ""num_attention_heads"": 14, ""num_key_value_heads"": 2, ""role"": ""attn_softmax"", ""role_id"": 2, ""seq_len"": 128}","{""block_size"": 512, ""num_stages"": 2, ""num_warps"": 1}",0.0055680000223219395,164.78160853479795,5.190719351941049,3.0517578125e-05
QWEN,softmax,qwen05b_attn_softmax_prefill_m1792_n128_seq128_ctx128,1792,128,0,18,512,1,3,"{""ctx_len"": 128, ""dtype"": ""bfloat16"", ""family"": ""softmax"", ""family_group"": ""QWEN"", ""head_dim"": 64, ""hidden_size"": 896, ""intermediate_size"": 4864, ""k"": 0, ""m"": 1792, ""mode"": ""prefill"", ""mode_id"": 1, ""model_id"": ""Qwen/Qwen2.5-0.5B"", ""n"": 128, ""num_attention_heads"": 14, ""num_key_value_heads"": 2, ""role"": ""attn_softmax"", ""role_id"": 2, ""seq_len"": 128}","{""block_size"": 512, ""num_stages"": 3, ""num_warps"": 1}",0.0055680000223219395,164.78160853479795,5.190719351941049,3.0517578125e-05
QWEN,softmax,qwen05b_attn_softmax_prefill_m1792_n128_seq128_ctx128,1792,128,0,19,512,1,4,"{""ctx_len"": 128, ""dtype"": ""bfloat16"", ""family"": ""softmax"", ""family_group"": ""QWEN"", ""head_dim"": 64, ""hidden_size"": 896, ""intermediate_size"": 4864, ""k"": 0, ""m"": 1792, ""mode"": ""prefill"", ""mode_id"": 1, ""model_id"": ""Qwen/Qwen2.5-0.5B"", ""n"": 128, ""num_attention_heads"": 14, ""num_key_value_heads"": 2, ""role"": ""attn_softmax"", ""role_id"": 2, ""seq_len"": 128}","{""block_size"": 512, ""num_stages"": 4, ""num_warps"": 1}",0.00559999980032444,163.8400058419366,5.184988716897384,3.0517578125e-05
QWEN,softmax,qwen05b_attn_softmax_prefill_m1792_n128_seq128_ctx128,1792,128,0,20,512,2,1,"{""ctx_len"": 128, ""dtype"": ""bfloat16"", ""family"": ""softmax"", ""family_group"": ""QWEN"", ""head_dim"": 64, ""hidden_size"": 896, ""intermediate_size"": 4864, ""k"": 0, ""m"": 1792, ""mode"": ""prefill"", ""mode_id"": 1, ""model_id"": ""Qwen/Qwen2.5-0.5B"", ""n"": 128, ""num_attention_heads"": 14, ""num_key_value_heads"": 2, ""role"": ""attn_softmax"", ""role_id"": 2, ""seq_len"": 128}","{""block_size"": 512, ""num_stages"": 1, ""num_warps"": 2}",0.005727999843657017,160.1787753217227,5.162388876618309,3.0517578125e-05
QWEN,softmax,qwen05b_attn_softmax_prefill_m1792_n128_seq128_ctx128,1792,128,0,21,512,2,2,"{""ctx_len"": 128, ""dtype"": ""bfloat16"", ""family"": ""softmax"", ""family_group"": ""QWEN"", ""head_dim"": 64, ""hidden_size"": 896, ""intermediate_size"": 4864, ""k"": 0, ""m"": 1792, ""mode"": ""prefill"", ""mode_id"": 1, ""model_id"": ""Qwen/Qwen2.5-0.5B"", ""n"": 128, ""num_attention_heads"": 14, ""num_key_value_heads"": 2, ""role"": ""attn_softmax"", ""role_id"": 2, ""seq_len"": 128}","{""block_size"": 512, ""num_stages"": 2, ""num_warps"": 2}",0.005727999843657017,160.1787753217227,5.162388876618309,3.0517578125e-05
QWEN,softmax,qwen05b_attn_softmax_prefill_m1792_n128_seq128_ctx128,1792,128,0,22,512,2,3,"{""ctx_len"": 128, ""dtype"": ""bfloat16"", ""family"": ""softmax"", ""family_group"": ""QWEN"", ""head_dim"": 64, ""hidden_size"": 896, ""intermediate_size"": 4864, ""k"": 0, ""m"": 1792, ""mode"": ""prefill"", ""mode_id"": 1, ""model_id"": ""Qwen/Qwen2.5-0.5B"", ""n"": 128, ""num_attention_heads"": 14, ""num_key_value_heads"": 2, ""role"": ""attn_softmax"", ""role_id"": 2, ""seq_len"": 128}","{""block_size"": 512, ""num_stages"": 3, ""num_warps"": 2}",0.005727999843657017,160.1787753217227,5.162388876618309,3.0517578125e-05
QWEN,softmax,qwen05b_attn_softmax_prefill_m1792_n128_seq128_ctx128,1792,128,0,23,512,2,4,"{""ctx_len"": 128, ""dtype"": ""bfloat16"", ""family"": ""softmax"", ""family_group"": ""QWEN"", ""head_dim"": 64, ""hidden_size"": 896, ""intermediate_size"": 4864, ""k"": 0, ""m"": 1792, ""mode"": ""prefill"", ""mode_id"": 1, ""model_id"": ""Qwen/Qwen2.5-0.5B"", ""n"": 128, ""num_attention_heads"": 14, ""num_key_value_heads"": 2, ""role"": ""attn_softmax"", ""role_id"": 2, ""seq_len"": 128}","{""block_size"": 512, ""num_stages"": 4, ""num_warps"": 2}",0.005727999843657017,160.1787753217227,5.162388876618309,3.0517578125e-05
QWEN,softmax,qwen05b_attn_softmax_prefill_m1792_n128_seq128_ctx128,1792,128,0,24,512,4,1,"{""ctx_len"": 128, ""dtype"": ""bfloat16"", ""family"": ""softmax"", ""family_group"": ""QWEN"", ""head_dim"": 64, ""hidden_size"": 896, ""intermediate_size"": 4864, ""k"": 0, ""m"": 1792, ""mode"": ""prefill"", ""mode_id"": 1, ""model_id"": ""Qwen/Qwen2.5-0.5B"", ""n"": 128, ""num_attention_heads"": 14, ""num_key_value_heads"": 2, ""role"": ""attn_softmax"", ""role_id"": 2, ""seq_len"": 128}","{""block_size"": 512, ""num_stages"": 1, ""num_warps"": 4}",0.005727999843657017,160.1787753217227,5.162388876618309,3.0517578125e-05
QWEN,softmax,qwen05b_attn_softmax_prefill_m1792_n128_seq128_ctx128,1792,128,0,25,512,4,2,"{""ctx_len"": 128, ""dtype"": ""bfloat16"", ""family"": ""softmax"", ""family_group"": ""QWEN"", ""head_dim"": 64, ""hidden_size"": 896, ""intermediate_size"": 4864, ""k"": 0, ""m"": 1792, ""mode"": ""prefill"", ""mode_id"": 1, ""model_id"": ""Qwen/Qwen2.5-0.5B"", ""n"": 128, ""num_attention_heads"": 14, ""num_key_value_heads"": 2, ""role"": ""attn_softmax"", ""role_id"": 2, ""seq_len"": 128}","{""block_size"": 512, ""num_stages"": 2, ""num_warps"": 4}",0.005727999843657017,160.1787753217227,5.162388876618309,3.0517578125e-05
QWEN,softmax,qwen05b_attn_softmax_prefill_m1792_n128_seq128_ctx128,1792,128,0,26,512,4,3,"{""ctx_len"": 128, ""dtype"": ""bfloat16"", ""family"": ""softmax"", ""family_group"": ""QWEN"", ""head_dim"": 64, ""hidden_size"": 896, ""intermediate_size"": 4864, ""k"": 0, ""m"": 1792, ""mode"": ""prefill"", ""mode_id"": 1, ""model_id"": ""Qwen/Qwen2.5-0.5B"", ""n"": 128, ""num_attention_heads"": 14, ""num_key_value_heads"": 2, ""role"": ""attn_softmax"", ""role_id"": 2, ""seq_len"": 128}","{""block_size"": 512, ""num_stages"": 3, ""num_warps"": 4}",0.005727999843657017,160.1787753217227,5.162388876618309,3.0517578125e-05
QWEN,softmax,qwen05b_attn_softmax_prefill_m1792_n128_seq128_ctx128,1792,128,0,27,512,4,4,"{""ctx_len"": 128, ""dtype"": ""bfloat16"", ""family"": ""softmax"", ""family_group"": ""QWEN"", ""head_dim"": 64, ""hidden_size"": 896, ""intermediate_size"": 4864, ""k"": 0, ""m"": 1792, ""mode"": ""prefill"", ""mode_id"": 1, ""model_id"": ""Qwen/Qwen2.5-0.5B"", ""n"": 128, ""num_attention_heads"": 14, ""num_key_value_heads"": 2, ""role"": ""attn_softmax"", ""role_id"": 2, ""seq_len"": 128}","{""block_size"": 512, ""num_stages"": 4, ""num_warps"": 4}",0.005727999843657017,160.1787753217227,5.162388876618309,3.0517578125e-05
QWEN,softmax,qwen05b_attn_softmax_prefill_m1792_n128_seq128_ctx128,1792,128,0,28,512,8,1,"{""ctx_len"": 128, ""dtype"": ""bfloat16"", ""family"": ""softmax"", ""family_group"": ""QWEN"", ""head_dim"": 64, ""hidden_size"": 896, ""intermediate_size"": 4864, ""k"": 0, ""m"": 1792, ""mode"": ""prefill"", ""mode_id"": 1, ""model_id"": ""Qwen/Qwen2.5-0.5B"", ""n"": 128, ""num_attention_heads"": 14, ""num_key_value_heads"": 2, ""role"": ""attn_softmax"", ""role_id"": 2, ""seq_len"": 128}","{""block_size"": 512, ""num_stages"": 1, ""num_warps"": 8}",0.006560000125318766,139.8634119622698,5.026764656922669,3.0517578125e-05
QWEN,softmax,qwen05b_attn_softmax_prefill_m1792_n128_seq128_ctx128,1792,128,0,29,512,8,2,"{""ctx_len"": 128, ""dtype"": ""bfloat16"", ""family"": ""softmax"", ""family_group"": ""QWEN"", ""head_dim"": 64, ""hidden_size"": 896, ""intermediate_size"": 4864, ""k"": 0, ""m"": 1792, ""mode"": ""prefill"", ""mode_id"": 1, ""model_id"": ""Qwen/Qwen2.5-0.5B"", ""n"": 128, ""num_attention_heads"": 14, ""num_key_value_heads"": 2, ""role"": ""attn_softmax"", ""role_id"": 2, ""seq_len"": 128}","{""block_size"": 512, ""num_stages"": 2, ""num_warps"": 8}",0.006560000125318766,139.8634119622698,5.026764656922669,3.0517578125e-05
QWEN,softmax,qwen05b_attn_softmax_prefill_m1792_n128_seq128_ctx128,1792,128,0,30,512,8,3,"{""ctx_len"": 128, ""dtype"": ""bfloat16"", ""family"": ""softmax"", ""family_group"": ""QWEN"", ""head_dim"": 64, ""hidden_size"": 896, ""intermediate_size"": 4864, ""k"": 0, ""m"": 1792, ""mode"": ""prefill"", ""mode_id"": 1, ""model_id"": ""Qwen/Qwen2.5-0.5B"", ""n"": 128, ""num_attention_heads"": 14, ""num_key_value_heads"": 2, ""role"": ""attn_softmax"", ""role_id"": 2, ""seq_len"": 128}","{""block_size"": 512, ""num_stages"": 3, ""num_warps"": 8}",0.006560000125318766,139.8634119622698,5.026764656922669,3.0517578125e-05
QWEN,softmax,qwen05b_attn_softmax_prefill_m1792_n128_seq128_ctx128,1792,128,0,31,512,8,4,"{""ctx_len"": 128, ""dtype"": ""bfloat16"", ""family"": ""softmax"", ""family_group"": ""QWEN"", ""head_dim"": 64, ""hidden_size"": 896, ""intermediate_size"": 4864, ""k"": 0, ""m"": 1792, ""mode"": ""prefill"", ""mode_id"": 1, ""model_id"": ""Qwen/Qwen2.5-0.5B"", ""n"": 128, ""num_attention_heads"": 14, ""num_key_value_heads"": 2, ""role"": ""attn_softmax"", ""role_id"": 2, ""seq_len"": 128}","{""block_size"": 512, ""num_stages"": 4, ""num_warps"": 8}",0.006560000125318766,139.8634119622698,5.026764656922669,3.0517578125e-05
QWEN,softmax,qwen05b_attn_softmax_prefill_m1792_n128_seq128_ctx128,1792,128,0,32,1024,1,1,"{""ctx_len"": 128, ""dtype"": ""bfloat16"", ""family"": ""softmax"", ""family_group"": ""QWEN"", ""head_dim"": 64, ""hidden_size"": 896, ""intermediate_size"": 4864, ""k"": 0, ""m"": 1792, ""mode"": ""prefill"", ""mode_id"": 1, ""model_id"": ""Qwen/Qwen2.5-0.5B"", ""n"": 128, ""num_attention_heads"": 14, ""num_key_value_heads"": 2, ""role"": ""attn_softmax"", ""role_id"": 2, ""seq_len"": 128}","{""block_size"": 1024, ""num_stages"": 1, ""num_warps"": 1}",0.005888000130653381,155.82608349877637,5.13483887536579,3.0517578125e-05
QWEN,softmax,qwen05b_attn_softmax_prefill_m1792_n128_seq128_ctx128,1792,128,0,33,1024,1,2,"{""ctx_len"": 128, ""dtype"": ""bfloat16"", ""family"": ""softmax"", ""family_group"": ""QWEN"", ""head_dim"": 64, ""hidden_size"": 896, ""intermediate_size"": 4864, ""k"": 0, ""m"": 1792, ""mode"": ""prefill"", ""mode_id"": 1, ""model_id"": ""Qwen/Qwen2.5-0.5B"", ""n"": 128, ""num_attention_heads"": 14, ""num_key_value_heads"": 2, ""role"": ""attn_softmax"", ""role_id"": 2, ""seq_len"": 128}","{""block_size"": 1024, ""num_stages"": 2, ""num_warps"": 1}",0.005888000130653381,155.82608349877637,5.13483887536579,3.0517578125e-05
QWEN,softmax,qwen05b_attn_softmax_prefill_m1792_n128_seq128_ctx128,1792,128,0,34,1024,1,3,"{""ctx_len"": 128, ""dtype"": ""bfloat16"", ""family"": ""softmax"", ""family_group"": ""QWEN"", ""head_dim"": 64, ""hidden_size"": 896, ""intermediate_size"": 4864, ""k"": 0, ""m"": 1792, ""mode"": ""prefill"", ""mode_id"": 1, ""model_id"": ""Qwen/Qwen2.5-0.5B"", ""n"": 128, ""num_attention_heads"": 14, ""num_key_value_heads"": 2, ""role"": ""attn_softmax"", ""role_id"": 2, ""seq_len"": 128}","{""block_size"": 1024, ""num_stages"": 3, ""num_warps"": 1}",0.005888000130653381,155.82608349877637,5.13483887536579,3.0517578125e-05
QWEN,softmax,qwen05b_attn_softmax_prefill_m1792_n128_seq128_ctx128,1792,128,0,35,1024,1,4,"{""ctx_len"": 128, ""dtype"": ""bfloat16"", ""family"": ""softmax"", ""family_group"": ""QWEN"", ""head_dim"": 64, ""hidden_size"": 896, ""intermediate_size"": 4864, ""k"": 0, ""m"": 1792, ""mode"": ""prefill"", ""mode_id"": 1, ""model_id"": ""Qwen/Qwen2.5-0.5B"", ""n"": 128, ""num_attention_heads"": 14, ""num_key_value_heads"": 2, ""role"": ""attn_softmax"", ""role_id"": 2, ""seq_len"": 128}","{""block_size"": 1024, ""num_stages"": 4, ""num_warps"": 1}",0.005888000130653381,155.82608349877637,5.13483887536579,3.0517578125e-05
QWEN,softmax,qwen05b_attn_softmax_prefill_m1792_n128_seq128_ctx128,1792,128,0,36,1024,2,1,"{""ctx_len"": 128, ""dtype"": ""bfloat16"", ""family"": ""softmax"", ""family_group"": ""QWEN"", ""head_dim"": 64, ""hidden_size"": 896, ""intermediate_size"": 4864, ""k"": 0, ""m"": 1792, ""mode"": ""prefill"", ""mode_id"": 1, ""model_id"": ""Qwen/Qwen2.5-0.5B"", ""n"": 128, ""num_attention_heads"": 14, ""num_key_value_heads"": 2, ""role"": ""attn_softmax"", ""role_id"": 2, ""seq_len"": 128}","{""block_size"": 1024, ""num_stages"": 1, ""num_warps"": 2}",0.005919999908655882,154.98378617514481,5.129418845515972,3.0517578125e-05
QWEN,softmax,qwen05b_attn_softmax_prefill_m1792_n128_seq128_ctx128,1792,128,0,37,1024,2,2,"{""ctx_len"": 128, ""dtype"": ""bfloat16"", ""family"": ""softmax"", ""family_group"": ""QWEN"", ""head_dim"": 64, ""hidden_size"": 896, ""intermediate_size"": 4864, ""k"": 0, ""m"": 1792, ""mode"": ""prefill"", ""mode_id"": 1, ""model_id"": ""Qwen/Qwen2.5-0.5B"", ""n"": 128, ""num_attention_heads"": 14, ""num_key_value_heads"": 2, ""role"": ""attn_softmax"", ""role_id"": 2, ""seq_len"": 128}","{""block_size"": 1024, ""num_stages"": 2, ""num_warps"": 2}",0.005888000130653381,155.82608349877637,5.13483887536579,3.0517578125e-05
QWEN,softmax,qwen05b_attn_softmax_prefill_m1792_n128_seq128_ctx128,1792,128,0,38,1024,2,3,"{""ctx_len"": 128, ""dtype"": ""bfloat16"", ""family"": ""softmax"", ""family_group"": ""QWEN"", ""head_dim"": 64, ""hidden_size"": 896, ""intermediate_size"": 4864, ""k"": 0, ""m"": 1792, ""mode"": ""prefill"", ""mode_id"": 1, ""model_id"": ""Qwen/Qwen2.5-0.5B"", ""n"": 128, ""num_attention_heads"": 14, ""num_key_value_heads"": 2, ""role"": ""attn_softmax"", ""role_id"": 2, ""seq_len"": 128}","{""block_size"": 1024, ""num_stages"": 3, ""num_warps"": 2}",0.005919999908655882,154.98378617514481,5.129418845515972,3.0517578125e-05
QWEN,softmax,qwen05b_attn_softmax_prefill_m1792_n128_seq128_ctx128,1792,128,0,39,1024,2,4,"{""ctx_len"": 128, ""dtype"": ""bfloat16"", ""family"": ""softmax"", ""family_group"": ""QWEN"", ""head_dim"": 64, ""hidden_size"": 896, ""intermediate_size"": 4864, ""k"": 0, ""m"": 1792, ""mode"": ""prefill"", ""mode_id"": 1, ""model_id"": ""Qwen/Qwen2.5-0.5B"", ""n"": 128, ""num_attention_heads"": 14, ""num_key_value_heads"": 2, ""role"": ""attn_softmax"", ""role_id"": 2, ""seq_len"": 128}","{""block_size"": 1024, ""num_stages"": 4, ""num_warps"": 2}",0.005919999908655882,154.98378617514481,5.129418845515972,3.0517578125e-05
QWEN,softmax,qwen05b_attn_softmax_prefill_m1792_n128_seq128_ctx128,1792,128,0,40,1024,4,1,"{""ctx_len"": 128, ""dtype"": ""bfloat16"", ""family"": ""softmax"", ""family_group"": ""QWEN"", ""head_dim"": 64, ""hidden_size"": 896, ""intermediate_size"": 4864, ""k"": 0, ""m"": 1792, ""mode"": ""prefill"", ""mode_id"": 1, ""model_id"": ""Qwen/Qwen2.5-0.5B"", ""n"": 128, ""num_attention_heads"": 14, ""num_key_value_heads"": 2, ""role"": ""attn_softmax"", ""role_id"": 2, ""seq_len"": 128}","{""block_size"": 1024, ""num_stages"": 1, ""num_warps"": 4}",0.005824000108987093,157.53845859037455,5.145767949374309,3.0517578125e-05
QWEN,softmax,qwen05b_attn_softmax_prefill_m1792_n128_seq128_ctx128,1792,128,0,41,1024,4,2,"{""ctx_len"": 128, ""dtype"": ""bfloat16"", ""family"": ""softmax"", ""family_group"": ""QWEN"", ""head_dim"": 64, ""hidden_size"": 896, ""intermediate_size"": 4864, ""k"": 0, ""m"": 1792, ""mode"": ""prefill"", ""mode_id"": 1, ""model_id"": ""Qwen/Qwen2.5-0.5B"", ""n"": 128, ""num_attention_heads"": 14, ""num_key_value_heads"": 2, ""role"": ""attn_softmax"", ""role_id"": 2, ""seq_len"": 128}","{""block_size"": 1024, ""num_stages"": 2, ""num_warps"": 4}",0.0058559998869895935,156.67759865201486,5.140288521621352,3.0517578125e-05
QWEN,softmax,qwen05b_attn_softmax_prefill_m1792_n128_seq128_ctx128,1792,128,0,42,1024,4,3,"{""ctx_len"": 128, ""dtype"": ""bfloat16"", ""family"": ""softmax"", ""family_group"": ""QWEN"", ""head_dim"": 64, ""hidden_size"": 896, ""intermediate_size"": 4864, ""k"": 0, ""m"": 1792, ""mode"": ""prefill"", ""mode_id"": 1, ""model_id"": ""Qwen/Qwen2.5-0.5B"", ""n"": 128, ""num_attention_heads"": 14, ""num_key_value_heads"": 2, ""role"": ""attn_softmax"", ""role_id"": 2, ""seq_len"": 128}","{""block_size"": 1024, ""num_stages"": 3, ""num_warps"": 4}",0.0058559998869895935,156.67759865201486,5.140288521621352,3.0517578125e-05
QWEN,softmax,qwen05b_attn_softmax_prefill_m1792_n128_seq128_ctx128,1792,128,0,43,1024,4,4,"{""ctx_len"": 128, ""dtype"": ""bfloat16"", ""family"": ""softmax"", ""family_group"": ""QWEN"", ""head_dim"": 64, ""hidden_size"": 896, ""intermediate_size"": 4864, ""k"": 0, ""m"": 1792, ""mode"": ""prefill"", ""mode_id"": 1, ""model_id"": ""Qwen/Qwen2.5-0.5B"", ""n"": 128, ""num_attention_heads"": 14, ""num_key_value_heads"": 2, ""role"": ""attn_softmax"", ""role_id"": 2, ""seq_len"": 128}","{""block_size"": 1024, ""num_stages"": 4, ""num_warps"": 4}",0.0058559998869895935,156.67759865201486,5.140288521621352,3.0517578125e-05
QWEN,softmax,qwen05b_attn_softmax_prefill_m1792_n128_seq128_ctx128,1792,128,0,44,1024,8,1,"{""ctx_len"": 128, ""dtype"": ""bfloat16"", ""family"": ""softmax"", ""family_group"": ""QWEN"", ""head_dim"": 64, ""hidden_size"": 896, ""intermediate_size"": 4864, ""k"": 0, ""m"": 1792, ""mode"": ""prefill"", ""mode_id"": 1, ""model_id"": ""Qwen/Qwen2.5-0.5B"", ""n"": 128, ""num_attention_heads"": 14, ""num_key_value_heads"": 2, ""role"": ""attn_softmax"", ""role_id"": 2, ""seq_len"": 128}","{""block_size"": 1024, ""num_stages"": 1, ""num_warps"": 8}",0.006719999946653843,136.53333441719178,5.002667132385495,3.0517578125e-05
QWEN,softmax,qwen05b_attn_softmax_prefill_m1792_n128_seq128_ctx128,1792,128,0,45,1024,8,2,"{""ctx_len"": 128, ""dtype"": ""bfloat16"", ""family"": ""softmax"", ""family_group"": ""QWEN"", ""head_dim"": 64, ""hidden_size"": 896, ""intermediate_size"": 4864, ""k"": 0, ""m"": 1792, ""mode"": ""prefill"", ""mode_id"": 1, ""model_id"": ""Qwen/Qwen2.5-0.5B"", ""n"": 128, ""num_attention_heads"": 14, ""num_key_value_heads"": 2, ""role"": ""attn_softmax"", ""role_id"": 2, ""seq_len"": 128}","{""block_size"": 1024, ""num_stages"": 2, ""num_warps"": 8}",0.006719999946653843,136.53333441719178,5.002667132385495,3.0517578125e-05
QWEN,softmax,qwen05b_attn_softmax_prefill_m1792_n128_seq128_ctx128,1792,128,0,46,1024,8,3,"{""ctx_len"": 128, ""dtype"": ""bfloat16"", ""family"": ""softmax"", ""family_group"": ""QWEN"", ""head_dim"": 64, ""hidden_size"": 896, ""intermediate_size"": 4864, ""k"": 0, ""m"": 1792, ""mode"": ""prefill"", ""mode_id"": 1, ""model_id"": ""Qwen/Qwen2.5-0.5B"", ""n"": 128, ""num_attention_heads"": 14, ""num_key_value_heads"": 2, ""role"": ""attn_softmax"", ""role_id"": 2, ""seq_len"": 128}","{""block_size"": 1024, ""num_stages"": 3, ""num_warps"": 8}",0.006752000190317631,135.88625209396483,4.997916493501629,3.0517578125e-05
QWEN,softmax,qwen05b_attn_softmax_prefill_m1792_n128_seq128_ctx128,1792,128,0,47,1024,8,4,"{""ctx_len"": 128, ""dtype"": ""bfloat16"", ""family"": ""softmax"", ""family_group"": ""QWEN"", ""head_dim"": 64, ""hidden_size"": 896, ""intermediate_size"": 4864, ""k"": 0, ""m"": 1792, ""mode"": ""prefill"", ""mode_id"": 1, ""model_id"": ""Qwen/Qwen2.5-0.5B"", ""n"": 128, ""num_attention_heads"": 14, ""num_key_value_heads"": 2, ""role"": ""attn_softmax"", ""role_id"": 2, ""seq_len"": 128}","{""block_size"": 1024, ""num_stages"": 4, ""num_warps"": 8}",0.006752000190317631,135.88625209396483,4.997916493501629,3.0517578125e-05
QWEN,softmax,qwen05b_attn_softmax_prefill_m1792_n128_seq128_ctx128,1792,128,0,48,2048,1,1,"{""ctx_len"": 128, ""dtype"": ""bfloat16"", ""family"": ""softmax"", ""family_group"": ""QWEN"", ""head_dim"": 64, ""hidden_size"": 896, ""intermediate_size"": 4864, ""k"": 0, ""m"": 1792, ""mode"": ""prefill"", ""mode_id"": 1, ""model_id"": ""Qwen/Qwen2.5-0.5B"", ""n"": 128, ""num_attention_heads"": 14, ""num_key_value_heads"": 2, ""role"": ""attn_softmax"", ""role_id"": 2, ""seq_len"": 128}","{""block_size"": 2048, ""num_stages"": 1, ""num_warps"": 1}",0.0071680000983178616,127.99999824432392,4.938128589593289,3.0517578125e-05
QWEN,softmax,qwen05b_attn_softmax_prefill_m1792_n128_seq128_ctx128,1792,128,0,49,2048,1,2,"{""ctx_len"": 128, ""dtype"": ""bfloat16"", ""family"": ""softmax"", ""family_group"": ""QWEN"", ""head_dim"": 64, ""hidden_size"": 896, ""intermediate_size"": 4864, ""k"": 0, ""m"": 1792, ""mode"": ""prefill"", ""mode_id"": 1, ""model_id"": ""Qwen/Qwen2.5-0.5B"", ""n"": 128, ""num_attention_heads"": 14, ""num_key_value_heads"": 2, ""role"": ""attn_softmax"", ""role_id"": 2, ""seq_len"": 128}","{""block_size"": 2048, ""num_stages"": 2, ""num_warps"": 1}",0.0071680000983178616,127.99999824432392,4.938128589593289,3.0517578125e-05
QWEN,softmax,qwen05b_attn_softmax_prefill_m1792_n128_seq128_ctx128,1792,128,0,50,2048,1,3,"{""ctx_len"": 128, ""dtype"": ""bfloat16"", ""family"": ""softmax"", ""family_group"": ""QWEN"", ""head_dim"": 64, ""hidden_size"": 896, ""intermediate_size"": 4864, ""k"": 0, ""m"": 1792, ""mode"": ""prefill"", ""mode_id"": 1, ""model_id"": ""Qwen/Qwen2.5-0.5B"", ""n"": 128, ""num_attention_heads"": 14, ""num_key_value_heads"": 2, ""role"": ""attn_softmax"", ""role_id"": 2, ""seq_len"": 128}","{""block_size"": 2048, ""num_stages"": 3, ""num_warps"": 1}",0.007135999854654074,128.57399365018304,4.9426029040724115,3.0517578125e-05
QWEN,softmax,qwen05b_attn_softmax_prefill_m1792_n128_seq128_ctx128,1792,128,0,51,2048,1,4,"{""ctx_len"": 128, ""dtype"": ""bfloat16"", ""family"": ""softmax"", ""family_group"": ""QWEN"", ""head_dim"": 64, ""hidden_size"": 896, ""intermediate_size"": 4864, ""k"": 0, ""m"": 1792, ""mode"": ""prefill"", ""mode_id"": 1, ""model_id"": ""Qwen/Qwen2.5-0.5B"", ""n"": 128, ""num_attention_heads"": 14, ""num_key_value_heads"": 2, ""role"": ""attn_softmax"", ""role_id"": 2, ""seq_len"": 128}","{""block_size"": 2048, ""num_stages"": 4, ""num_warps"": 1}",0.0071680000983178616,127.99999824432392,4.938128589593289,3.0517578125e-05
QWEN,softmax,qwen05b_attn_softmax_prefill_m1792_n128_seq128_ctx128,1792,128,0,52,2048,2,1,"{""ctx_len"": 128, ""dtype"": ""bfloat16"", ""family"": ""softmax"", ""family_group"": ""QWEN"", ""head_dim"": 64, ""hidden_size"": 896, ""intermediate_size"": 4864, ""k"": 0, ""m"": 1792, ""mode"": ""prefill"", ""mode_id"": 1, ""model_id"": ""Qwen/Qwen2.5-0.5B"", ""n"": 128, ""num_attention_heads"": 14, ""num_key_value_heads"": 2, ""role"": ""attn_softmax"", ""role_id"": 2, ""seq_len"": 128}","{""block_size"": 2048, ""num_stages"": 1, ""num_warps"": 2}",0.006783999968320131,135.24528365043525,4.993188385162327,3.0517578125e-05
QWEN,softmax,qwen05b_attn_softmax_prefill_m1792_n128_seq128_ctx128,1792,128,0,53,2048,2,2,"{""ctx_len"": 128, ""dtype"": ""bfloat16"", ""family"": ""softmax"", ""family_group"": ""QWEN"", ""head_dim"": 64, ""hidden_size"": 896, ""intermediate_size"": 4864, ""k"": 0, ""m"": 1792, ""mode"": ""prefill"", ""mode_id"": 1, ""model_id"": ""Qwen/Qwen2.5-0.5B"", ""n"": 128, ""num_attention_heads"": 14, ""num_key_value_heads"": 2, ""role"": ""attn_softmax"", ""role_id"": 2, ""seq_len"": 128}","{""block_size"": 2048, ""num_stages"": 2, ""num_warps"": 2}",0.006783999968320131,135.24528365043525,4.993188385162327,3.0517578125e-05
QWEN,softmax,qwen05b_attn_softmax_prefill_m1792_n128_seq128_ctx128,1792,128,0,54,2048,2,3,"{""ctx_len"": 128, ""dtype"": ""bfloat16"", ""family"": ""softmax"", ""family_group"": ""QWEN"", ""head_dim"": 64, ""hidden_size"": 896, ""intermediate_size"": 4864, ""k"": 0, ""m"": 1792, ""mode"": ""prefill"", ""mode_id"": 1, ""model_id"": ""Qwen/Qwen2.5-0.5B"", ""n"": 128, ""num_attention_heads"": 14, ""num_key_value_heads"": 2, ""role"": ""attn_softmax"", ""role_id"": 2, ""seq_len"": 128}","{""block_size"": 2048, ""num_stages"": 3, ""num_warps"": 2}",0.006783999968320131,135.24528365043525,4.993188385162327,3.0517578125e-05
QWEN,softmax,qwen05b_attn_softmax_prefill_m1792_n128_seq128_ctx128,1792,128,0,55,2048,2,4,"{""ctx_len"": 128, ""dtype"": ""bfloat16"", ""family"": ""softmax"", ""family_group"": ""QWEN"", ""head_dim"": 64, ""hidden_size"": 896, ""intermediate_size"": 4864, ""k"": 0, ""m"": 1792, ""mode"": ""prefill"", ""mode_id"": 1, ""model_id"": ""Qwen/Qwen2.5-0.5B"", ""n"": 128, ""num_attention_heads"": 14, ""num_key_value_heads"": 2, ""role"": ""attn_softmax"", ""role_id"": 2, ""seq_len"": 128}","{""block_size"": 2048, ""num_stages"": 4, ""num_warps"": 2}",0.006783999968320131,135.24528365043525,4.993188385162327,3.0517578125e-05
QWEN,softmax,qwen05b_attn_softmax_prefill_m1792_n128_seq128_ctx128,1792,128,0,56,2048,4,1,"{""ctx_len"": 128, ""dtype"": ""bfloat16"", ""family"": ""softmax"", ""family_group"": ""QWEN"", ""head_dim"": 64, ""hidden_size"": 896, ""intermediate_size"": 4864, ""k"": 0, ""m"": 1792, ""mode"": ""prefill"", ""mode_id"": 1, ""model_id"": ""Qwen/Qwen2.5-0.5B"", ""n"": 128, ""num_attention_heads"": 14, ""num_key_value_heads"": 2, ""role"": ""attn_softmax"", ""role_id"": 2, ""seq_len"": 128}","{""block_size"": 2048, ""num_stages"": 1, ""num_warps"": 4}",0.006463999859988689,141.94059713386275,5.041506979423509,3.0517578125e-05
QWEN,softmax,qwen05b_attn_softmax_prefill_m1792_n128_seq128_ctx128,1792,128,0,57,2048,4,2,"{""ctx_len"": 128, ""dtype"": ""bfloat16"", ""family"": ""softmax"", ""family_group"": ""QWEN"", ""head_dim"": 64, ""hidden_size"": 896, ""intermediate_size"": 4864, ""k"": 0, ""m"": 1792, ""mode"": ""prefill"", ""mode_id"": 1, ""model_id"": ""Qwen/Qwen2.5-0.5B"", ""n"": 128, ""num_attention_heads"": 14, ""num_key_value_heads"": 2, ""role"": ""attn_softmax"", ""role_id"": 2, ""seq_len"": 128}","{""block_size"": 2048, ""num_stages"": 2, ""num_warps"": 4}",0.006463999859988689,141.94059713386275,5.041506979423509,3.0517578125e-05
QWEN,softmax,qwen05b_attn_softmax_prefill_m1792_n128_seq128_ctx128,1792,128,0,58,2048,4,3,"{""ctx_len"": 128, ""dtype"": ""bfloat16"", ""family"": ""softmax"", ""family_group"": ""QWEN"", ""head_dim"": 64, ""hidden_size"": 896, ""intermediate_size"": 4864, ""k"": 0, ""m"": 1792, ""mode"": ""prefill"", ""mode_id"": 1, ""model_id"": ""Qwen/Qwen2.5-0.5B"", ""n"": 128, ""num_attention_heads"": 14, ""num_key_value_heads"": 2, ""role"": ""attn_softmax"", ""role_id"": 2, ""seq_len"": 128}","{""block_size"": 2048, ""num_stages"": 3, ""num_warps"": 4}",0.006432000081986189,142.6467643508917,5.046469734358863,3.0517578125e-05
QWEN,softmax,qwen05b_attn_softmax_prefill_m1792_n128_seq128_ctx128,1792,128,0,59,2048,4,4,"{""ctx_len"": 128, ""dtype"": ""bfloat16"", ""family"": ""softmax"", ""family_group"": ""QWEN"", ""head_dim"": 64, ""hidden_size"": 896, ""intermediate_size"": 4864, ""k"": 0, ""m"": 1792, ""mode"": ""prefill"", ""mode_id"": 1, ""model_id"": ""Qwen/Qwen2.5-0.5B"", ""n"": 128, ""num_attention_heads"": 14, ""num_key_value_heads"": 2, ""role"": ""attn_softmax"", ""role_id"": 2, ""seq_len"": 128}","{""block_size"": 2048, ""num_stages"": 4, ""num_warps"": 4}",0.006463999859988689,141.94059713386275,5.041506979423509,3.0517578125e-05
QWEN,softmax,qwen05b_attn_softmax_prefill_m1792_n128_seq128_ctx128,1792,128,0,60,2048,8,1,"{""ctx_len"": 128, ""dtype"": ""bfloat16"", ""family"": ""softmax"", ""family_group"": ""QWEN"", ""head_dim"": 64, ""hidden_size"": 896, ""intermediate_size"": 4864, ""k"": 0, ""m"": 1792, ""mode"": ""prefill"", ""mode_id"": 1, ""model_id"": ""Qwen/Qwen2.5-0.5B"", ""n"": 128, ""num_attention_heads"": 14, ""num_key_value_heads"": 2, ""role"": ""attn_softmax"", ""role_id"": 2, ""seq_len"": 128}","{""block_size"": 2048, ""num_stages"": 1, ""num_warps"": 8}",0.0072639998979866505,126.30837181788823,4.924824651726833,3.0517578125e-05
QWEN,softmax,qwen05b_attn_softmax_prefill_m1792_n128_seq128_ctx128,1792,128,0,61,2048,8,2,"{""ctx_len"": 128, ""dtype"": ""bfloat16"", ""family"": ""softmax"", ""family_group"": ""QWEN"", ""head_dim"": 64, ""hidden_size"": 896, ""intermediate_size"": 4864, ""k"": 0, ""m"": 1792, ""mode"": ""prefill"", ""mode_id"": 1, ""model_id"": ""Qwen/Qwen2.5-0.5B"", ""n"": 128, ""num_attention_heads"": 14, ""num_key_value_heads"": 2, ""role"": ""attn_softmax"", ""role_id"": 2, ""seq_len"": 128}","{""block_size"": 2048, ""num_stages"": 2, ""num_warps"": 8}",0.0072639998979866505,126.30837181788823,4.924824651726833,3.0517578125e-05
QWEN,softmax,qwen05b_attn_softmax_prefill_m1792_n128_seq128_ctx128,1792,128,0,62,2048,8,3,"{""ctx_len"": 128, ""dtype"": ""bfloat16"", ""family"": ""softmax"", ""family_group"": ""QWEN"", ""head_dim"": 64, ""hidden_size"": 896, ""intermediate_size"": 4864, ""k"": 0, ""m"": 1792, ""mode"": ""prefill"", ""mode_id"": 1, ""model_id"": ""Qwen/Qwen2.5-0.5B"", ""n"": 128, ""num_attention_heads"": 14, ""num_key_value_heads"": 2, ""role"": ""attn_softmax"", ""role_id"": 2, ""seq_len"": 128}","{""block_size"": 2048, ""num_stages"": 3, ""num_warps"": 8}",0.0072639998979866505,126.30837181788823,4.924824651726833,3.0517578125e-05
QWEN,softmax,qwen05b_attn_softmax_prefill_m1792_n128_seq128_ctx128,1792,128,0,63,2048,8,4,"{""ctx_len"": 128, ""dtype"": ""bfloat16"", ""family"": ""softmax"", ""family_group"": ""QWEN"", ""head_dim"": 64, ""hidden_size"": 896, ""intermediate_size"": 4864, ""k"": 0, ""m"": 1792, ""mode"": ""prefill"", ""mode_id"": 1, ""model_id"": ""Qwen/Qwen2.5-0.5B"", ""n"": 128, ""num_attention_heads"": 14, ""num_key_value_heads"": 2, ""role"": ""attn_softmax"", ""role_id"": 2, ""seq_len"": 128}","{""block_size"": 2048, ""num_stages"": 4, ""num_warps"": 8}",0.0072639998979866505,126.30837181788823,4.924824651726833,3.0517578125e-05
QWEN,softmax,qwen05b_attn_softmax_prefill_m1792_n128_seq128_ctx128,1792,128,0,64,4096,1,1,"{""ctx_len"": 128, ""dtype"": ""bfloat16"", ""family"": ""softmax"", ""family_group"": ""QWEN"", ""head_dim"": 64, ""hidden_size"": 896, ""intermediate_size"": 4864, ""k"": 0, ""m"": 1792, ""mode"": ""prefill"", ""mode_id"": 1, ""model_id"": ""Qwen/Qwen2.5-0.5B"", ""n"": 128, ""num_attention_heads"": 14, ""num_key_value_heads"": 2, ""role"": ""attn_softmax"", ""role_id"": 2, ""seq_len"": 128}","{""block_size"": 4096, ""num_stages"": 1, ""num_warps"": 1}",0.012415999546647072,73.89690991473748,4.38876935205488,3.0517578125e-05
QWEN,softmax,qwen05b_attn_softmax_prefill_m1792_n128_seq128_ctx128,1792,128,0,65,4096,1,2,"{""ctx_len"": 128, ""dtype"": ""bfloat16"", ""family"": ""softmax"", ""family_group"": ""QWEN"", ""head_dim"": 64, ""hidden_size"": 896, ""intermediate_size"": 4864, ""k"": 0, ""m"": 1792, ""mode"": ""prefill"", ""mode_id"": 1, ""model_id"": ""Qwen/Qwen2.5-0.5B"", ""n"": 128, ""num_attention_heads"": 14, ""num_key_value_heads"": 2, ""role"": ""attn_softmax"", ""role_id"": 2, ""seq_len"": 128}","{""block_size"": 4096, ""num_stages"": 2, ""num_warps"": 1}",0.012415999546647072,73.89690991473748,4.38876935205488,3.0517578125e-05
QWEN,softmax,qwen05b_attn_softmax_prefill_m1792_n128_seq128_ctx128,1792,128,0,66,4096,1,3,"{""ctx_len"": 128, ""dtype"": ""bfloat16"", ""family"": ""softmax"", ""family_group"": ""QWEN"", ""head_dim"": 64, ""hidden_size"": 896, ""intermediate_size"": 4864, ""k"": 0, ""m"": 1792, ""mode"": ""prefill"", ""mode_id"": 1, ""model_id"": ""Qwen/Qwen2.5-0.5B"", ""n"": 128, ""num_attention_heads"": 14, ""num_key_value_heads"": 2, ""role"": ""attn_softmax"", ""role_id"": 2, ""seq_len"": 128}","{""block_size"": 4096, ""num_stages"": 3, ""num_warps"": 1}",0.012415999546647072,73.89690991473748,4.38876935205488,3.0517578125e-05
QWEN,softmax,qwen05b_attn_softmax_prefill_m1792_n128_seq128_ctx128,1792,128,0,67,4096,1,4,"{""ctx_len"": 128, ""dtype"": ""bfloat16"", ""family"": ""softmax"", ""family_group"": ""QWEN"", ""head_dim"": 64, ""hidden_size"": 896, ""intermediate_size"": 4864, ""k"": 0, ""m"": 1792, ""mode"": ""prefill"", ""mode_id"": 1, ""model_id"": ""Qwen/Qwen2.5-0.5B"", ""n"": 128, ""num_attention_heads"": 14, ""num_key_value_heads"": 2, ""role"": ""attn_softmax"", ""role_id"": 2, ""seq_len"": 128}","{""block_size"": 4096, ""num_stages"": 4, ""num_warps"": 1}",0.01244799979031086,73.70694211564471,4.386195328391309,3.0517578125e-05
QWEN,softmax,qwen05b_attn_softmax_prefill_m1792_n128_seq128_ctx128,1792,128,0,68,4096,2,1,"{""ctx_len"": 128, ""dtype"": ""bfloat16"", ""family"": ""softmax"", ""family_group"": ""QWEN"", ""head_dim"": 64, ""hidden_size"": 896, ""intermediate_size"": 4864, ""k"": 0, ""m"": 1792, ""mode"": ""prefill"", ""mode_id"": 1, ""model_id"": ""Qwen/Qwen2.5-0.5B"", ""n"": 128, ""num_attention_heads"": 14, ""num_key_value_heads"": 2, ""role"": ""attn_softmax"", ""role_id"": 2, ""seq_len"": 128}","{""block_size"": 4096, ""num_stages"": 1, ""num_warps"": 2}",0.009631999768316746,95.25581624472358,4.6426644144691664,3.0517578125e-05
QWEN,softmax,qwen05b_attn_softmax_prefill_m1792_n128_seq128_ctx128,1792,128,0,69,4096,2,2,"{""ctx_len"": 128, ""dtype"": ""bfloat16"", ""family"": ""softmax"", ""family_group"": ""QWEN"", ""head_dim"": 64, ""hidden_size"": 896, ""intermediate_size"": 4864, ""k"": 0, ""m"": 1792, ""mode"": ""prefill"", ""mode_id"": 1, ""model_id"": ""Qwen/Qwen2.5-0.5B"", ""n"": 128, ""num_attention_heads"": 14, ""num_key_value_heads"": 2, ""role"": ""attn_softmax"", ""role_id"": 2, ""seq_len"": 128}","{""block_size"": 4096, ""num_stages"": 2, ""num_warps"": 2}",0.009631999768316746,95.25581624472358,4.6426644144691664,3.0517578125e-05
QWEN,softmax,qwen05b_attn_softmax_prefill_m1792_n128_seq128_ctx128,1792,128,0,70,4096,2,3,"{""ctx_len"": 128, ""dtype"": ""bfloat16"", ""family"": ""softmax"", ""family_group"": ""QWEN"", ""head_dim"": 64, ""hidden_size"": 896, ""intermediate_size"": 4864, ""k"": 0, ""m"": 1792, ""mode"": ""prefill"", ""mode_id"": 1, ""model_id"": ""Qwen/Qwen2.5-0.5B"", ""n"": 128, ""num_attention_heads"": 14, ""num_key_value_heads"": 2, ""role"": ""attn_softmax"", ""role_id"": 2, ""seq_len"": 128}","{""block_size"": 4096, ""num_stages"": 3, ""num_warps"": 2}",0.009631999768316746,95.25581624472358,4.6426644144691664,3.0517578125e-05
QWEN,softmax,qwen05b_attn_softmax_prefill_m1792_n128_seq128_ctx128,1792,128,0,71,4096,2,4,"{""ctx_len"": 128, ""dtype"": ""bfloat16"", ""family"": ""softmax"", ""family_group"": ""QWEN"", ""head_dim"": 64, ""hidden_size"": 896, ""intermediate_size"": 4864, ""k"": 0, ""m"": 1792, ""mode"": ""prefill"", ""mode_id"": 1, ""model_id"": ""Qwen/Qwen2.5-0.5B"", ""n"": 128, ""num_attention_heads"": 14, ""num_key_value_heads"": 2, ""role"": ""attn_softmax"", ""role_id"": 2, ""seq_len"": 128}","{""block_size"": 4096, ""num_stages"": 4, ""num_warps"": 2}",0.009631999768316746,95.25581624472358,4.6426644144691664,3.0517578125e-05
QWEN,softmax,qwen05b_attn_softmax_prefill_m1792_n128_seq128_ctx128,1792,128,0,72,4096,4,1,"{""ctx_len"": 128, ""dtype"": ""bfloat16"", ""family"": ""softmax"", ""family_group"": ""QWEN"", ""head_dim"": 64, ""hidden_size"": 896, ""intermediate_size"": 4864, ""k"": 0, ""m"": 1792, ""mode"": ""prefill"", ""mode_id"": 1, ""model_id"": ""Qwen/Qwen2.5-0.5B"", ""n"": 128, ""num_attention_heads"": 14, ""num_key_value_heads"": 2, ""role"": ""attn_softmax"", ""role_id"": 2, ""seq_len"": 128}","{""block_size"": 4096, ""num_stages"": 1, ""num_warps"": 4}",0.00854399986565113,107.3857694788339,4.762526012488651,3.0517578125e-05
QWEN,softmax,qwen05b_attn_softmax_prefill_m1792_n128_seq128_ctx128,1792,128,0,73,4096,4,2,"{""ctx_len"": 128, ""dtype"": ""bfloat16"", ""family"": ""softmax"", ""family_group"": ""QWEN"", ""head_dim"": 64, ""hidden_size"": 896, ""intermediate_size"": 4864, ""k"": 0, ""m"": 1792, ""mode"": ""prefill"", ""mode_id"": 1, ""model_id"": ""Qwen/Qwen2.5-0.5B"", ""n"": 128, ""num_attention_heads"": 14, ""num_key_value_heads"": 2, ""role"": ""attn_softmax"", ""role_id"": 2, ""seq_len"": 128}","{""block_size"": 4096, ""num_stages"": 2, ""num_warps"": 4}",0.008576000109314919,106.98507326316877,4.758787661907082,3.0517578125e-05
QWEN,softmax,qwen05b_attn_softmax_prefill_m1792_n128_seq128_ctx128,1792,128,0,74,4096,4,3,"{""ctx_len"": 128, ""dtype"": ""bfloat16"", ""family"": ""softmax"", ""family_group"": ""QWEN"", ""head_dim"": 64, ""hidden_size"": 896, ""intermediate_size"": 4864, ""k"": 0, ""m"": 1792, ""mode"": ""prefill"", ""mode_id"": 1, ""model_id"": ""Qwen/Qwen2.5-0.5B"", ""n"": 128, ""num_attention_heads"": 14, ""num_key_value_heads"": 2, ""role"": ""attn_softmax"", ""role_id"": 2, ""seq_len"": 128}","{""block_size"": 4096, ""num_stages"": 3, ""num_warps"": 4}",0.00854399986565113,107.3857694788339,4.762526012488651,3.0517578125e-05
QWEN,softmax,qwen05b_attn_softmax_prefill_m1792_n128_seq128_ctx128,1792,128,0,75,4096,4,4,"{""ctx_len"": 128, ""dtype"": ""bfloat16"", ""family"": ""softmax"", ""family_group"": ""QWEN"", ""head_dim"": 64, ""hidden_size"": 896, ""intermediate_size"": 4864, ""k"": 0, ""m"": 1792, ""mode"": ""prefill"", ""mode_id"": 1, ""model_id"": ""Qwen/Qwen2.5-0.5B"", ""n"": 128, ""num_attention_heads"": 14, ""num_key_value_heads"": 2, ""role"": ""attn_softmax"", ""role_id"": 2, ""seq_len"": 128}","{""block_size"": 4096, ""num_stages"": 4, ""num_warps"": 4}",0.008576000109314919,106.98507326316877,4.758787661907082,3.0517578125e-05
QWEN,softmax,qwen05b_attn_softmax_prefill_m1792_n128_seq128_ctx128,1792,128,0,76,4096,8,1,"{""ctx_len"": 128, ""dtype"": ""bfloat16"", ""family"": ""softmax"", ""family_group"": ""QWEN"", ""head_dim"": 64, ""hidden_size"": 896, ""intermediate_size"": 4864, ""k"": 0, ""m"": 1792, ""mode"": ""prefill"", ""mode_id"": 1, ""model_id"": ""Qwen/Qwen2.5-0.5B"", ""n"": 128, ""num_attention_heads"": 14, ""num_key_value_heads"": 2, ""role"": ""attn_softmax"", ""role_id"": 2, ""seq_len"": 128}","{""block_size"": 4096, ""num_stages"": 1, ""num_warps"": 8}",0.008608000352978706,106.58735622408607,4.755063234556819,3.0517578125e-05
QWEN,softmax,qwen05b_attn_softmax_prefill_m1792_n128_seq128_ctx128,1792,128,0,77,4096,8,2,"{""ctx_len"": 128, ""dtype"": ""bfloat16"", ""family"": ""softmax"", ""family_group"": ""QWEN"", ""head_dim"": 64, ""hidden_size"": 896, ""intermediate_size"": 4864, ""k"": 0, ""m"": 1792, ""mode"": ""prefill"", ""mode_id"": 1, ""model_id"": ""Qwen/Qwen2.5-0.5B"", ""n"": 128, ""num_attention_heads"": 14, ""num_key_value_heads"": 2, ""role"": ""attn_softmax"", ""role_id"": 2, ""seq_len"": 128}","{""block_size"": 4096, ""num_stages"": 2, ""num_warps"": 8}",0.008608000352978706,106.58735622408607,4.755063234556819,3.0517578125e-05
QWEN,softmax,qwen05b_attn_softmax_prefill_m1792_n128_seq128_ctx128,1792,128,0,78,4096,8,3,"{""ctx_len"": 128, ""dtype"": ""bfloat16"", ""family"": ""softmax"", ""family_group"": ""QWEN"", ""head_dim"": 64, ""hidden_size"": 896, ""intermediate_size"": 4864, ""k"": 0, ""m"": 1792, ""mode"": ""prefill"", ""mode_id"": 1, ""model_id"": ""Qwen/Qwen2.5-0.5B"", ""n"": 128, ""num_attention_heads"": 14, ""num_key_value_heads"": 2, ""role"": ""attn_softmax"", ""role_id"": 2, ""seq_len"": 128}","{""block_size"": 4096, ""num_stages"": 3, ""num_warps"": 8}",0.008608000352978706,106.58735622408607,4.755063234556819,3.0517578125e-05
QWEN,softmax,qwen05b_attn_softmax_prefill_m1792_n128_seq128_ctx128,1792,128,0,79,4096,8,4,"{""ctx_len"": 128, ""dtype"": ""bfloat16"", ""family"": ""softmax"", ""family_group"": ""QWEN"", ""head_dim"": 64, ""hidden_size"": 896, ""intermediate_size"": 4864, ""k"": 0, ""m"": 1792, ""mode"": ""prefill"", ""mode_id"": 1, ""model_id"": ""Qwen/Qwen2.5-0.5B"", ""n"": 128, ""num_attention_heads"": 14, ""num_key_value_heads"": 2, ""role"": ""attn_softmax"", ""role_id"": 2, ""seq_len"": 128}","{""block_size"": 4096, ""num_stages"": 4, ""num_warps"": 8}",0.00863999966531992,106.1925967060818,4.751352734902294,3.0517578125e-05
QWEN,softmax,qwen05b_attn_softmax_prefill_m1792_n128_seq128_ctx128,1792,128,0,80,8192,1,1,"{""ctx_len"": 128, ""dtype"": ""bfloat16"", ""family"": ""softmax"", ""family_group"": ""QWEN"", ""head_dim"": 64, ""hidden_size"": 896, ""intermediate_size"": 4864, ""k"": 0, ""m"": 1792, ""mode"": ""prefill"", ""mode_id"": 1, ""model_id"": ""Qwen/Qwen2.5-0.5B"", ""n"": 128, ""num_attention_heads"": 14, ""num_key_value_heads"": 2, ""role"": ""attn_softmax"", ""role_id"": 2, ""seq_len"": 128}","{""block_size"": 8192, ""num_stages"": 1, ""num_warps"": 1}",0.022431999444961548,40.90157019890978,3.7972667928731125,3.0517578125e-05
QWEN,softmax,qwen05b_attn_softmax_prefill_m1792_n128_seq128_ctx128,1792,128,0,81,8192,1,2,"{""ctx_len"": 128, ""dtype"": ""bfloat16"", ""family"": ""softmax"", ""family_group"": ""QWEN"", ""head_dim"": 64, ""hidden_size"": 896, ""intermediate_size"": 4864, ""k"": 0, ""m"": 1792, ""mode"": ""prefill"", ""mode_id"": 1, ""model_id"": ""Qwen/Qwen2.5-0.5B"", ""n"": 128, ""num_attention_heads"": 14, ""num_key_value_heads"": 2, ""role"": ""attn_softmax"", ""role_id"": 2, ""seq_len"": 128}","{""block_size"": 8192, ""num_stages"": 2, ""num_warps"": 1}",0.022431999444961548,40.90157019890978,3.7972667928731125,3.0517578125e-05
QWEN,softmax,qwen05b_attn_softmax_prefill_m1792_n128_seq128_ctx128,1792,128,0,82,8192,1,3,"{""ctx_len"": 128, ""dtype"": ""bfloat16"", ""family"": ""softmax"", ""family_group"": ""QWEN"", ""head_dim"": 64, ""hidden_size"": 896, ""intermediate_size"": 4864, ""k"": 0, ""m"": 1792, ""mode"": ""prefill"", ""mode_id"": 1, ""model_id"": ""Qwen/Qwen2.5-0.5B"", ""n"": 128, ""num_attention_heads"": 14, ""num_key_value_heads"": 2, ""role"": ""attn_softmax"", ""role_id"": 2, ""seq_len"": 128}","{""block_size"": 8192, ""num_stages"": 3, ""num_warps"": 1}",0.022431999444961548,40.90157019890978,3.7972667928731125,3.0517578125e-05
QWEN,softmax,qwen05b_attn_softmax_prefill_m1792_n128_seq128_ctx128,1792,128,0,83,8192,1,4,"{""ctx_len"": 128, ""dtype"": ""bfloat16"", ""family"": ""softmax"", ""family_group"": ""QWEN"", ""head_dim"": 64, ""hidden_size"": 896, ""intermediate_size"": 4864, ""k"": 0, ""m"": 1792, ""mode"": ""prefill"", ""mode_id"": 1, ""model_id"": ""Qwen/Qwen2.5-0.5B"", ""n"": 128, ""num_attention_heads"": 14, ""num_key_value_heads"": 2, ""role"": ""attn_softmax"", ""role_id"": 2, ""seq_len"": 128}","{""block_size"": 8192, ""num_stages"": 4, ""num_warps"": 1}",0.022431999444961548,40.90157019890978,3.7972667928731125,3.0517578125e-05
QWEN,softmax,qwen05b_attn_softmax_prefill_m1792_n128_seq128_ctx128,1792,128,0,84,8192,2,1,"{""ctx_len"": 128, ""dtype"": ""bfloat16"", ""family"": ""softmax"", ""family_group"": ""QWEN"", ""head_dim"": 64, ""hidden_size"": 896, ""intermediate_size"": 4864, ""k"": 0, ""m"": 1792, ""mode"": ""prefill"", ""mode_id"": 1, ""model_id"": ""Qwen/Qwen2.5-0.5B"", ""n"": 128, ""num_attention_heads"": 14, ""num_key_value_heads"": 2, ""role"": ""attn_softmax"", ""role_id"": 2, ""seq_len"": 128}","{""block_size"": 8192, ""num_stages"": 1, ""num_warps"": 2}",0.01724799908697605,53.19480801067565,4.060059137190613,3.0517578125e-05
QWEN,softmax,qwen05b_attn_softmax_prefill_m1792_n128_seq128_ctx128,1792,128,0,85,8192,2,2,"{""ctx_len"": 128, ""dtype"": ""bfloat16"", ""family"": ""softmax"", ""family_group"": ""QWEN"", ""head_dim"": 64, ""hidden_size"": 896, ""intermediate_size"": 4864, ""k"": 0, ""m"": 1792, ""mode"": ""prefill"", ""mode_id"": 1, ""model_id"": ""Qwen/Qwen2.5-0.5B"", ""n"": 128, ""num_attention_heads"": 14, ""num_key_value_heads"": 2, ""role"": ""attn_softmax"", ""role_id"": 2, ""seq_len"": 128}","{""block_size"": 8192, ""num_stages"": 2, ""num_warps"": 2}",0.01724799908697605,53.19480801067565,4.060059137190613,3.0517578125e-05
QWEN,softmax,qwen05b_attn_softmax_prefill_m1792_n128_seq128_ctx128,1792,128,0,86,8192,2,3,"{""ctx_len"": 128, ""dtype"": ""bfloat16"", ""family"": ""softmax"", ""family_group"": ""QWEN"", ""head_dim"": 64, ""hidden_size"": 896, ""intermediate_size"": 4864, ""k"": 0, ""m"": 1792, ""mode"": ""prefill"", ""mode_id"": 1, ""model_id"": ""Qwen/Qwen2.5-0.5B"", ""n"": 128, ""num_attention_heads"": 14, ""num_key_value_heads"": 2, ""role"": ""attn_softmax"", ""role_id"": 2, ""seq_len"": 128}","{""block_size"": 8192, ""num_stages"": 3, ""num_warps"": 2}",0.01724799908697605,53.19480801067565,4.060059137190613,3.0517578125e-05
QWEN,softmax,qwen05b_attn_softmax_prefill_m1792_n128_seq128_ctx128,1792,128,0,87,8192,2,4,"{""ctx_len"": 128, ""dtype"": ""bfloat16"", ""family"": ""softmax"", ""family_group"": ""QWEN"", ""head_dim"": 64, ""hidden_size"": 896, ""intermediate_size"": 4864, ""k"": 0, ""m"": 1792, ""mode"": ""prefill"", ""mode_id"": 1, ""model_id"": ""Qwen/Qwen2.5-0.5B"", ""n"": 128, ""num_attention_heads"": 14, ""num_key_value_heads"": 2, ""role"": ""attn_softmax"", ""role_id"": 2, ""seq_len"": 128}","{""block_size"": 8192, ""num_stages"": 4, ""num_warps"": 2}",0.01724799908697605,53.19480801067565,4.060059137190613,3.0517578125e-05
QWEN,softmax,qwen05b_attn_softmax_prefill_m1792_n128_seq128_ctx128,1792,128,0,88,8192,4,1,"{""ctx_len"": 128, ""dtype"": ""bfloat16"", ""family"": ""softmax"", ""family_group"": ""QWEN"", ""head_dim"": 64, ""hidden_size"": 896, ""intermediate_size"": 4864, ""k"": 0, ""m"": 1792, ""mode"": ""prefill"", ""mode_id"": 1, ""model_id"": ""Qwen/Qwen2.5-0.5B"", ""n"": 128, ""num_attention_heads"": 14, ""num_key_value_heads"": 2, ""role"": ""attn_softmax"", ""role_id"": 2, ""seq_len"": 128}","{""block_size"": 8192, ""num_stages"": 1, ""num_warps"": 4}",0.013344000093638897,68.75779328249371,4.316688426348443,3.0517578125e-05
QWEN,softmax,qwen05b_attn_softmax_prefill_m1792_n128_seq128_ctx128,1792,128,0,89,8192,4,2,"{""ctx_len"": 128, ""dtype"": ""bfloat16"", ""family"": ""softmax"", ""family_group"": ""QWEN"", ""head_dim"": 64, ""hidden_size"": 896, ""intermediate_size"": 4864, ""k"": 0, ""m"": 1792, ""mode"": ""prefill"", ""mode_id"": 1, ""model_id"": ""Qwen/Qwen2.5-0.5B"", ""n"": 128, ""num_attention_heads"": 14, ""num_key_value_heads"": 2, ""role"": ""attn_softmax"", ""role_id"": 2, ""seq_len"": 128}","{""block_size"": 8192, ""num_stages"": 2, ""num_warps"": 4}",0.013344000093638897,68.75779328249371,4.316688426348443,3.0517578125e-05
QWEN,softmax,qwen05b_attn_softmax_prefill_m1792_n128_seq128_ctx128,1792,128,0,90,8192,4,3,"{""ctx_len"": 128, ""dtype"": ""bfloat16"", ""family"": ""softmax"", ""family_group"": ""QWEN"", ""head_dim"": 64, ""hidden_size"": 896, ""intermediate_size"": 4864, ""k"": 0, ""m"": 1792, ""mode"": ""prefill"", ""mode_id"": 1, ""model_id"": ""Qwen/Qwen2.5-0.5B"", ""n"": 128, ""num_attention_heads"": 14, ""num_key_value_heads"": 2, ""role"": ""attn_softmax"", ""role_id"": 2, ""seq_len"": 128}","{""block_size"": 8192, ""num_stages"": 3, ""num_warps"": 4}",0.013344000093638897,68.75779328249371,4.316688426348443,3.0517578125e-05
QWEN,softmax,qwen05b_attn_softmax_prefill_m1792_n128_seq128_ctx128,1792,128,0,91,8192,4,4,"{""ctx_len"": 128, ""dtype"": ""bfloat16"", ""family"": ""softmax"", ""family_group"": ""QWEN"", ""head_dim"": 64, ""hidden_size"": 896, ""intermediate_size"": 4864, ""k"": 0, ""m"": 1792, ""mode"": ""prefill"", ""mode_id"": 1, ""model_id"": ""Qwen/Qwen2.5-0.5B"", ""n"": 128, ""num_attention_heads"": 14, ""num_key_value_heads"": 2, ""role"": ""attn_softmax"", ""role_id"": 2, ""seq_len"": 128}","{""block_size"": 8192, ""num_stages"": 4, ""num_warps"": 4}",0.013376000337302685,68.59329970568899,4.314293197422785,3.0517578125e-05
QWEN,softmax,qwen05b_attn_softmax_prefill_m1792_n128_seq128_ctx128,1792,128,0,92,8192,8,1,"{""ctx_len"": 128, ""dtype"": ""bfloat16"", ""family"": ""softmax"", ""family_group"": ""QWEN"", ""head_dim"": 64, ""hidden_size"": 896, ""intermediate_size"": 4864, ""k"": 0, ""m"": 1792, ""mode"": ""prefill"", ""mode_id"": 1, ""model_id"": ""Qwen/Qwen2.5-0.5B"", ""n"": 128, ""num_attention_heads"": 14, ""num_key_value_heads"": 2, ""role"": ""attn_softmax"", ""role_id"": 2, ""seq_len"": 128}","{""block_size"": 8192, ""num_stages"": 1, ""num_warps"": 8}",0.012543999589979649,73.14285953364644,4.378512848060657,3.0517578125e-05
QWEN,softmax,qwen05b_attn_softmax_prefill_m1792_n128_seq128_ctx128,1792,128,0,93,8192,8,2,"{""ctx_len"": 128, ""dtype"": ""bfloat16"", ""family"": ""softmax"", ""family_group"": ""QWEN"", ""head_dim"": 64, ""hidden_size"": 896, ""intermediate_size"": 4864, ""k"": 0, ""m"": 1792, ""mode"": ""prefill"", ""mode_id"": 1, ""model_id"": ""Qwen/Qwen2.5-0.5B"", ""n"": 128, ""num_attention_heads"": 14, ""num_key_value_heads"": 2, ""role"": ""attn_softmax"", ""role_id"": 2, ""seq_len"": 128}","{""block_size"": 8192, ""num_stages"": 2, ""num_warps"": 8}",0.012575999833643436,72.95674396762351,4.375965056523385,3.0517578125e-05
QWEN,softmax,qwen05b_attn_softmax_prefill_m1792_n128_seq128_ctx128,1792,128,0,94,8192,8,3,"{""ctx_len"": 128, ""dtype"": ""bfloat16"", ""family"": ""softmax"", ""family_group"": ""QWEN"", ""head_dim"": 64, ""hidden_size"": 896, ""intermediate_size"": 4864, ""k"": 0, ""m"": 1792, ""mode"": ""prefill"", ""mode_id"": 1, ""model_id"": ""Qwen/Qwen2.5-0.5B"", ""n"": 128, ""num_attention_heads"": 14, ""num_key_value_heads"": 2, ""role"": ""attn_softmax"", ""role_id"": 2, ""seq_len"": 128}","{""block_size"": 8192, ""num_stages"": 3, ""num_warps"": 8}",0.012575999833643436,72.95674396762351,4.375965056523385,3.0517578125e-05
QWEN,softmax,qwen05b_attn_softmax_prefill_m1792_n128_seq128_ctx128,1792,128,0,95,8192,8,4,"{""ctx_len"": 128, ""dtype"": ""bfloat16"", ""family"": ""softmax"", ""family_group"": ""QWEN"", ""head_dim"": 64, ""hidden_size"": 896, ""intermediate_size"": 4864, ""k"": 0, ""m"": 1792, ""mode"": ""prefill"", ""mode_id"": 1, ""model_id"": ""Qwen/Qwen2.5-0.5B"", ""n"": 128, ""num_attention_heads"": 14, ""num_key_value_heads"": 2, ""role"": ""attn_softmax"", ""role_id"": 2, ""seq_len"": 128}","{""block_size"": 8192, ""num_stages"": 4, ""num_warps"": 8}",0.012543999589979649,73.14285953364644,4.378512848060657,3.0517578125e-05
QWEN,gemm,qwen05b_q_proj_prefill_m128_n896_k896_seq128_ctx128,128,896,896,0,256,1,1,"{""ctx_len"": 128, ""dtype"": ""bfloat16"", ""family"": ""gemm"", ""family_group"": ""QWEN"", ""head_dim"": 64, ""hidden_size"": 896, ""intermediate_size"": 4864, ""k"": 896, ""m"": 128, ""mode"": ""prefill"", ""mode_id"": 1, ""model_id"": ""Qwen/Qwen2.5-0.5B"", ""n"": 896, ""num_attention_heads"": 14, ""num_key_value_heads"": 2, ""role"": ""q_proj"", ""role_id"": 3, ""seq_len"": 128}","{""block_size"": 256, ""num_stages"": 1, ""num_warps"": 1}",0.03436800092458725,60.06703749018805,3.370629353193176,0.0625
QWEN,gemm,qwen05b_q_proj_prefill_m128_n896_k896_seq128_ctx128,128,896,896,1,256,1,2,"{""ctx_len"": 128, ""dtype"": ""bfloat16"", ""family"": ""gemm"", ""family_group"": ""QWEN"", ""head_dim"": 64, ""hidden_size"": 896, ""intermediate_size"": 4864, ""k"": 896, ""m"": 128, ""mode"": ""prefill"", ""mode_id"": 1, ""model_id"": ""Qwen/Qwen2.5-0.5B"", ""n"": 896, ""num_attention_heads"": 14, ""num_key_value_heads"": 2, ""role"": ""q_proj"", ""role_id"": 3, ""seq_len"": 128}","{""block_size"": 256, ""num_stages"": 2, ""num_warps"": 1}",0.028511999174952507,72.40404249918538,3.5574302566305898,0.0625
QWEN,gemm,qwen05b_q_proj_prefill_m128_n896_k896_seq128_ctx128,128,896,896,2,256,1,3,"{""ctx_len"": 128, ""dtype"": ""bfloat16"", ""family"": ""gemm"", ""family_group"": ""QWEN"", ""head_dim"": 64, ""hidden_size"": 896, ""intermediate_size"": 4864, ""k"": 896, ""m"": 128, ""mode"": ""prefill"", ""mode_id"": 1, ""model_id"": ""Qwen/Qwen2.5-0.5B"", ""n"": 896, ""num_attention_heads"": 14, ""num_key_value_heads"": 2, ""role"": ""q_proj"", ""role_id"": 3, ""seq_len"": 128}","{""block_size"": 256, ""num_stages"": 3, ""num_warps"": 1}",0.017775999382138252,116.13321735791364,4.0299060808430625,0.0625
QWEN,gemm,qwen05b_q_proj_prefill_m128_n896_k896_seq128_ctx128,128,896,896,3,256,1,4,"{""ctx_len"": 128, ""dtype"": ""bfloat16"", ""family"": ""gemm"", ""family_group"": ""QWEN"", ""head_dim"": 64, ""hidden_size"": 896, ""intermediate_size"": 4864, ""k"": 896, ""m"": 128, ""mode"": ""prefill"", ""mode_id"": 1, ""model_id"": ""Qwen/Qwen2.5-0.5B"", ""n"": 896, ""num_attention_heads"": 14, ""num_key_value_heads"": 2, ""role"": ""q_proj"", ""role_id"": 3, ""seq_len"": 128}","{""block_size"": 256, ""num_stages"": 4, ""num_warps"": 1}",0.01711999997496605,120.58317774641785,4.0675079097308044,0.0625
QWEN,gemm,qwen05b_q_proj_prefill_m128_n896_k896_seq128_ctx128,128,896,896,4,256,2,1,"{""ctx_len"": 128, ""dtype"": ""bfloat16"", ""family"": ""gemm"", ""family_group"": ""QWEN"", ""head_dim"": 64, ""hidden_size"": 896, ""intermediate_size"": 4864, ""k"": 896, ""m"": 128, ""mode"": ""prefill"", ""mode_id"": 1, ""model_id"": ""Qwen/Qwen2.5-0.5B"", ""n"": 896, ""num_attention_heads"": 14, ""num_key_value_heads"": 2, ""role"": ""q_proj"", ""role_id"": 3, ""seq_len"": 128}","{""block_size"": 256, ""num_stages"": 1, ""num_warps"": 2}",0.041280001401901245,50.00930062722624,3.1873771238480444,0.0625
QWEN,gemm,qwen05b_q_proj_prefill_m128_n896_k896_seq128_ctx128,128,896,896,5,256,2,2,"{""ctx_len"": 128, ""dtype"": ""bfloat16"", ""family"": ""gemm"", ""family_group"": ""QWEN"", ""head_dim"": 64, ""hidden_size"": 896, ""intermediate_size"": 4864, ""k"": 896, ""m"": 128, ""mode"": ""prefill"", ""mode_id"": 1, ""model_id"": ""Qwen/Qwen2.5-0.5B"", ""n"": 896, ""num_attention_heads"": 14, ""num_key_value_heads"": 2, ""role"": ""q_proj"", ""role_id"": 3, ""seq_len"": 128}","{""block_size"": 256, ""num_stages"": 2, ""num_warps"": 2}",0.02812799997627735,73.3924915294747,3.5709897583227526,0.0625
QWEN,gemm,qwen05b_q_proj_prefill_m128_n896_k896_seq128_ctx128,128,896,896,6,256,2,3,"{""ctx_len"": 128, ""dtype"": ""bfloat16"", ""family"": ""gemm"", ""family_group"": ""QWEN"", ""head_dim"": 64, ""hidden_size"": 896, ""intermediate_size"": 4864, ""k"": 896, ""m"": 128, ""mode"": ""prefill"", ""mode_id"": 1, ""model_id"": ""Qwen/Qwen2.5-0.5B"", ""n"": 896, ""num_attention_heads"": 14, ""num_key_value_heads"": 2, ""role"": ""q_proj"", ""role_id"": 3, ""seq_len"": 128}","{""block_size"": 256, ""num_stages"": 3, ""num_warps"": 2}",0.016224000602960587,127.24259882135898,4.121263614408635,0.0625
QWEN,gemm,qwen05b_q_proj_prefill_m128_n896_k896_seq128_ctx128,128,896,896,7,256,2,4,"{""ctx_len"": 128, ""dtype"": ""bfloat16"", ""family"": ""gemm"", ""family_group"": ""QWEN"", ""head_dim"": 64, ""hidden_size"": 896, ""intermediate_size"": 4864, ""k"": 896, ""m"": 128, ""mode"": ""prefill"", ""mode_id"": 1, ""model_id"": ""Qwen/Qwen2.5-0.5B"", ""n"": 896, ""num_attention_heads"": 14, ""num_key_value_heads"": 2, ""role"": ""q_proj"", ""role_id"": 3, ""seq_len"": 128}","{""block_size"": 256, ""num_stages"": 4, ""num_warps"": 2}",0.013024000450968742,158.50613701771243,4.340961435095974,0.0625
QWEN,gemm,qwen05b_q_proj_prefill_m128_n896_k896_seq128_ctx128,128,896,896,8,256,4,1,"{""ctx_len"": 128, ""dtype"": ""bfloat16"", ""family"": ""gemm"", ""family_group"": ""QWEN"", ""head_dim"": 64, ""hidden_size"": 896, ""intermediate_size"": 4864, ""k"": 896, ""m"": 128, ""mode"": ""prefill"", ""mode_id"": 1, ""model_id"": ""Qwen/Qwen2.5-0.5B"", ""n"": 896, ""num_attention_heads"": 14, ""num_key_value_heads"": 2, ""role"": ""q_proj"", ""role_id"": 3, ""seq_len"": 128}","{""block_size"": 256, ""num_stages"": 1, ""num_warps"": 4}",0.036320000886917114,56.8387651318482,3.315386700829521,0.0625
QWEN,gemm,qwen05b_q_proj_prefill_m128_n896_k896_seq128_ctx128,128,896,896,9,256,4,2,"{""ctx_len"": 128, ""dtype"": ""bfloat16"", ""family"": ""gemm"", ""family_group"": ""QWEN"", ""head_dim"": 64, ""hidden_size"": 896, ""intermediate_size"": 4864, ""k"": 896, ""m"": 128, ""mode"": ""prefill"", ""mode_id"": 1, ""model_id"": ""Qwen/Qwen2.5-0.5B"", ""n"": 896, ""num_attention_heads"": 14, ""num_key_value_heads"": 2, ""role"": ""q_proj"", ""role_id"": 3, ""seq_len"": 128}","{""block_size"": 256, ""num_stages"": 2, ""num_warps"": 4}",0.024000000208616257,86.01599925231933,3.7297014399418473,0.0625
QWEN,gemm,qwen05b_q_proj_prefill_m128_n896_k896_seq128_ctx128,128,896,896,10,256,4,3,"{""ctx_len"": 128, ""dtype"": ""bfloat16"", ""family"": ""gemm"", ""family_group"": ""QWEN"", ""head_dim"": 64, ""hidden_size"": 896, ""intermediate_size"": 4864, ""k"": 896, ""m"": 128, ""mode"": ""prefill"", ""mode_id"": 1, ""model_id"": ""Qwen/Qwen2.5-0.5B"", ""n"": 896, ""num_attention_heads"": 14, ""num_key_value_heads"": 2, ""role"": ""q_proj"", ""role_id"": 3, ""seq_len"": 128}","{""block_size"": 256, ""num_stages"": 3, ""num_warps"": 4}",0.01484800036996603,139.03447929431343,4.2098900780214,0.0625
QWEN,gemm,qwen05b_q_proj_prefill_m128_n896_k896_seq128_ctx128,128,896,896,11,256,4,4,"{""ctx_len"": 128, ""dtype"": ""bfloat16"", ""family"": ""gemm"", ""family_group"": ""QWEN"", ""head_dim"": 64, ""hidden_size"": 896, ""intermediate_size"": 4864, ""k"": 896, ""m"": 128, ""mode"": ""prefill"", ""mode_id"": 1, ""model_id"": ""Qwen/Qwen2.5-0.5B"", ""n"": 896, ""num_attention_heads"": 14, ""num_key_value_heads"": 2, ""role"": ""q_proj"", ""role_id"": 3, ""seq_len"": 128}","{""block_size"": 256, ""num_stages"": 4, ""num_warps"": 4}",0.011935999616980553,172.9544291425025,4.428196267610163,0.0625
QWEN,gemm,qwen05b_q_proj_prefill_m128_n896_k896_seq128_ctx128,128,896,896,12,256,8,1,"{""ctx_len"": 128, ""dtype"": ""bfloat16"", ""family"": ""gemm"", ""family_group"": ""QWEN"", ""head_dim"": 64, ""hidden_size"": 896, ""intermediate_size"": 4864, ""k"": 896, ""m"": 128, ""mode"": ""prefill"", ""mode_id"": 1, ""model_id"": ""Qwen/Qwen2.5-0.5B"", ""n"": 896, ""num_attention_heads"": 14, ""num_key_value_heads"": 2, ""role"": ""q_proj"", ""role_id"": 3, ""seq_len"": 128}","{""block_size"": 256, ""num_stages"": 1, ""num_warps"": 8}",0.025599999353289604,80.6400020371378,3.6651629527587453,0.0625
QWEN,gemm,qwen05b_q_proj_prefill_m128_n896_k896_seq128_ctx128,128,896,896,13,256,8,2,"{""ctx_len"": 128, ""dtype"": ""bfloat16"", ""family"": ""gemm"", ""family_group"": ""QWEN"", ""head_dim"": 64, ""hidden_size"": 896, ""intermediate_size"": 4864, ""k"": 896, ""m"": 128, ""mode"": ""prefill"", ""mode_id"": 1, ""model_id"": ""Qwen/Qwen2.5-0.5B"", ""n"": 896, ""num_attention_heads"": 14, ""num_key_value_heads"": 2, ""role"": ""q_proj"", ""role_id"": 3, ""seq_len"": 128}","{""block_size"": 256, ""num_stages"": 2, ""num_warps"": 8}",0.02454400062561035,84.10951545714701,3.707287828307952,0.0625
QWEN,gemm,qwen05b_q_proj_prefill_m128_n896_k896_seq128_ctx128,128,896,896,14,256,8,3,"{""ctx_len"": 128, ""dtype"": ""bfloat16"", ""family"": ""gemm"", ""family_group"": ""QWEN"", ""head_dim"": 64, ""hidden_size"": 896, ""intermediate_size"": 4864, ""k"": 896, ""m"": 128, ""mode"": ""prefill"", ""mode_id"": 1, ""model_id"": ""Qwen/Qwen2.5-0.5B"", ""n"": 896, ""num_attention_heads"": 14, ""num_key_value_heads"": 2, ""role"": ""q_proj"", ""role_id"": 3, ""seq_len"": 128}","{""block_size"": 256, ""num_stages"": 3, ""num_warps"": 8}",0.01532800029963255,134.68058191840515,4.17807403820558,0.0625
QWEN,gemm,qwen05b_q_proj_prefill_m128_n896_k896_seq128_ctx128,128,896,896,15,256,8,4,"{""ctx_len"": 128, ""dtype"": ""bfloat16"", ""family"": ""gemm"", ""family_group"": ""QWEN"", ""head_dim"": 64, ""hidden_size"": 896, ""intermediate_size"": 4864, ""k"": 896, ""m"": 128, ""mode"": ""prefill"", ""mode_id"": 1, ""model_id"": ""Qwen/Qwen2.5-0.5B"", ""n"": 896, ""num_attention_heads"": 14, ""num_key_value_heads"": 2, ""role"": ""q_proj"", ""role_id"": 3, ""seq_len"": 128}","{""block_size"": 256, ""num_stages"": 4, ""num_warps"": 8}",0.012319999746978283,167.56363980497076,4.39653134141424,0.0625
QWEN,gemm,qwen05b_q_proj_prefill_m128_n896_k896_seq128_ctx128,128,896,896,16,512,1,1,"{""ctx_len"": 128, ""dtype"": ""bfloat16"", ""family"": ""gemm"", ""family_group"": ""QWEN"", ""head_dim"": 64, ""hidden_size"": 896, ""intermediate_size"": 4864, ""k"": 896, ""m"": 128, ""mode"": ""prefill"", ""mode_id"": 1, ""model_id"": ""Qwen/Qwen2.5-0.5B"", ""n"": 896, ""num_attention_heads"": 14, ""num_key_value_heads"": 2, ""role"": ""q_proj"", ""role_id"": 3, ""seq_len"": 128}","{""block_size"": 512, ""num_stages"": 1, ""num_warps"": 1}",0.8326239883899689,2.4793712753722903,0.18317313321428902,0.0625
QWEN,gemm,qwen05b_q_proj_prefill_m128_n896_k896_seq128_ctx128,128,896,896,17,512,1,2,"{""ctx_len"": 128, ""dtype"": ""bfloat16"", ""family"": ""gemm"", ""family_group"": ""QWEN"", ""head_dim"": 64, ""hidden_size"": 896, ""intermediate_size"": 4864, ""k"": 896, ""m"": 128, ""mode"": ""prefill"", ""mode_id"": 1, ""model_id"": ""Qwen/Qwen2.5-0.5B"", ""n"": 896, ""num_attention_heads"": 14, ""num_key_value_heads"": 2, ""role"": ""q_proj"", ""role_id"": 3, ""seq_len"": 128}","{""block_size"": 512, ""num_stages"": 2, ""num_warps"": 1}",0.22646400332450867,9.115726869147798,1.4851692724086871,0.0625
QWEN,gemm,qwen05b_q_proj_prefill_m128_n896_k896_seq128_ctx128,128,896,896,18,512,1,3,"{""ctx_len"": 128, ""dtype"": ""bfloat16"", ""family"": ""gemm"", ""family_group"": ""QWEN"", ""head_dim"": 64, ""hidden_size"": 896, ""intermediate_size"": 4864, ""k"": 896, ""m"": 128, ""mode"": ""prefill"", ""mode_id"": 1, ""model_id"": ""Qwen/Qwen2.5-0.5B"", ""n"": 896, ""num_attention_heads"": 14, ""num_key_value_heads"": 2, ""role"": ""q_proj"", ""role_id"": 3, ""seq_len"": 128}","{""block_size"": 512, ""num_stages"": 3, ""num_warps"": 1}",0.19459199905395508,10.608781501995887,1.6368502249061223,0.0625
QWEN,gemm,qwen05b_q_proj_prefill_m128_n896_k896_seq128_ctx128,128,896,896,19,512,1,4,"{""ctx_len"": 128, ""dtype"": ""bfloat16"", ""family"": ""gemm"", ""family_group"": ""QWEN"", ""head_dim"": 64, ""hidden_size"": 896, ""intermediate_size"": 4864, ""k"": 896, ""m"": 128, ""mode"": ""prefill"", ""mode_id"": 1, ""model_id"": ""Qwen/Qwen2.5-0.5B"", ""n"": 896, ""num_attention_heads"": 14, ""num_key_value_heads"": 2, ""role"": ""q_proj"", ""role_id"": 3, ""seq_len"": 128}","{""block_size"": 512, ""num_stages"": 4, ""num_warps"": 1}",0.14815999567508698,13.933477728544002,1.909462537275096,0.0625
QWEN,gemm,qwen05b_q_proj_prefill_m128_n896_k896_seq128_ctx128,128,896,896,20,512,2,1,"{""ctx_len"": 128, ""dtype"": ""bfloat16"", ""family"": ""gemm"", ""family_group"": ""QWEN"", ""head_dim"": 64, ""hidden_size"": 896, ""intermediate_size"": 4864, ""k"": 896, ""m"": 128, ""mode"": ""prefill"", ""mode_id"": 1, ""model_id"": ""Qwen/Qwen2.5-0.5B"", ""n"": 896, ""num_attention_heads"": 14, ""num_key_value_heads"": 2, ""role"": ""q_proj"", ""role_id"": 3, ""seq_len"": 128}","{""block_size"": 512, ""num_stages"": 1, ""num_warps"": 2}",0.8858240246772766,2.330467386851577,0.12123696584991017,0.0625
QWEN,gemm,qwen05b_q_proj_prefill_m128_n896_k896_seq128_ctx128,128,896,896,21,512,2,2,"{""ctx_len"": 128, ""dtype"": ""bfloat16"", ""family"": ""gemm"", ""family_group"": ""QWEN"", ""head_dim"": 64, ""hidden_size"": 896, ""intermediate_size"": 4864, ""k"": 896, ""m"": 128, ""mode"": ""prefill"", ""mode_id"": 1, ""model_id"": ""Qwen/Qwen2.5-0.5B"", ""n"": 896, ""num_attention_heads"": 14, ""num_key_value_heads"": 2, ""role"": ""q_proj"", ""role_id"": 3, ""seq_len"": 128}","{""block_size"": 512, ""num_stages"": 2, ""num_warps"": 2}",0.06230400130152702,33.13405169612122,2.775729628902405,0.0625
QWEN,gemm,qwen05b_q_proj_prefill_m128_n896_k896_seq128_ctx128,128,896,896,22,512,2,3,"{""ctx_len"": 128, ""dtype"": ""bfloat16"", ""family"": ""gemm"", ""family_group"": ""QWEN"", ""head_dim"": 64, ""hidden_size"": 896, ""intermediate_size"": 4864, ""k"": 896, ""m"": 128, ""mode"": ""prefill"", ""mode_id"": 1, ""model_id"": ""Qwen/Qwen2.5-0.5B"", ""n"": 896, ""num_attention_heads"": 14, ""num_key_value_heads"": 2, ""role"": ""q_proj"", ""role_id"": 3, ""seq_len"": 128}","{""block_size"": 512, ""num_stages"": 3, ""num_warps"": 2}",0.04755200073122978,43.41318910361253,3.0459314145093663,0.0625
QWEN,gemm,qwen05b_q_proj_prefill_m128_n896_k896_seq128_ctx128,128,896,896,23,512,2,4,"{""ctx_len"": 128, ""dtype"": ""bfloat16"", ""family"": ""gemm"", ""family_group"": ""QWEN"", ""head_dim"": 64, ""hidden_size"": 896, ""intermediate_size"": 4864, ""k"": 896, ""m"": 128, ""mode"": ""prefill"", ""mode_id"": 1, ""model_id"": ""Qwen/Qwen2.5-0.5B"", ""n"": 896, ""num_attention_heads"": 14, ""num_key_value_heads"": 2, ""role"": ""q_proj"", ""role_id"": 3, ""seq_len"": 128}","{""block_size"": 512, ""num_stages"": 4, ""num_warps"": 2}",0.04636799916625023,44.521739930986676,3.071145730825011,0.0625
QWEN,gemm,qwen05b_q_proj_prefill_m128_n896_k896_seq128_ctx128,128,896,896,24,512,4,1,"{""ctx_len"": 128, ""dtype"": ""bfloat16"", ""family"": ""gemm"", ""family_group"": ""QWEN"", ""head_dim"": 64, ""hidden_size"": 896, ""intermediate_size"": 4864, ""k"": 896, ""m"": 128, ""mode"": ""prefill"", ""mode_id"": 1, ""model_id"": ""Qwen/Qwen2.5-0.5B"", ""n"": 896, ""num_attention_heads"": 14, ""num_key_value_heads"": 2, ""role"": ""q_proj"", ""role_id"": 3, ""seq_len"": 128}","{""block_size"": 512, ""num_stages"": 1, ""num_warps"": 4}",0.033504001796245575,61.616042541859365,3.3960903906811426,0.0625
QWEN,gemm,qwen05b_q_proj_prefill_m128_n896_k896_seq128_ctx128,128,896,896,25,512,4,2,"{""ctx_len"": 128, ""dtype"": ""bfloat16"", ""family"": ""gemm"", ""family_group"": ""QWEN"", ""head_dim"": 64, ""hidden_size"": 896, ""intermediate_size"": 4864, ""k"": 896, ""m"": 128, ""mode"": ""prefill"", ""mode_id"": 1, ""model_id"": ""Qwen/Qwen2.5-0.5B"", ""n"": 896, ""num_attention_heads"": 14, ""num_key_value_heads"": 2, ""role"": ""q_proj"", ""role_id"": 3, ""seq_len"": 128}","{""block_size"": 512, ""num_stages"": 2, ""num_warps"": 4}",0.028384000062942505,72.73055226261827,3.5619296706374333,0.0625
QWEN,gemm,qwen05b_q_proj_prefill_m128_n896_k896_seq128_ctx128,128,896,896,26,512,4,3,"{""ctx_len"": 128, ""dtype"": ""bfloat16"", ""family"": ""gemm"", ""family_group"": ""QWEN"", ""head_dim"": 64, ""hidden_size"": 896, ""intermediate_size"": 4864, ""k"": 896, ""m"": 128, ""mode"": ""prefill"", ""mode_id"": 1, ""model_id"": ""Qwen/Qwen2.5-0.5B"", ""n"": 896, ""num_attention_heads"": 14, ""num_key_value_heads"": 2, ""role"": ""q_proj"", ""role_id"": 3, ""seq_len"": 128}","{""block_size"": 512, ""num_stages"": 3, ""num_warps"": 4}",0.017424000427126884,118.47933593860712,4.049906688277822,0.0625
QWEN,gemm,qwen05b_q_proj_prefill_m128_n896_k896_seq128_ctx128,128,896,896,27,512,4,4,"{""ctx_len"": 128, ""dtype"": ""bfloat16"", ""family"": ""gemm"", ""family_group"": ""QWEN"", ""head_dim"": 64, ""hidden_size"": 896, ""intermediate_size"": 4864, ""k"": 896, ""m"": 128, ""mode"": ""prefill"", ""mode_id"": 1, ""model_id"": ""Qwen/Qwen2.5-0.5B"", ""n"": 896, ""num_attention_heads"": 14, ""num_key_value_heads"": 2, ""role"": ""q_proj"", ""role_id"": 3, ""seq_len"": 128}","{""block_size"": 512, ""num_stages"": 4, ""num_warps"": 4}",0.013535999692976475,152.5106417571184,4.302402498800268,0.0625
QWEN,gemm,qwen05b_q_proj_prefill_m128_n896_k896_seq128_ctx128,128,896,896,28,512,8,1,"{""ctx_len"": 128, ""dtype"": ""bfloat16"", ""family"": ""gemm"", ""family_group"": ""QWEN"", ""head_dim"": 64, ""hidden_size"": 896, ""intermediate_size"": 4864, ""k"": 896, ""m"": 128, ""mode"": ""prefill"", ""mode_id"": 1, ""model_id"": ""Qwen/Qwen2.5-0.5B"", ""n"": 896, ""num_attention_heads"": 14, ""num_key_value_heads"": 2, ""role"": ""q_proj"", ""role_id"": 3, ""seq_len"": 128}","{""block_size"": 512, ""num_stages"": 1, ""num_warps"": 8}",0.030880000442266464,66.85181251404421,3.477646539503461,0.0625
QWEN,gemm,qwen05b_q_proj_prefill_m128_n896_k896_seq128_ctx128,128,896,896,29,512,8,2,"{""ctx_len"": 128, ""dtype"": ""bfloat16"", ""family"": ""gemm"", ""family_group"": ""QWEN"", ""head_dim"": 64, ""hidden_size"": 896, ""intermediate_size"": 4864, ""k"": 896, ""m"": 128, ""mode"": ""prefill"", ""mode_id"": 1, ""model_id"": ""Qwen/Qwen2.5-0.5B"", ""n"": 896, ""num_attention_heads"": 14, ""num_key_value_heads"": 2, ""role"": ""q_proj"", ""role_id"": 3, ""seq_len"": 128}","{""block_size"": 512, ""num_stages"": 2, ""num_warps"": 8}",0.027488000690937042,75.10127867104717,3.5940057080443406,0.0625
QWEN,gemm,qwen05b_q_proj_prefill_m128_n896_k896_seq128_ctx128,128,896,896,30,512,8,3,"{""ctx_len"": 128, ""dtype"": ""bfloat16"", ""family"": ""gemm"", ""family_group"": ""QWEN"", ""head_dim"": 64, ""hidden_size"": 896, ""intermediate_size"": 4864, ""k"": 896, ""m"": 128, ""mode"": ""prefill"", ""mode_id"": 1, ""model_id"": ""Qwen/Qwen2.5-0.5B"", ""n"": 896, ""num_attention_heads"": 14, ""num_key_value_heads"": 2, ""role"": ""q_proj"", ""role_id"": 3, ""seq_len"": 128}","{""block_size"": 512, ""num_stages"": 3, ""num_warps"": 8}",0.017311999574303627,119.24584396733616,4.056355400907736,0.0625
QWEN,gemm,qwen05b_q_proj_prefill_m128_n896_k896_seq128_ctx128,128,896,896,31,512,8,4,"{""ctx_len"": 128, ""dtype"": ""bfloat16"", ""family"": ""gemm"", ""family_group"": ""QWEN"", ""head_dim"": 64, ""hidden_size"": 896, ""intermediate_size"": 4864, ""k"": 896, ""m"": 128, ""mode"": ""prefill"", ""mode_id"": 1, ""model_id"": ""Qwen/Qwen2.5-0.5B"", ""n"": 896, ""num_attention_heads"": 14, ""num_key_value_heads"": 2, ""role"": ""q_proj"", ""role_id"": 3, ""seq_len"": 128}","{""block_size"": 512, ""num_stages"": 4, ""num_warps"": 8}",0.013887999579310417,148.6451657930208,4.276730151355732,0.0625
QWEN,gemm,qwen05b_q_proj_prefill_m128_n896_k896_seq128_ctx128,128,896,896,32,1024,1,1,"{""ctx_len"": 128, ""dtype"": ""bfloat16"", ""family"": ""gemm"", ""family_group"": ""QWEN"", ""head_dim"": 64, ""hidden_size"": 896, ""intermediate_size"": 4864, ""k"": 896, ""m"": 128, ""mode"": ""prefill"", ""mode_id"": 1, ""model_id"": ""Qwen/Qwen2.5-0.5B"", ""n"": 896, ""num_attention_heads"": 14, ""num_key_value_heads"": 2, ""role"": ""q_proj"", ""role_id"": 3, ""seq_len"": 128}","{""block_size"": 1024, ""num_stages"": 1, ""num_warps"": 1}",0.8325120210647583,2.479704734304874,0.18330761751436248,0.0625
QWEN,gemm,qwen05b_q_proj_prefill_m128_n896_k896_seq128_ctx128,128,896,896,33,1024,1,2,"{""ctx_len"": 128, ""dtype"": ""bfloat16"", ""family"": ""gemm"", ""family_group"": ""QWEN"", ""head_dim"": 64, ""hidden_size"": 896, ""intermediate_size"": 4864, ""k"": 896, ""m"": 128, ""mode"": ""prefill"", ""mode_id"": 1, ""model_id"": ""Qwen/Qwen2.5-0.5B"", ""n"": 896, ""num_attention_heads"": 14, ""num_key_value_heads"": 2, ""role"": ""q_proj"", ""role_id"": 3, ""seq_len"": 128}","{""block_size"": 1024, ""num_stages"": 2, ""num_warps"": 1}",0.22633600234985352,9.120882133497378,1.485734647746411,0.0625
QWEN,gemm,qwen05b_q_proj_prefill_m128_n896_k896_seq128_ctx128,128,896,896,34,1024,1,3,"{""ctx_len"": 128, ""dtype"": ""bfloat16"", ""family"": ""gemm"", ""family_group"": ""QWEN"", ""head_dim"": 64, ""hidden_size"": 896, ""intermediate_size"": 4864, ""k"": 896, ""m"": 128, ""mode"": ""prefill"", ""mode_id"": 1, ""model_id"": ""Qwen/Qwen2.5-0.5B"", ""n"": 896, ""num_attention_heads"": 14, ""num_key_value_heads"": 2, ""role"": ""q_proj"", ""role_id"": 3, ""seq_len"": 128}","{""block_size"": 1024, ""num_stages"": 3, ""num_warps"": 1}",0.1944960057735443,10.614017453929641,1.6373436520031668,0.0625
QWEN,gemm,qwen05b_q_proj_prefill_m128_n896_k896_seq128_ctx128,128,896,896,35,1024,1,4,"{""ctx_len"": 128, ""dtype"": ""bfloat16"", ""family"": ""gemm"", ""family_group"": ""QWEN"", ""head_dim"": 64, ""hidden_size"": 896, ""intermediate_size"": 4864, ""k"": 896, ""m"": 128, ""mode"": ""prefill"", ""mode_id"": 1, ""model_id"": ""Qwen/Qwen2.5-0.5B"", ""n"": 896, ""num_attention_heads"": 14, ""num_key_value_heads"": 2, ""role"": ""q_proj"", ""role_id"": 3, ""seq_len"": 128}","{""block_size"": 1024, ""num_stages"": 4, ""num_warps"": 1}",0.14822399616241455,13.92746150048456,1.9090306618021626,0.0625
QWEN,gemm,qwen05b_q_proj_prefill_m128_n896_k896_seq128_ctx128,128,896,896,36,1024,2,1,"{""ctx_len"": 128, ""dtype"": ""bfloat16"", ""family"": ""gemm"", ""family_group"": ""QWEN"", ""head_dim"": 64, ""hidden_size"": 896, ""intermediate_size"": 4864, ""k"": 896, ""m"": 128, ""mode"": ""prefill"", ""mode_id"": 1, ""model_id"": ""Qwen/Qwen2.5-0.5B"", ""n"": 896, ""num_attention_heads"": 14, ""num_key_value_heads"": 2, ""role"": ""q_proj"", ""role_id"": 3, ""seq_len"": 128}","{""block_size"": 1024, ""num_stages"": 1, ""num_warps"": 2}",0.8845279812812805,2.3338820746062128,0.12270113074273352,0.0625
QWEN,gemm,qwen05b_q_proj_prefill_m128_n896_k896_seq128_ctx128,128,896,896,37,1024,2,2,"{""ctx_len"": 128, ""dtype"": ""bfloat16"", ""family"": ""gemm"", ""family_group"": ""QWEN"", ""head_dim"": 64, ""hidden_size"": 896, ""intermediate_size"": 4864, ""k"": 896, ""m"": 128, ""mode"": ""prefill"", ""mode_id"": 1, ""model_id"": ""Qwen/Qwen2.5-0.5B"", ""n"": 896, ""num_attention_heads"": 14, ""num_key_value_heads"": 2, ""role"": ""q_proj"", ""role_id"": 3, ""seq_len"": 128}","{""block_size"": 1024, ""num_stages"": 2, ""num_warps"": 2}",0.06233600154519081,33.117042300241444,2.7752161461739706,0.0625
QWEN,gemm,qwen05b_q_proj_prefill_m128_n896_k896_seq128_ctx128,128,896,896,38,1024,2,3,"{""ctx_len"": 128, ""dtype"": ""bfloat16"", ""family"": ""gemm"", ""family_group"": ""QWEN"", ""head_dim"": 64, ""hidden_size"": 896, ""intermediate_size"": 4864, ""k"": 896, ""m"": 128, ""mode"": ""prefill"", ""mode_id"": 1, ""model_id"": ""Qwen/Qwen2.5-0.5B"", ""n"": 896, ""num_attention_heads"": 14, ""num_key_value_heads"": 2, ""role"": ""q_proj"", ""role_id"": 3, ""seq_len"": 128}","{""block_size"": 1024, ""num_stages"": 3, ""num_warps"": 2}",0.04758400097489357,43.38399373119585,3.0452586882165487,0.0625
QWEN,gemm,qwen05b_q_proj_prefill_m128_n896_k896_seq128_ctx128,128,896,896,39,1024,2,4,"{""ctx_len"": 128, ""dtype"": ""bfloat16"", ""family"": ""gemm"", ""family_group"": ""QWEN"", ""head_dim"": 64, ""hidden_size"": 896, ""intermediate_size"": 4864, ""k"": 896, ""m"": 128, ""mode"": ""prefill"", ""mode_id"": 1, ""model_id"": ""Qwen/Qwen2.5-0.5B"", ""n"": 896, ""num_attention_heads"": 14, ""num_key_value_heads"": 2, ""role"": ""q_proj"", ""role_id"": 3, ""seq_len"": 128}","{""block_size"": 1024, ""num_stages"": 4, ""num_warps"": 2}",0.04636799916625023,44.521739930986676,3.071145730825011,0.0625
QWEN,gemm,qwen05b_q_proj_prefill_m128_n896_k896_seq128_ctx128,128,896,896,40,1024,4,1,"{""ctx_len"": 128, ""dtype"": ""bfloat16"", ""family"": ""gemm"", ""family_group"": ""QWEN"", ""head_dim"": 64, ""hidden_size"": 896, ""intermediate_size"": 4864, ""k"": 896, ""m"": 128, ""mode"": ""prefill"", ""mode_id"": 1, ""model_id"": ""Qwen/Qwen2.5-0.5B"", ""n"": 896, ""num_attention_heads"": 14, ""num_key_value_heads"": 2, ""role"": ""q_proj"", ""role_id"": 3, ""seq_len"": 128}","{""block_size"": 1024, ""num_stages"": 1, ""num_warps"": 4}",0.033504001796245575,61.616042541859365,3.3960903906811426,0.0625
QWEN,gemm,qwen05b_q_proj_prefill_m128_n896_k896_seq128_ctx128,128,896,896,41,1024,4,2,"{""ctx_len"": 128, ""dtype"": ""bfloat16"", ""family"": ""gemm"", ""family_group"": ""QWEN"", ""head_dim"": 64, ""hidden_size"": 896, ""intermediate_size"": 4864, ""k"": 896, ""m"": 128, ""mode"": ""prefill"", ""mode_id"": 1, ""model_id"": ""Qwen/Qwen2.5-0.5B"", ""n"": 896, ""num_attention_heads"": 14, ""num_key_value_heads"": 2, ""role"": ""q_proj"", ""role_id"": 3, ""seq_len"": 128}","{""block_size"": 1024, ""num_stages"": 2, ""num_warps"": 4}",0.028416000306606293,72.64864786477574,3.56080290138246,0.0625
QWEN,gemm,qwen05b_q_proj_prefill_m128_n896_k896_seq128_ctx128,128,896,896,42,1024,4,3,"{""ctx_len"": 128, ""dtype"": ""bfloat16"", ""family"": ""gemm"", ""family_group"": ""QWEN"", ""head_dim"": 64, ""hidden_size"": 896, ""intermediate_size"": 4864, ""k"": 896, ""m"": 128, ""mode"": ""prefill"", ""mode_id"": 1, ""model_id"": ""Qwen/Qwen2.5-0.5B"", ""n"": 896, ""num_attention_heads"": 14, ""num_key_value_heads"": 2, ""role"": ""q_proj"", ""role_id"": 3, ""seq_len"": 128}","{""block_size"": 1024, ""num_stages"": 3, ""num_warps"": 4}",0.01744000054895878,118.37063847588297,4.04898882902431,0.0625
QWEN,gemm,qwen05b_q_proj_prefill_m128_n896_k896_seq128_ctx128,128,896,896,43,1024,4,4,"{""ctx_len"": 128, ""dtype"": ""bfloat16"", ""family"": ""gemm"", ""family_group"": ""QWEN"", ""head_dim"": 64, ""hidden_size"": 896, ""intermediate_size"": 4864, ""k"": 896, ""m"": 128, ""mode"": ""prefill"", ""mode_id"": 1, ""model_id"": ""Qwen/Qwen2.5-0.5B"", ""n"": 896, ""num_attention_heads"": 14, ""num_key_value_heads"": 2, ""role"": ""q_proj"", ""role_id"": 3, ""seq_len"": 128}","{""block_size"": 1024, ""num_stages"": 4, ""num_warps"": 4}",0.013535999692976475,152.5106417571184,4.302402498800268,0.0625
QWEN,gemm,qwen05b_q_proj_prefill_m128_n896_k896_seq128_ctx128,128,896,896,44,1024,8,1,"{""ctx_len"": 128, ""dtype"": ""bfloat16"", ""family"": ""gemm"", ""family_group"": ""QWEN"", ""head_dim"": 64, ""hidden_size"": 896, ""intermediate_size"": 4864, ""k"": 896, ""m"": 128, ""mode"": ""prefill"", ""mode_id"": 1, ""model_id"": ""Qwen/Qwen2.5-0.5B"", ""n"": 896, ""num_attention_heads"": 14, ""num_key_value_heads"": 2, ""role"": ""q_proj"", ""role_id"": 3, ""seq_len"": 128}","{""block_size"": 1024, ""num_stages"": 1, ""num_warps"": 8}",0.030880000442266464,66.85181251404421,3.477646539503461,0.0625
QWEN,gemm,qwen05b_q_proj_prefill_m128_n896_k896_seq128_ctx128,128,896,896,45,1024,8,2,"{""ctx_len"": 128, ""dtype"": ""bfloat16"", ""family"": ""gemm"", ""family_group"": ""QWEN"", ""head_dim"": 64, ""hidden_size"": 896, ""intermediate_size"": 4864, ""k"": 896, ""m"": 128, ""mode"": ""prefill"", ""mode_id"": 1, ""model_id"": ""Qwen/Qwen2.5-0.5B"", ""n"": 896, ""num_attention_heads"": 14, ""num_key_value_heads"": 2, ""role"": ""q_proj"", ""role_id"": 3, ""seq_len"": 128}","{""block_size"": 1024, ""num_stages"": 2, ""num_warps"": 8}",0.027456000447273254,75.18880996394437,3.5951705393860385,0.0625
QWEN,gemm,qwen05b_q_proj_prefill_m128_n896_k896_seq128_ctx128,128,896,896,46,1024,8,3,"{""ctx_len"": 128, ""dtype"": ""bfloat16"", ""family"": ""gemm"", ""family_group"": ""QWEN"", ""head_dim"": 64, ""hidden_size"": 896, ""intermediate_size"": 4864, ""k"": 896, ""m"": 128, ""mode"": ""prefill"", ""mode_id"": 1, ""model_id"": ""Qwen/Qwen2.5-0.5B"", ""n"": 896, ""num_attention_heads"": 14, ""num_key_value_heads"": 2, ""role"": ""q_proj"", ""role_id"": 3, ""seq_len"": 128}","{""block_size"": 1024, ""num_stages"": 3, ""num_warps"": 8}",0.017311999574303627,119.24584396733616,4.056355400907736,0.0625
QWEN,gemm,qwen05b_q_proj_prefill_m128_n896_k896_seq128_ctx128,128,896,896,47,1024,8,4,"{""ctx_len"": 128, ""dtype"": ""bfloat16"", ""family"": ""gemm"", ""family_group"": ""QWEN"", ""head_dim"": 64, ""hidden_size"": 896, ""intermediate_size"": 4864, ""k"": 896, ""m"": 128, ""mode"": ""prefill"", ""mode_id"": 1, ""model_id"": ""Qwen/Qwen2.5-0.5B"", ""n"": 896, ""num_attention_heads"": 14, ""num_key_value_heads"": 2, ""role"": ""q_proj"", ""role_id"": 3, ""seq_len"": 128}","{""block_size"": 1024, ""num_stages"": 4, ""num_warps"": 8}",0.013887999579310417,148.6451657930208,4.276730151355732,0.0625
QWEN,gemm,qwen05b_k_proj_prefill_m128_n128_k896_seq128_ctx128,128,128,896,0,256,1,1,"{""ctx_len"": 128, ""dtype"": ""bfloat16"", ""family"": ""gemm"", ""family_group"": ""QWEN"", ""head_dim"": 64, ""hidden_size"": 896, ""intermediate_size"": 4864, ""k"": 896, ""m"": 128, ""mode"": ""prefill"", ""mode_id"": 1, ""model_id"": ""Qwen/Qwen2.5-0.5B"", ""n"": 128, ""num_attention_heads"": 14, ""num_key_value_heads"": 2, ""role"": ""k_proj"", ""role_id"": 4, ""seq_len"": 128}","{""block_size"": 256, ""num_stages"": 1, ""num_warps"": 1}",0.03542400151491165,13.875338160007015,3.3403656796907906,0.03125
QWEN,gemm,qwen05b_k_proj_prefill_m128_n128_k896_seq128_ctx128,128,128,896,1,256,1,2,"{""ctx_len"": 128, ""dtype"": ""bfloat16"", ""family"": ""gemm"", ""family_group"": ""QWEN"", ""head_dim"": 64, ""hidden_size"": 896, ""intermediate_size"": 4864, ""k"": 896, ""m"": 128, ""mode"": ""prefill"", ""mode_id"": 1, ""model_id"": ""Qwen/Qwen2.5-0.5B"", ""n"": 128, ""num_attention_heads"": 14, ""num_key_value_heads"": 2, ""role"": ""k_proj"", ""role_id"": 4, ""seq_len"": 128}","{""block_size"": 256, ""num_stages"": 2, ""num_warps"": 1}",0.027807999402284622,17.6754894478176,3.5824315513935234,0.03125
QWEN,gemm,qwen05b_k_proj_prefill_m128_n128_k896_seq128_ctx128,128,128,896,2,256,1,3,"{""ctx_len"": 128, ""dtype"": ""bfloat16"", ""family"": ""gemm"", ""family_group"": ""QWEN"", ""head_dim"": 64, ""hidden_size"": 896, ""intermediate_size"": 4864, ""k"": 896, ""m"": 128, ""mode"": ""prefill"", ""mode_id"": 1, ""model_id"": ""Qwen/Qwen2.5-0.5B"", ""n"": 128, ""num_attention_heads"": 14, ""num_key_value_heads"": 2, ""role"": ""k_proj"", ""role_id"": 4, ""seq_len"": 128}","{""block_size"": 256, ""num_stages"": 3, ""num_warps"": 1}",0.01724799908697605,28.49721857714767,4.060059137190613,0.03125
QWEN,gemm,qwen05b_k_proj_prefill_m128_n128_k896_seq128_ctx128,128,128,896,3,256,1,4,"{""ctx_len"": 128, ""dtype"": ""bfloat16"", ""family"": ""gemm"", ""family_group"": ""QWEN"", ""head_dim"": 64, ""hidden_size"": 896, ""intermediate_size"": 4864, ""k"": 896, ""m"": 128, ""mode"": ""prefill"", ""mode_id"": 1, ""model_id"": ""Qwen/Qwen2.5-0.5B"", ""n"": 128, ""num_attention_heads"": 14, ""num_key_value_heads"": 2, ""role"": ""k_proj"", ""role_id"": 4, ""seq_len"": 128}","{""block_size"": 256, ""num_stages"": 4, ""num_warps"": 1}",0.016992000862956047,28.926552203251934,4.075012583136591,0.03125
QWEN,gemm,qwen05b_k_proj_prefill_m128_n128_k896_seq128_ctx128,128,128,896,4,256,2,1,"{""ctx_len"": 128, ""dtype"": ""bfloat16"", ""family"": ""gemm"", ""family_group"": ""QWEN"", ""head_dim"": 64, ""hidden_size"": 896, ""intermediate_size"": 4864, ""k"": 896, ""m"": 128, ""mode"": ""prefill"", ""mode_id"": 1, ""model_id"": ""Qwen/Qwen2.5-0.5B"", ""n"": 128, ""num_attention_heads"": 14, ""num_key_value_heads"": 2, ""role"": ""k_proj"", ""role_id"": 4, ""seq_len"": 128}","{""block_size"": 256, ""num_stages"": 1, ""num_warps"": 2}",0.04185599833726883,11.743119732550918,3.1735201628724417,0.03125
QWEN,gemm,qwen05b_k_proj_prefill_m128_n128_k896_seq128_ctx128,128,128,896,5,256,2,2,"{""ctx_len"": 128, ""dtype"": ""bfloat16"", ""family"": ""gemm"", ""family_group"": ""QWEN"", ""head_dim"": 64, ""hidden_size"": 896, ""intermediate_size"": 4864, ""k"": 896, ""m"": 128, ""mode"": ""prefill"", ""mode_id"": 1, ""model_id"": ""Qwen/Qwen2.5-0.5B"", ""n"": 128, ""num_attention_heads"": 14, ""num_key_value_heads"": 2, ""role"": ""k_proj"", ""role_id"": 4, ""seq_len"": 128}","{""block_size"": 256, ""num_stages"": 2, ""num_warps"": 2}",0.028511999174952507,17.239057737901284,3.5574302566305898,0.03125
QWEN,gemm,qwen05b_k_proj_prefill_m128_n128_k896_seq128_ctx128,128,128,896,6,256,2,3,"{""ctx_len"": 128, ""dtype"": ""bfloat16"", ""family"": ""gemm"", ""family_group"": ""QWEN"", ""head_dim"": 64, ""hidden_size"": 896, ""intermediate_size"": 4864, ""k"": 896, ""m"": 128, ""mode"": ""prefill"", ""mode_id"": 1, ""model_id"": ""Qwen/Qwen2.5-0.5B"", ""n"": 128, ""num_attention_heads"": 14, ""num_key_value_heads"": 2, ""role"": ""k_proj"", ""role_id"": 4, ""seq_len"": 128}","{""block_size"": 256, ""num_stages"": 3, ""num_warps"": 2}",0.015968000516295433,30.78156213098823,4.137168527079899,0.03125
QWEN,gemm,qwen05b_k_proj_prefill_m128_n128_k896_seq128_ctx128,128,128,896,7,256,2,4,"{""ctx_len"": 128, ""dtype"": ""bfloat16"", ""family"": ""gemm"", ""family_group"": ""QWEN"", ""head_dim"": 64, ""hidden_size"": 896, ""intermediate_size"": 4864, ""k"": 896, ""m"": 128, ""mode"": ""prefill"", ""mode_id"": 1, ""model_id"": ""Qwen/Qwen2.5-0.5B"", ""n"": 128, ""num_attention_heads"": 14, ""num_key_value_heads"": 2, ""role"": ""k_proj"", ""role_id"": 4, ""seq_len"": 128}","{""block_size"": 256, ""num_stages"": 4, ""num_warps"": 2}",0.012608000077307224,38.984771334565,4.373423739735013,0.03125
QWEN,gemm,qwen05b_k_proj_prefill_m128_n128_k896_seq128_ctx128,128,128,896,8,256,4,1,"{""ctx_len"": 128, ""dtype"": ""bfloat16"", ""family"": ""gemm"", ""family_group"": ""QWEN"", ""head_dim"": 64, ""hidden_size"": 896, ""intermediate_size"": 4864, ""k"": 896, ""m"": 128, ""mode"": ""prefill"", ""mode_id"": 1, ""model_id"": ""Qwen/Qwen2.5-0.5B"", ""n"": 128, ""num_attention_heads"": 14, ""num_key_value_heads"": 2, ""role"": ""k_proj"", ""role_id"": 4, ""seq_len"": 128}","{""block_size"": 256, ""num_stages"": 1, ""num_warps"": 4}",0.03699199855327606,13.287197751484294,3.2970536450413284,0.03125
QWEN,gemm,qwen05b_k_proj_prefill_m128_n128_k896_seq128_ctx128,128,128,896,9,256,4,2,"{""ctx_len"": 128, ""dtype"": ""bfloat16"", ""family"": ""gemm"", ""family_group"": ""QWEN"", ""head_dim"": 64, ""hidden_size"": 896, ""intermediate_size"": 4864, ""k"": 896, ""m"": 128, ""mode"": ""prefill"", ""mode_id"": 1, ""model_id"": ""Qwen/Qwen2.5-0.5B"", ""n"": 128, ""num_attention_heads"": 14, ""num_key_value_heads"": 2, ""role"": ""k_proj"", ""role_id"": 4, ""seq_len"": 128}","{""block_size"": 256, ""num_stages"": 2, ""num_warps"": 4}",0.024288000538945198,20.23715370113979,3.7177728555791454,0.03125
QWEN,gemm,qwen05b_k_proj_prefill_m128_n128_k896_seq128_ctx128,128,128,896,10,256,4,3,"{""ctx_len"": 128, ""dtype"": ""bfloat16"", ""family"": ""gemm"", ""family_group"": ""QWEN"", ""head_dim"": 64, ""hidden_size"": 896, ""intermediate_size"": 4864, ""k"": 896, ""m"": 128, ""mode"": ""prefill"", ""mode_id"": 1, ""model_id"": ""Qwen/Qwen2.5-0.5B"", ""n"": 128, ""num_attention_heads"": 14, ""num_key_value_heads"": 2, ""role"": ""k_proj"", ""role_id"": 4, ""seq_len"": 128}","{""block_size"": 256, ""num_stages"": 3, ""num_warps"": 4}",0.014751999638974667,33.318872832765535,4.216376636640875,0.03125
QWEN,gemm,qwen05b_k_proj_prefill_m128_n128_k896_seq128_ctx128,128,128,896,11,256,4,4,"{""ctx_len"": 128, ""dtype"": ""bfloat16"", ""family"": ""gemm"", ""family_group"": ""QWEN"", ""head_dim"": 64, ""hidden_size"": 896, ""intermediate_size"": 4864, ""k"": 896, ""m"": 128, ""mode"": ""prefill"", ""mode_id"": 1, ""model_id"": ""Qwen/Qwen2.5-0.5B"", ""n"": 128, ""num_attention_heads"": 14, ""num_key_value_heads"": 2, ""role"": ""k_proj"", ""role_id"": 4, ""seq_len"": 128}","{""block_size"": 256, ""num_stages"": 4, ""num_warps"": 4}",0.011744000017642975,41.85286097254692,4.444412805607681,0.03125
QWEN,gemm,qwen05b_k_proj_prefill_m128_n128_k896_seq128_ctx128,128,128,896,12,256,8,1,"{""ctx_len"": 128, ""dtype"": ""bfloat16"", ""family"": ""gemm"", ""family_group"": ""QWEN"", ""head_dim"": 64, ""hidden_size"": 896, ""intermediate_size"": 4864, ""k"": 896, ""m"": 128, ""mode"": ""prefill"", ""mode_id"": 1, ""model_id"": ""Qwen/Qwen2.5-0.5B"", ""n"": 128, ""num_attention_heads"": 14, ""num_key_value_heads"": 2, ""role"": ""k_proj"", ""role_id"": 4, ""seq_len"": 128}","{""block_size"": 256, ""num_stages"": 1, ""num_warps"": 8}",0.0261439997702837,18.80048976127521,3.644135569091123,0.03125
QWEN,gemm,qwen05b_k_proj_prefill_m128_n128_k896_seq128_ctx128,128,128,896,13,256,8,2,"{""ctx_len"": 128, ""dtype"": ""bfloat16"", ""family"": ""gemm"", ""family_group"": ""QWEN"", ""head_dim"": 64, ""hidden_size"": 896, ""intermediate_size"": 4864, ""k"": 896, ""m"": 128, ""mode"": ""prefill"", ""mode_id"": 1, ""model_id"": ""Qwen/Qwen2.5-0.5B"", ""n"": 128, ""num_attention_heads"": 14, ""num_key_value_heads"": 2, ""role"": ""k_proj"", ""role_id"": 4, ""seq_len"": 128}","{""block_size"": 256, ""num_stages"": 2, ""num_warps"": 8}",0.024800000712275505,19.819354269482236,3.6969115970904145,0.03125
QWEN,gemm,qwen05b_k_proj_prefill_m128_n128_k896_seq128_ctx128,128,128,896,14,256,8,3,"{""ctx_len"": 128, ""dtype"": ""bfloat16"", ""family"": ""gemm"", ""family_group"": ""QWEN"", ""head_dim"": 64, ""hidden_size"": 896, ""intermediate_size"": 4864, ""k"": 896, ""m"": 128, ""mode"": ""prefill"", ""mode_id"": 1, ""model_id"": ""Qwen/Qwen2.5-0.5B"", ""n"": 128, ""num_attention_heads"": 14, ""num_key_value_heads"": 2, ""role"": ""k_proj"", ""role_id"": 4, ""seq_len"": 128}","{""block_size"": 256, ""num_stages"": 3, ""num_warps"": 8}",0.015231999568641186,32.26890847685649,4.184356829252378,0.03125
QWEN,gemm,qwen05b_k_proj_prefill_m128_n128_k896_seq128_ctx128,128,128,896,15,256,8,4,"{""ctx_len"": 128, ""dtype"": ""bfloat16"", ""family"": ""gemm"", ""family_group"": ""QWEN"", ""head_dim"": 64, ""hidden_size"": 896, ""intermediate_size"": 4864, ""k"": 896, ""m"": 128, ""mode"": ""prefill"", ""mode_id"": 1, ""model_id"": ""Qwen/Qwen2.5-0.5B"", ""n"": 128, ""num_attention_heads"": 14, ""num_key_value_heads"": 2, ""role"": ""k_proj"", ""role_id"": 4, ""seq_len"": 128}","{""block_size"": 256, ""num_stages"": 4, ""num_warps"": 8}",0.012128000147640705,40.52770399212246,4.41223843790858,0.03125
QWEN,gemm,qwen05b_k_proj_prefill_m128_n128_k896_seq128_ctx128,128,128,896,16,512,1,1,"{""ctx_len"": 128, ""dtype"": ""bfloat16"", ""family"": ""gemm"", ""family_group"": ""QWEN"", ""head_dim"": 64, ""hidden_size"": 896, ""intermediate_size"": 4864, ""k"": 896, ""m"": 128, ""mode"": ""prefill"", ""mode_id"": 1, ""model_id"": ""Qwen/Qwen2.5-0.5B"", ""n"": 128, ""num_attention_heads"": 14, ""num_key_value_heads"": 2, ""role"": ""k_proj"", ""role_id"": 4, ""seq_len"": 128}","{""block_size"": 512, ""num_stages"": 1, ""num_warps"": 1}",0.813696026802063,0.6040584982720648,0.20616841416957998,0.03125
QWEN,gemm,qwen05b_k_proj_prefill_m128_n128_k896_seq128_ctx128,128,128,896,17,512,1,2,"{""ctx_len"": 128, ""dtype"": ""bfloat16"", ""family"": ""gemm"", ""family_group"": ""QWEN"", ""head_dim"": 64, ""hidden_size"": 896, ""intermediate_size"": 4864, ""k"": 896, ""m"": 128, ""mode"": ""prefill"", ""mode_id"": 1, ""model_id"": ""Qwen/Qwen2.5-0.5B"", ""n"": 128, ""num_attention_heads"": 14, ""num_key_value_heads"": 2, ""role"": ""k_proj"", ""role_id"": 4, ""seq_len"": 128}","{""block_size"": 512, ""num_stages"": 2, ""num_warps"": 1}",0.2274399995803833,2.1610974362769637,1.4808688134843484,0.03125
QWEN,gemm,qwen05b_k_proj_prefill_m128_n128_k896_seq128_ctx128,128,128,896,18,512,1,3,"{""ctx_len"": 128, ""dtype"": ""bfloat16"", ""family"": ""gemm"", ""family_group"": ""QWEN"", ""head_dim"": 64, ""hidden_size"": 896, ""intermediate_size"": 4864, ""k"": 896, ""m"": 128, ""mode"": ""prefill"", ""mode_id"": 1, ""model_id"": ""Qwen/Qwen2.5-0.5B"", ""n"": 128, ""num_attention_heads"": 14, ""num_key_value_heads"": 2, ""role"": ""k_proj"", ""role_id"": 4, ""seq_len"": 128}","{""block_size"": 512, ""num_stages"": 3, ""num_warps"": 1}",0.19494399428367615,2.521339535521962,1.6350429704723979,0.03125
QWEN,gemm,qwen05b_k_proj_prefill_m128_n128_k896_seq128_ctx128,128,128,896,19,512,1,4,"{""ctx_len"": 128, ""dtype"": ""bfloat16"", ""family"": ""gemm"", ""family_group"": ""QWEN"", ""head_dim"": 64, ""hidden_size"": 896, ""intermediate_size"": 4864, ""k"": 896, ""m"": 128, ""mode"": ""prefill"", ""mode_id"": 1, ""model_id"": ""Qwen/Qwen2.5-0.5B"", ""n"": 128, ""num_attention_heads"": 14, ""num_key_value_heads"": 2, ""role"": ""k_proj"", ""role_id"": 4, ""seq_len"": 128}","{""block_size"": 512, ""num_stages"": 4, ""num_warps"": 1}",0.1470080018043518,3.3434914696286264,1.91726825964167,0.03125
QWEN,gemm,qwen05b_k_proj_prefill_m128_n128_k896_seq128_ctx128,128,128,896,20,512,2,1,"{""ctx_len"": 128, ""dtype"": ""bfloat16"", ""family"": ""gemm"", ""family_group"": ""QWEN"", ""head_dim"": 64, ""hidden_size"": 896, ""intermediate_size"": 4864, ""k"": 896, ""m"": 128, ""mode"": ""prefill"", ""mode_id"": 1, ""model_id"": ""Qwen/Qwen2.5-0.5B"", ""n"": 128, ""num_attention_heads"": 14, ""num_key_value_heads"": 2, ""role"": ""k_proj"", ""role_id"": 4, ""seq_len"": 128}","{""block_size"": 512, ""num_stages"": 1, ""num_warps"": 2}",0.8581919968128204,0.5727389696308308,0.1529274320183935,0.03125
QWEN,gemm,qwen05b_k_proj_prefill_m128_n128_k896_seq128_ctx128,128,128,896,21,512,2,2,"{""ctx_len"": 128, ""dtype"": ""bfloat16"", ""family"": ""gemm"", ""family_group"": ""QWEN"", ""head_dim"": 64, ""hidden_size"": 896, ""intermediate_size"": 4864, ""k"": 896, ""m"": 128, ""mode"": ""prefill"", ""mode_id"": 1, ""model_id"": ""Qwen/Qwen2.5-0.5B"", ""n"": 128, ""num_attention_heads"": 14, ""num_key_value_heads"": 2, ""role"": ""k_proj"", ""role_id"": 4, ""seq_len"": 128}","{""block_size"": 512, ""num_stages"": 2, ""num_warps"": 2}",0.06092799827456474,8.067227119214122,2.7980624681324873,0.03125
QWEN,gemm,qwen05b_k_proj_prefill_m128_n128_k896_seq128_ctx128,128,128,896,22,512,2,3,"{""ctx_len"": 128, ""dtype"": ""bfloat16"", ""family"": ""gemm"", ""family_group"": ""QWEN"", ""head_dim"": 64, ""hidden_size"": 896, ""intermediate_size"": 4864, ""k"": 896, ""m"": 128, ""mode"": ""prefill"", ""mode_id"": 1, ""model_id"": ""Qwen/Qwen2.5-0.5B"", ""n"": 128, ""num_attention_heads"": 14, ""num_key_value_heads"": 2, ""role"": ""k_proj"", ""role_id"": 4, ""seq_len"": 128}","{""block_size"": 512, ""num_stages"": 3, ""num_warps"": 2}",0.047359999269247055,10.378378538514163,3.0499773038361364,0.03125
QWEN,gemm,qwen05b_k_proj_prefill_m128_n128_k896_seq128_ctx128,128,128,896,23,512,2,4,"{""ctx_len"": 128, ""dtype"": ""bfloat16"", ""family"": ""gemm"", ""family_group"": ""QWEN"", ""head_dim"": 64, ""hidden_size"": 896, ""intermediate_size"": 4864, ""k"": 896, ""m"": 128, ""mode"": ""prefill"", ""mode_id"": 1, ""model_id"": ""Qwen/Qwen2.5-0.5B"", ""n"": 128, ""num_attention_heads"": 14, ""num_key_value_heads"": 2, ""role"": ""k_proj"", ""role_id"": 4, ""seq_len"": 128}","{""block_size"": 512, ""num_stages"": 4, ""num_warps"": 2}",0.046271998435258865,10.622406998213114,3.0732182862619934,0.03125
QWEN,gemm,qwen05b_k_proj_prefill_m128_n128_k896_seq128_ctx128,128,128,896,24,512,4,1,"{""ctx_len"": 128, ""dtype"": ""bfloat16"", ""family"": ""gemm"", ""family_group"": ""QWEN"", ""head_dim"": 64, ""hidden_size"": 896, ""intermediate_size"": 4864, ""k"": 896, ""m"": 128, ""mode"": ""prefill"", ""mode_id"": 1, ""model_id"": ""Qwen/Qwen2.5-0.5B"", ""n"": 128, ""num_attention_heads"": 14, ""num_key_value_heads"": 2, ""role"": ""k_proj"", ""role_id"": 4, ""seq_len"": 128}","{""block_size"": 512, ""num_stages"": 1, ""num_warps"": 4}",0.034143999218940735,14.395501735114223,3.3771684267382414,0.03125
QWEN,gemm,qwen05b_k_proj_prefill_m128_n128_k896_seq128_ctx128,128,128,896,25,512,4,2,"{""ctx_len"": 128, ""dtype"": ""bfloat16"", ""family"": ""gemm"", ""family_group"": ""QWEN"", ""head_dim"": 64, ""hidden_size"": 896, ""intermediate_size"": 4864, ""k"": 896, ""m"": 128, ""mode"": ""prefill"", ""mode_id"": 1, ""model_id"": ""Qwen/Qwen2.5-0.5B"", ""n"": 128, ""num_attention_heads"": 14, ""num_key_value_heads"": 2, ""role"": ""k_proj"", ""role_id"": 4, ""seq_len"": 128}","{""block_size"": 512, ""num_stages"": 2, ""num_warps"": 4}",0.028095999732613564,17.49430540567127,3.572128071046317,0.03125
QWEN,gemm,qwen05b_k_proj_prefill_m128_n128_k896_seq128_ctx128,128,128,896,26,512,4,3,"{""ctx_len"": 128, ""dtype"": ""bfloat16"", ""family"": ""gemm"", ""family_group"": ""QWEN"", ""head_dim"": 64, ""hidden_size"": 896, ""intermediate_size"": 4864, ""k"": 896, ""m"": 128, ""mode"": ""prefill"", ""mode_id"": 1, ""model_id"": ""Qwen/Qwen2.5-0.5B"", ""n"": 128, ""num_attention_heads"": 14, ""num_key_value_heads"": 2, ""role"": ""k_proj"", ""role_id"": 4, ""seq_len"": 128}","{""block_size"": 512, ""num_stages"": 3, ""num_warps"": 4}",0.016863999888300896,29.14611024997595,4.082574113246709,0.03125
QWEN,gemm,qwen05b_k_proj_prefill_m128_n128_k896_seq128_ctx128,128,128,896,27,512,4,4,"{""ctx_len"": 128, ""dtype"": ""bfloat16"", ""family"": ""gemm"", ""family_group"": ""QWEN"", ""head_dim"": 64, ""hidden_size"": 896, ""intermediate_size"": 4864, ""k"": 896, ""m"": 128, ""mode"": ""prefill"", ""mode_id"": 1, ""model_id"": ""Qwen/Qwen2.5-0.5B"", ""n"": 128, ""num_attention_heads"": 14, ""num_key_value_heads"": 2, ""role"": ""k_proj"", ""role_id"": 4, ""seq_len"": 128}","{""block_size"": 512, ""num_stages"": 4, ""num_warps"": 4}",0.013248000293970108,37.101448452089606,4.323908659149461,0.03125
QWEN,gemm,qwen05b_k_proj_prefill_m128_n128_k896_seq128_ctx128,128,128,896,28,512,8,1,"{""ctx_len"": 128, ""dtype"": ""bfloat16"", ""family"": ""gemm"", ""family_group"": ""QWEN"", ""head_dim"": 64, ""hidden_size"": 896, ""intermediate_size"": 4864, ""k"": 896, ""m"": 128, ""mode"": ""prefill"", ""mode_id"": 1, ""model_id"": ""Qwen/Qwen2.5-0.5B"", ""n"": 128, ""num_attention_heads"": 14, ""num_key_value_heads"": 2, ""role"": ""k_proj"", ""role_id"": 4, ""seq_len"": 128}","{""block_size"": 512, ""num_stages"": 1, ""num_warps"": 8}",0.03209599852561951,15.314058529995924,3.4390239131391938,0.03125
QWEN,gemm,qwen05b_k_proj_prefill_m128_n128_k896_seq128_ctx128,128,128,896,29,512,8,2,"{""ctx_len"": 128, ""dtype"": ""bfloat16"", ""family"": ""gemm"", ""family_group"": ""QWEN"", ""head_dim"": 64, ""hidden_size"": 896, ""intermediate_size"": 4864, ""k"": 896, ""m"": 128, ""mode"": ""prefill"", ""mode_id"": 1, ""model_id"": ""Qwen/Qwen2.5-0.5B"", ""n"": 128, ""num_attention_heads"": 14, ""num_key_value_heads"": 2, ""role"": ""k_proj"", ""role_id"": 4, ""seq_len"": 128}","{""block_size"": 512, ""num_stages"": 2, ""num_warps"": 8}",0.027424000203609467,17.922987031458216,3.5963367291422688,0.03125
QWEN,gemm,qwen05b_k_proj_prefill_m128_n128_k896_seq128_ctx128,128,128,896,30,512,8,3,"{""ctx_len"": 128, ""dtype"": ""bfloat16"", ""family"": ""gemm"", ""family_group"": ""QWEN"", ""head_dim"": 64, ""hidden_size"": 896, ""intermediate_size"": 4864, ""k"": 896, ""m"": 128, ""mode"": ""prefill"", ""mode_id"": 1, ""model_id"": ""Qwen/Qwen2.5-0.5B"", ""n"": 128, ""num_attention_heads"": 14, ""num_key_value_heads"": 2, ""role"": ""k_proj"", ""role_id"": 4, ""seq_len"": 128}","{""block_size"": 512, ""num_stages"": 3, ""num_warps"": 8}",0.017055999487638474,28.818012122727524,4.071253261038661,0.03125
QWEN,gemm,qwen05b_k_proj_prefill_m128_n128_k896_seq128_ctx128,128,128,896,31,512,8,4,"{""ctx_len"": 128, ""dtype"": ""bfloat16"", ""family"": ""gemm"", ""family_group"": ""QWEN"", ""head_dim"": 64, ""hidden_size"": 896, ""intermediate_size"": 4864, ""k"": 896, ""m"": 128, ""mode"": ""prefill"", ""mode_id"": 1, ""model_id"": ""Qwen/Qwen2.5-0.5B"", ""n"": 128, ""num_attention_heads"": 14, ""num_key_value_heads"": 2, ""role"": ""k_proj"", ""role_id"": 4, ""seq_len"": 128}","{""block_size"": 512, ""num_stages"": 4, ""num_warps"": 8}",0.013663999736309052,35.9718976496973,4.292990661234148,0.03125
QWEN,gemm,qwen05b_k_proj_prefill_m128_n128_k896_seq128_ctx128,128,128,896,32,1024,1,1,"{""ctx_len"": 128, ""dtype"": ""bfloat16"", ""family"": ""gemm"", ""family_group"": ""QWEN"", ""head_dim"": 64, ""hidden_size"": 896, ""intermediate_size"": 4864, ""k"": 896, ""m"": 128, ""mode"": ""prefill"", ""mode_id"": 1, ""model_id"": ""Qwen/Qwen2.5-0.5B"", ""n"": 128, ""num_attention_heads"": 14, ""num_key_value_heads"": 2, ""role"": ""k_proj"", ""role_id"": 4, ""seq_len"": 128}","{""block_size"": 1024, ""num_stages"": 1, ""num_warps"": 1}",0.8128319978713989,0.6047006039220482,0.2072308354729073,0.03125
QWEN,gemm,qwen05b_k_proj_prefill_m128_n128_k896_seq128_ctx128,128,128,896,33,1024,1,2,"{""ctx_len"": 128, ""dtype"": ""bfloat16"", ""family"": ""gemm"", ""family_group"": ""QWEN"", ""head_dim"": 64, ""hidden_size"": 896, ""intermediate_size"": 4864, ""k"": 896, ""m"": 128, ""mode"": ""prefill"", ""mode_id"": 1, ""model_id"": ""Qwen/Qwen2.5-0.5B"", ""n"": 128, ""num_attention_heads"": 14, ""num_key_value_heads"": 2, ""role"": ""k_proj"", ""role_id"": 4, ""seq_len"": 128}","{""block_size"": 1024, ""num_stages"": 2, ""num_warps"": 1}",0.22865600138902664,2.1496046332225784,1.4755365821679542,0.03125
QWEN,gemm,qwen05b_k_proj_prefill_m128_n128_k896_seq128_ctx128,128,128,896,34,1024,1,3,"{""ctx_len"": 128, ""dtype"": ""bfloat16"", ""family"": ""gemm"", ""family_group"": ""QWEN"", ""head_dim"": 64, ""hidden_size"": 896, ""intermediate_size"": 4864, ""k"": 896, ""m"": 128, ""mode"": ""prefill"", ""mode_id"": 1, ""model_id"": ""Qwen/Qwen2.5-0.5B"", ""n"": 128, ""num_attention_heads"": 14, ""num_key_value_heads"": 2, ""role"": ""k_proj"", ""role_id"": 4, ""seq_len"": 128}","{""block_size"": 1024, ""num_stages"": 3, ""num_warps"": 1}",0.19491200149059296,2.5217533873804188,1.6352070966805454,0.03125
QWEN,gemm,qwen05b_k_proj_prefill_m128_n128_k896_seq128_ctx128,128,128,896,35,1024,1,4,"{""ctx_len"": 128, ""dtype"": ""bfloat16"", ""family"": ""gemm"", ""family_group"": ""QWEN"", ""head_dim"": 64, ""hidden_size"": 896, ""intermediate_size"": 4864, ""k"": 896, ""m"": 128, ""mode"": ""prefill"", ""mode_id"": 1, ""model_id"": ""Qwen/Qwen2.5-0.5B"", ""n"": 128, ""num_attention_heads"": 14, ""num_key_value_heads"": 2, ""role"": ""k_proj"", ""role_id"": 4, ""seq_len"": 128}","{""block_size"": 1024, ""num_stages"": 4, ""num_warps"": 1}",0.14720000326633453,3.3391303606880656,1.9159630504975889,0.03125
QWEN,gemm,qwen05b_k_proj_prefill_m128_n128_k896_seq128_ctx128,128,128,896,36,1024,2,1,"{""ctx_len"": 128, ""dtype"": ""bfloat16"", ""family"": ""gemm"", ""family_group"": ""QWEN"", ""head_dim"": 64, ""hidden_size"": 896, ""intermediate_size"": 4864, ""k"": 896, ""m"": 128, ""mode"": ""prefill"", ""mode_id"": 1, ""model_id"": ""Qwen/Qwen2.5-0.5B"", ""n"": 128, ""num_attention_heads"": 14, ""num_key_value_heads"": 2, ""role"": ""k_proj"", ""role_id"": 4, ""seq_len"": 128}","{""block_size"": 1024, ""num_stages"": 1, ""num_warps"": 2}",0.8562400043010712,0.5740446574920501,0.15520456328280943,0.03125
QWEN,gemm,qwen05b_k_proj_prefill_m128_n128_k896_seq128_ctx128,128,128,896,37,1024,2,2,"{""ctx_len"": 128, ""dtype"": ""bfloat16"", ""family"": ""gemm"", ""family_group"": ""QWEN"", ""head_dim"": 64, ""hidden_size"": 896, ""intermediate_size"": 4864, ""k"": 896, ""m"": 128, ""mode"": ""prefill"", ""mode_id"": 1, ""model_id"": ""Qwen/Qwen2.5-0.5B"", ""n"": 128, ""num_attention_heads"": 14, ""num_key_value_heads"": 2, ""role"": ""k_proj"", ""role_id"": 4, ""seq_len"": 128}","{""block_size"": 1024, ""num_stages"": 2, ""num_warps"": 2}",0.06092799827456474,8.067227119214122,2.7980624681324873,0.03125
QWEN,gemm,qwen05b_k_proj_prefill_m128_n128_k896_seq128_ctx128,128,128,896,38,1024,2,3,"{""ctx_len"": 128, ""dtype"": ""bfloat16"", ""family"": ""gemm"", ""family_group"": ""QWEN"", ""head_dim"": 64, ""hidden_size"": 896, ""intermediate_size"": 4864, ""k"": 896, ""m"": 128, ""mode"": ""prefill"", ""mode_id"": 1, ""model_id"": ""Qwen/Qwen2.5-0.5B"", ""n"": 128, ""num_attention_heads"": 14, ""num_key_value_heads"": 2, ""role"": ""k_proj"", ""role_id"": 4, ""seq_len"": 128}","{""block_size"": 1024, ""num_stages"": 3, ""num_warps"": 2}",0.047359999269247055,10.378378538514163,3.0499773038361364,0.03125
QWEN,gemm,qwen05b_k_proj_prefill_m128_n128_k896_seq128_ctx128,128,128,896,39,1024,2,4,"{""ctx_len"": 128, ""dtype"": ""bfloat16"", ""family"": ""gemm"", ""family_group"": ""QWEN"", ""head_dim"": 64, ""hidden_size"": 896, ""intermediate_size"": 4864, ""k"": 896, ""m"": 128, ""mode"": ""prefill"", ""mode_id"": 1, ""model_id"": ""Qwen/Qwen2.5-0.5B"", ""n"": 128, ""num_attention_heads"": 14, ""num_key_value_heads"": 2, ""role"": ""k_proj"", ""role_id"": 4, ""seq_len"": 128}","{""block_size"": 1024, ""num_stages"": 4, ""num_warps"": 2}",0.046271998435258865,10.622406998213114,3.0732182862619934,0.03125
QWEN,gemm,qwen05b_k_proj_prefill_m128_n128_k896_seq128_ctx128,128,128,896,40,1024,4,1,"{""ctx_len"": 128, ""dtype"": ""bfloat16"", ""family"": ""gemm"", ""family_group"": ""QWEN"", ""head_dim"": 64, ""hidden_size"": 896, ""intermediate_size"": 4864, ""k"": 896, ""m"": 128, ""mode"": ""prefill"", ""mode_id"": 1, ""model_id"": ""Qwen/Qwen2.5-0.5B"", ""n"": 128, ""num_attention_heads"": 14, ""num_key_value_heads"": 2, ""role"": ""k_proj"", ""role_id"": 4, ""seq_len"": 128}","{""block_size"": 1024, ""num_stages"": 1, ""num_warps"": 4}",0.03407999873161316,14.422535748044439,3.3790446142389463,0.03125
QWEN,gemm,qwen05b_k_proj_prefill_m128_n128_k896_seq128_ctx128,128,128,896,41,1024,4,2,"{""ctx_len"": 128, ""dtype"": ""bfloat16"", ""family"": ""gemm"", ""family_group"": ""QWEN"", ""head_dim"": 64, ""hidden_size"": 896, ""intermediate_size"": 4864, ""k"": 896, ""m"": 128, ""mode"": ""prefill"", ""mode_id"": 1, ""model_id"": ""Qwen/Qwen2.5-0.5B"", ""n"": 128, ""num_attention_heads"": 14, ""num_key_value_heads"": 2, ""role"": ""k_proj"", ""role_id"": 4, ""seq_len"": 128}","{""block_size"": 1024, ""num_stages"": 2, ""num_warps"": 4}",0.028095999732613564,17.49430540567127,3.572128071046317,0.03125
QWEN,gemm,qwen05b_k_proj_prefill_m128_n128_k896_seq128_ctx128,128,128,896,42,1024,4,3,"{""ctx_len"": 128, ""dtype"": ""bfloat16"", ""family"": ""gemm"", ""family_group"": ""QWEN"", ""head_dim"": 64, ""hidden_size"": 896, ""intermediate_size"": 4864, ""k"": 896, ""m"": 128, ""mode"": ""prefill"", ""mode_id"": 1, ""model_id"": ""Qwen/Qwen2.5-0.5B"", ""n"": 128, ""num_attention_heads"": 14, ""num_key_value_heads"": 2, ""role"": ""k_proj"", ""role_id"": 4, ""seq_len"": 128}","{""block_size"": 1024, ""num_stages"": 3, ""num_warps"": 4}",0.016847999766469002,29.17378957816858,4.083523337451569,0.03125
QWEN,gemm,qwen05b_k_proj_prefill_m128_n128_k896_seq128_ctx128,128,128,896,43,1024,4,4,"{""ctx_len"": 128, ""dtype"": ""bfloat16"", ""family"": ""gemm"", ""family_group"": ""QWEN"", ""head_dim"": 64, ""hidden_size"": 896, ""intermediate_size"": 4864, ""k"": 896, ""m"": 128, ""mode"": ""prefill"", ""mode_id"": 1, ""model_id"": ""Qwen/Qwen2.5-0.5B"", ""n"": 128, ""num_attention_heads"": 14, ""num_key_value_heads"": 2, ""role"": ""k_proj"", ""role_id"": 4, ""seq_len"": 128}","{""block_size"": 1024, ""num_stages"": 4, ""num_warps"": 4}",0.013248000293970108,37.101448452089606,4.323908659149461,0.03125
QWEN,gemm,qwen05b_k_proj_prefill_m128_n128_k896_seq128_ctx128,128,128,896,44,1024,8,1,"{""ctx_len"": 128, ""dtype"": ""bfloat16"", ""family"": ""gemm"", ""family_group"": ""QWEN"", ""head_dim"": 64, ""hidden_size"": 896, ""intermediate_size"": 4864, ""k"": 896, ""m"": 128, ""mode"": ""prefill"", ""mode_id"": 1, ""model_id"": ""Qwen/Qwen2.5-0.5B"", ""n"": 128, ""num_attention_heads"": 14, ""num_key_value_heads"": 2, ""role"": ""k_proj"", ""role_id"": 4, ""seq_len"": 128}","{""block_size"": 1024, ""num_stages"": 1, ""num_warps"": 8}",0.03219199925661087,15.268390014610933,3.4360373275972194,0.03125
QWEN,gemm,qwen05b_k_proj_prefill_m128_n128_k896_seq128_ctx128,128,128,896,45,1024,8,2,"{""ctx_len"": 128, ""dtype"": ""bfloat16"", ""family"": ""gemm"", ""family_group"": ""QWEN"", ""head_dim"": 64, ""hidden_size"": 896, ""intermediate_size"": 4864, ""k"": 896, ""m"": 128, ""mode"": ""prefill"", ""mode_id"": 1, ""model_id"": ""Qwen/Qwen2.5-0.5B"", ""n"": 128, ""num_attention_heads"": 14, ""num_key_value_heads"": 2, ""role"": ""k_proj"", ""role_id"": 4, ""seq_len"": 128}","{""block_size"": 1024, ""num_stages"": 2, ""num_warps"": 8}",0.027424000203609467,17.922987031458216,3.5963367291422688,0.03125
QWEN,gemm,qwen05b_k_proj_prefill_m128_n128_k896_seq128_ctx128,128,128,896,46,1024,8,3,"{""ctx_len"": 128, ""dtype"": ""bfloat16"", ""family"": ""gemm"", ""family_group"": ""QWEN"", ""head_dim"": 64, ""hidden_size"": 896, ""intermediate_size"": 4864, ""k"": 896, ""m"": 128, ""mode"": ""prefill"", ""mode_id"": 1, ""model_id"": ""Qwen/Qwen2.5-0.5B"", ""n"": 128, ""num_attention_heads"": 14, ""num_key_value_heads"": 2, ""role"": ""k_proj"", ""role_id"": 4, ""seq_len"": 128}","{""block_size"": 1024, ""num_stages"": 3, ""num_warps"": 8}",0.01708799973130226,28.764045396116224,4.069378831928706,0.03125
QWEN,gemm,qwen05b_k_proj_prefill_m128_n128_k896_seq128_ctx128,128,128,896,47,1024,8,4,"{""ctx_len"": 128, ""dtype"": ""bfloat16"", ""family"": ""gemm"", ""family_group"": ""QWEN"", ""head_dim"": 64, ""hidden_size"": 896, ""intermediate_size"": 4864, ""k"": 896, ""m"": 128, ""mode"": ""prefill"", ""mode_id"": 1, ""model_id"": ""Qwen/Qwen2.5-0.5B"", ""n"": 128, ""num_attention_heads"": 14, ""num_key_value_heads"": 2, ""role"": ""k_proj"", ""role_id"": 4, ""seq_len"": 128}","{""block_size"": 1024, ""num_stages"": 4, ""num_warps"": 8}",0.013663999736309052,35.9718976496973,4.292990661234148,0.03125
QWEN,gemm,qwen05b_v_proj_prefill_m128_n128_k896_seq128_ctx128,128,128,896,0,256,1,1,"{""ctx_len"": 128, ""dtype"": ""bfloat16"", ""family"": ""gemm"", ""family_group"": ""QWEN"", ""head_dim"": 64, ""hidden_size"": 896, ""intermediate_size"": 4864, ""k"": 896, ""m"": 128, ""mode"": ""prefill"", ""mode_id"": 1, ""model_id"": ""Qwen/Qwen2.5-0.5B"", ""n"": 128, ""num_attention_heads"": 14, ""num_key_value_heads"": 2, ""role"": ""v_proj"", ""role_id"": 5, ""seq_len"": 128}","{""block_size"": 256, ""num_stages"": 1, ""num_warps"": 1}",0.03551999852061272,13.837838414175737,3.3376594025075854,0.03125
QWEN,gemm,qwen05b_v_proj_prefill_m128_n128_k896_seq128_ctx128,128,128,896,1,256,1,2,"{""ctx_len"": 128, ""dtype"": ""bfloat16"", ""family"": ""gemm"", ""family_group"": ""QWEN"", ""head_dim"": 64, ""hidden_size"": 896, ""intermediate_size"": 4864, ""k"": 896, ""m"": 128, ""mode"": ""prefill"", ""mode_id"": 1, ""model_id"": ""Qwen/Qwen2.5-0.5B"", ""n"": 128, ""num_attention_heads"": 14, ""num_key_value_heads"": 2, ""role"": ""v_proj"", ""role_id"": 5, ""seq_len"": 128}","{""block_size"": 256, ""num_stages"": 2, ""num_warps"": 1}",0.02783999964594841,17.655172638320472,3.5812814562332886,0.03125
QWEN,gemm,qwen05b_v_proj_prefill_m128_n128_k896_seq128_ctx128,128,128,896,2,256,1,3,"{""ctx_len"": 128, ""dtype"": ""bfloat16"", ""family"": ""gemm"", ""family_group"": ""QWEN"", ""head_dim"": 64, ""hidden_size"": 896, ""intermediate_size"": 4864, ""k"": 896, ""m"": 128, ""mode"": ""prefill"", ""mode_id"": 1, ""model_id"": ""Qwen/Qwen2.5-0.5B"", ""n"": 128, ""num_attention_heads"": 14, ""num_key_value_heads"": 2, ""role"": ""v_proj"", ""role_id"": 5, ""seq_len"": 128}","{""block_size"": 256, ""num_stages"": 3, ""num_warps"": 1}",0.01727999933063984,28.44444554627191,4.058205554342349,0.03125
QWEN,gemm,qwen05b_v_proj_prefill_m128_n128_k896_seq128_ctx128,128,128,896,3,256,1,4,"{""ctx_len"": 128, ""dtype"": ""bfloat16"", ""family"": ""gemm"", ""family_group"": ""QWEN"", ""head_dim"": 64, ""hidden_size"": 896, ""intermediate_size"": 4864, ""k"": 896, ""m"": 128, ""mode"": ""prefill"", ""mode_id"": 1, ""model_id"": ""Qwen/Qwen2.5-0.5B"", ""n"": 128, ""num_attention_heads"": 14, ""num_key_value_heads"": 2, ""role"": ""v_proj"", ""role_id"": 5, ""seq_len"": 128}","{""block_size"": 256, ""num_stages"": 4, ""num_warps"": 1}",0.017023999243974686,28.872181733323558,4.073131210232286,0.03125
QWEN,gemm,qwen05b_v_proj_prefill_m128_n128_k896_seq128_ctx128,128,128,896,4,256,2,1,"{""ctx_len"": 128, ""dtype"": ""bfloat16"", ""family"": ""gemm"", ""family_group"": ""QWEN"", ""head_dim"": 64, ""hidden_size"": 896, ""intermediate_size"": 4864, ""k"": 896, ""m"": 128, ""mode"": ""prefill"", ""mode_id"": 1, ""model_id"": ""Qwen/Qwen2.5-0.5B"", ""n"": 128, ""num_attention_heads"": 14, ""num_key_value_heads"": 2, ""role"": ""v_proj"", ""role_id"": 5, ""seq_len"": 128}","{""block_size"": 256, ""num_stages"": 1, ""num_warps"": 2}",0.04179200157523155,11.761102160067495,3.175050307635993,0.03125
QWEN,gemm,qwen05b_v_proj_prefill_m128_n128_k896_seq128_ctx128,128,128,896,5,256,2,2,"{""ctx_len"": 128, ""dtype"": ""bfloat16"", ""family"": ""gemm"", ""family_group"": ""QWEN"", ""head_dim"": 64, ""hidden_size"": 896, ""intermediate_size"": 4864, ""k"": 896, ""m"": 128, ""mode"": ""prefill"", ""mode_id"": 1, ""model_id"": ""Qwen/Qwen2.5-0.5B"", ""n"": 128, ""num_attention_heads"": 14, ""num_key_value_heads"": 2, ""role"": ""v_proj"", ""role_id"": 5, ""seq_len"": 128}","{""block_size"": 256, ""num_stages"": 2, ""num_warps"": 2}",0.028511999174952507,17.239057737901284,3.5574302566305898,0.03125
QWEN,gemm,qwen05b_v_proj_prefill_m128_n128_k896_seq128_ctx128,128,128,896,6,256,2,3,"{""ctx_len"": 128, ""dtype"": ""bfloat16"", ""family"": ""gemm"", ""family_group"": ""QWEN"", ""head_dim"": 64, ""hidden_size"": 896, ""intermediate_size"": 4864, ""k"": 896, ""m"": 128, ""mode"": ""prefill"", ""mode_id"": 1, ""model_id"": ""Qwen/Qwen2.5-0.5B"", ""n"": 128, ""num_attention_heads"": 14, ""num_key_value_heads"": 2, ""role"": ""v_proj"", ""role_id"": 5, ""seq_len"": 128}","{""block_size"": 256, ""num_stages"": 3, ""num_warps"": 2}",0.015936000272631645,30.84337296631027,4.139174561031985,0.03125
QWEN,gemm,qwen05b_v_proj_prefill_m128_n128_k896_seq128_ctx128,128,128,896,7,256,2,4,"{""ctx_len"": 128, ""dtype"": ""bfloat16"", ""family"": ""gemm"", ""family_group"": ""QWEN"", ""head_dim"": 64, ""hidden_size"": 896, ""intermediate_size"": 4864, ""k"": 896, ""m"": 128, ""mode"": ""prefill"", ""mode_id"": 1, ""model_id"": ""Qwen/Qwen2.5-0.5B"", ""n"": 128, ""num_attention_heads"": 14, ""num_key_value_heads"": 2, ""role"": ""v_proj"", ""role_id"": 5, ""seq_len"": 128}","{""block_size"": 256, ""num_stages"": 4, ""num_warps"": 2}",0.012640000320971012,38.88607496192224,4.37088886487015,0.03125
QWEN,gemm,qwen05b_v_proj_prefill_m128_n128_k896_seq128_ctx128,128,128,896,8,256,4,1,"{""ctx_len"": 128, ""dtype"": ""bfloat16"", ""family"": ""gemm"", ""family_group"": ""QWEN"", ""head_dim"": 64, ""hidden_size"": 896, ""intermediate_size"": 4864, ""k"": 896, ""m"": 128, ""mode"": ""prefill"", ""mode_id"": 1, ""model_id"": ""Qwen/Qwen2.5-0.5B"", ""n"": 128, ""num_attention_heads"": 14, ""num_key_value_heads"": 2, ""role"": ""v_proj"", ""role_id"": 5, ""seq_len"": 128}","{""block_size"": 256, ""num_stages"": 1, ""num_warps"": 4}",0.03699199855327606,13.287197751484294,3.2970536450413284,0.03125
QWEN,gemm,qwen05b_v_proj_prefill_m128_n128_k896_seq128_ctx128,128,128,896,9,256,4,2,"{""ctx_len"": 128, ""dtype"": ""bfloat16"", ""family"": ""gemm"", ""family_group"": ""QWEN"", ""head_dim"": 64, ""hidden_size"": 896, ""intermediate_size"": 4864, ""k"": 896, ""m"": 128, ""mode"": ""prefill"", ""mode_id"": 1, ""model_id"": ""Qwen/Qwen2.5-0.5B"", ""n"": 128, ""num_attention_heads"": 14, ""num_key_value_heads"": 2, ""role"": ""v_proj"", ""role_id"": 5, ""seq_len"": 128}","{""block_size"": 256, ""num_stages"": 2, ""num_warps"": 4}",0.02425600029528141,20.26385199606123,3.719091257348635,0.03125
QWEN,gemm,qwen05b_v_proj_prefill_m128_n128_k896_seq128_ctx128,128,128,896,10,256,4,3,"{""ctx_len"": 128, ""dtype"": ""bfloat16"", ""family"": ""gemm"", ""family_group"": ""QWEN"", ""head_dim"": 64, ""hidden_size"": 896, ""intermediate_size"": 4864, ""k"": 896, ""m"": 128, ""mode"": ""prefill"", ""mode_id"": 1, ""model_id"": ""Qwen/Qwen2.5-0.5B"", ""n"": 128, ""num_attention_heads"": 14, ""num_key_value_heads"": 2, ""role"": ""v_proj"", ""role_id"": 5, ""seq_len"": 128}","{""block_size"": 256, ""num_stages"": 3, ""num_warps"": 4}",0.014751999638974667,33.318872832765535,4.216376636640875,0.03125
QWEN,gemm,qwen05b_v_proj_prefill_m128_n128_k896_seq128_ctx128,128,128,896,11,256,4,4,"{""ctx_len"": 128, ""dtype"": ""bfloat16"", ""family"": ""gemm"", ""family_group"": ""QWEN"", ""head_dim"": 64, ""hidden_size"": 896, ""intermediate_size"": 4864, ""k"": 896, ""m"": 128, ""mode"": ""prefill"", ""mode_id"": 1, ""model_id"": ""Qwen/Qwen2.5-0.5B"", ""n"": 128, ""num_attention_heads"": 14, ""num_key_value_heads"": 2, ""role"": ""v_proj"", ""role_id"": 5, ""seq_len"": 128}","{""block_size"": 256, ""num_stages"": 4, ""num_warps"": 4}",0.011744000017642975,41.85286097254692,4.444412805607681,0.03125
QWEN,gemm,qwen05b_v_proj_prefill_m128_n128_k896_seq128_ctx128,128,128,896,12,256,8,1,"{""ctx_len"": 128, ""dtype"": ""bfloat16"", ""family"": ""gemm"", ""family_group"": ""QWEN"", ""head_dim"": 64, ""hidden_size"": 896, ""intermediate_size"": 4864, ""k"": 896, ""m"": 128, ""mode"": ""prefill"", ""mode_id"": 1, ""model_id"": ""Qwen/Qwen2.5-0.5B"", ""n"": 128, ""num_attention_heads"": 14, ""num_key_value_heads"": 2, ""role"": ""v_proj"", ""role_id"": 5, ""seq_len"": 128}","{""block_size"": 256, ""num_stages"": 1, ""num_warps"": 8}",0.0261439997702837,18.80048976127521,3.644135569091123,0.03125
QWEN,gemm,qwen05b_v_proj_prefill_m128_n128_k896_seq128_ctx128,128,128,896,13,256,8,2,"{""ctx_len"": 128, ""dtype"": ""bfloat16"", ""family"": ""gemm"", ""family_group"": ""QWEN"", ""head_dim"": 64, ""hidden_size"": 896, ""intermediate_size"": 4864, ""k"": 896, ""m"": 128, ""mode"": ""prefill"", ""mode_id"": 1, ""model_id"": ""Qwen/Qwen2.5-0.5B"", ""n"": 128, ""num_attention_heads"": 14, ""num_key_value_heads"": 2, ""role"": ""v_proj"", ""role_id"": 5, ""seq_len"": 128}","{""block_size"": 256, ""num_stages"": 2, ""num_warps"": 8}",0.024800000712275505,19.819354269482236,3.6969115970904145,0.03125
QWEN,gemm,qwen05b_v_proj_prefill_m128_n128_k896_seq128_ctx128,128,128,896,14,256,8,3,"{""ctx_len"": 128, ""dtype"": ""bfloat16"", ""family"": ""gemm"", ""family_group"": ""QWEN"", ""head_dim"": 64, ""hidden_size"": 896, ""intermediate_size"": 4864, ""k"": 896, ""m"": 128, ""mode"": ""prefill"", ""mode_id"": 1, ""model_id"": ""Qwen/Qwen2.5-0.5B"", ""n"": 128, ""num_attention_heads"": 14, ""num_key_value_heads"": 2, ""role"": ""v_proj"", ""role_id"": 5, ""seq_len"": 128}","{""block_size"": 256, ""num_stages"": 3, ""num_warps"": 8}",0.015231999568641186,32.26890847685649,4.184356829252378,0.03125
QWEN,gemm,qwen05b_v_proj_prefill_m128_n128_k896_seq128_ctx128,128,128,896,15,256,8,4,"{""ctx_len"": 128, ""dtype"": ""bfloat16"", ""family"": ""gemm"", ""family_group"": ""QWEN"", ""head_dim"": 64, ""hidden_size"": 896, ""intermediate_size"": 4864, ""k"": 896, ""m"": 128, ""mode"": ""prefill"", ""mode_id"": 1, ""model_id"": ""Qwen/Qwen2.5-0.5B"", ""n"": 128, ""num_attention_heads"": 14, ""num_key_value_heads"": 2, ""role"": ""v_proj"", ""role_id"": 5, ""seq_len"": 128}","{""block_size"": 256, ""num_stages"": 4, ""num_warps"": 8}",0.012128000147640705,40.52770399212246,4.41223843790858,0.03125
QWEN,gemm,qwen05b_v_proj_prefill_m128_n128_k896_seq128_ctx128,128,128,896,16,512,1,1,"{""ctx_len"": 128, ""dtype"": ""bfloat16"", ""family"": ""gemm"", ""family_group"": ""QWEN"", ""head_dim"": 64, ""hidden_size"": 896, ""intermediate_size"": 4864, ""k"": 896, ""m"": 128, ""mode"": ""prefill"", ""mode_id"": 1, ""model_id"": ""Qwen/Qwen2.5-0.5B"", ""n"": 128, ""num_attention_heads"": 14, ""num_key_value_heads"": 2, ""role"": ""v_proj"", ""role_id"": 5, ""seq_len"": 128}","{""block_size"": 512, ""num_stages"": 1, ""num_warps"": 1}",0.813759982585907,0.6040110235429416,0.20608981814792657,0.03125
QWEN,gemm,qwen05b_v_proj_prefill_m128_n128_k896_seq128_ctx128,128,128,896,17,512,1,2,"{""ctx_len"": 128, ""dtype"": ""bfloat16"", ""family"": ""gemm"", ""family_group"": ""QWEN"", ""head_dim"": 64, ""hidden_size"": 896, ""intermediate_size"": 4864, ""k"": 896, ""m"": 128, ""mode"": ""prefill"", ""mode_id"": 1, ""model_id"": ""Qwen/Qwen2.5-0.5B"", ""n"": 128, ""num_attention_heads"": 14, ""num_key_value_heads"": 2, ""role"": ""v_proj"", ""role_id"": 5, ""seq_len"": 128}","{""block_size"": 512, ""num_stages"": 2, ""num_warps"": 1}",0.22843199968338013,2.151712547634635,1.4765167073213301,0.03125
QWEN,gemm,qwen05b_v_proj_prefill_m128_n128_k896_seq128_ctx128,128,128,896,18,512,1,3,"{""ctx_len"": 128, ""dtype"": ""bfloat16"", ""family"": ""gemm"", ""family_group"": ""QWEN"", ""head_dim"": 64, ""hidden_size"": 896, ""intermediate_size"": 4864, ""k"": 896, ""m"": 128, ""mode"": ""prefill"", ""mode_id"": 1, ""model_id"": ""Qwen/Qwen2.5-0.5B"", ""n"": 128, ""num_attention_heads"": 14, ""num_key_value_heads"": 2, ""role"": ""v_proj"", ""role_id"": 5, ""seq_len"": 128}","{""block_size"": 512, ""num_stages"": 3, ""num_warps"": 1}",0.19491200149059296,2.5217533873804188,1.6352070966805454,0.03125
QWEN,gemm,qwen05b_v_proj_prefill_m128_n128_k896_seq128_ctx128,128,128,896,19,512,1,4,"{""ctx_len"": 128, ""dtype"": ""bfloat16"", ""family"": ""gemm"", ""family_group"": ""QWEN"", ""head_dim"": 64, ""hidden_size"": 896, ""intermediate_size"": 4864, ""k"": 896, ""m"": 128, ""mode"": ""prefill"", ""mode_id"": 1, ""model_id"": ""Qwen/Qwen2.5-0.5B"", ""n"": 128, ""num_attention_heads"": 14, ""num_key_value_heads"": 2, ""role"": ""v_proj"", ""role_id"": 5, ""seq_len"": 128}","{""block_size"": 512, ""num_stages"": 4, ""num_warps"": 1}",0.14694400131702423,3.344947705211664,1.9177037082023825,0.03125
QWEN,gemm,qwen05b_v_proj_prefill_m128_n128_k896_seq128_ctx128,128,128,896,20,512,2,1,"{""ctx_len"": 128, ""dtype"": ""bfloat16"", ""family"": ""gemm"", ""family_group"": ""QWEN"", ""head_dim"": 64, ""hidden_size"": 896, ""intermediate_size"": 4864, ""k"": 896, ""m"": 128, ""mode"": ""prefill"", ""mode_id"": 1, ""model_id"": ""Qwen/Qwen2.5-0.5B"", ""n"": 128, ""num_attention_heads"": 14, ""num_key_value_heads"": 2, ""role"": ""v_proj"", ""role_id"": 5, ""seq_len"": 128}","{""block_size"": 512, ""num_stages"": 1, ""num_warps"": 2}",0.8585600256919861,0.5724934603190296,0.1524986818203696,0.03125
QWEN,gemm,qwen05b_v_proj_prefill_m128_n128_k896_seq128_ctx128,128,128,896,21,512,2,2,"{""ctx_len"": 128, ""dtype"": ""bfloat16"", ""family"": ""gemm"", ""family_group"": ""QWEN"", ""head_dim"": 64, ""hidden_size"": 896, ""intermediate_size"": 4864, ""k"": 896, ""m"": 128, ""mode"": ""prefill"", ""mode_id"": 1, ""model_id"": ""Qwen/Qwen2.5-0.5B"", ""n"": 128, ""num_attention_heads"": 14, ""num_key_value_heads"": 2, ""role"": ""v_proj"", ""role_id"": 5, ""seq_len"": 128}","{""block_size"": 512, ""num_stages"": 2, ""num_warps"": 2}",0.06095999851822853,8.06299232197362,2.797537391911021,0.03125
QWEN,gemm,qwen05b_v_proj_prefill_m128_n128_k896_seq128_ctx128,128,128,896,22,512,2,3,"{""ctx_len"": 128, ""dtype"": ""bfloat16"", ""family"": ""gemm"", ""family_group"": ""QWEN"", ""head_dim"": 64, ""hidden_size"": 896, ""intermediate_size"": 4864, ""k"": 896, ""m"": 128, ""mode"": ""prefill"", ""mode_id"": 1, ""model_id"": ""Qwen/Qwen2.5-0.5B"", ""n"": 128, ""num_attention_heads"": 14, ""num_key_value_heads"": 2, ""role"": ""v_proj"", ""role_id"": 5, ""seq_len"": 128}","{""block_size"": 512, ""num_stages"": 3, ""num_warps"": 2}",0.047359999269247055,10.378378538514163,3.0499773038361364,0.03125
QWEN,gemm,qwen05b_v_proj_prefill_m128_n128_k896_seq128_ctx128,128,128,896,23,512,2,4,"{""ctx_len"": 128, ""dtype"": ""bfloat16"", ""family"": ""gemm"", ""family_group"": ""QWEN"", ""head_dim"": 64, ""hidden_size"": 896, ""intermediate_size"": 4864, ""k"": 896, ""m"": 128, ""mode"": ""prefill"", ""mode_id"": 1, ""model_id"": ""Qwen/Qwen2.5-0.5B"", ""n"": 128, ""num_attention_heads"": 14, ""num_key_value_heads"": 2, ""role"": ""v_proj"", ""role_id"": 5, ""seq_len"": 128}","{""block_size"": 512, ""num_stages"": 4, ""num_warps"": 2}",0.046271998435258865,10.622406998213114,3.0732182862619934,0.03125
QWEN,gemm,qwen05b_v_proj_prefill_m128_n128_k896_seq128_ctx128,128,128,896,24,512,4,1,"{""ctx_len"": 128, ""dtype"": ""bfloat16"", ""family"": ""gemm"", ""family_group"": ""QWEN"", ""head_dim"": 64, ""hidden_size"": 896, ""intermediate_size"": 4864, ""k"": 896, ""m"": 128, ""mode"": ""prefill"", ""mode_id"": 1, ""model_id"": ""Qwen/Qwen2.5-0.5B"", ""n"": 128, ""num_attention_heads"": 14, ""num_key_value_heads"": 2, ""role"": ""v_proj"", ""role_id"": 5, ""seq_len"": 128}","{""block_size"": 512, ""num_stages"": 1, ""num_warps"": 4}",0.03407999873161316,14.422535748044439,3.3790446142389463,0.03125
QWEN,gemm,qwen05b_v_proj_prefill_m128_n128_k896_seq128_ctx128,128,128,896,25,512,4,2,"{""ctx_len"": 128, ""dtype"": ""bfloat16"", ""family"": ""gemm"", ""family_group"": ""QWEN"", ""head_dim"": 64, ""hidden_size"": 896, ""intermediate_size"": 4864, ""k"": 896, ""m"": 128, ""mode"": ""prefill"", ""mode_id"": 1, ""model_id"": ""Qwen/Qwen2.5-0.5B"", ""n"": 128, ""num_attention_heads"": 14, ""num_key_value_heads"": 2, ""role"": ""v_proj"", ""role_id"": 5, ""seq_len"": 128}","{""block_size"": 512, ""num_stages"": 2, ""num_warps"": 4}",0.028095999732613564,17.49430540567127,3.572128071046317,0.03125
QWEN,gemm,qwen05b_v_proj_prefill_m128_n128_k896_seq128_ctx128,128,128,896,26,512,4,3,"{""ctx_len"": 128, ""dtype"": ""bfloat16"", ""family"": ""gemm"", ""family_group"": ""QWEN"", ""head_dim"": 64, ""hidden_size"": 896, ""intermediate_size"": 4864, ""k"": 896, ""m"": 128, ""mode"": ""prefill"", ""mode_id"": 1, ""model_id"": ""Qwen/Qwen2.5-0.5B"", ""n"": 128, ""num_attention_heads"": 14, ""num_key_value_heads"": 2, ""role"": ""v_proj"", ""role_id"": 5, ""seq_len"": 128}","{""block_size"": 512, ""num_stages"": 3, ""num_warps"": 4}",0.016831999644637108,29.201521529059953,4.084473463539177,0.03125
QWEN,gemm,qwen05b_v_proj_prefill_m128_n128_k896_seq128_ctx128,128,128,896,27,512,4,4,"{""ctx_len"": 128, ""dtype"": ""bfloat16"", ""family"": ""gemm"", ""family_group"": ""QWEN"", ""head_dim"": 64, ""hidden_size"": 896, ""intermediate_size"": 4864, ""k"": 896, ""m"": 128, ""mode"": ""prefill"", ""mode_id"": 1, ""model_id"": ""Qwen/Qwen2.5-0.5B"", ""n"": 128, ""num_attention_heads"": 14, ""num_key_value_heads"": 2, ""role"": ""v_proj"", ""role_id"": 5, ""seq_len"": 128}","{""block_size"": 512, ""num_stages"": 4, ""num_warps"": 4}",0.013248000293970108,37.101448452089606,4.323908659149461,0.03125
QWEN,gemm,qwen05b_v_proj_prefill_m128_n128_k896_seq128_ctx128,128,128,896,28,512,8,1,"{""ctx_len"": 128, ""dtype"": ""bfloat16"", ""family"": ""gemm"", ""family_group"": ""QWEN"", ""head_dim"": 64, ""hidden_size"": 896, ""intermediate_size"": 4864, ""k"": 896, ""m"": 128, ""mode"": ""prefill"", ""mode_id"": 1, ""model_id"": ""Qwen/Qwen2.5-0.5B"", ""n"": 128, ""num_attention_heads"": 14, ""num_key_value_heads"": 2, ""role"": ""v_proj"", ""role_id"": 5, ""seq_len"": 128}","{""block_size"": 512, ""num_stages"": 1, ""num_warps"": 8}",0.032127998769283295,15.298805366922789,3.438027393219544,0.03125
QWEN,gemm,qwen05b_v_proj_prefill_m128_n128_k896_seq128_ctx128,128,128,896,29,512,8,2,"{""ctx_len"": 128, ""dtype"": ""bfloat16"", ""family"": ""gemm"", ""family_group"": ""QWEN"", ""head_dim"": 64, ""hidden_size"": 896, ""intermediate_size"": 4864, ""k"": 896, ""m"": 128, ""mode"": ""prefill"", ""mode_id"": 1, ""model_id"": ""Qwen/Qwen2.5-0.5B"", ""n"": 128, ""num_attention_heads"": 14, ""num_key_value_heads"": 2, ""role"": ""v_proj"", ""role_id"": 5, ""seq_len"": 128}","{""block_size"": 512, ""num_stages"": 2, ""num_warps"": 8}",0.027424000203609467,17.922987031458216,3.5963367291422688,0.03125
QWEN,gemm,qwen05b_v_proj_prefill_m128_n128_k896_seq128_ctx128,128,128,896,30,512,8,3,"{""ctx_len"": 128, ""dtype"": ""bfloat16"", ""family"": ""gemm"", ""family_group"": ""QWEN"", ""head_dim"": 64, ""hidden_size"": 896, ""intermediate_size"": 4864, ""k"": 896, ""m"": 128, ""mode"": ""prefill"", ""mode_id"": 1, ""model_id"": ""Qwen/Qwen2.5-0.5B"", ""n"": 128, ""num_attention_heads"": 14, ""num_key_value_heads"": 2, ""role"": ""v_proj"", ""role_id"": 5, ""seq_len"": 128}","{""block_size"": 512, ""num_stages"": 3, ""num_warps"": 8}",0.017055999487638474,28.818012122727524,4.071253261038661,0.03125
QWEN,gemm,qwen05b_v_proj_prefill_m128_n128_k896_seq128_ctx128,128,128,896,31,512,8,4,"{""ctx_len"": 128, ""dtype"": ""bfloat16"", ""family"": ""gemm"", ""family_group"": ""QWEN"", ""head_dim"": 64, ""hidden_size"": 896, ""intermediate_size"": 4864, ""k"": 896, ""m"": 128, ""mode"": ""prefill"", ""mode_id"": 1, ""model_id"": ""Qwen/Qwen2.5-0.5B"", ""n"": 128, ""num_attention_heads"": 14, ""num_key_value_heads"": 2, ""role"": ""v_proj"", ""role_id"": 5, ""seq_len"": 128}","{""block_size"": 512, ""num_stages"": 4, ""num_warps"": 8}",0.013663999736309052,35.9718976496973,4.292990661234148,0.03125
QWEN,gemm,qwen05b_v_proj_prefill_m128_n128_k896_seq128_ctx128,128,128,896,32,1024,1,1,"{""ctx_len"": 128, ""dtype"": ""bfloat16"", ""family"": ""gemm"", ""family_group"": ""QWEN"", ""head_dim"": 64, ""hidden_size"": 896, ""intermediate_size"": 4864, ""k"": 896, ""m"": 128, ""mode"": ""prefill"", ""mode_id"": 1, ""model_id"": ""Qwen/Qwen2.5-0.5B"", ""n"": 128, ""num_attention_heads"": 14, ""num_key_value_heads"": 2, ""role"": ""v_proj"", ""role_id"": 5, ""seq_len"": 128}","{""block_size"": 1024, ""num_stages"": 1, ""num_warps"": 1}",0.813152015209198,0.6044626229863644,0.2068372063358965,0.03125
QWEN,gemm,qwen05b_v_proj_prefill_m128_n128_k896_seq128_ctx128,128,128,896,33,1024,1,2,"{""ctx_len"": 128, ""dtype"": ""bfloat16"", ""family"": ""gemm"", ""family_group"": ""QWEN"", ""head_dim"": 64, ""hidden_size"": 896, ""intermediate_size"": 4864, ""k"": 896, ""m"": 128, ""mode"": ""prefill"", ""mode_id"": 1, ""model_id"": ""Qwen/Qwen2.5-0.5B"", ""n"": 128, ""num_attention_heads"": 14, ""num_key_value_heads"": 2, ""role"": ""v_proj"", ""role_id"": 5, ""seq_len"": 128}","{""block_size"": 1024, ""num_stages"": 2, ""num_warps"": 1}",0.22755199670791626,2.1600337817774053,1.4803765097484207,0.03125
QWEN,gemm,qwen05b_v_proj_prefill_m128_n128_k896_seq128_ctx128,128,128,896,34,1024,1,3,"{""ctx_len"": 128, ""dtype"": ""bfloat16"", ""family"": ""gemm"", ""family_group"": ""QWEN"", ""head_dim"": 64, ""hidden_size"": 896, ""intermediate_size"": 4864, ""k"": 896, ""m"": 128, ""mode"": ""prefill"", ""mode_id"": 1, ""model_id"": ""Qwen/Qwen2.5-0.5B"", ""n"": 128, ""num_attention_heads"": 14, ""num_key_value_heads"": 2, ""role"": ""v_proj"", ""role_id"": 5, ""seq_len"": 128}","{""block_size"": 1024, ""num_stages"": 3, ""num_warps"": 1}",0.19494399428367615,2.521339535521962,1.6350429704723979,0.03125
QWEN,gemm,qwen05b_v_proj_prefill_m128_n128_k896_seq128_ctx128,128,128,896,35,1024,1,4,"{""ctx_len"": 128, ""dtype"": ""bfloat16"", ""family"": ""gemm"", ""family_group"": ""QWEN"", ""head_dim"": 64, ""hidden_size"": 896, ""intermediate_size"": 4864, ""k"": 896, ""m"": 128, ""mode"": ""prefill"", ""mode_id"": 1, ""model_id"": ""Qwen/Qwen2.5-0.5B"", ""n"": 128, ""num_attention_heads"": 14, ""num_key_value_heads"": 2, ""role"": ""v_proj"", ""role_id"": 5, ""seq_len"": 128}","{""block_size"": 1024, ""num_stages"": 4, ""num_warps"": 1}",0.14691199362277985,3.345676468471707,1.9179215543237624,0.03125
QWEN,gemm,qwen05b_v_proj_prefill_m128_n128_k896_seq128_ctx128,128,128,896,36,1024,2,1,"{""ctx_len"": 128, ""dtype"": ""bfloat16"", ""family"": ""gemm"", ""family_group"": ""QWEN"", ""head_dim"": 64, ""hidden_size"": 896, ""intermediate_size"": 4864, ""k"": 896, ""m"": 128, ""mode"": ""prefill"", ""mode_id"": 1, ""model_id"": ""Qwen/Qwen2.5-0.5B"", ""n"": 128, ""num_attention_heads"": 14, ""num_key_value_heads"": 2, ""role"": ""v_proj"", ""role_id"": 5, ""seq_len"": 128}","{""block_size"": 1024, ""num_stages"": 1, ""num_warps"": 2}",0.8588480055332184,0.5723014978591449,0.15216331615455755,0.03125
QWEN,gemm,qwen05b_v_proj_prefill_m128_n128_k896_seq128_ctx128,128,128,896,37,1024,2,2,"{""ctx_len"": 128, ""dtype"": ""bfloat16"", ""family"": ""gemm"", ""family_group"": ""QWEN"", ""head_dim"": 64, ""hidden_size"": 896, ""intermediate_size"": 4864, ""k"": 896, ""m"": 128, ""mode"": ""prefill"", ""mode_id"": 1, ""model_id"": ""Qwen/Qwen2.5-0.5B"", ""n"": 128, ""num_attention_heads"": 14, ""num_key_value_heads"": 2, ""role"": ""v_proj"", ""role_id"": 5, ""seq_len"": 128}","{""block_size"": 1024, ""num_stages"": 2, ""num_warps"": 2}",0.06092799827456474,8.067227119214122,2.7980624681324873,0.03125
QWEN,gemm,qwen05b_v_proj_prefill_m128_n128_k896_seq128_ctx128,128,128,896,38,1024,2,3,"{""ctx_len"": 128, ""dtype"": ""bfloat16"", ""family"": ""gemm"", ""family_group"": ""QWEN"", ""head_dim"": 64, ""hidden_size"": 896, ""intermediate_size"": 4864, ""k"": 896, ""m"": 128, ""mode"": ""prefill"", ""mode_id"": 1, ""model_id"": ""Qwen/Qwen2.5-0.5B"", ""n"": 128, ""num_attention_heads"": 14, ""num_key_value_heads"": 2, ""role"": ""v_proj"", ""role_id"": 5, ""seq_len"": 128}","{""block_size"": 1024, ""num_stages"": 3, ""num_warps"": 2}",0.047359999269247055,10.378378538514163,3.0499773038361364,0.03125
QWEN,gemm,qwen05b_v_proj_prefill_m128_n128_k896_seq128_ctx128,128,128,896,39,1024,2,4,"{""ctx_len"": 128, ""dtype"": ""bfloat16"", ""family"": ""gemm"", ""family_group"": ""QWEN"", ""head_dim"": 64, ""hidden_size"": 896, ""intermediate_size"": 4864, ""k"": 896, ""m"": 128, ""mode"": ""prefill"", ""mode_id"": 1, ""model_id"": ""Qwen/Qwen2.5-0.5B"", ""n"": 128, ""num_attention_heads"": 14, ""num_key_value_heads"": 2, ""role"": ""v_proj"", ""role_id"": 5, ""seq_len"": 128}","{""block_size"": 1024, ""num_stages"": 4, ""num_warps"": 2}",0.046271998435258865,10.622406998213114,3.0732182862619934,0.03125
QWEN,gemm,qwen05b_v_proj_prefill_m128_n128_k896_seq128_ctx128,128,128,896,40,1024,4,1,"{""ctx_len"": 128, ""dtype"": ""bfloat16"", ""family"": ""gemm"", ""family_group"": ""QWEN"", ""head_dim"": 64, ""hidden_size"": 896, ""intermediate_size"": 4864, ""k"": 896, ""m"": 128, ""mode"": ""prefill"", ""mode_id"": 1, ""model_id"": ""Qwen/Qwen2.5-0.5B"", ""n"": 128, ""num_attention_heads"": 14, ""num_key_value_heads"": 2, ""role"": ""v_proj"", ""role_id"": 5, ""seq_len"": 128}","{""block_size"": 1024, ""num_stages"": 1, ""num_warps"": 4}",0.03407999873161316,14.422535748044439,3.3790446142389463,0.03125
QWEN,gemm,qwen05b_v_proj_prefill_m128_n128_k896_seq128_ctx128,128,128,896,41,1024,4,2,"{""ctx_len"": 128, ""dtype"": ""bfloat16"", ""family"": ""gemm"", ""family_group"": ""QWEN"", ""head_dim"": 64, ""hidden_size"": 896, ""intermediate_size"": 4864, ""k"": 896, ""m"": 128, ""mode"": ""prefill"", ""mode_id"": 1, ""model_id"": ""Qwen/Qwen2.5-0.5B"", ""n"": 128, ""num_attention_heads"": 14, ""num_key_value_heads"": 2, ""role"": ""v_proj"", ""role_id"": 5, ""seq_len"": 128}","{""block_size"": 1024, ""num_stages"": 2, ""num_warps"": 4}",0.028095999732613564,17.49430540567127,3.572128071046317,0.03125
QWEN,gemm,qwen05b_v_proj_prefill_m128_n128_k896_seq128_ctx128,128,128,896,42,1024,4,3,"{""ctx_len"": 128, ""dtype"": ""bfloat16"", ""family"": ""gemm"", ""family_group"": ""QWEN"", ""head_dim"": 64, ""hidden_size"": 896, ""intermediate_size"": 4864, ""k"": 896, ""m"": 128, ""mode"": ""prefill"", ""mode_id"": 1, ""model_id"": ""Qwen/Qwen2.5-0.5B"", ""n"": 128, ""num_attention_heads"": 14, ""num_key_value_heads"": 2, ""role"": ""v_proj"", ""role_id"": 5, ""seq_len"": 128}","{""block_size"": 1024, ""num_stages"": 3, ""num_warps"": 4}",0.016863999888300896,29.14611024997595,4.082574113246709,0.03125
QWEN,gemm,qwen05b_v_proj_prefill_m128_n128_k896_seq128_ctx128,128,128,896,43,1024,4,4,"{""ctx_len"": 128, ""dtype"": ""bfloat16"", ""family"": ""gemm"", ""family_group"": ""QWEN"", ""head_dim"": 64, ""hidden_size"": 896, ""intermediate_size"": 4864, ""k"": 896, ""m"": 128, ""mode"": ""prefill"", ""mode_id"": 1, ""model_id"": ""Qwen/Qwen2.5-0.5B"", ""n"": 128, ""num_attention_heads"": 14, ""num_key_value_heads"": 2, ""role"": ""v_proj"", ""role_id"": 5, ""seq_len"": 128}","{""block_size"": 1024, ""num_stages"": 4, ""num_warps"": 4}",0.013248000293970108,37.101448452089606,4.323908659149461,0.03125
QWEN,gemm,qwen05b_v_proj_prefill_m128_n128_k896_seq128_ctx128,128,128,896,44,1024,8,1,"{""ctx_len"": 128, ""dtype"": ""bfloat16"", ""family"": ""gemm"", ""family_group"": ""QWEN"", ""head_dim"": 64, ""hidden_size"": 896, ""intermediate_size"": 4864, ""k"": 896, ""m"": 128, ""mode"": ""prefill"", ""mode_id"": 1, ""model_id"": ""Qwen/Qwen2.5-0.5B"", ""n"": 128, ""num_attention_heads"": 14, ""num_key_value_heads"": 2, ""role"": ""v_proj"", ""role_id"": 5, ""seq_len"": 128}","{""block_size"": 1024, ""num_stages"": 1, ""num_warps"": 8}",0.032127998769283295,15.298805366922789,3.438027393219544,0.03125
QWEN,gemm,qwen05b_v_proj_prefill_m128_n128_k896_seq128_ctx128,128,128,896,45,1024,8,2,"{""ctx_len"": 128, ""dtype"": ""bfloat16"", ""family"": ""gemm"", ""family_group"": ""QWEN"", ""head_dim"": 64, ""hidden_size"": 896, ""intermediate_size"": 4864, ""k"": 896, ""m"": 128, ""mode"": ""prefill"", ""mode_id"": 1, ""model_id"": ""Qwen/Qwen2.5-0.5B"", ""n"": 128, ""num_attention_heads"": 14, ""num_key_value_heads"": 2, ""role"": ""v_proj"", ""role_id"": 5, ""seq_len"": 128}","{""block_size"": 1024, ""num_stages"": 2, ""num_warps"": 8}",0.027424000203609467,17.922987031458216,3.5963367291422688,0.03125
QWEN,gemm,qwen05b_v_proj_prefill_m128_n128_k896_seq128_ctx128,128,128,896,46,1024,8,3,"{""ctx_len"": 128, ""dtype"": ""bfloat16"", ""family"": ""gemm"", ""family_group"": ""QWEN"", ""head_dim"": 64, ""hidden_size"": 896, ""intermediate_size"": 4864, ""k"": 896, ""m"": 128, ""mode"": ""prefill"", ""mode_id"": 1, ""model_id"": ""Qwen/Qwen2.5-0.5B"", ""n"": 128, ""num_attention_heads"": 14, ""num_key_value_heads"": 2, ""role"": ""v_proj"", ""role_id"": 5, ""seq_len"": 128}","{""block_size"": 1024, ""num_stages"": 3, ""num_warps"": 8}",0.017055999487638474,28.818012122727524,4.071253261038661,0.03125
QWEN,gemm,qwen05b_v_proj_prefill_m128_n128_k896_seq128_ctx128,128,128,896,47,1024,8,4,"{""ctx_len"": 128, ""dtype"": ""bfloat16"", ""family"": ""gemm"", ""family_group"": ""QWEN"", ""head_dim"": 64, ""hidden_size"": 896, ""intermediate_size"": 4864, ""k"": 896, ""m"": 128, ""mode"": ""prefill"", ""mode_id"": 1, ""model_id"": ""Qwen/Qwen2.5-0.5B"", ""n"": 128, ""num_attention_heads"": 14, ""num_key_value_heads"": 2, ""role"": ""v_proj"", ""role_id"": 5, ""seq_len"": 128}","{""block_size"": 1024, ""num_stages"": 4, ""num_warps"": 8}",0.013663999736309052,35.9718976496973,4.292990661234148,0.03125
QWEN,gemm,qwen05b_o_proj_prefill_m128_n896_k896_seq128_ctx128,128,896,896,0,256,1,1,"{""ctx_len"": 128, ""dtype"": ""bfloat16"", ""family"": ""gemm"", ""family_group"": ""QWEN"", ""head_dim"": 64, ""hidden_size"": 896, ""intermediate_size"": 4864, ""k"": 896, ""m"": 128, ""mode"": ""prefill"", ""mode_id"": 1, ""model_id"": ""Qwen/Qwen2.5-0.5B"", ""n"": 896, ""num_attention_heads"": 14, ""num_key_value_heads"": 2, ""role"": ""o_proj"", ""role_id"": 6, ""seq_len"": 128}","{""block_size"": 256, ""num_stages"": 1, ""num_warps"": 1}",0.03436800092458725,60.06703749018805,3.370629353193176,0.0625
QWEN,gemm,qwen05b_o_proj_prefill_m128_n896_k896_seq128_ctx128,128,896,896,1,256,1,2,"{""ctx_len"": 128, ""dtype"": ""bfloat16"", ""family"": ""gemm"", ""family_group"": ""QWEN"", ""head_dim"": 64, ""hidden_size"": 896, ""intermediate_size"": 4864, ""k"": 896, ""m"": 128, ""mode"": ""prefill"", ""mode_id"": 1, ""model_id"": ""Qwen/Qwen2.5-0.5B"", ""n"": 896, ""num_attention_heads"": 14, ""num_key_value_heads"": 2, ""role"": ""o_proj"", ""role_id"": 6, ""seq_len"": 128}","{""block_size"": 256, ""num_stages"": 2, ""num_warps"": 1}",0.028511999174952507,72.40404249918538,3.5574302566305898,0.0625
QWEN,gemm,qwen05b_o_proj_prefill_m128_n896_k896_seq128_ctx128,128,896,896,2,256,1,3,"{""ctx_len"": 128, ""dtype"": ""bfloat16"", ""family"": ""gemm"", ""family_group"": ""QWEN"", ""head_dim"": 64, ""hidden_size"": 896, ""intermediate_size"": 4864, ""k"": 896, ""m"": 128, ""mode"": ""prefill"", ""mode_id"": 1, ""model_id"": ""Qwen/Qwen2.5-0.5B"", ""n"": 896, ""num_attention_heads"": 14, ""num_key_value_heads"": 2, ""role"": ""o_proj"", ""role_id"": 6, ""seq_len"": 128}","{""block_size"": 256, ""num_stages"": 3, ""num_warps"": 1}",0.01775999926030636,116.23784267907621,4.03080658306753,0.0625
QWEN,gemm,qwen05b_o_proj_prefill_m128_n896_k896_seq128_ctx128,128,896,896,3,256,1,4,"{""ctx_len"": 128, ""dtype"": ""bfloat16"", ""family"": ""gemm"", ""family_group"": ""QWEN"", ""head_dim"": 64, ""hidden_size"": 896, ""intermediate_size"": 4864, ""k"": 896, ""m"": 128, ""mode"": ""prefill"", ""mode_id"": 1, ""model_id"": ""Qwen/Qwen2.5-0.5B"", ""n"": 896, ""num_attention_heads"": 14, ""num_key_value_heads"": 2, ""role"": ""o_proj"", ""role_id"": 6, ""seq_len"": 128}","{""block_size"": 256, ""num_stages"": 4, ""num_warps"": 1}",0.017055999487638474,121.03565091545559,4.071253261038661,0.0625
QWEN,gemm,qwen05b_o_proj_prefill_m128_n896_k896_seq128_ctx128,128,896,896,4,256,2,1,"{""ctx_len"": 128, ""dtype"": ""bfloat16"", ""family"": ""gemm"", ""family_group"": ""QWEN"", ""head_dim"": 64, ""hidden_size"": 896, ""intermediate_size"": 4864, ""k"": 896, ""m"": 128, ""mode"": ""prefill"", ""mode_id"": 1, ""model_id"": ""Qwen/Qwen2.5-0.5B"", ""n"": 896, ""num_attention_heads"": 14, ""num_key_value_heads"": 2, ""role"": ""o_proj"", ""role_id"": 6, ""seq_len"": 128}","{""block_size"": 256, ""num_stages"": 1, ""num_warps"": 2}",0.04118400067090988,50.12587330929624,3.1897054312778743,0.0625
QWEN,gemm,qwen05b_o_proj_prefill_m128_n896_k896_seq128_ctx128,128,896,896,5,256,2,2,"{""ctx_len"": 128, ""dtype"": ""bfloat16"", ""family"": ""gemm"", ""family_group"": ""QWEN"", ""head_dim"": 64, ""hidden_size"": 896, ""intermediate_size"": 4864, ""k"": 896, ""m"": 128, ""mode"": ""prefill"", ""mode_id"": 1, ""model_id"": ""Qwen/Qwen2.5-0.5B"", ""n"": 896, ""num_attention_heads"": 14, ""num_key_value_heads"": 2, ""role"": ""o_proj"", ""role_id"": 6, ""seq_len"": 128}","{""block_size"": 256, ""num_stages"": 2, ""num_warps"": 2}",0.028095999732613564,73.47608270381933,3.572128071046317,0.0625
QWEN,gemm,qwen05b_o_proj_prefill_m128_n896_k896_seq128_ctx128,128,896,896,6,256,2,3,"{""ctx_len"": 128, ""dtype"": ""bfloat16"", ""family"": ""gemm"", ""family_group"": ""QWEN"", ""head_dim"": 64, ""hidden_size"": 896, ""intermediate_size"": 4864, ""k"": 896, ""m"": 128, ""mode"": ""prefill"", ""mode_id"": 1, ""model_id"": ""Qwen/Qwen2.5-0.5B"", ""n"": 896, ""num_attention_heads"": 14, ""num_key_value_heads"": 2, ""role"": ""o_proj"", ""role_id"": 6, ""seq_len"": 128}","{""block_size"": 256, ""num_stages"": 3, ""num_warps"": 2}",0.01616000011563301,127.74653373937397,4.12521621873368,0.0625
QWEN,gemm,qwen05b_o_proj_prefill_m128_n896_k896_seq128_ctx128,128,896,896,7,256,2,4,"{""ctx_len"": 128, ""dtype"": ""bfloat16"", ""family"": ""gemm"", ""family_group"": ""QWEN"", ""head_dim"": 64, ""hidden_size"": 896, ""intermediate_size"": 4864, ""k"": 896, ""m"": 128, ""mode"": ""prefill"", ""mode_id"": 1, ""model_id"": ""Qwen/Qwen2.5-0.5B"", ""n"": 896, ""num_attention_heads"": 14, ""num_key_value_heads"": 2, ""role"": ""o_proj"", ""role_id"": 6, ""seq_len"": 128}","{""block_size"": 256, ""num_stages"": 4, ""num_warps"": 2}",0.012992000207304955,158.8965491887283,4.3434214796064605,0.0625
QWEN,gemm,qwen05b_o_proj_prefill_m128_n896_k896_seq128_ctx128,128,896,896,8,256,4,1,"{""ctx_len"": 128, ""dtype"": ""bfloat16"", ""family"": ""gemm"", ""family_group"": ""QWEN"", ""head_dim"": 64, ""hidden_size"": 896, ""intermediate_size"": 4864, ""k"": 896, ""m"": 128, ""mode"": ""prefill"", ""mode_id"": 1, ""model_id"": ""Qwen/Qwen2.5-0.5B"", ""n"": 896, ""num_attention_heads"": 14, ""num_key_value_heads"": 2, ""role"": ""o_proj"", ""role_id"": 6, ""seq_len"": 128}","{""block_size"": 256, ""num_stages"": 1, ""num_warps"": 4}",0.03625600039958954,56.939099107671325,3.317150383115206,0.0625
QWEN,gemm,qwen05b_o_proj_prefill_m128_n896_k896_seq128_ctx128,128,896,896,9,256,4,2,"{""ctx_len"": 128, ""dtype"": ""bfloat16"", ""family"": ""gemm"", ""family_group"": ""QWEN"", ""head_dim"": 64, ""hidden_size"": 896, ""intermediate_size"": 4864, ""k"": 896, ""m"": 128, ""mode"": ""prefill"", ""mode_id"": 1, ""model_id"": ""Qwen/Qwen2.5-0.5B"", ""n"": 896, ""num_attention_heads"": 14, ""num_key_value_heads"": 2, ""role"": ""o_proj"", ""role_id"": 6, ""seq_len"": 128}","{""block_size"": 256, ""num_stages"": 2, ""num_warps"": 4}",0.02393599972128868,86.24599030906307,3.7323716888340925,0.0625
QWEN,gemm,qwen05b_o_proj_prefill_m128_n896_k896_seq128_ctx128,128,896,896,10,256,4,3,"{""ctx_len"": 128, ""dtype"": ""bfloat16"", ""family"": ""gemm"", ""family_group"": ""QWEN"", ""head_dim"": 64, ""hidden_size"": 896, ""intermediate_size"": 4864, ""k"": 896, ""m"": 128, ""mode"": ""prefill"", ""mode_id"": 1, ""model_id"": ""Qwen/Qwen2.5-0.5B"", ""n"": 896, ""num_attention_heads"": 14, ""num_key_value_heads"": 2, ""role"": ""o_proj"", ""role_id"": 6, ""seq_len"": 128}","{""block_size"": 256, ""num_stages"": 3, ""num_warps"": 4}",0.014816000126302242,139.33477203035272,4.212047592553594,0.0625
QWEN,gemm,qwen05b_o_proj_prefill_m128_n896_k896_seq128_ctx128,128,896,896,11,256,4,4,"{""ctx_len"": 128, ""dtype"": ""bfloat16"", ""family"": ""gemm"", ""family_group"": ""QWEN"", ""head_dim"": 64, ""hidden_size"": 896, ""intermediate_size"": 4864, ""k"": 896, ""m"": 128, ""mode"": ""prefill"", ""mode_id"": 1, ""model_id"": ""Qwen/Qwen2.5-0.5B"", ""n"": 896, ""num_attention_heads"": 14, ""num_key_value_heads"": 2, ""role"": ""o_proj"", ""role_id"": 6, ""seq_len"": 128}","{""block_size"": 256, ""num_stages"": 4, ""num_warps"": 4}",0.01190400030463934,173.4193504006757,4.430880775300059,0.0625
QWEN,gemm,qwen05b_o_proj_prefill_m128_n896_k896_seq128_ctx128,128,896,896,12,256,8,1,"{""ctx_len"": 128, ""dtype"": ""bfloat16"", ""family"": ""gemm"", ""family_group"": ""QWEN"", ""head_dim"": 64, ""hidden_size"": 896, ""intermediate_size"": 4864, ""k"": 896, ""m"": 128, ""mode"": ""prefill"", ""mode_id"": 1, ""model_id"": ""Qwen/Qwen2.5-0.5B"", ""n"": 896, ""num_attention_heads"": 14, ""num_key_value_heads"": 2, ""role"": ""o_proj"", ""role_id"": 6, ""seq_len"": 128}","{""block_size"": 256, ""num_stages"": 1, ""num_warps"": 8}",0.02550400048494339,80.9435367294137,3.6689199573599276,0.0625
QWEN,gemm,qwen05b_o_proj_prefill_m128_n896_k896_seq128_ctx128,128,896,896,13,256,8,2,"{""ctx_len"": 128, ""dtype"": ""bfloat16"", ""family"": ""gemm"", ""family_group"": ""QWEN"", ""head_dim"": 64, ""hidden_size"": 896, ""intermediate_size"": 4864, ""k"": 896, ""m"": 128, ""mode"": ""prefill"", ""mode_id"": 1, ""model_id"": ""Qwen/Qwen2.5-0.5B"", ""n"": 896, ""num_attention_heads"": 14, ""num_key_value_heads"": 2, ""role"": ""o_proj"", ""role_id"": 6, ""seq_len"": 128}","{""block_size"": 256, ""num_stages"": 2, ""num_warps"": 8}",0.024480000138282776,84.32941128834538,3.7098988156892054,0.0625
QWEN,gemm,qwen05b_o_proj_prefill_m128_n896_k896_seq128_ctx128,128,896,896,14,256,8,3,"{""ctx_len"": 128, ""dtype"": ""bfloat16"", ""family"": ""gemm"", ""family_group"": ""QWEN"", ""head_dim"": 64, ""hidden_size"": 896, ""intermediate_size"": 4864, ""k"": 896, ""m"": 128, ""mode"": ""prefill"", ""mode_id"": 1, ""model_id"": ""Qwen/Qwen2.5-0.5B"", ""n"": 896, ""num_attention_heads"": 14, ""num_key_value_heads"": 2, ""role"": ""o_proj"", ""role_id"": 6, ""seq_len"": 128}","{""block_size"": 256, ""num_stages"": 3, ""num_warps"": 8}",0.015296000055968761,134.96234260240092,4.180163919014046,0.0625
QWEN,gemm,qwen05b_o_proj_prefill_m128_n896_k896_seq128_ctx128,128,896,896,15,256,8,4,"{""ctx_len"": 128, ""dtype"": ""bfloat16"", ""family"": ""gemm"", ""family_group"": ""QWEN"", ""head_dim"": 64, ""hidden_size"": 896, ""intermediate_size"": 4864, ""k"": 896, ""m"": 128, ""mode"": ""prefill"", ""mode_id"": 1, ""model_id"": ""Qwen/Qwen2.5-0.5B"", ""n"": 896, ""num_attention_heads"": 14, ""num_key_value_heads"": 2, ""role"": ""o_proj"", ""role_id"": 6, ""seq_len"": 128}","{""block_size"": 256, ""num_stages"": 4, ""num_warps"": 8}",0.012319999746978283,167.56363980497076,4.39653134141424,0.0625
QWEN,gemm,qwen05b_o_proj_prefill_m128_n896_k896_seq128_ctx128,128,896,896,16,512,1,1,"{""ctx_len"": 128, ""dtype"": ""bfloat16"", ""family"": ""gemm"", ""family_group"": ""QWEN"", ""head_dim"": 64, ""hidden_size"": 896, ""intermediate_size"": 4864, ""k"": 896, ""m"": 128, ""mode"": ""prefill"", ""mode_id"": 1, ""model_id"": ""Qwen/Qwen2.5-0.5B"", ""n"": 896, ""num_attention_heads"": 14, ""num_key_value_heads"": 2, ""role"": ""o_proj"", ""role_id"": 6, ""seq_len"": 128}","{""block_size"": 512, ""num_stages"": 1, ""num_warps"": 1}",0.8289119899272919,2.4904742904986543,0.18764129362343518,0.0625
QWEN,gemm,qwen05b_o_proj_prefill_m128_n896_k896_seq128_ctx128,128,896,896,17,512,1,2,"{""ctx_len"": 128, ""dtype"": ""bfloat16"", ""family"": ""gemm"", ""family_group"": ""QWEN"", ""head_dim"": 64, ""hidden_size"": 896, ""intermediate_size"": 4864, ""k"": 896, ""m"": 128, ""mode"": ""prefill"", ""mode_id"": 1, ""model_id"": ""Qwen/Qwen2.5-0.5B"", ""n"": 896, ""num_attention_heads"": 14, ""num_key_value_heads"": 2, ""role"": ""o_proj"", ""role_id"": 6, ""seq_len"": 128}","{""block_size"": 512, ""num_stages"": 2, ""num_warps"": 1}",0.2252800017595291,9.16363629206461,1.4904111982020498,0.0625
QWEN,gemm,qwen05b_o_proj_prefill_m128_n896_k896_seq128_ctx128,128,896,896,18,512,1,3,"{""ctx_len"": 128, ""dtype"": ""bfloat16"", ""family"": ""gemm"", ""family_group"": ""QWEN"", ""head_dim"": 64, ""hidden_size"": 896, ""intermediate_size"": 4864, ""k"": 896, ""m"": 128, ""mode"": ""prefill"", ""mode_id"": 1, ""model_id"": ""Qwen/Qwen2.5-0.5B"", ""n"": 896, ""num_attention_heads"": 14, ""num_key_value_heads"": 2, ""role"": ""o_proj"", ""role_id"": 6, ""seq_len"": 128}","{""block_size"": 512, ""num_stages"": 3, ""num_warps"": 1}",0.19382399320602417,10.650817609591162,1.640804783235895,0.0625
QWEN,gemm,qwen05b_o_proj_prefill_m128_n896_k896_seq128_ctx128,128,896,896,19,512,1,4,"{""ctx_len"": 128, ""dtype"": ""bfloat16"", ""family"": ""gemm"", ""family_group"": ""QWEN"", ""head_dim"": 64, ""hidden_size"": 896, ""intermediate_size"": 4864, ""k"": 896, ""m"": 128, ""mode"": ""prefill"", ""mode_id"": 1, ""model_id"": ""Qwen/Qwen2.5-0.5B"", ""n"": 896, ""num_attention_heads"": 14, ""num_key_value_heads"": 2, ""role"": ""o_proj"", ""role_id"": 6, ""seq_len"": 128}","{""block_size"": 512, ""num_stages"": 4, ""num_warps"": 1}",0.1475840061903,13.987857175648905,1.9133577318313502,0.0625
QWEN,gemm,qwen05b_o_proj_prefill_m128_n896_k896_seq128_ctx128,128,896,896,20,512,2,1,"{""ctx_len"": 128, ""dtype"": ""bfloat16"", ""family"": ""gemm"", ""family_group"": ""QWEN"", ""head_dim"": 64, ""hidden_size"": 896, ""intermediate_size"": 4864, ""k"": 896, ""m"": 128, ""mode"": ""prefill"", ""mode_id"": 1, ""model_id"": ""Qwen/Qwen2.5-0.5B"", ""n"": 896, ""num_attention_heads"": 14, ""num_key_value_heads"": 2, ""role"": ""o_proj"", ""role_id"": 6, ""seq_len"": 128}","{""block_size"": 512, ""num_stages"": 1, ""num_warps"": 2}",0.8821440041065216,2.3401893459457437,0.12539996634039277,0.0625
QWEN,gemm,qwen05b_o_proj_prefill_m128_n896_k896_seq128_ctx128,128,896,896,21,512,2,2,"{""ctx_len"": 128, ""dtype"": ""bfloat16"", ""family"": ""gemm"", ""family_group"": ""QWEN"", ""head_dim"": 64, ""hidden_size"": 896, ""intermediate_size"": 4864, ""k"": 896, ""m"": 128, ""mode"": ""prefill"", ""mode_id"": 1, ""model_id"": ""Qwen/Qwen2.5-0.5B"", ""n"": 896, ""num_attention_heads"": 14, ""num_key_value_heads"": 2, ""role"": ""o_proj"", ""role_id"": 6, ""seq_len"": 128}","{""block_size"": 512, ""num_stages"": 2, ""num_warps"": 2}",0.06185600161552429,33.37402913352698,2.7829461498387134,0.0625
QWEN,gemm,qwen05b_o_proj_prefill_m128_n896_k896_seq128_ctx128,128,896,896,22,512,2,3,"{""ctx_len"": 128, ""dtype"": ""bfloat16"", ""family"": ""gemm"", ""family_group"": ""QWEN"", ""head_dim"": 64, ""hidden_size"": 896, ""intermediate_size"": 4864, ""k"": 896, ""m"": 128, ""mode"": ""prefill"", ""mode_id"": 1, ""model_id"": ""Qwen/Qwen2.5-0.5B"", ""n"": 896, ""num_attention_heads"": 14, ""num_key_value_heads"": 2, ""role"": ""o_proj"", ""role_id"": 6, ""seq_len"": 128}","{""block_size"": 512, ""num_stages"": 3, ""num_warps"": 2}",0.047200001776218414,43.73694750664467,3.053361348758882,0.0625
QWEN,gemm,qwen05b_o_proj_prefill_m128_n896_k896_seq128_ctx128,128,896,896,23,512,2,4,"{""ctx_len"": 128, ""dtype"": ""bfloat16"", ""family"": ""gemm"", ""family_group"": ""QWEN"", ""head_dim"": 64, ""hidden_size"": 896, ""intermediate_size"": 4864, ""k"": 896, ""m"": 128, ""mode"": ""prefill"", ""mode_id"": 1, ""model_id"": ""Qwen/Qwen2.5-0.5B"", ""n"": 896, ""num_attention_heads"": 14, ""num_key_value_heads"": 2, ""role"": ""o_proj"", ""role_id"": 6, ""seq_len"": 128}","{""block_size"": 512, ""num_stages"": 4, ""num_warps"": 2}",0.04608000069856644,44.7999993208382,3.0773762474346396,0.0625
QWEN,gemm,qwen05b_o_proj_prefill_m128_n896_k896_seq128_ctx128,128,896,896,24,512,4,1,"{""ctx_len"": 128, ""dtype"": ""bfloat16"", ""family"": ""gemm"", ""family_group"": ""QWEN"", ""head_dim"": 64, ""hidden_size"": 896, ""intermediate_size"": 4864, ""k"": 896, ""m"": 128, ""mode"": ""prefill"", ""mode_id"": 1, ""model_id"": ""Qwen/Qwen2.5-0.5B"", ""n"": 896, ""num_attention_heads"": 14, ""num_key_value_heads"": 2, ""role"": ""o_proj"", ""role_id"": 6, ""seq_len"": 128}","{""block_size"": 512, ""num_stages"": 1, ""num_warps"": 4}",0.033344000577926636,61.911707180289575,3.4008774155189827,0.0625
QWEN,gemm,qwen05b_o_proj_prefill_m128_n896_k896_seq128_ctx128,128,896,896,25,512,4,2,"{""ctx_len"": 128, ""dtype"": ""bfloat16"", ""family"": ""gemm"", ""family_group"": ""QWEN"", ""head_dim"": 64, ""hidden_size"": 896, ""intermediate_size"": 4864, ""k"": 896, ""m"": 128, ""mode"": ""prefill"", ""mode_id"": 1, ""model_id"": ""Qwen/Qwen2.5-0.5B"", ""n"": 896, ""num_attention_heads"": 14, ""num_key_value_heads"": 2, ""role"": ""o_proj"", ""role_id"": 6, ""seq_len"": 128}","{""block_size"": 512, ""num_stages"": 2, ""num_warps"": 4}",0.028351999819278717,72.8126415476437,3.5630577109336654,0.0625
QWEN,gemm,qwen05b_o_proj_prefill_m128_n896_k896_seq128_ctx128,128,896,896,26,512,4,3,"{""ctx_len"": 128, ""dtype"": ""bfloat16"", ""family"": ""gemm"", ""family_group"": ""QWEN"", ""head_dim"": 64, ""hidden_size"": 896, ""intermediate_size"": 4864, ""k"": 896, ""m"": 128, ""mode"": ""prefill"", ""mode_id"": 1, ""model_id"": ""Qwen/Qwen2.5-0.5B"", ""n"": 896, ""num_attention_heads"": 14, ""num_key_value_heads"": 2, ""role"": ""o_proj"", ""role_id"": 6, ""seq_len"": 128}","{""block_size"": 512, ""num_stages"": 3, ""num_warps"": 4}",0.017376000061631203,118.80662941285708,4.052665331683697,0.0625
QWEN,gemm,qwen05b_o_proj_prefill_m128_n896_k896_seq128_ctx128,128,896,896,27,512,4,4,"{""ctx_len"": 128, ""dtype"": ""bfloat16"", ""family"": ""gemm"", ""family_group"": ""QWEN"", ""head_dim"": 64, ""hidden_size"": 896, ""intermediate_size"": 4864, ""k"": 896, ""m"": 128, ""mode"": ""prefill"", ""mode_id"": 1, ""model_id"": ""Qwen/Qwen2.5-0.5B"", ""n"": 896, ""num_attention_heads"": 14, ""num_key_value_heads"": 2, ""role"": ""o_proj"", ""role_id"": 6, ""seq_len"": 128}","{""block_size"": 512, ""num_stages"": 4, ""num_warps"": 4}",0.013504000380635262,152.8720336057104,4.3047693129416835,0.0625
QWEN,gemm,qwen05b_o_proj_prefill_m128_n896_k896_seq128_ctx128,128,896,896,28,512,8,1,"{""ctx_len"": 128, ""dtype"": ""bfloat16"", ""family"": ""gemm"", ""family_group"": ""QWEN"", ""head_dim"": 64, ""hidden_size"": 896, ""intermediate_size"": 4864, ""k"": 896, ""m"": 128, ""mode"": ""prefill"", ""mode_id"": 1, ""model_id"": ""Qwen/Qwen2.5-0.5B"", ""n"": 896, ""num_attention_heads"": 14, ""num_key_value_heads"": 2, ""role"": ""o_proj"", ""role_id"": 6, ""seq_len"": 128}","{""block_size"": 512, ""num_stages"": 1, ""num_warps"": 8}",0.03081599995493889,66.99065430356546,3.4797212448286854,0.0625
QWEN,gemm,qwen05b_o_proj_prefill_m128_n896_k896_seq128_ctx128,128,896,896,29,512,8,2,"{""ctx_len"": 128, ""dtype"": ""bfloat16"", ""family"": ""gemm"", ""family_group"": ""QWEN"", ""head_dim"": 64, ""hidden_size"": 896, ""intermediate_size"": 4864, ""k"": 896, ""m"": 128, ""mode"": ""prefill"", ""mode_id"": 1, ""model_id"": ""Qwen/Qwen2.5-0.5B"", ""n"": 896, ""num_attention_heads"": 14, ""num_key_value_heads"": 2, ""role"": ""o_proj"", ""role_id"": 6, ""seq_len"": 128}","{""block_size"": 512, ""num_stages"": 2, ""num_warps"": 8}",0.02739199995994568,75.36448609151114,3.5975042804850688,0.0625
QWEN,gemm,qwen05b_o_proj_prefill_m128_n896_k896_seq128_ctx128,128,896,896,30,512,8,3,"{""ctx_len"": 128, ""dtype"": ""bfloat16"", ""family"": ""gemm"", ""family_group"": ""QWEN"", ""head_dim"": 64, ""hidden_size"": 896, ""intermediate_size"": 4864, ""k"": 896, ""m"": 128, ""mode"": ""prefill"", ""mode_id"": 1, ""model_id"": ""Qwen/Qwen2.5-0.5B"", ""n"": 896, ""num_attention_heads"": 14, ""num_key_value_heads"": 2, ""role"": ""o_proj"", ""role_id"": 6, ""seq_len"": 128}","{""block_size"": 512, ""num_stages"": 3, ""num_warps"": 8}",0.01727999933063984,119.46667129434202,4.058205554342349,0.0625
QWEN,gemm,qwen05b_o_proj_prefill_m128_n896_k896_seq128_ctx128,128,896,896,31,512,8,4,"{""ctx_len"": 128, ""dtype"": ""bfloat16"", ""family"": ""gemm"", ""family_group"": ""QWEN"", ""head_dim"": 64, ""hidden_size"": 896, ""intermediate_size"": 4864, ""k"": 896, ""m"": 128, ""mode"": ""prefill"", ""mode_id"": 1, ""model_id"": ""Qwen/Qwen2.5-0.5B"", ""n"": 896, ""num_attention_heads"": 14, ""num_key_value_heads"": 2, ""role"": ""o_proj"", ""role_id"": 6, ""seq_len"": 128}","{""block_size"": 512, ""num_stages"": 4, ""num_warps"": 8}",0.013856000266969204,148.9884497852679,4.27903690789465,0.0625
QWEN,gemm,qwen05b_o_proj_prefill_m128_n896_k896_seq128_ctx128,128,896,896,32,1024,1,1,"{""ctx_len"": 128, ""dtype"": ""bfloat16"", ""family"": ""gemm"", ""family_group"": ""QWEN"", ""head_dim"": 64, ""hidden_size"": 896, ""intermediate_size"": 4864, ""k"": 896, ""m"": 128, ""mode"": ""prefill"", ""mode_id"": 1, ""model_id"": ""Qwen/Qwen2.5-0.5B"", ""n"": 896, ""num_attention_heads"": 14, ""num_key_value_heads"": 2, ""role"": ""o_proj"", ""role_id"": 6, ""seq_len"": 128}","{""block_size"": 1024, ""num_stages"": 1, ""num_warps"": 1}",0.8285599946975708,2.4915323129419398,0.18806603110108547,0.0625
QWEN,gemm,qwen05b_o_proj_prefill_m128_n896_k896_seq128_ctx128,128,896,896,33,1024,1,2,"{""ctx_len"": 128, ""dtype"": ""bfloat16"", ""family"": ""gemm"", ""family_group"": ""QWEN"", ""head_dim"": 64, ""hidden_size"": 896, ""intermediate_size"": 4864, ""k"": 896, ""m"": 128, ""mode"": ""prefill"", ""mode_id"": 1, ""model_id"": ""Qwen/Qwen2.5-0.5B"", ""n"": 896, ""num_attention_heads"": 14, ""num_key_value_heads"": 2, ""role"": ""o_proj"", ""role_id"": 6, ""seq_len"": 128}","{""block_size"": 1024, ""num_stages"": 2, ""num_warps"": 1}",0.22524799406528473,9.164938442922024,1.4905532879038879,0.0625
QWEN,gemm,qwen05b_o_proj_prefill_m128_n896_k896_seq128_ctx128,128,896,896,34,1024,1,3,"{""ctx_len"": 128, ""dtype"": ""bfloat16"", ""family"": ""gemm"", ""family_group"": ""QWEN"", ""head_dim"": 64, ""hidden_size"": 896, ""intermediate_size"": 4864, ""k"": 896, ""m"": 128, ""mode"": ""prefill"", ""mode_id"": 1, ""model_id"": ""Qwen/Qwen2.5-0.5B"", ""n"": 896, ""num_attention_heads"": 14, ""num_key_value_heads"": 2, ""role"": ""o_proj"", ""role_id"": 6, ""seq_len"": 128}","{""block_size"": 1024, ""num_stages"": 3, ""num_warps"": 1}",0.19379200041294098,10.65257593502887,1.6409698579164165,0.0625
QWEN,gemm,qwen05b_o_proj_prefill_m128_n896_k896_seq128_ctx128,128,896,896,35,1024,1,4,"{""ctx_len"": 128, ""dtype"": ""bfloat16"", ""family"": ""gemm"", ""family_group"": ""QWEN"", ""head_dim"": 64, ""hidden_size"": 896, ""intermediate_size"": 4864, ""k"": 896, ""m"": 128, ""mode"": ""prefill"", ""mode_id"": 1, ""model_id"": ""Qwen/Qwen2.5-0.5B"", ""n"": 896, ""num_attention_heads"": 14, ""num_key_value_heads"": 2, ""role"": ""o_proj"", ""role_id"": 6, ""seq_len"": 128}","{""block_size"": 1024, ""num_stages"": 4, ""num_warps"": 1}",0.1475519984960556,13.990891489383559,1.913574633150482,0.0625
QWEN,gemm,qwen05b_o_proj_prefill_m128_n896_k896_seq128_ctx128,128,896,896,36,1024,2,1,"{""ctx_len"": 128, ""dtype"": ""bfloat16"", ""family"": ""gemm"", ""family_group"": ""QWEN"", ""head_dim"": 64, ""hidden_size"": 896, ""intermediate_size"": 4864, ""k"": 896, ""m"": 128, ""mode"": ""prefill"", ""mode_id"": 1, ""model_id"": ""Qwen/Qwen2.5-0.5B"", ""n"": 896, ""num_attention_heads"": 14, ""num_key_value_heads"": 2, ""role"": ""o_proj"", ""role_id"": 6, ""seq_len"": 128}","{""block_size"": 1024, ""num_stages"": 1, ""num_warps"": 2}",0.8808320164680481,2.34367502702473,0.12688834492905512,0.0625
QWEN,gemm,qwen05b_o_proj_prefill_m128_n896_k896_seq128_ctx128,128,896,896,37,1024,2,2,"{""ctx_len"": 128, ""dtype"": ""bfloat16"", ""family"": ""gemm"", ""family_group"": ""QWEN"", ""head_dim"": 64, ""hidden_size"": 896, ""intermediate_size"": 4864, ""k"": 896, ""m"": 128, ""mode"": ""prefill"", ""mode_id"": 1, ""model_id"": ""Qwen/Qwen2.5-0.5B"", ""n"": 896, ""num_attention_heads"": 14, ""num_key_value_heads"": 2, ""role"": ""o_proj"", ""role_id"": 6, ""seq_len"": 128}","{""block_size"": 1024, ""num_stages"": 2, ""num_warps"": 2}",0.06185600161552429,33.37402913352698,2.7829461498387134,0.0625
QWEN,gemm,qwen05b_o_proj_prefill_m128_n896_k896_seq128_ctx128,128,896,896,38,1024,2,3,"{""ctx_len"": 128, ""dtype"": ""bfloat16"", ""family"": ""gemm"", ""family_group"": ""QWEN"", ""head_dim"": 64, ""hidden_size"": 896, ""intermediate_size"": 4864, ""k"": 896, ""m"": 128, ""mode"": ""prefill"", ""mode_id"": 1, ""model_id"": ""Qwen/Qwen2.5-0.5B"", ""n"": 896, ""num_attention_heads"": 14, ""num_key_value_heads"": 2, ""role"": ""o_proj"", ""role_id"": 6, ""seq_len"": 128}","{""block_size"": 1024, ""num_stages"": 3, ""num_warps"": 2}",0.047200001776218414,43.73694750664467,3.053361348758882,0.0625
QWEN,gemm,qwen05b_o_proj_prefill_m128_n896_k896_seq128_ctx128,128,896,896,39,1024,2,4,"{""ctx_len"": 128, ""dtype"": ""bfloat16"", ""family"": ""gemm"", ""family_group"": ""QWEN"", ""head_dim"": 64, ""hidden_size"": 896, ""intermediate_size"": 4864, ""k"": 896, ""m"": 128, ""mode"": ""prefill"", ""mode_id"": 1, ""model_id"": ""Qwen/Qwen2.5-0.5B"", ""n"": 896, ""num_attention_heads"": 14, ""num_key_value_heads"": 2, ""role"": ""o_proj"", ""role_id"": 6, ""seq_len"": 128}","{""block_size"": 1024, ""num_stages"": 4, ""num_warps"": 2}",0.04608000069856644,44.7999993208382,3.0773762474346396,0.0625
QWEN,gemm,qwen05b_o_proj_prefill_m128_n896_k896_seq128_ctx128,128,896,896,40,1024,4,1,"{""ctx_len"": 128, ""dtype"": ""bfloat16"", ""family"": ""gemm"", ""family_group"": ""QWEN"", ""head_dim"": 64, ""hidden_size"": 896, ""intermediate_size"": 4864, ""k"": 896, ""m"": 128, ""mode"": ""prefill"", ""mode_id"": 1, ""model_id"": ""Qwen/Qwen2.5-0.5B"", ""n"": 896, ""num_attention_heads"": 14, ""num_key_value_heads"": 2, ""role"": ""o_proj"", ""role_id"": 6, ""seq_len"": 128}","{""block_size"": 1024, ""num_stages"": 1, ""num_warps"": 4}",0.033376000821590424,61.85234747071859,3.3999181755475716,0.0625
QWEN,gemm,qwen05b_o_proj_prefill_m128_n896_k896_seq128_ctx128,128,896,896,41,1024,4,2,"{""ctx_len"": 128, ""dtype"": ""bfloat16"", ""family"": ""gemm"", ""family_group"": ""QWEN"", ""head_dim"": 64, ""hidden_size"": 896, ""intermediate_size"": 4864, ""k"": 896, ""m"": 128, ""mode"": ""prefill"", ""mode_id"": 1, ""model_id"": ""Qwen/Qwen2.5-0.5B"", ""n"": 896, ""num_attention_heads"": 14, ""num_key_value_heads"": 2, ""role"": ""o_proj"", ""role_id"": 6, ""seq_len"": 128}","{""block_size"": 1024, ""num_stages"": 2, ""num_warps"": 4}",0.028351999819278717,72.8126415476437,3.5630577109336654,0.0625
QWEN,gemm,qwen05b_o_proj_prefill_m128_n896_k896_seq128_ctx128,128,896,896,42,1024,4,3,"{""ctx_len"": 128, ""dtype"": ""bfloat16"", ""family"": ""gemm"", ""family_group"": ""QWEN"", ""head_dim"": 64, ""hidden_size"": 896, ""intermediate_size"": 4864, ""k"": 896, ""m"": 128, ""mode"": ""prefill"", ""mode_id"": 1, ""model_id"": ""Qwen/Qwen2.5-0.5B"", ""n"": 896, ""num_attention_heads"": 14, ""num_key_value_heads"": 2, ""role"": ""o_proj"", ""role_id"": 6, ""seq_len"": 128}","{""block_size"": 1024, ""num_stages"": 3, ""num_warps"": 4}",0.017376000061631203,118.80662941285708,4.052665331683697,0.0625
QWEN,gemm,qwen05b_o_proj_prefill_m128_n896_k896_seq128_ctx128,128,896,896,43,1024,4,4,"{""ctx_len"": 128, ""dtype"": ""bfloat16"", ""family"": ""gemm"", ""family_group"": ""QWEN"", ""head_dim"": 64, ""hidden_size"": 896, ""intermediate_size"": 4864, ""k"": 896, ""m"": 128, ""mode"": ""prefill"", ""mode_id"": 1, ""model_id"": ""Qwen/Qwen2.5-0.5B"", ""n"": 896, ""num_attention_heads"": 14, ""num_key_value_heads"": 2, ""role"": ""o_proj"", ""role_id"": 6, ""seq_len"": 128}","{""block_size"": 1024, ""num_stages"": 4, ""num_warps"": 4}",0.013535999692976475,152.5106417571184,4.302402498800268,0.0625
QWEN,gemm,qwen05b_o_proj_prefill_m128_n896_k896_seq128_ctx128,128,896,896,44,1024,8,1,"{""ctx_len"": 128, ""dtype"": ""bfloat16"", ""family"": ""gemm"", ""family_group"": ""QWEN"", ""head_dim"": 64, ""hidden_size"": 896, ""intermediate_size"": 4864, ""k"": 896, ""m"": 128, ""mode"": ""prefill"", ""mode_id"": 1, ""model_id"": ""Qwen/Qwen2.5-0.5B"", ""n"": 896, ""num_attention_heads"": 14, ""num_key_value_heads"": 2, ""role"": ""o_proj"", ""role_id"": 6, ""seq_len"": 128}","{""block_size"": 1024, ""num_stages"": 1, ""num_warps"": 8}",0.03081599995493889,66.99065430356546,3.4797212448286854,0.0625
QWEN,gemm,qwen05b_o_proj_prefill_m128_n896_k896_seq128_ctx128,128,896,896,45,1024,8,2,"{""ctx_len"": 128, ""dtype"": ""bfloat16"", ""family"": ""gemm"", ""family_group"": ""QWEN"", ""head_dim"": 64, ""hidden_size"": 896, ""intermediate_size"": 4864, ""k"": 896, ""m"": 128, ""mode"": ""prefill"", ""mode_id"": 1, ""model_id"": ""Qwen/Qwen2.5-0.5B"", ""n"": 896, ""num_attention_heads"": 14, ""num_key_value_heads"": 2, ""role"": ""o_proj"", ""role_id"": 6, ""seq_len"": 128}","{""block_size"": 1024, ""num_stages"": 2, ""num_warps"": 8}",0.027408000081777573,75.3204901430412,3.5969203344166614,0.0625
QWEN,gemm,qwen05b_o_proj_prefill_m128_n896_k896_seq128_ctx128,128,896,896,46,1024,8,3,"{""ctx_len"": 128, ""dtype"": ""bfloat16"", ""family"": ""gemm"", ""family_group"": ""QWEN"", ""head_dim"": 64, ""hidden_size"": 896, ""intermediate_size"": 4864, ""k"": 896, ""m"": 128, ""mode"": ""prefill"", ""mode_id"": 1, ""model_id"": ""Qwen/Qwen2.5-0.5B"", ""n"": 896, ""num_attention_heads"": 14, ""num_key_value_heads"": 2, ""role"": ""o_proj"", ""role_id"": 6, ""seq_len"": 128}","{""block_size"": 1024, ""num_stages"": 3, ""num_warps"": 8}",0.01727999933063984,119.46667129434202,4.058205554342349,0.0625
QWEN,gemm,qwen05b_o_proj_prefill_m128_n896_k896_seq128_ctx128,128,896,896,47,1024,8,4,"{""ctx_len"": 128, ""dtype"": ""bfloat16"", ""family"": ""gemm"", ""family_group"": ""QWEN"", ""head_dim"": 64, ""hidden_size"": 896, ""intermediate_size"": 4864, ""k"": 896, ""m"": 128, ""mode"": ""prefill"", ""mode_id"": 1, ""model_id"": ""Qwen/Qwen2.5-0.5B"", ""n"": 896, ""num_attention_heads"": 14, ""num_key_value_heads"": 2, ""role"": ""o_proj"", ""role_id"": 6, ""seq_len"": 128}","{""block_size"": 1024, ""num_stages"": 4, ""num_warps"": 8}",0.013824000023305416,149.3333330815773,4.281349065234571,0.0625
QWEN,gemm,qwen05b_gate_proj_prefill_m128_n4864_k896_seq128_ctx128,128,4864,896,0,256,1,1,"{""ctx_len"": 128, ""dtype"": ""bfloat16"", ""family"": ""gemm"", ""family_group"": ""QWEN"", ""head_dim"": 64, ""hidden_size"": 896, ""intermediate_size"": 4864, ""k"": 896, ""m"": 128, ""mode"": ""prefill"", ""mode_id"": 1, ""model_id"": ""Qwen/Qwen2.5-0.5B"", ""n"": 4864, ""num_attention_heads"": 14, ""num_key_value_heads"": 2, ""role"": ""gate_proj"", ""role_id"": 7, ""seq_len"": 128}","{""block_size"": 256, ""num_stages"": 1, ""num_warps"": 1}",0.0344959981739521,295.4211659164308,3.3669119566306684,0.0625
QWEN,gemm,qwen05b_gate_proj_prefill_m128_n4864_k896_seq128_ctx128,128,4864,896,1,256,1,2,"{""ctx_len"": 128, ""dtype"": ""bfloat16"", ""family"": ""gemm"", ""family_group"": ""QWEN"", ""head_dim"": 64, ""hidden_size"": 896, ""intermediate_size"": 4864, ""k"": 896, ""m"": 128, ""mode"": ""prefill"", ""mode_id"": 1, ""model_id"": ""Qwen/Qwen2.5-0.5B"", ""n"": 4864, ""num_attention_heads"": 14, ""num_key_value_heads"": 2, ""role"": ""gate_proj"", ""role_id"": 7, ""seq_len"": 128}","{""block_size"": 256, ""num_stages"": 2, ""num_warps"": 1}",0.029632000252604485,343.9136039796801,3.518900411993649,0.0625
QWEN,gemm,qwen05b_gate_proj_prefill_m128_n4864_k896_seq128_ctx128,128,4864,896,2,256,1,3,"{""ctx_len"": 128, ""dtype"": ""bfloat16"", ""family"": ""gemm"", ""family_group"": ""QWEN"", ""head_dim"": 64, ""hidden_size"": 896, ""intermediate_size"": 4864, ""k"": 896, ""m"": 128, ""mode"": ""prefill"", ""mode_id"": 1, ""model_id"": ""Qwen/Qwen2.5-0.5B"", ""n"": 4864, ""num_attention_heads"": 14, ""num_key_value_heads"": 2, ""role"": ""gate_proj"", ""role_id"": 7, ""seq_len"": 128}","{""block_size"": 256, ""num_stages"": 3, ""num_warps"": 1}",0.01881599985063076,541.6054464763602,3.973047715204337,0.0625
QWEN,gemm,qwen05b_gate_proj_prefill_m128_n4864_k896_seq128_ctx128,128,4864,896,3,256,1,4,"{""ctx_len"": 128, ""dtype"": ""bfloat16"", ""family"": ""gemm"", ""family_group"": ""QWEN"", ""head_dim"": 64, ""hidden_size"": 896, ""intermediate_size"": 4864, ""k"": 896, ""m"": 128, ""mode"": ""prefill"", ""mode_id"": 1, ""model_id"": ""Qwen/Qwen2.5-0.5B"", ""n"": 4864, ""num_attention_heads"": 14, ""num_key_value_heads"": 2, ""role"": ""gate_proj"", ""role_id"": 7, ""seq_len"": 128}","{""block_size"": 256, ""num_stages"": 4, ""num_warps"": 1}",0.017664000391960144,576.9275234299934,4.03622658669768,0.0625
QWEN,gemm,qwen05b_gate_proj_prefill_m128_n4864_k896_seq128_ctx128,128,4864,896,4,256,2,1,"{""ctx_len"": 128, ""dtype"": ""bfloat16"", ""family"": ""gemm"", ""family_group"": ""QWEN"", ""head_dim"": 64, ""hidden_size"": 896, ""intermediate_size"": 4864, ""k"": 896, ""m"": 128, ""mode"": ""prefill"", ""mode_id"": 1, ""model_id"": ""Qwen/Qwen2.5-0.5B"", ""n"": 4864, ""num_attention_heads"": 14, ""num_key_value_heads"": 2, ""role"": ""gate_proj"", ""role_id"": 7, ""seq_len"": 128}","{""block_size"": 256, ""num_stages"": 1, ""num_warps"": 2}",0.04121600091457367,247.25465289856862,3.1889287263104764,0.0625
QWEN,gemm,qwen05b_gate_proj_prefill_m128_n4864_k896_seq128_ctx128,128,4864,896,5,256,2,2,"{""ctx_len"": 128, ""dtype"": ""bfloat16"", ""family"": ""gemm"", ""family_group"": ""QWEN"", ""head_dim"": 64, ""hidden_size"": 896, ""intermediate_size"": 4864, ""k"": 896, ""m"": 128, ""mode"": ""prefill"", ""mode_id"": 1, ""model_id"": ""Qwen/Qwen2.5-0.5B"", ""n"": 4864, ""num_attention_heads"": 14, ""num_key_value_heads"": 2, ""role"": ""gate_proj"", ""role_id"": 7, ""seq_len"": 128}","{""block_size"": 256, ""num_stages"": 2, ""num_warps"": 2}",0.028991999104619026,351.50552961959727,3.5407353800052945,0.0625
QWEN,gemm,qwen05b_gate_proj_prefill_m128_n4864_k896_seq128_ctx128,128,4864,896,6,256,2,3,"{""ctx_len"": 128, ""dtype"": ""bfloat16"", ""family"": ""gemm"", ""family_group"": ""QWEN"", ""head_dim"": 64, ""hidden_size"": 896, ""intermediate_size"": 4864, ""k"": 896, ""m"": 128, ""mode"": ""prefill"", ""mode_id"": 1, ""model_id"": ""Qwen/Qwen2.5-0.5B"", ""n"": 4864, ""num_attention_heads"": 14, ""num_key_value_heads"": 2, ""role"": ""gate_proj"", ""role_id"": 7, ""seq_len"": 128}","{""block_size"": 256, ""num_stages"": 3, ""num_warps"": 2}",0.01744000054895878,584.3375962857078,4.04898882902431,0.0625
QWEN,gemm,qwen05b_gate_proj_prefill_m128_n4864_k896_seq128_ctx128,128,4864,896,7,256,2,4,"{""ctx_len"": 128, ""dtype"": ""bfloat16"", ""family"": ""gemm"", ""family_group"": ""QWEN"", ""head_dim"": 64, ""hidden_size"": 896, ""intermediate_size"": 4864, ""k"": 896, ""m"": 128, ""mode"": ""prefill"", ""mode_id"": 1, ""model_id"": ""Qwen/Qwen2.5-0.5B"", ""n"": 4864, ""num_attention_heads"": 14, ""num_key_value_heads"": 2, ""role"": ""gate_proj"", ""role_id"": 7, ""seq_len"": 128}","{""block_size"": 256, ""num_stages"": 4, ""num_warps"": 2}",0.014303999952971935,712.4474296354183,4.247216063838735,0.0625
QWEN,gemm,qwen05b_gate_proj_prefill_m128_n4864_k896_seq128_ctx128,128,4864,896,8,256,4,1,"{""ctx_len"": 128, ""dtype"": ""bfloat16"", ""family"": ""gemm"", ""family_group"": ""QWEN"", ""head_dim"": 64, ""hidden_size"": 896, ""intermediate_size"": 4864, ""k"": 896, ""m"": 128, ""mode"": ""prefill"", ""mode_id"": 1, ""model_id"": ""Qwen/Qwen2.5-0.5B"", ""n"": 4864, ""num_attention_heads"": 14, ""num_key_value_heads"": 2, ""role"": ""gate_proj"", ""role_id"": 7, ""seq_len"": 128}","{""block_size"": 256, ""num_stages"": 1, ""num_warps"": 4}",0.035679999738931656,285.61793930957964,3.3331649785872663,0.0625
QWEN,gemm,qwen05b_gate_proj_prefill_m128_n4864_k896_seq128_ctx128,128,4864,896,9,256,4,2,"{""ctx_len"": 128, ""dtype"": ""bfloat16"", ""family"": ""gemm"", ""family_group"": ""QWEN"", ""head_dim"": 64, ""hidden_size"": 896, ""intermediate_size"": 4864, ""k"": 896, ""m"": 128, ""mode"": ""prefill"", ""mode_id"": 1, ""model_id"": ""Qwen/Qwen2.5-0.5B"", ""n"": 4864, ""num_attention_heads"": 14, ""num_key_value_heads"": 2, ""role"": ""gate_proj"", ""role_id"": 7, ""seq_len"": 128}","{""block_size"": 256, ""num_stages"": 2, ""num_warps"": 4}",0.025312000885605812,402.6093411601938,3.676476652409307,0.0625
QWEN,gemm,qwen05b_gate_proj_prefill_m128_n4864_k896_seq128_ctx128,128,4864,896,10,256,4,3,"{""ctx_len"": 128, ""dtype"": ""bfloat16"", ""family"": ""gemm"", ""family_group"": ""QWEN"", ""head_dim"": 64, ""hidden_size"": 896, ""intermediate_size"": 4864, ""k"": 896, ""m"": 128, ""mode"": ""prefill"", ""mode_id"": 1, ""model_id"": ""Qwen/Qwen2.5-0.5B"", ""n"": 4864, ""num_attention_heads"": 14, ""num_key_value_heads"": 2, ""role"": ""gate_proj"", ""role_id"": 7, ""seq_len"": 128}","{""block_size"": 256, ""num_stages"": 3, ""num_warps"": 4}",0.016303999349474907,625.0520367156547,4.116344842401492,0.0625
QWEN,gemm,qwen05b_gate_proj_prefill_m128_n4864_k896_seq128_ctx128,128,4864,896,11,256,4,4,"{""ctx_len"": 128, ""dtype"": ""bfloat16"", ""family"": ""gemm"", ""family_group"": ""QWEN"", ""head_dim"": 64, ""hidden_size"": 896, ""intermediate_size"": 4864, ""k"": 896, ""m"": 128, ""mode"": ""prefill"", ""mode_id"": 1, ""model_id"": ""Qwen/Qwen2.5-0.5B"", ""n"": 4864, ""num_attention_heads"": 14, ""num_key_value_heads"": 2, ""role"": ""gate_proj"", ""role_id"": 7, ""seq_len"": 128}","{""block_size"": 256, ""num_stages"": 4, ""num_warps"": 4}",0.013535999692976475,752.8699934359337,4.302402498800268,0.0625
QWEN,gemm,qwen05b_gate_proj_prefill_m128_n4864_k896_seq128_ctx128,128,4864,896,12,256,8,1,"{""ctx_len"": 128, ""dtype"": ""bfloat16"", ""family"": ""gemm"", ""family_group"": ""QWEN"", ""head_dim"": 64, ""hidden_size"": 896, ""intermediate_size"": 4864, ""k"": 896, ""m"": 128, ""mode"": ""prefill"", ""mode_id"": 1, ""model_id"": ""Qwen/Qwen2.5-0.5B"", ""n"": 4864, ""num_attention_heads"": 14, ""num_key_value_heads"": 2, ""role"": ""gate_proj"", ""role_id"": 7, ""seq_len"": 128}","{""block_size"": 256, ""num_stages"": 1, ""num_warps"": 8}",0.026528000831604004,384.15439085252075,3.6295544686810923,0.0625
QWEN,gemm,qwen05b_gate_proj_prefill_m128_n4864_k896_seq128_ctx128,128,4864,896,13,256,8,2,"{""ctx_len"": 128, ""dtype"": ""bfloat16"", ""family"": ""gemm"", ""family_group"": ""QWEN"", ""head_dim"": 64, ""hidden_size"": 896, ""intermediate_size"": 4864, ""k"": 896, ""m"": 128, ""mode"": ""prefill"", ""mode_id"": 1, ""model_id"": ""Qwen/Qwen2.5-0.5B"", ""n"": 4864, ""num_attention_heads"": 14, ""num_key_value_heads"": 2, ""role"": ""gate_proj"", ""role_id"": 7, ""seq_len"": 128}","{""block_size"": 256, ""num_stages"": 2, ""num_warps"": 8}",0.02595200017094612,392.680638597132,3.651506594462123,0.0625
QWEN,gemm,qwen05b_gate_proj_prefill_m128_n4864_k896_seq128_ctx128,128,4864,896,14,256,8,3,"{""ctx_len"": 128, ""dtype"": ""bfloat16"", ""family"": ""gemm"", ""family_group"": ""QWEN"", ""head_dim"": 64, ""hidden_size"": 896, ""intermediate_size"": 4864, ""k"": 896, ""m"": 128, ""mode"": ""prefill"", ""mode_id"": 1, ""model_id"": ""Qwen/Qwen2.5-0.5B"", ""n"": 4864, ""num_attention_heads"": 14, ""num_key_value_heads"": 2, ""role"": ""gate_proj"", ""role_id"": 7, ""seq_len"": 128}","{""block_size"": 256, ""num_stages"": 3, ""num_warps"": 8}",0.01679999940097332,606.5981168671699,4.086376428229275,0.0625
QWEN,gemm,qwen05b_gate_proj_prefill_m128_n4864_k896_seq128_ctx128,128,4864,896,15,256,8,4,"{""ctx_len"": 128, ""dtype"": ""bfloat16"", ""family"": ""gemm"", ""family_group"": ""QWEN"", ""head_dim"": 64, ""hidden_size"": 896, ""intermediate_size"": 4864, ""k"": 896, ""m"": 128, ""mode"": ""prefill"", ""mode_id"": 1, ""model_id"": ""Qwen/Qwen2.5-0.5B"", ""n"": 4864, ""num_attention_heads"": 14, ""num_key_value_heads"": 2, ""role"": ""gate_proj"", ""role_id"": 7, ""seq_len"": 128}","{""block_size"": 256, ""num_stages"": 4, ""num_warps"": 8}",0.01398400031030178,728.7505559115707,4.269841437879185,0.0625
QWEN,gemm,qwen05b_gate_proj_prefill_m128_n4864_k896_seq128_ctx128,128,4864,896,16,512,1,1,"{""ctx_len"": 128, ""dtype"": ""bfloat16"", ""family"": ""gemm"", ""family_group"": ""QWEN"", ""head_dim"": 64, ""hidden_size"": 896, ""intermediate_size"": 4864, ""k"": 896, ""m"": 128, ""mode"": ""prefill"", ""mode_id"": 1, ""model_id"": ""Qwen/Qwen2.5-0.5B"", ""n"": 4864, ""num_attention_heads"": 14, ""num_key_value_heads"": 2, ""role"": ""gate_proj"", ""role_id"": 7, ""seq_len"": 128}","{""block_size"": 512, ""num_stages"": 1, ""num_warps"": 1}",0.8528000116348267,11.949868504884323,0.15923021192746764,0.0625
QWEN,gemm,qwen05b_gate_proj_prefill_m128_n4864_k896_seq128_ctx128,128,4864,896,17,512,1,2,"{""ctx_len"": 128, ""dtype"": ""bfloat16"", ""family"": ""gemm"", ""family_group"": ""QWEN"", ""head_dim"": 64, ""hidden_size"": 896, ""intermediate_size"": 4864, ""k"": 896, ""m"": 128, ""mode"": ""prefill"", ""mode_id"": 1, ""model_id"": ""Qwen/Qwen2.5-0.5B"", ""n"": 4864, ""num_attention_heads"": 14, ""num_key_value_heads"": 2, ""role"": ""gate_proj"", ""role_id"": 7, ""seq_len"": 128}","{""block_size"": 512, ""num_stages"": 2, ""num_warps"": 1}",0.23836800456047058,42.7525834215503,1.4339395618562127,0.0625
QWEN,gemm,qwen05b_gate_proj_prefill_m128_n4864_k896_seq128_ctx128,128,4864,896,18,512,1,3,"{""ctx_len"": 128, ""dtype"": ""bfloat16"", ""family"": ""gemm"", ""family_group"": ""QWEN"", ""head_dim"": 64, ""hidden_size"": 896, ""intermediate_size"": 4864, ""k"": 896, ""m"": 128, ""mode"": ""prefill"", ""mode_id"": 1, ""model_id"": ""Qwen/Qwen2.5-0.5B"", ""n"": 4864, ""num_attention_heads"": 14, ""num_key_value_heads"": 2, ""role"": ""gate_proj"", ""role_id"": 7, ""seq_len"": 128}","{""block_size"": 512, ""num_stages"": 3, ""num_warps"": 1}",0.19232000410556793,52.98901717164096,1.6485946062877075,0.0625
QWEN,gemm,qwen05b_gate_proj_prefill_m128_n4864_k896_seq128_ctx128,128,4864,896,19,512,1,4,"{""ctx_len"": 128, ""dtype"": ""bfloat16"", ""family"": ""gemm"", ""family_group"": ""QWEN"", ""head_dim"": 64, ""hidden_size"": 896, ""intermediate_size"": 4864, ""k"": 896, ""m"": 128, ""mode"": ""prefill"", ""mode_id"": 1, ""model_id"": ""Qwen/Qwen2.5-0.5B"", ""n"": 4864, ""num_attention_heads"": 14, ""num_key_value_heads"": 2, ""role"": ""gate_proj"", ""role_id"": 7, ""seq_len"": 128}","{""block_size"": 512, ""num_stages"": 4, ""num_warps"": 1}",0.15593600273132324,65.3527589620132,1.8583095948053734,0.0625
QWEN,gemm,qwen05b_gate_proj_prefill_m128_n4864_k896_seq128_ctx128,128,4864,896,20,512,2,1,"{""ctx_len"": 128, ""dtype"": ""bfloat16"", ""family"": ""gemm"", ""family_group"": ""QWEN"", ""head_dim"": 64, ""hidden_size"": 896, ""intermediate_size"": 4864, ""k"": 896, ""m"": 128, ""mode"": ""prefill"", ""mode_id"": 1, ""model_id"": ""Qwen/Qwen2.5-0.5B"", ""n"": 4864, ""num_attention_heads"": 14, ""num_key_value_heads"": 2, ""role"": ""gate_proj"", ""role_id"": 7, ""seq_len"": 128}","{""block_size"": 512, ""num_stages"": 1, ""num_warps"": 2}",0.9018880128860474,11.29946052546948,0.10326492085561643,0.0625
QWEN,gemm,qwen05b_gate_proj_prefill_m128_n4864_k896_seq128_ctx128,128,4864,896,21,512,2,2,"{""ctx_len"": 128, ""dtype"": ""bfloat16"", ""family"": ""gemm"", ""family_group"": ""QWEN"", ""head_dim"": 64, ""hidden_size"": 896, ""intermediate_size"": 4864, ""k"": 896, ""m"": 128, ""mode"": ""prefill"", ""mode_id"": 1, ""model_id"": ""Qwen/Qwen2.5-0.5B"", ""n"": 4864, ""num_attention_heads"": 14, ""num_key_value_heads"": 2, ""role"": ""gate_proj"", ""role_id"": 7, ""seq_len"": 128}","{""block_size"": 512, ""num_stages"": 2, ""num_warps"": 2}",0.06300800293684006,161.7389462448988,2.764493529914833,0.0625
QWEN,gemm,qwen05b_gate_proj_prefill_m128_n4864_k896_seq128_ctx128,128,4864,896,22,512,2,3,"{""ctx_len"": 128, ""dtype"": ""bfloat16"", ""family"": ""gemm"", ""family_group"": ""QWEN"", ""head_dim"": 64, ""hidden_size"": 896, ""intermediate_size"": 4864, ""k"": 896, ""m"": 128, ""mode"": ""prefill"", ""mode_id"": 1, ""model_id"": ""Qwen/Qwen2.5-0.5B"", ""n"": 4864, ""num_attention_heads"": 14, ""num_key_value_heads"": 2, ""role"": ""gate_proj"", ""role_id"": 7, ""seq_len"": 128}","{""block_size"": 512, ""num_stages"": 3, ""num_warps"": 2}",0.04755200073122978,214.30955255910314,3.0459314145093663,0.0625
QWEN,gemm,qwen05b_gate_proj_prefill_m128_n4864_k896_seq128_ctx128,128,4864,896,23,512,2,4,"{""ctx_len"": 128, ""dtype"": ""bfloat16"", ""family"": ""gemm"", ""family_group"": ""QWEN"", ""head_dim"": 64, ""hidden_size"": 896, ""intermediate_size"": 4864, ""k"": 896, ""m"": 128, ""mode"": ""prefill"", ""mode_id"": 1, ""model_id"": ""Qwen/Qwen2.5-0.5B"", ""n"": 4864, ""num_attention_heads"": 14, ""num_key_value_heads"": 2, ""role"": ""gate_proj"", ""role_id"": 7, ""seq_len"": 128}","{""block_size"": 512, ""num_stages"": 4, ""num_warps"": 2}",0.04630399867892265,220.08570081958865,3.0725269570635874,0.0625
QWEN,gemm,qwen05b_gate_proj_prefill_m128_n4864_k896_seq128_ctx128,128,4864,896,24,512,4,1,"{""ctx_len"": 128, ""dtype"": ""bfloat16"", ""family"": ""gemm"", ""family_group"": ""QWEN"", ""head_dim"": 64, ""hidden_size"": 896, ""intermediate_size"": 4864, ""k"": 896, ""m"": 128, ""mode"": ""prefill"", ""mode_id"": 1, ""model_id"": ""Qwen/Qwen2.5-0.5B"", ""n"": 4864, ""num_attention_heads"": 14, ""num_key_value_heads"": 2, ""role"": ""gate_proj"", ""role_id"": 7, ""seq_len"": 128}","{""block_size"": 512, ""num_stages"": 1, ""num_warps"": 4}",0.03270399942994118,311.6086159991206,3.420257901831757,0.0625
QWEN,gemm,qwen05b_gate_proj_prefill_m128_n4864_k896_seq128_ctx128,128,4864,896,25,512,4,2,"{""ctx_len"": 128, ""dtype"": ""bfloat16"", ""family"": ""gemm"", ""family_group"": ""QWEN"", ""head_dim"": 64, ""hidden_size"": 896, ""intermediate_size"": 4864, ""k"": 896, ""m"": 128, ""mode"": ""prefill"", ""mode_id"": 1, ""model_id"": ""Qwen/Qwen2.5-0.5B"", ""n"": 4864, ""num_attention_heads"": 14, ""num_key_value_heads"": 2, ""role"": ""gate_proj"", ""role_id"": 7, ""seq_len"": 128}","{""block_size"": 512, ""num_stages"": 2, ""num_warps"": 4}",0.028960000723600388,351.89391385944157,3.5418396864784207,0.0625
QWEN,gemm,qwen05b_gate_proj_prefill_m128_n4864_k896_seq128_ctx128,128,4864,896,26,512,4,3,"{""ctx_len"": 128, ""dtype"": ""bfloat16"", ""family"": ""gemm"", ""family_group"": ""QWEN"", ""head_dim"": 64, ""hidden_size"": 896, ""intermediate_size"": 4864, ""k"": 896, ""m"": 128, ""mode"": ""prefill"", ""mode_id"": 1, ""model_id"": ""Qwen/Qwen2.5-0.5B"", ""n"": 4864, ""num_attention_heads"": 14, ""num_key_value_heads"": 2, ""role"": ""gate_proj"", ""role_id"": 7, ""seq_len"": 128}","{""block_size"": 512, ""num_stages"": 3, ""num_warps"": 4}",0.01817600056529045,560.6760389004836,4.00765320534247,0.0625
QWEN,gemm,qwen05b_gate_proj_prefill_m128_n4864_k896_seq128_ctx128,128,4864,896,27,512,4,4,"{""ctx_len"": 128, ""dtype"": ""bfloat16"", ""family"": ""gemm"", ""family_group"": ""QWEN"", ""head_dim"": 64, ""hidden_size"": 896, ""intermediate_size"": 4864, ""k"": 896, ""m"": 128, ""mode"": ""prefill"", ""mode_id"": 1, ""model_id"": ""Qwen/Qwen2.5-0.5B"", ""n"": 4864, ""num_attention_heads"": 14, ""num_key_value_heads"": 2, ""role"": ""gate_proj"", ""role_id"": 7, ""seq_len"": 128}","{""block_size"": 512, ""num_stages"": 4, ""num_warps"": 4}",0.014336000196635723,710.8571331068704,4.244981409033343,0.0625
QWEN,gemm,qwen05b_gate_proj_prefill_m128_n4864_k896_seq128_ctx128,128,4864,896,28,512,8,1,"{""ctx_len"": 128, ""dtype"": ""bfloat16"", ""family"": ""gemm"", ""family_group"": ""QWEN"", ""head_dim"": 64, ""hidden_size"": 896, ""intermediate_size"": 4864, ""k"": 896, ""m"": 128, ""mode"": ""prefill"", ""mode_id"": 1, ""model_id"": ""Qwen/Qwen2.5-0.5B"", ""n"": 4864, ""num_attention_heads"": 14, ""num_key_value_heads"": 2, ""role"": ""gate_proj"", ""role_id"": 7, ""seq_len"": 128}","{""block_size"": 512, ""num_stages"": 1, ""num_warps"": 8}",0.030719999223947525,331.73334171362245,3.482841395964791,0.0625
QWEN,gemm,qwen05b_gate_proj_prefill_m128_n4864_k896_seq128_ctx128,128,4864,896,29,512,8,2,"{""ctx_len"": 128, ""dtype"": ""bfloat16"", ""family"": ""gemm"", ""family_group"": ""QWEN"", ""head_dim"": 64, ""hidden_size"": 896, ""intermediate_size"": 4864, ""k"": 896, ""m"": 128, ""mode"": ""prefill"", ""mode_id"": 1, ""model_id"": ""Qwen/Qwen2.5-0.5B"", ""n"": 4864, ""num_attention_heads"": 14, ""num_key_value_heads"": 2, ""role"": ""gate_proj"", ""role_id"": 7, ""seq_len"": 128}","{""block_size"": 512, ""num_stages"": 2, ""num_warps"": 8}",0.028255999088287354,360.66139329061275,3.566449486826749,0.0625
QWEN,gemm,qwen05b_gate_proj_prefill_m128_n4864_k896_seq128_ctx128,128,4864,896,30,512,8,3,"{""ctx_len"": 128, ""dtype"": ""bfloat16"", ""family"": ""gemm"", ""family_group"": ""QWEN"", ""head_dim"": 64, ""hidden_size"": 896, ""intermediate_size"": 4864, ""k"": 896, ""m"": 128, ""mode"": ""prefill"", ""mode_id"": 1, ""model_id"": ""Qwen/Qwen2.5-0.5B"", ""n"": 4864, ""num_attention_heads"": 14, ""num_key_value_heads"": 2, ""role"": ""gate_proj"", ""role_id"": 7, ""seq_len"": 128}","{""block_size"": 512, ""num_stages"": 3, ""num_warps"": 8}",0.0180479995906353,564.6524950769503,4.014720426348487,0.0625
QWEN,gemm,qwen05b_gate_proj_prefill_m128_n4864_k896_seq128_ctx128,128,4864,896,31,512,8,4,"{""ctx_len"": 128, ""dtype"": ""bfloat16"", ""family"": ""gemm"", ""family_group"": ""QWEN"", ""head_dim"": 64, ""hidden_size"": 896, ""intermediate_size"": 4864, ""k"": 896, ""m"": 128, ""mode"": ""prefill"", ""mode_id"": 1, ""model_id"": ""Qwen/Qwen2.5-0.5B"", ""n"": 4864, ""num_attention_heads"": 14, ""num_key_value_heads"": 2, ""role"": ""gate_proj"", ""role_id"": 7, ""seq_len"": 128}","{""block_size"": 512, ""num_stages"": 4, ""num_warps"": 8}",0.014655999839305878,695.3362521654236,4.222905482014754,0.0625
QWEN,gemm,qwen05b_gate_proj_prefill_m128_n4864_k896_seq128_ctx128,128,4864,896,32,1024,1,1,"{""ctx_len"": 128, ""dtype"": ""bfloat16"", ""family"": ""gemm"", ""family_group"": ""QWEN"", ""head_dim"": 64, ""hidden_size"": 896, ""intermediate_size"": 4864, ""k"": 896, ""m"": 128, ""mode"": ""prefill"", ""mode_id"": 1, ""model_id"": ""Qwen/Qwen2.5-0.5B"", ""n"": 4864, ""num_attention_heads"": 14, ""num_key_value_heads"": 2, ""role"": ""gate_proj"", ""role_id"": 7, ""seq_len"": 128}","{""block_size"": 1024, ""num_stages"": 1, ""num_warps"": 1}",0.8527200222015381,11.950989462742344,0.15932401256511514,0.0625
QWEN,gemm,qwen05b_gate_proj_prefill_m128_n4864_k896_seq128_ctx128,128,4864,896,33,1024,1,2,"{""ctx_len"": 128, ""dtype"": ""bfloat16"", ""family"": ""gemm"", ""family_group"": ""QWEN"", ""head_dim"": 64, ""hidden_size"": 896, ""intermediate_size"": 4864, ""k"": 896, ""m"": 128, ""mode"": ""prefill"", ""mode_id"": 1, ""model_id"": ""Qwen/Qwen2.5-0.5B"", ""n"": 4864, ""num_attention_heads"": 14, ""num_key_value_heads"": 2, ""role"": ""gate_proj"", ""role_id"": 7, ""seq_len"": 128}","{""block_size"": 1024, ""num_stages"": 2, ""num_warps"": 1}",0.23820799589157104,42.78130111400094,1.4346110546496396,0.0625
QWEN,gemm,qwen05b_gate_proj_prefill_m128_n4864_k896_seq128_ctx128,128,4864,896,34,1024,1,3,"{""ctx_len"": 128, ""dtype"": ""bfloat16"", ""family"": ""gemm"", ""family_group"": ""QWEN"", ""head_dim"": 64, ""hidden_size"": 896, ""intermediate_size"": 4864, ""k"": 896, ""m"": 128, ""mode"": ""prefill"", ""mode_id"": 1, ""model_id"": ""Qwen/Qwen2.5-0.5B"", ""n"": 4864, ""num_attention_heads"": 14, ""num_key_value_heads"": 2, ""role"": ""gate_proj"", ""role_id"": 7, ""seq_len"": 128}","{""block_size"": 1024, ""num_stages"": 3, ""num_warps"": 1}",0.1923840045928955,52.971389287611984,1.648261880418099,0.0625
QWEN,gemm,qwen05b_gate_proj_prefill_m128_n4864_k896_seq128_ctx128,128,4864,896,35,1024,1,4,"{""ctx_len"": 128, ""dtype"": ""bfloat16"", ""family"": ""gemm"", ""family_group"": ""QWEN"", ""head_dim"": 64, ""hidden_size"": 896, ""intermediate_size"": 4864, ""k"": 896, ""m"": 128, ""mode"": ""prefill"", ""mode_id"": 1, ""model_id"": ""Qwen/Qwen2.5-0.5B"", ""n"": 4864, ""num_attention_heads"": 14, ""num_key_value_heads"": 2, ""role"": ""gate_proj"", ""role_id"": 7, ""seq_len"": 128}","{""block_size"": 1024, ""num_stages"": 4, ""num_warps"": 1}",0.15583999454975128,65.3930207675066,1.8589254740612746,0.0625
QWEN,gemm,qwen05b_gate_proj_prefill_m128_n4864_k896_seq128_ctx128,128,4864,896,36,1024,2,1,"{""ctx_len"": 128, ""dtype"": ""bfloat16"", ""family"": ""gemm"", ""family_group"": ""QWEN"", ""head_dim"": 64, ""hidden_size"": 896, ""intermediate_size"": 4864, ""k"": 896, ""m"": 128, ""mode"": ""prefill"", ""mode_id"": 1, ""model_id"": ""Qwen/Qwen2.5-0.5B"", ""n"": 4864, ""num_attention_heads"": 14, ""num_key_value_heads"": 2, ""role"": ""gate_proj"", ""role_id"": 7, ""seq_len"": 128}","{""block_size"": 1024, ""num_stages"": 1, ""num_warps"": 2}",0.9009599983692169,11.311099292361426,0.10429441928587915,0.0625
QWEN,gemm,qwen05b_gate_proj_prefill_m128_n4864_k896_seq128_ctx128,128,4864,896,37,1024,2,2,"{""ctx_len"": 128, ""dtype"": ""bfloat16"", ""family"": ""gemm"", ""family_group"": ""QWEN"", ""head_dim"": 64, ""hidden_size"": 896, ""intermediate_size"": 4864, ""k"": 896, ""m"": 128, ""mode"": ""prefill"", ""mode_id"": 1, ""model_id"": ""Qwen/Qwen2.5-0.5B"", ""n"": 4864, ""num_attention_heads"": 14, ""num_key_value_heads"": 2, ""role"": ""gate_proj"", ""role_id"": 7, ""seq_len"": 128}","{""block_size"": 1024, ""num_stages"": 2, ""num_warps"": 2}",0.06300800293684006,161.7389462448988,2.764493529914833,0.0625
QWEN,gemm,qwen05b_gate_proj_prefill_m128_n4864_k896_seq128_ctx128,128,4864,896,38,1024,2,3,"{""ctx_len"": 128, ""dtype"": ""bfloat16"", ""family"": ""gemm"", ""family_group"": ""QWEN"", ""head_dim"": 64, ""hidden_size"": 896, ""intermediate_size"": 4864, ""k"": 896, ""m"": 128, ""mode"": ""prefill"", ""mode_id"": 1, ""model_id"": ""Qwen/Qwen2.5-0.5B"", ""n"": 4864, ""num_attention_heads"": 14, ""num_key_value_heads"": 2, ""role"": ""gate_proj"", ""role_id"": 7, ""seq_len"": 128}","{""block_size"": 1024, ""num_stages"": 3, ""num_warps"": 2}",0.047520000487565994,214.45386985352664,3.0466045936675203,0.0625
QWEN,gemm,qwen05b_gate_proj_prefill_m128_n4864_k896_seq128_ctx128,128,4864,896,39,1024,2,4,"{""ctx_len"": 128, ""dtype"": ""bfloat16"", ""family"": ""gemm"", ""family_group"": ""QWEN"", ""head_dim"": 64, ""hidden_size"": 896, ""intermediate_size"": 4864, ""k"": 896, ""m"": 128, ""mode"": ""prefill"", ""mode_id"": 1, ""model_id"": ""Qwen/Qwen2.5-0.5B"", ""n"": 4864, ""num_attention_heads"": 14, ""num_key_value_heads"": 2, ""role"": ""gate_proj"", ""role_id"": 7, ""seq_len"": 128}","{""block_size"": 1024, ""num_stages"": 4, ""num_warps"": 2}",0.04633599892258644,219.9337067713993,3.071836105471078,0.0625
QWEN,gemm,qwen05b_gate_proj_prefill_m128_n4864_k896_seq128_ctx128,128,4864,896,40,1024,4,1,"{""ctx_len"": 128, ""dtype"": ""bfloat16"", ""family"": ""gemm"", ""family_group"": ""QWEN"", ""head_dim"": 64, ""hidden_size"": 896, ""intermediate_size"": 4864, ""k"": 896, ""m"": 128, ""mode"": ""prefill"", ""mode_id"": 1, ""model_id"": ""Qwen/Qwen2.5-0.5B"", ""n"": 4864, ""num_attention_heads"": 14, ""num_key_value_heads"": 2, ""role"": ""gate_proj"", ""role_id"": 7, ""seq_len"": 128}","{""block_size"": 1024, ""num_stages"": 1, ""num_warps"": 4}",0.03267199918627739,311.9138177586718,3.421236861905692,0.0625
QWEN,gemm,qwen05b_gate_proj_prefill_m128_n4864_k896_seq128_ctx128,128,4864,896,41,1024,4,2,"{""ctx_len"": 128, ""dtype"": ""bfloat16"", ""family"": ""gemm"", ""family_group"": ""QWEN"", ""head_dim"": 64, ""hidden_size"": 896, ""intermediate_size"": 4864, ""k"": 896, ""m"": 128, ""mode"": ""prefill"", ""mode_id"": 1, ""model_id"": ""Qwen/Qwen2.5-0.5B"", ""n"": 4864, ""num_attention_heads"": 14, ""num_key_value_heads"": 2, ""role"": ""gate_proj"", ""role_id"": 7, ""seq_len"": 128}","{""block_size"": 1024, ""num_stages"": 2, ""num_warps"": 4}",0.0289280004799366,352.28317999607333,3.5429452781816426,0.0625
QWEN,gemm,qwen05b_gate_proj_prefill_m128_n4864_k896_seq128_ctx128,128,4864,896,42,1024,4,3,"{""ctx_len"": 128, ""dtype"": ""bfloat16"", ""family"": ""gemm"", ""family_group"": ""QWEN"", ""head_dim"": 64, ""hidden_size"": 896, ""intermediate_size"": 4864, ""k"": 896, ""m"": 128, ""mode"": ""prefill"", ""mode_id"": 1, ""model_id"": ""Qwen/Qwen2.5-0.5B"", ""n"": 4864, ""num_attention_heads"": 14, ""num_key_value_heads"": 2, ""role"": ""gate_proj"", ""role_id"": 7, ""seq_len"": 128}","{""block_size"": 1024, ""num_stages"": 3, ""num_warps"": 4}",0.01820800080895424,559.6906605467854,4.005894176609711,0.0625
QWEN,gemm,qwen05b_gate_proj_prefill_m128_n4864_k896_seq128_ctx128,128,4864,896,43,1024,4,4,"{""ctx_len"": 128, ""dtype"": ""bfloat16"", ""family"": ""gemm"", ""family_group"": ""QWEN"", ""head_dim"": 64, ""hidden_size"": 896, ""intermediate_size"": 4864, ""k"": 896, ""m"": 128, ""mode"": ""prefill"", ""mode_id"": 1, ""model_id"": ""Qwen/Qwen2.5-0.5B"", ""n"": 4864, ""num_attention_heads"": 14, ""num_key_value_heads"": 2, ""role"": ""gate_proj"", ""role_id"": 7, ""seq_len"": 128}","{""block_size"": 1024, ""num_stages"": 4, ""num_warps"": 4}",0.014368000440299511,709.2739203582294,4.24275173677784,0.0625
QWEN,gemm,qwen05b_gate_proj_prefill_m128_n4864_k896_seq128_ctx128,128,4864,896,44,1024,8,1,"{""ctx_len"": 128, ""dtype"": ""bfloat16"", ""family"": ""gemm"", ""family_group"": ""QWEN"", ""head_dim"": 64, ""hidden_size"": 896, ""intermediate_size"": 4864, ""k"": 896, ""m"": 128, ""mode"": ""prefill"", ""mode_id"": 1, ""model_id"": ""Qwen/Qwen2.5-0.5B"", ""n"": 4864, ""num_attention_heads"": 14, ""num_key_value_heads"": 2, ""role"": ""gate_proj"", ""role_id"": 7, ""seq_len"": 128}","{""block_size"": 1024, ""num_stages"": 1, ""num_warps"": 8}",0.030704000033438206,331.90620078496784,3.4833623386277424,0.0625
QWEN,gemm,qwen05b_gate_proj_prefill_m128_n4864_k896_seq128_ctx128,128,4864,896,45,1024,8,2,"{""ctx_len"": 128, ""dtype"": ""bfloat16"", ""family"": ""gemm"", ""family_group"": ""QWEN"", ""head_dim"": 64, ""hidden_size"": 896, ""intermediate_size"": 4864, ""k"": 896, ""m"": 128, ""mode"": ""prefill"", ""mode_id"": 1, ""model_id"": ""Qwen/Qwen2.5-0.5B"", ""n"": 4864, ""num_attention_heads"": 14, ""num_key_value_heads"": 2, ""role"": ""gate_proj"", ""role_id"": 7, ""seq_len"": 128}","{""block_size"": 1024, ""num_stages"": 2, ""num_warps"": 8}",0.028224000707268715,361.07028573647545,3.5675825740986324,0.0625
QWEN,gemm,qwen05b_gate_proj_prefill_m128_n4864_k896_seq128_ctx128,128,4864,896,46,1024,8,3,"{""ctx_len"": 128, ""dtype"": ""bfloat16"", ""family"": ""gemm"", ""family_group"": ""QWEN"", ""head_dim"": 64, ""hidden_size"": 896, ""intermediate_size"": 4864, ""k"": 896, ""m"": 128, ""mode"": ""prefill"", ""mode_id"": 1, ""model_id"": ""Qwen/Qwen2.5-0.5B"", ""n"": 4864, ""num_attention_heads"": 14, ""num_key_value_heads"": 2, ""role"": ""gate_proj"", ""role_id"": 7, ""seq_len"": 128}","{""block_size"": 1024, ""num_stages"": 3, ""num_warps"": 8}",0.0180479995906353,564.6524950769503,4.014720426348487,0.0625
QWEN,gemm,qwen05b_gate_proj_prefill_m128_n4864_k896_seq128_ctx128,128,4864,896,47,1024,8,4,"{""ctx_len"": 128, ""dtype"": ""bfloat16"", ""family"": ""gemm"", ""family_group"": ""QWEN"", ""head_dim"": 64, ""hidden_size"": 896, ""intermediate_size"": 4864, ""k"": 896, ""m"": 128, ""mode"": ""prefill"", ""mode_id"": 1, ""model_id"": ""Qwen/Qwen2.5-0.5B"", ""n"": 4864, ""num_attention_heads"": 14, ""num_key_value_heads"": 2, ""role"": ""gate_proj"", ""role_id"": 7, ""seq_len"": 128}","{""block_size"": 1024, ""num_stages"": 4, ""num_warps"": 8}",0.014655999839305878,695.3362521654236,4.222905482014754,0.0625
QWEN,gemm,qwen05b_up_proj_prefill_m128_n4864_k896_seq128_ctx128,128,4864,896,0,256,1,1,"{""ctx_len"": 128, ""dtype"": ""bfloat16"", ""family"": ""gemm"", ""family_group"": ""QWEN"", ""head_dim"": 64, ""hidden_size"": 896, ""intermediate_size"": 4864, ""k"": 896, ""m"": 128, ""mode"": ""prefill"", ""mode_id"": 1, ""model_id"": ""Qwen/Qwen2.5-0.5B"", ""n"": 4864, ""num_attention_heads"": 14, ""num_key_value_heads"": 2, ""role"": ""up_proj"", ""role_id"": 8, ""seq_len"": 128}","{""block_size"": 256, ""num_stages"": 1, ""num_warps"": 1}",0.03452799841761589,295.1473721917432,3.3659847357354256,0.0625
QWEN,gemm,qwen05b_up_proj_prefill_m128_n4864_k896_seq128_ctx128,128,4864,896,1,256,1,2,"{""ctx_len"": 128, ""dtype"": ""bfloat16"", ""family"": ""gemm"", ""family_group"": ""QWEN"", ""head_dim"": 64, ""hidden_size"": 896, ""intermediate_size"": 4864, ""k"": 896, ""m"": 128, ""mode"": ""prefill"", ""mode_id"": 1, ""model_id"": ""Qwen/Qwen2.5-0.5B"", ""n"": 4864, ""num_attention_heads"": 14, ""num_key_value_heads"": 2, ""role"": ""up_proj"", ""role_id"": 8, ""seq_len"": 128}","{""block_size"": 256, ""num_stages"": 2, ""num_warps"": 1}",0.029600000008940697,344.28540530141373,3.519980917350072,0.0625
QWEN,gemm,qwen05b_up_proj_prefill_m128_n4864_k896_seq128_ctx128,128,4864,896,2,256,1,3,"{""ctx_len"": 128, ""dtype"": ""bfloat16"", ""family"": ""gemm"", ""family_group"": ""QWEN"", ""head_dim"": 64, ""hidden_size"": 896, ""intermediate_size"": 4864, ""k"": 896, ""m"": 128, ""mode"": ""prefill"", ""mode_id"": 1, ""model_id"": ""Qwen/Qwen2.5-0.5B"", ""n"": 4864, ""num_attention_heads"": 14, ""num_key_value_heads"": 2, ""role"": ""up_proj"", ""role_id"": 8, ""seq_len"": 128}","{""block_size"": 256, ""num_stages"": 3, ""num_warps"": 1}",0.01881599985063076,541.6054464763602,3.973047715204337,0.0625
QWEN,gemm,qwen05b_up_proj_prefill_m128_n4864_k896_seq128_ctx128,128,4864,896,3,256,1,4,"{""ctx_len"": 128, ""dtype"": ""bfloat16"", ""family"": ""gemm"", ""family_group"": ""QWEN"", ""head_dim"": 64, ""hidden_size"": 896, ""intermediate_size"": 4864, ""k"": 896, ""m"": 128, ""mode"": ""prefill"", ""mode_id"": 1, ""model_id"": ""Qwen/Qwen2.5-0.5B"", ""n"": 4864, ""num_attention_heads"": 14, ""num_key_value_heads"": 2, ""role"": ""up_proj"", ""role_id"": 8, ""seq_len"": 128}","{""block_size"": 256, ""num_stages"": 4, ""num_warps"": 1}",0.017696000635623932,575.8842469458741,4.0344166177231395,0.0625
QWEN,gemm,qwen05b_up_proj_prefill_m128_n4864_k896_seq128_ctx128,128,4864,896,4,256,2,1,"{""ctx_len"": 128, ""dtype"": ""bfloat16"", ""family"": ""gemm"", ""family_group"": ""QWEN"", ""head_dim"": 64, ""hidden_size"": 896, ""intermediate_size"": 4864, ""k"": 896, ""m"": 128, ""mode"": ""prefill"", ""mode_id"": 1, ""model_id"": ""Qwen/Qwen2.5-0.5B"", ""n"": 4864, ""num_attention_heads"": 14, ""num_key_value_heads"": 2, ""role"": ""up_proj"", ""role_id"": 8, ""seq_len"": 128}","{""block_size"": 256, ""num_stages"": 1, ""num_warps"": 2}",0.041280001401901245,246.87130944551367,3.1873771238480444,0.0625
QWEN,gemm,qwen05b_up_proj_prefill_m128_n4864_k896_seq128_ctx128,128,4864,896,5,256,2,2,"{""ctx_len"": 128, ""dtype"": ""bfloat16"", ""family"": ""gemm"", ""family_group"": ""QWEN"", ""head_dim"": 64, ""hidden_size"": 896, ""intermediate_size"": 4864, ""k"": 896, ""m"": 128, ""mode"": ""prefill"", ""mode_id"": 1, ""model_id"": ""Qwen/Qwen2.5-0.5B"", ""n"": 4864, ""num_attention_heads"": 14, ""num_key_value_heads"": 2, ""role"": ""up_proj"", ""role_id"": 8, ""seq_len"": 128}","{""block_size"": 256, ""num_stages"": 2, ""num_warps"": 2}",0.029055999591946602,350.73128245860033,3.5385302906069422,0.0625
QWEN,gemm,qwen05b_up_proj_prefill_m128_n4864_k896_seq128_ctx128,128,4864,896,6,256,2,3,"{""ctx_len"": 128, ""dtype"": ""bfloat16"", ""family"": ""gemm"", ""family_group"": ""QWEN"", ""head_dim"": 64, ""hidden_size"": 896, ""intermediate_size"": 4864, ""k"": 896, ""m"": 128, ""mode"": ""prefill"", ""mode_id"": 1, ""model_id"": ""Qwen/Qwen2.5-0.5B"", ""n"": 4864, ""num_attention_heads"": 14, ""num_key_value_heads"": 2, ""role"": ""up_proj"", ""role_id"": 8, ""seq_len"": 128}","{""block_size"": 256, ""num_stages"": 3, ""num_warps"": 2}",0.017472000792622566,583.2673728072983,4.047155634054341,0.0625
QWEN,gemm,qwen05b_up_proj_prefill_m128_n4864_k896_seq128_ctx128,128,4864,896,7,256,2,4,"{""ctx_len"": 128, ""dtype"": ""bfloat16"", ""family"": ""gemm"", ""family_group"": ""QWEN"", ""head_dim"": 64, ""hidden_size"": 896, ""intermediate_size"": 4864, ""k"": 896, ""m"": 128, ""mode"": ""prefill"", ""mode_id"": 1, ""model_id"": ""Qwen/Qwen2.5-0.5B"", ""n"": 4864, ""num_attention_heads"": 14, ""num_key_value_heads"": 2, ""role"": ""up_proj"", ""role_id"": 8, ""seq_len"": 128}","{""block_size"": 256, ""num_stages"": 4, ""num_warps"": 2}",0.014303999952971935,712.4474296354183,4.247216063838735,0.0625
QWEN,gemm,qwen05b_up_proj_prefill_m128_n4864_k896_seq128_ctx128,128,4864,896,8,256,4,1,"{""ctx_len"": 128, ""dtype"": ""bfloat16"", ""family"": ""gemm"", ""family_group"": ""QWEN"", ""head_dim"": 64, ""hidden_size"": 896, ""intermediate_size"": 4864, ""k"": 896, ""m"": 128, ""mode"": ""prefill"", ""mode_id"": 1, ""model_id"": ""Qwen/Qwen2.5-0.5B"", ""n"": 4864, ""num_attention_heads"": 14, ""num_key_value_heads"": 2, ""role"": ""up_proj"", ""role_id"": 8, ""seq_len"": 128}","{""block_size"": 256, ""num_stages"": 1, ""num_warps"": 4}",0.03564799949526787,285.87433079808017,3.334062248836097,0.0625
QWEN,gemm,qwen05b_up_proj_prefill_m128_n4864_k896_seq128_ctx128,128,4864,896,9,256,4,2,"{""ctx_len"": 128, ""dtype"": ""bfloat16"", ""family"": ""gemm"", ""family_group"": ""QWEN"", ""head_dim"": 64, ""hidden_size"": 896, ""intermediate_size"": 4864, ""k"": 896, ""m"": 128, ""mode"": ""prefill"", ""mode_id"": 1, ""model_id"": ""Qwen/Qwen2.5-0.5B"", ""n"": 4864, ""num_attention_heads"": 14, ""num_key_value_heads"": 2, ""role"": ""up_proj"", ""role_id"": 8, ""seq_len"": 128}","{""block_size"": 256, ""num_stages"": 2, ""num_warps"": 4}",0.025312000885605812,402.6093411601938,3.676476652409307,0.0625
QWEN,gemm,qwen05b_up_proj_prefill_m128_n4864_k896_seq128_ctx128,128,4864,896,10,256,4,3,"{""ctx_len"": 128, ""dtype"": ""bfloat16"", ""family"": ""gemm"", ""family_group"": ""QWEN"", ""head_dim"": 64, ""hidden_size"": 896, ""intermediate_size"": 4864, ""k"": 896, ""m"": 128, ""mode"": ""prefill"", ""mode_id"": 1, ""model_id"": ""Qwen/Qwen2.5-0.5B"", ""n"": 4864, ""num_attention_heads"": 14, ""num_key_value_heads"": 2, ""role"": ""up_proj"", ""role_id"": 8, ""seq_len"": 128}","{""block_size"": 256, ""num_stages"": 3, ""num_warps"": 4}",0.016287999227643013,625.6660414561358,4.1173266860328,0.0625
QWEN,gemm,qwen05b_up_proj_prefill_m128_n4864_k896_seq128_ctx128,128,4864,896,11,256,4,4,"{""ctx_len"": 128, ""dtype"": ""bfloat16"", ""family"": ""gemm"", ""family_group"": ""QWEN"", ""head_dim"": 64, ""hidden_size"": 896, ""intermediate_size"": 4864, ""k"": 896, ""m"": 128, ""mode"": ""prefill"", ""mode_id"": 1, ""model_id"": ""Qwen/Qwen2.5-0.5B"", ""n"": 4864, ""num_attention_heads"": 14, ""num_key_value_heads"": 2, ""role"": ""up_proj"", ""role_id"": 8, ""seq_len"": 128}","{""block_size"": 256, ""num_stages"": 4, ""num_warps"": 4}",0.013535999692976475,752.8699934359337,4.302402498800268,0.0625
QWEN,gemm,qwen05b_up_proj_prefill_m128_n4864_k896_seq128_ctx128,128,4864,896,12,256,8,1,"{""ctx_len"": 128, ""dtype"": ""bfloat16"", ""family"": ""gemm"", ""family_group"": ""QWEN"", ""head_dim"": 64, ""hidden_size"": 896, ""intermediate_size"": 4864, ""k"": 896, ""m"": 128, ""mode"": ""prefill"", ""mode_id"": 1, ""model_id"": ""Qwen/Qwen2.5-0.5B"", ""n"": 4864, ""num_attention_heads"": 14, ""num_key_value_heads"": 2, ""role"": ""up_proj"", ""role_id"": 8, ""seq_len"": 128}","{""block_size"": 256, ""num_stages"": 1, ""num_warps"": 8}",0.026496000587940216,384.61834895332896,3.6307614785895153,0.0625
QWEN,gemm,qwen05b_up_proj_prefill_m128_n4864_k896_seq128_ctx128,128,4864,896,13,256,8,2,"{""ctx_len"": 128, ""dtype"": ""bfloat16"", ""family"": ""gemm"", ""family_group"": ""QWEN"", ""head_dim"": 64, ""hidden_size"": 896, ""intermediate_size"": 4864, ""k"": 896, ""m"": 128, ""mode"": ""prefill"", ""mode_id"": 1, ""model_id"": ""Qwen/Qwen2.5-0.5B"", ""n"": 4864, ""num_attention_heads"": 14, ""num_key_value_heads"": 2, ""role"": ""up_proj"", ""role_id"": 8, ""seq_len"": 128}","{""block_size"": 256, ""num_stages"": 2, ""num_warps"": 8}",0.02595200017094612,392.680638597132,3.651506594462123,0.0625
QWEN,gemm,qwen05b_up_proj_prefill_m128_n4864_k896_seq128_ctx128,128,4864,896,14,256,8,3,"{""ctx_len"": 128, ""dtype"": ""bfloat16"", ""family"": ""gemm"", ""family_group"": ""QWEN"", ""head_dim"": 64, ""hidden_size"": 896, ""intermediate_size"": 4864, ""k"": 896, ""m"": 128, ""mode"": ""prefill"", ""mode_id"": 1, ""model_id"": ""Qwen/Qwen2.5-0.5B"", ""n"": 4864, ""num_attention_heads"": 14, ""num_key_value_heads"": 2, ""role"": ""up_proj"", ""role_id"": 8, ""seq_len"": 128}","{""block_size"": 256, ""num_stages"": 3, ""num_warps"": 8}",0.016783999279141426,607.1763845143174,4.087329270277349,0.0625
QWEN,gemm,qwen05b_up_proj_prefill_m128_n4864_k896_seq128_ctx128,128,4864,896,15,256,8,4,"{""ctx_len"": 128, ""dtype"": ""bfloat16"", ""family"": ""gemm"", ""family_group"": ""QWEN"", ""head_dim"": 64, ""hidden_size"": 896, ""intermediate_size"": 4864, ""k"": 896, ""m"": 128, ""mode"": ""prefill"", ""mode_id"": 1, ""model_id"": ""Qwen/Qwen2.5-0.5B"", ""n"": 4864, ""num_attention_heads"": 14, ""num_key_value_heads"": 2, ""role"": ""up_proj"", ""role_id"": 8, ""seq_len"": 128}","{""block_size"": 256, ""num_stages"": 4, ""num_warps"": 8}",0.01398400031030178,728.7505559115707,4.269841437879185,0.0625
QWEN,gemm,qwen05b_up_proj_prefill_m128_n4864_k896_seq128_ctx128,128,4864,896,16,512,1,1,"{""ctx_len"": 128, ""dtype"": ""bfloat16"", ""family"": ""gemm"", ""family_group"": ""QWEN"", ""head_dim"": 64, ""hidden_size"": 896, ""intermediate_size"": 4864, ""k"": 896, ""m"": 128, ""mode"": ""prefill"", ""mode_id"": 1, ""model_id"": ""Qwen/Qwen2.5-0.5B"", ""n"": 4864, ""num_attention_heads"": 14, ""num_key_value_heads"": 2, ""role"": ""up_proj"", ""role_id"": 8, ""seq_len"": 128}","{""block_size"": 512, ""num_stages"": 1, ""num_warps"": 1}",0.8524639904499054,11.954578861004522,0.1596243106580566,0.0625
QWEN,gemm,qwen05b_up_proj_prefill_m128_n4864_k896_seq128_ctx128,128,4864,896,17,512,1,2,"{""ctx_len"": 128, ""dtype"": ""bfloat16"", ""family"": ""gemm"", ""family_group"": ""QWEN"", ""head_dim"": 64, ""hidden_size"": 896, ""intermediate_size"": 4864, ""k"": 896, ""m"": 128, ""mode"": ""prefill"", ""mode_id"": 1, ""model_id"": ""Qwen/Qwen2.5-0.5B"", ""n"": 4864, ""num_attention_heads"": 14, ""num_key_value_heads"": 2, ""role"": ""up_proj"", ""role_id"": 8, ""seq_len"": 128}","{""block_size"": 512, ""num_stages"": 2, ""num_warps"": 1}",0.23814399540424347,42.7927984608694,1.4348797655562051,0.0625
QWEN,gemm,qwen05b_up_proj_prefill_m128_n4864_k896_seq128_ctx128,128,4864,896,18,512,1,3,"{""ctx_len"": 128, ""dtype"": ""bfloat16"", ""family"": ""gemm"", ""family_group"": ""QWEN"", ""head_dim"": 64, ""hidden_size"": 896, ""intermediate_size"": 4864, ""k"": 896, ""m"": 128, ""mode"": ""prefill"", ""mode_id"": 1, ""model_id"": ""Qwen/Qwen2.5-0.5B"", ""n"": 4864, ""num_attention_heads"": 14, ""num_key_value_heads"": 2, ""role"": ""up_proj"", ""role_id"": 8, ""seq_len"": 128}","{""block_size"": 512, ""num_stages"": 3, ""num_warps"": 1}",0.19222399592399597,53.01548306190342,1.6490939415188355,0.0625
